Solving original (integer) problem with strategy gdp.binary_multiplication...
--- Job model.gms Start 02/18/26 23:09:54 52.2.0 d8e408be LEX-LEG x86 64bit/Linux
--- Applying:
    /package/gams/52.2/gmsprmun.txt
--- GAMS Parameters defined
    Input /local/scratch/a/sgusev/repos/k_means/data/gams_gurobi_gdp.binary_multiplication/no_mode/2026-02-18_23-09-54/original/model.gms
    Output /local/scratch/a/sgusev/repos/k_means/data/gams_gurobi_gdp.binary_multiplication/no_mode/2026-02-18_23-09-54/original/output.lst
    ScrDir /local/scratch/a/sgusev/repos/k_means/data/gams_gurobi_gdp.binary_multiplication/no_mode/2026-02-18_23-09-54/original/225a/
    SysDir /package/gams/52.2/
    CurDir /local/scratch/a/sgusev/repos/k_means/data/gams_gurobi_gdp.binary_multiplication/no_mode/2026-02-18_23-09-54/original/
    LogOption 3
    AppendLog 1
Licensee: David Bernal / SECQUOIA Research Group         G251008+0003Ac-GEN
          Purdue University, Davidson School of Chemical EngineeringDCE4838
          225a/gamslice.dat
          5a82958a-fbca-4a23
          node:66820903 mem:995 cores:48 ipport:49815 v:2                  
          Evaluation license: Not for commercial or production use
          The time-limited license stops working on : Jun 30, 2027
System information: 48 physical cores and 995 Gb physical memory detected
GAMS 52.2.0   Copyright (C) 1987-2025 GAMS Development. All rights reserved
--- Starting compilation
--- model.gms(221) 2 Mb
--- $echo File /local/scratch/a/sgusev/repos/k_means/data/gams_gurobi_gdp.binary_multiplication/no_mode/2026-02-18_23-09-54/original/gurobi.opt
--- model.gms(400) 2 Mb
--- Starting execution: elapsed 0:00:00.006
--- model.gms(230) 3 Mb
--- Generating MINLP model GAMS_MODEL
--- model.gms(234) 5 Mb
---   54 rows  59 columns  217 non-zeroes
---   440 nl-code  160 nl-non-zeroes
---   40 discrete-columns
--- Range statistics (absolute non-zero finite values)
--- RHS       [min, max] : [ 1.000E+00, 1.000E+00] - Zero values observed as well
--- Bound     [min, max] : [ 1.000E+00, 4.000E+01] - Zero values observed as well
--- Matrix    [min, max] : [ 2.955E-02, 1.073E+00] - Zero values observed as well
--- model.gms(234) 3 Mb
--- Executing GUROBI (Solvelink=5): elapsed 0:00:00.009
Reading parameter(s) from "/local/scratch/a/sgusev/repos/k_means/data/gams_gurobi_gdp.binary_multiplication/no_mode/2026-02-18_23-09-54/original/gurobi.opt"
>>  NonConvex 2
>>  Threads 1
>>  MIPGap 1e-06
>>  MIPGapAbs 1e-10
>>  FeasibilityTol 1e-06
>>  OptimalityTol 1e-06
>>  IntFeasTol 1e-05
Finished reading from "/local/scratch/a/sgusev/repos/k_means/data/gams_gurobi_gdp.binary_multiplication/no_mode/2026-02-18_23-09-54/original/gurobi.opt"

... GRB_LICENSE_FILE = /local/scratch/a/sgusev/gurobi.lic

    Gurobi           52.2.0 d8e408be Dec 8, 2025           LEG x86 64bit/Linux    

... GAMS/Gurobi Link license.
... GMO Q Extraction (ThreePass): 0.00s

    Gurobi Optimizer version 13.0.0 build v13.0.0rc1 (linux64 - "Oracle Linux Server 9.7")
    
    CPU model: AMD EPYC 7643 48-Core Processor, instruction set [SSE2|AVX|AVX2]
    Thread count: 48 physical cores, 96 logical processors, using up to 1 threads
    
    Non-default parameters:
    TimeLimit  300
    MIPGap  1e-06
    LogToConsole  0
    NonConvex  2
    Threads  1
    
    Optimize a model with 53 rows, 98 columns and 86 nonzeros (Min)
    Model fingerprint: 0x6e40d193
    Model has 10 linear objective coefficients
    Model has 40 general nonlinear constraints (120 nonlinear terms)
    Variable types: 58 continuous, 40 integer (0 binary)
    Coefficient statistics:
      Matrix range     [1e+00, 1e+00]
      Objective range  [1e+00, 1e+00]
      Bounds range     [1e+00, 4e+01]
      RHS range        [1e+00, 1e+00]
      NLCon coe range  [2e-02, 9e-01]
    Presolve model has 40 nlconstr
    Added 200 variables to disaggregate expressions
    Presolve removed 40 rows and 0 columns
    Presolve time: 0.00s
    Presolved: 533 rows, 339 columns, 1246 nonzeros
    Presolved model has 80 bilinear constraint(s)
    
    Solving non-convex MIQCP to global optimality
    
    Variable types: 299 continuous, 40 integer (40 binary)
    Found heuristic solution: objective 5.4016623
    
    Root relaxation: objective 0.000000e+00, 38 iterations, 0.00 seconds (0.00 work units)
    
        Nodes    |    Current Node    |     Objective Bounds      |     Work
     Expl Unexpl |  Obj  Depth IntInf | Incumbent    BestBd   Gap | It/Node Time
    
         0     0    0.00000    0   80    5.40166    0.00000   100%     -    0s
    H    0     0                       5.0942150    0.00000   100%     -    0s
         0     0    0.00000    0   92    5.09421    0.00000   100%     -    0s
         0     0    0.00000    0   94    5.09421    0.00000   100%     -    0s
         0     0    0.00000    0   82    5.09421    0.00000   100%     -    0s
         0     0    0.00000    0   86    5.09421    0.00000   100%     -    0s
         0     0    0.00000    0   90    5.09421    0.00000   100%     -    0s
         0     0    0.00000    0   79    5.09421    0.00000   100%     -    0s
         0     0    0.00000    0   79    5.09421    0.00000   100%     -    0s
    H    0     0                       1.0910864    0.00000   100%     -    0s
    H    0     0                       0.8093997    0.00000   100%     -    0s
         0     2    0.00000    0   79    0.80940    0.00000   100%     -    0s
    H   15    10                       0.8093997    0.00000   100%  12.7    0s
    H  329   123                       0.5997417    0.00000   100%  15.1    0s
    * 1339   368              86       0.5997302    0.00120   100%  15.1    1s
      9322  1893    0.57772   40   50    0.59973    0.55238  7.90%   9.4    5s
     21874  2357    0.59969   71   50    0.59973    0.58382  2.65%   7.3   10s
     35861  3100    0.59932   56   60    0.59973    0.59672  0.50%   6.2   15s
     48505  2752    0.59969   74   30    0.59973    0.59885  0.15%   5.8   20s
     60916  1749    0.59966   76   30    0.59973    0.59954  0.03%   5.6   25s
    
    Cutting planes:
      Learned: 2
    
    Explored 68452 nodes (381022 simplex iterations) in 27.85 seconds (18.51 work units)
    Thread count was 1 (of 96 available processors)
    
    Solution count 6: 0.59973 0.599742 0.8094 ... 5.40166
    
    Optimal solution found (tolerance 1.00e-06)
    Warning: max constraint violation (1.8429e-06) exceeds tolerance
    Warning: max general constraint violation (1.8429e-06) exceeds tolerance
    Best objective 5.997301526570e-01, best bound 5.997295983222e-01, gap 0.0001%
    
    User-callback calls 68463, time in user-callback 0.00 sec

... Solving fixed model...

    Gurobi Optimizer version 13.0.0 build v13.0.0rc1 (linux64 - "Oracle Linux Server 9.7")
    
    CPU model: AMD EPYC 7643 48-Core Processor, instruction set [SSE2|AVX|AVX2]
    Thread count: 48 physical cores, 96 logical processors, using up to 1 threads
    
    Non-default parameters:
    TimeLimit  300
    MIPGap  1e-06
    LogToConsole  0
    NonConvex  2
    Threads  1
    
    Optimize a model with 53 rows, 98 columns and 86 nonzeros (Min)
    Model fingerprint: 0xced6dcf0
    Model has 10 linear objective coefficients
    Coefficient statistics:
      Matrix range     [1e+00, 1e+00]
      Objective range  [1e+00, 1e+00]
      Bounds range     [6e-03, 1e+00]
      RHS range        [1e+00, 1e+00]
    Presolve removed 53 rows and 98 columns
    Presolve time: 0.00s
    Presolve: All rows and columns removed
    Iteration    Objective       Primal Inf.    Dual Inf.      Time
           0    5.9973015e-01   0.000000e+00   0.000000e+00      0s
    
    Solved in 0 iterations and 0.00 seconds (0.00 work units)
    Optimal objective  5.997301527e-01
    
    User-callback calls 0, time in user-callback 0.00 sec

--- Reading solution for model GAMS_MODEL
***
*** Solver did not provide marginals for model GAMS_MODEL
***
--- Executing after solve: elapsed 0:00:27.899
--- model.gms(237) 3 Mb
--- model.gms(400) 5 Mb
--- Putfile results /local/scratch/a/sgusev/repos/k_means/data/gams_gurobi_gdp.binary_multiplication/no_mode/2026-02-18_23-09-54/original/results.dat
--- Putfile statresults /local/scratch/a/sgusev/repos/k_means/data/gams_gurobi_gdp.binary_multiplication/no_mode/2026-02-18_23-09-54/original/resultsstat.dat
*** Status: Normal completion
--- Job model.gms Stop 02/18/26 23:10:22 elapsed 0:00:27.900
Original problem solved. Time taken: 28.36223292350769 seconds
Original objective value: 0.599730152656984
