Solving original (integer) problem with strategy gdp.hull...
--- Job model.gms Start 02/14/26 20:13:40 52.2.0 d8e408be LEX-LEG x86 64bit/Linux
--- Applying:
    /package/gams/52.2/gmsprmun.txt
--- GAMS Parameters defined
    Input /local/scratch/a/sgusev/repos/k_means/data/gams_gurobi_gdp.hull/no_mode/2026-02-14_20-13-39/original/model.gms
    Output /local/scratch/a/sgusev/repos/k_means/data/gams_gurobi_gdp.hull/no_mode/2026-02-14_20-13-39/original/output.lst
    ScrDir /local/scratch/a/sgusev/repos/k_means/data/gams_gurobi_gdp.hull/no_mode/2026-02-14_20-13-39/original/225a/
    SysDir /package/gams/52.2/
    CurDir /local/scratch/a/sgusev/repos/k_means/data/gams_gurobi_gdp.hull/no_mode/2026-02-14_20-13-39/original/
    LogOption 3
    AppendLog 1
Licensee: David Bernal / SECQUOIA Research Group         G251008+0003Ac-GEN
          Purdue University, Davidson School of Chemical EngineeringDCE4838
          225a/gamslice.dat
          5a82958a-fbca-4a23
          node:66820903 mem:995 cores:48 ipport:53245 v:2                  
          Evaluation license: Not for commercial or production use
          The time-limited license stops working on : Jun 30, 2027
System information: 48 physical cores and 995 Gb physical memory detected
GAMS 52.2.0   Copyright (C) 1987-2025 GAMS Development. All rights reserved
--- Starting compilation
--- model.gms(2491) 2 Mb
--- $echo File /local/scratch/a/sgusev/repos/k_means/data/gams_gurobi_gdp.hull/no_mode/2026-02-14_20-13-39/original/gurobi.opt
--- model.gms(3695) 2 Mb
--- Starting execution: elapsed 0:00:00.015
--- model.gms(2500) 3 Mb
--- Generating MINLP model GAMS_MODEL
--- model.gms(2504) 5 Mb
---   754 rows  384 columns  1,837 non-zeroes
---   1,860 nl-code  240 nl-non-zeroes
---   60 discrete-columns
--- Range statistics (absolute non-zero finite values)
--- RHS       [min, max] : [ 6.800E-06, 1.000E+00] - Zero values observed as well
--- Bound     [min, max] : [ 1.000E+00, 6.000E+01] - Zero values observed as well
--- Matrix    [min, max] : [ 6.444E-02, 6.000E+01]
--- model.gms(2504) 3 Mb
--- Executing GUROBI (Solvelink=5): elapsed 0:00:00.020
Reading parameter(s) from "/local/scratch/a/sgusev/repos/k_means/data/gams_gurobi_gdp.hull/no_mode/2026-02-14_20-13-39/original/gurobi.opt"
>>  NonConvex 2
>>  Threads 1
>>  MIPGap 1e-06
>>  MIPGapAbs 1e-10
>>  FeasibilityTol 1e-06
>>  OptimalityTol 1e-06
>>  IntFeasTol 1e-05
Finished reading from "/local/scratch/a/sgusev/repos/k_means/data/gams_gurobi_gdp.hull/no_mode/2026-02-14_20-13-39/original/gurobi.opt"

... GRB_LICENSE_FILE = /local/scratch/a/sgusev/gurobi.lic

    Gurobi           52.2.0 d8e408be Dec 8, 2025           LEG x86 64bit/Linux    

... GAMS/Gurobi Link license.
... GMO Q Extraction (ThreePass): 0.00s

    Gurobi Optimizer version 13.0.0 build v13.0.0rc1 (linux64 - "Oracle Linux Server 9.7")
    
    CPU model: AMD EPYC 7643 48-Core Processor, instruction set [SSE2|AVX|AVX2]
    Thread count: 48 physical cores, 96 logical processors, using up to 1 threads
    
    Non-default parameters:
    TimeLimit  300
    MIPGap  1e-06
    LogToConsole  0
    NonConvex  2
    Threads  1
    
    Optimize a model with 753 rows, 443 columns and 1641 nonzeros (Min)
    Model fingerprint: 0x85a3bb92
    Model has 15 linear objective coefficients
    Model has 60 general nonlinear constraints (360 nonlinear terms)
    Variable types: 383 continuous, 60 integer (0 binary)
    Coefficient statistics:
      Matrix range     [1e+00, 6e+01]
      Objective range  [1e+00, 1e+00]
      Bounds range     [1e+00, 6e+01]
      RHS range        [1e+00, 1e+00]
      NLCon coe range  [7e-06, 1e+00]
    Presolve model has 60 nlconstr
    Added 780 variables to disaggregate expressions
    Presolve removed 180 rows and 135 columns
    Presolve time: 0.01s
    Presolved: 2373 rows, 1089 columns, 6066 nonzeros
    Presolved model has 360 bilinear constraint(s)
    
    Solving non-convex MIQCP to global optimality
    
    Variable types: 1029 continuous, 60 integer (60 binary)
    Found heuristic solution: objective 11.4333578
    
    Root relaxation: objective 0.000000e+00, 352 iterations, 0.00 seconds (0.00 work units)
    
        Nodes    |    Current Node    |     Objective Bounds      |     Work
     Expl Unexpl |  Obj  Depth IntInf | Incumbent    BestBd   Gap | It/Node Time
    
         0     0    0.00000    0  188   11.43336    0.00000   100%     -    0s
         0     0    0.00000    0  188   11.43336    0.00000   100%     -    0s
         0     0    0.00000    0  184   11.43336    0.00000   100%     -    0s
         0     0    0.00000    0  184   11.43336    0.00000   100%     -    0s
         0     0    0.00000    0  141   11.43336    0.00000   100%     -    0s
         0     0    0.00000    0  141   11.43336    0.00000   100%     -    0s
         0     0    0.00000    0   58   11.43336    0.00000   100%     -    0s
         0     0    0.00000    0  104   11.43336    0.00000   100%     -    0s
         0     0    0.00000    0  148   11.43336    0.00000   100%     -    0s
         0     0    0.00000    0  147   11.43336    0.00000   100%     -    0s
         0     0    0.00000    0  147   11.43336    0.00000   100%     -    0s
         0     0    0.00000    0  154   11.43336    0.00000   100%     -    0s
         0     0    0.00000    0  195   11.43336    0.00000   100%     -    0s
         0     0    0.00000    0  195   11.43336    0.00000   100%     -    0s
         0     0    0.00000    0   66   11.43336    0.00000   100%     -    0s
         0     0    0.00000    0   66   11.43336    0.00000   100%     -    0s
    H    0     0                      11.4333549    0.00000   100%     -    0s
    H    0     0                       6.9345320    0.00000   100%     -    0s
         0     2    0.00000    0   66    6.93453    0.00000   100%     -    0s
    H    4     4                       6.3479537    0.00000   100%  16.5    0s
    H  445   338                       4.6123824    0.00000   100%  16.8    1s
    H  610   416                       4.4338262    0.00000   100%  15.9    1s
    H  614   398                       2.6090202    0.00000   100%  15.8    1s
    H  633   391                       2.4462588    0.00000   100%  26.1    2s
    H  633   371                       2.1949127    0.00000   100%  26.1    2s
    H  633   352                       2.1709534    0.00000   100%  26.1    2s
    H  633   334                       2.1709311    0.00000   100%  26.1    2s
    H  669   334                       2.1247350    0.00000   100%  25.8    2s
    H  795   360                       2.1247313    0.00000   100%  23.6    2s
    H  874   369                       2.1247298    0.00000   100%  22.9    3s
    H  993   409                       2.1247289    0.00000   100%  22.4    3s
    H 1993   721                       2.1247272    0.00000   100%  21.0    4s
      2108   750    0.89360   35   76    2.12473    0.00000   100%  21.1    5s
      6935  1898    1.25676   55   63    2.12473    0.72484  65.9%  19.4   10s
     10762  2115     cutoff   64         2.12473    1.13629  46.5%  19.4   15s
     15693  1664    1.61959   73   28    2.12473    1.56155  26.5%  19.2   20s
     21762  1371    2.02682   75   13    2.12473    1.83923  13.4%  16.2   25s
     29085  1024     cutoff  106         2.12473    2.06274  2.92%  13.1   30s
     36693  1234    2.11149  103   18    2.12473    2.10601  0.88%  11.0   35s
     43781   904     cutoff   95         2.12473    2.11643  0.39%   9.7   40s
     51501  1282     cutoff  114         2.12473    2.12353  0.06%   8.6   45s
     59472  1393    2.12468  132   20    2.12473    2.12443  0.01%   7.7   50s
    *60507  1432             145       2.1247268    2.12447  0.01%   7.6   50s
    *64076  1292             147       2.1247262    2.12458  0.01%   7.3   53s
     65905  1303     cutoff  135         2.12473    2.12461  0.01%   7.2   55s
    *66839  1186             150       2.1247223    2.12463  0.00%   7.1   55s
    
    Cutting planes:
      Learned: 66
      Gomory: 2
      Implied bound: 21
      Projected implied bound: 2
      MIR: 15
      Flow cover: 83
      Inf proof: 1
      RLT: 22
      Relax-and-lift: 16
    
    Explored 73062 nodes (490160 simplex iterations) in 59.56 seconds (43.43 work units)
    Thread count was 1 (of 96 available processors)
    
    Solution count 10: 2.12472 2.12472 2.12473 ... 2.17093
    
    Optimal solution found (tolerance 1.00e-06)
    Warning: max constraint violation (1.0554e-06) exceeds tolerance
    Warning: max general constraint violation (1.0554e-06) exceeds tolerance
    Best objective 2.124722340040e+00, best bound 2.124720237387e+00, gap 0.0001%
    
    User-callback calls 73085, time in user-callback 0.00 sec

... Solving fixed model...

    Gurobi Optimizer version 13.0.0 build v13.0.0rc1 (linux64 - "Oracle Linux Server 9.7")
    
    CPU model: AMD EPYC 7643 48-Core Processor, instruction set [SSE2|AVX|AVX2]
    Thread count: 48 physical cores, 96 logical processors, using up to 1 threads
    
    Non-default parameters:
    TimeLimit  300
    MIPGap  1e-06
    LogToConsole  0
    NonConvex  2
    Threads  1
    
    Optimize a model with 753 rows, 443 columns and 1641 nonzeros (Min)
    Model fingerprint: 0xfba2d33c
    Model has 15 linear objective coefficients
    Coefficient statistics:
      Matrix range     [1e+00, 6e+01]
      Objective range  [1e+00, 1e+00]
      Bounds range     [2e-02, 6e+01]
      RHS range        [1e+00, 1e+00]
    Presolve removed 753 rows and 443 columns
    Presolve time: 0.00s
    Presolve: All rows and columns removed
    Iteration    Objective       Primal Inf.    Dual Inf.      Time
           0    2.1247223e+00   0.000000e+00   0.000000e+00      0s
    
    Solved in 0 iterations and 0.00 seconds (0.00 work units)
    Optimal objective  2.124722340e+00
    
    User-callback calls 0, time in user-callback 0.00 sec

--- Reading solution for model GAMS_MODEL
***
*** Solver did not provide marginals for model GAMS_MODEL
***
--- Executing after solve: elapsed 0:00:59.618
--- model.gms(2507) 3 Mb
--- model.gms(3695) 5 Mb
--- Putfile results /local/scratch/a/sgusev/repos/k_means/data/gams_gurobi_gdp.hull/no_mode/2026-02-14_20-13-39/original/results.dat
--- Putfile statresults /local/scratch/a/sgusev/repos/k_means/data/gams_gurobi_gdp.hull/no_mode/2026-02-14_20-13-39/original/resultsstat.dat
*** Status: Normal completion
--- Job model.gms Stop 02/14/26 20:14:40 elapsed 0:00:59.620
Original problem solved. Time taken: 60.20394253730774 seconds
Original objective value: 2.124722340042569
