Solving original (integer) problem with strategy gdp.hull...
--- Job model.gms Start 02/14/26 20:12:47 52.2.0 d8e408be LEX-LEG x86 64bit/Linux
--- Applying:
    /package/gams/52.2/gmsprmun.txt
--- GAMS Parameters defined
    Input /local/scratch/a/sgusev/repos/k_means/data/gams_gurobi_gdp.hull/no_mode/2026-02-14_20-12-47/original/model.gms
    Output /local/scratch/a/sgusev/repos/k_means/data/gams_gurobi_gdp.hull/no_mode/2026-02-14_20-12-47/original/output.lst
    ScrDir /local/scratch/a/sgusev/repos/k_means/data/gams_gurobi_gdp.hull/no_mode/2026-02-14_20-12-47/original/225a/
    SysDir /package/gams/52.2/
    CurDir /local/scratch/a/sgusev/repos/k_means/data/gams_gurobi_gdp.hull/no_mode/2026-02-14_20-12-47/original/
    LogOption 3
    AppendLog 1
Licensee: David Bernal / SECQUOIA Research Group         G251008+0003Ac-GEN
          Purdue University, Davidson School of Chemical EngineeringDCE4838
          225a/gamslice.dat
          5a82958a-fbca-4a23
          node:66820903 mem:995 cores:48 ipport:40983 v:2                  
          Evaluation license: Not for commercial or production use
          The time-limited license stops working on : Jun 30, 2027
System information: 48 physical cores and 995 Gb physical memory detected
GAMS 52.2.0   Copyright (C) 1987-2025 GAMS Development. All rights reserved
--- Starting compilation
--- model.gms(2021) 2 Mb
--- $echo File /local/scratch/a/sgusev/repos/k_means/data/gams_gurobi_gdp.hull/no_mode/2026-02-14_20-12-47/original/gurobi.opt
--- model.gms(3009) 2 Mb
--- Starting execution: elapsed 0:00:00.013
--- model.gms(2030) 3 Mb
--- Generating MINLP model GAMS_MODEL
--- model.gms(2034) 5 Mb
---   611 rows  311 columns  1,477 non-zeroes
---   1,488 nl-code  192 nl-non-zeroes
---   48 discrete-columns
--- Range statistics (absolute non-zero finite values)
--- RHS       [min, max] : [ 8.324E-06, 1.000E+00] - Zero values observed as well
--- Bound     [min, max] : [ 1.000E+00, 6.400E+01] - Zero values observed as well
--- Matrix    [min, max] : [ 7.669E-02, 6.400E+01]
--- model.gms(2034) 3 Mb
--- Executing GUROBI (Solvelink=5): elapsed 0:00:00.017
Reading parameter(s) from "/local/scratch/a/sgusev/repos/k_means/data/gams_gurobi_gdp.hull/no_mode/2026-02-14_20-12-47/original/gurobi.opt"
>>  NonConvex 2
>>  Threads 1
>>  MIPGap 1e-06
>>  MIPGapAbs 1e-10
>>  FeasibilityTol 1e-06
>>  OptimalityTol 1e-06
>>  IntFeasTol 1e-05
Finished reading from "/local/scratch/a/sgusev/repos/k_means/data/gams_gurobi_gdp.hull/no_mode/2026-02-14_20-12-47/original/gurobi.opt"

... GRB_LICENSE_FILE = /local/scratch/a/sgusev/gurobi.lic

    Gurobi           52.2.0 d8e408be Dec 8, 2025           LEG x86 64bit/Linux    

... GAMS/Gurobi Link license.
... GMO Q Extraction (ThreePass): 0.00s

    Gurobi Optimizer version 13.0.0 build v13.0.0rc1 (linux64 - "Oracle Linux Server 9.7")
    
    CPU model: AMD EPYC 7643 48-Core Processor, instruction set [SSE2|AVX|AVX2]
    Thread count: 48 physical cores, 96 logical processors, using up to 1 threads
    
    Non-default parameters:
    TimeLimit  300
    MIPGap  1e-06
    LogToConsole  0
    NonConvex  2
    Threads  1
    
    Optimize a model with 610 rows, 358 columns and 1316 nonzeros (Min)
    Model fingerprint: 0x7b055204
    Model has 16 linear objective coefficients
    Model has 48 general nonlinear constraints (288 nonlinear terms)
    Variable types: 310 continuous, 48 integer (0 binary)
    Coefficient statistics:
      Matrix range     [1e+00, 6e+01]
      Objective range  [1e+00, 1e+00]
      Bounds range     [1e+00, 6e+01]
      RHS range        [1e+00, 1e+00]
      NLCon coe range  [8e-06, 1e+00]
    Presolve model has 48 nlconstr
    Added 624 variables to disaggregate expressions
    Presolve removed 144 rows and 112 columns
    Presolve time: 0.00s
    Presolved: 1906 rows, 871 columns, 4852 nonzeros
    Presolved model has 288 bilinear constraint(s)
    
    Solving non-convex MIQCP to global optimality
    
    Variable types: 823 continuous, 48 integer (48 binary)
    Found heuristic solution: objective 10.1601589
    
    Root relaxation: objective 0.000000e+00, 286 iterations, 0.00 seconds (0.00 work units)
    
        Nodes    |    Current Node    |     Objective Bounds      |     Work
     Expl Unexpl |  Obj  Depth IntInf | Incumbent    BestBd   Gap | It/Node Time
    
         0     0    0.00000    0  152   10.16016    0.00000   100%     -    0s
         0     0    0.00000    0  160   10.16016    0.00000   100%     -    0s
         0     0    0.00000    0  146   10.16016    0.00000   100%     -    0s
         0     0    0.00000    0  191   10.16016    0.00000   100%     -    0s
         0     0    0.00000    0  191   10.16016    0.00000   100%     -    0s
         0     0    0.00000    0   86   10.16016    0.00000   100%     -    0s
         0     0    0.00000    0  123   10.16016    0.00000   100%     -    0s
         0     0    0.00000    0  169   10.16016    0.00000   100%     -    0s
         0     0    0.00000    0  169   10.16016    0.00000   100%     -    0s
         0     0    0.00000    0   94   10.16016    0.00000   100%     -    0s
         0     0    0.00000    0   94   10.16016    0.00000   100%     -    0s
         0     0    0.00000    0   94   10.16016    0.00000   100%     -    0s
    H    0     0                       8.2654374    0.00000   100%     -    0s
    H    0     0                       7.4245164    0.00000   100%     -    0s
    H    0     0                       7.2836063    0.00000   100%     -    0s
         0     2    0.00000    0   94    7.28361    0.00000   100%     -    0s
    H   24    24                       7.0611217    0.00000   100%  25.9    0s
    H   46    46                       6.2526851    0.00000   100%  20.1    0s
    H  191   132                       5.4964358    0.00000   100%  14.8    0s
    H  211   118                       4.3139536    0.00000   100%  14.3    0s
    H  285   186                       4.3072044    0.00000   100%  12.0    0s
    H  288   187                       4.2927400    0.00000   100%  12.0    0s
    H  387   252                       4.2888876    0.00000   100%  11.9    0s
    H  406   247                       4.2463470    0.00000   100%  12.0    1s
    H  658   376                       3.9629674    0.00000   100%  20.2    2s
    H  660   358                       3.7633458    0.00000   100%  20.3    2s
    H  660   340                       3.7633458    0.00000   100%  20.3    2s
    H  666   327                       3.7546730    0.00000   100%  20.6    2s
    H  666   311                       3.7382629    0.00000   100%  20.6    2s
    H  666   295                       3.7382413    0.00000   100%  20.6    2s
    H  671   285                       3.7378679    0.00000   100%  20.6    2s
    H  671   271                       3.7378574    0.00000   100%  20.6    2s
    H  672   258                       3.7378546    0.00000   100%  20.6    2s
    H  680   249                       3.7257153    0.00000   100%  20.6    2s
    H  680   237                       3.7047670    0.00000   100%  20.6    2s
    H  680   226                       3.6914809    0.00000   100%  20.6    2s
    H  680   215                       3.6914706    0.00000   100%  20.6    2s
    H  680   205                       3.6900939    0.00000   100%  20.6    2s
    H  683   197                       3.6370913    0.00000   100%  20.5    2s
    H  683   188                       3.6357226    0.00000   100%  20.5    2s
    H  683   179                       3.6337807    0.00000   100%  20.5    2s
    H  685   172                       3.5975405    0.00000   100%  20.5    2s
    H  685   164                       3.5446985    0.00000   100%  20.5    2s
    H  686   158                       3.5168825    0.00000   100%  20.4    2s
    H  686   151                       3.5084547    0.00000   100%  20.4    2s
    H  686   144                       3.5019123    0.00000   100%  20.4    2s
    H  686   138                       3.5019022    0.00000   100%  20.4    2s
    H  744   140                       3.4620480    0.00000   100%  20.2    2s
    H  763   144                       3.3719327    0.00000   100%  20.1    2s
    H  944   154                       2.9772439    0.00000   100%  18.7    2s
    H 1944   646                       2.8938782    0.64030  77.9%  15.0    3s
    H 3136  1033                       2.8805712    1.03162  64.2%  13.8    4s
    H 3136  1032                       2.8735571    1.03162  64.1%  13.8    4s
    H 3136  1032                       2.8732805    1.03162  64.1%  13.8    4s
    H 3243  1047                       2.8709911    1.05170  63.4%  13.8    4s
    H 3266  1059                       2.8709900    1.06199  63.0%  13.8    4s
    H 3550  1133                       2.8690650    1.15355  59.8%  13.5    4s
    H 3550  1133                       2.8664812    1.15355  59.8%  13.5    4s
    H 3550  1133                       2.8664530    1.15355  59.8%  13.5    4s
    H 3596  1115                       2.8381001    1.17264  58.7%  13.6    4s
      4010  1221    2.18658   32   83    2.83810    1.26442  55.4%  13.4    5s
    H 4136  1236                       2.8380997    1.29278  54.4%  13.4    5s
    H 4213  1243                       2.8380984    1.31839  53.5%  13.4    5s
    H 4699  1319                       2.8380984    1.45197  48.8%  13.3    5s
    H 5693  1459                       2.8380858    1.67299  41.1%  13.0    6s
    H 9377  1634                       2.8380809    2.07858  26.8%  12.0    9s
     10401  1518     cutoff   40         2.83808    2.17457  23.4%  11.8   10s
    H14967   403                       2.8380777    2.64266  6.89%  10.2   12s
     19184   520     cutoff   88         2.83808    2.83561  0.09%   8.5   15s
     28907  2235     cutoff   94         2.83808    2.83649  0.06%   6.4   20s
     40372  2684     cutoff   99         2.83808    2.83671  0.05%   5.4   25s
     51342  2008     cutoff   94         2.83808    2.83690  0.04%   4.9   30s
     61123   681    2.83776   95    5    2.83808    2.83760  0.02%   4.5   35s
    
    Cutting planes:
      Learned: 44
      Implied bound: 20
      Projected implied bound: 2
      MIR: 3
      Flow cover: 33
      RLT: 13
      Relax-and-lift: 10
    
    Explored 62707 nodes (282875 simplex iterations) in 35.85 seconds (25.90 work units)
    Thread count was 1 (of 96 available processors)
    
    Solution count 10: 2.83808 2.83808 2.83808 ... 2.86906
    
    Optimal solution found (tolerance 1.00e-06)
    Best objective 2.838077658084e+00, best bound 2.838074884272e+00, gap 0.0001%
    
    User-callback calls 62762, time in user-callback 0.00 sec

... Solving fixed model...

    Gurobi Optimizer version 13.0.0 build v13.0.0rc1 (linux64 - "Oracle Linux Server 9.7")
    
    CPU model: AMD EPYC 7643 48-Core Processor, instruction set [SSE2|AVX|AVX2]
    Thread count: 48 physical cores, 96 logical processors, using up to 1 threads
    
    Non-default parameters:
    TimeLimit  300
    MIPGap  1e-06
    LogToConsole  0
    NonConvex  2
    Threads  1
    
    Optimize a model with 610 rows, 358 columns and 1316 nonzeros (Min)
    Model fingerprint: 0xbc62b244
    Model has 16 linear objective coefficients
    Coefficient statistics:
      Matrix range     [1e+00, 6e+01]
      Objective range  [1e+00, 1e+00]
      Bounds range     [2e-02, 6e+01]
      RHS range        [1e+00, 1e+00]
    Presolve removed 610 rows and 358 columns
    Presolve time: 0.00s
    Presolve: All rows and columns removed
    Iteration    Objective       Primal Inf.    Dual Inf.      Time
           0    2.8380777e+00   0.000000e+00   0.000000e+00      0s
    
    Solved in 0 iterations and 0.00 seconds (0.00 work units)
    Optimal objective  2.838077658e+00
    
    User-callback calls 0, time in user-callback 0.00 sec

--- Reading solution for model GAMS_MODEL
***
*** Solver did not provide marginals for model GAMS_MODEL
***
--- Executing after solve: elapsed 0:00:35.888
--- model.gms(2037) 3 Mb
--- model.gms(3009) 5 Mb
--- Putfile results /local/scratch/a/sgusev/repos/k_means/data/gams_gurobi_gdp.hull/no_mode/2026-02-14_20-12-47/original/results.dat
--- Putfile statresults /local/scratch/a/sgusev/repos/k_means/data/gams_gurobi_gdp.hull/no_mode/2026-02-14_20-12-47/original/resultsstat.dat
*** Status: Normal completion
--- Job model.gms Stop 02/14/26 20:13:23 elapsed 0:00:35.890
Original problem solved. Time taken: 36.48167538642883 seconds
Original objective value: 2.838077658084178
