Solving original (integer) problem with strategy gdp.binary_multiplication...
--- Job model.gms Start 02/19/26 03:11:47 52.2.0 d8e408be LEX-LEG x86 64bit/Linux
--- Applying:
    /package/gams/52.2/gmsprmun.txt
--- GAMS Parameters defined
    Input /local/scratch/a/sgusev/repos/k_means/data/gams_gurobi_gdp.binary_multiplication/no_mode/2026-02-19_03-11-46/original/model.gms
    Output /local/scratch/a/sgusev/repos/k_means/data/gams_gurobi_gdp.binary_multiplication/no_mode/2026-02-19_03-11-46/original/output.lst
    ScrDir /local/scratch/a/sgusev/repos/k_means/data/gams_gurobi_gdp.binary_multiplication/no_mode/2026-02-19_03-11-46/original/225a/
    SysDir /package/gams/52.2/
    CurDir /local/scratch/a/sgusev/repos/k_means/data/gams_gurobi_gdp.binary_multiplication/no_mode/2026-02-19_03-11-46/original/
    LogOption 3
    AppendLog 1
Licensee: David Bernal / SECQUOIA Research Group         G251008+0003Ac-GEN
          Purdue University, Davidson School of Chemical EngineeringDCE4838
          225a/gamslice.dat
          5a82958a-fbca-4a23
          node:66820903 mem:995 cores:48 ipport:38341 v:2                  
          Evaluation license: Not for commercial or production use
          The time-limited license stops working on : Jun 30, 2027
System information: 48 physical cores and 995 Gb physical memory detected
GAMS 52.2.0   Copyright (C) 1987-2025 GAMS Development. All rights reserved
--- Starting compilation
--- model.gms(373) 2 Mb
--- $echo File /local/scratch/a/sgusev/repos/k_means/data/gams_gurobi_gdp.binary_multiplication/no_mode/2026-02-19_03-11-46/original/gurobi.opt
--- model.gms(647) 2 Mb
--- Starting execution: elapsed 0:00:00.007
--- model.gms(382) 3 Mb
--- Generating MINLP model GAMS_MODEL
--- model.gms(386) 5 Mb
---   101 rows  107 columns  425 non-zeroes
---   880 nl-code  320 nl-non-zeroes
---   80 discrete-columns
--- Range statistics (absolute non-zero finite values)
--- RHS       [min, max] : [ 1.000E+00, 1.000E+00] - Zero values observed as well
--- Bound     [min, max] : [ 1.000E+00, 6.400E+01] - Zero values observed as well
--- Matrix    [min, max] : [ 1.729E-02, 1.373E+00] - Zero values observed as well
--- model.gms(386) 3 Mb
--- Executing GUROBI (Solvelink=5): elapsed 0:00:00.010
Reading parameter(s) from "/local/scratch/a/sgusev/repos/k_means/data/gams_gurobi_gdp.binary_multiplication/no_mode/2026-02-19_03-11-46/original/gurobi.opt"
>>  NonConvex 2
>>  Threads 1
>>  MIPGap 1e-06
>>  MIPGapAbs 1e-10
>>  FeasibilityTol 1e-06
>>  OptimalityTol 1e-06
>>  IntFeasTol 1e-05
Finished reading from "/local/scratch/a/sgusev/repos/k_means/data/gams_gurobi_gdp.binary_multiplication/no_mode/2026-02-19_03-11-46/original/gurobi.opt"

... GRB_LICENSE_FILE = /local/scratch/a/sgusev/gurobi.lic

    Gurobi           52.2.0 d8e408be Dec 8, 2025           LEG x86 64bit/Linux    

... GAMS/Gurobi Link license.
... GMO Q Extraction (ThreePass): 0.00s

    Gurobi Optimizer version 13.0.0 build v13.0.0rc1 (linux64 - "Oracle Linux Server 9.7")
    
    CPU model: AMD EPYC 7643 48-Core Processor, instruction set [SSE2|AVX|AVX2]
    Thread count: 48 physical cores, 96 logical processors, using up to 1 threads
    
    Non-default parameters:
    TimeLimit  300
    MIPGap  1e-06
    LogToConsole  0
    NonConvex  2
    Threads  1
    
    Optimize a model with 100 rows, 186 columns and 168 nonzeros (Min)
    Model fingerprint: 0x8673f698
    Model has 16 linear objective coefficients
    Model has 80 general nonlinear constraints (240 nonlinear terms)
    Variable types: 106 continuous, 80 integer (0 binary)
    Coefficient statistics:
      Matrix range     [1e+00, 1e+00]
      Objective range  [1e+00, 1e+00]
      Bounds range     [1e+00, 6e+01]
      RHS range        [1e+00, 1e+00]
      NLCon coe range  [5e-04, 9e-01]
    Presolve model has 80 nlconstr
    Added 400 variables to disaggregate expressions
    Presolve removed 80 rows and 0 columns
    Presolve time: 0.00s
    Presolved: 1060 rows, 667 columns, 2488 nonzeros
    Presolved model has 160 bilinear constraint(s)
    
    Solving non-convex MIQCP to global optimality
    
    Variable types: 587 continuous, 80 integer (80 binary)
    Found heuristic solution: objective 7.9880517
    
    Root relaxation: objective 0.000000e+00, 165 iterations, 0.00 seconds (0.00 work units)
    
        Nodes    |    Current Node    |     Objective Bounds      |     Work
     Expl Unexpl |  Obj  Depth IntInf | Incumbent    BestBd   Gap | It/Node Time
    
         0     0    0.00000    0   96    7.98805    0.00000   100%     -    0s
    H    0     0                       7.1498638    0.00000   100%     -    0s
         0     0    0.00000    0  114    7.14986    0.00000   100%     -    0s
         0     0    0.00000    0  163    7.14986    0.00000   100%     -    0s
         0     0    0.00000    0  159    7.14986    0.00000   100%     -    0s
    H    0     0                       4.0675835    0.00000   100%     -    0s
         0     0    0.00000    0  165    4.06758    0.00000   100%     -    0s
         0     0    0.00000    0  170    4.06758    0.00000   100%     -    0s
         0     0    0.00000    0  168    4.06758    0.00000   100%     -    0s
         0     0    0.00000    0  168    4.06758    0.00000   100%     -    0s
         0     0    0.00000    0  166    4.06758    0.00000   100%     -    0s
    H    0     0                       3.6106437    0.00000   100%     -    0s
    H    0     0                       3.2237827    0.00000   100%     -    0s
         0     2    0.00000    0  166    3.22378    0.00000   100%     -    0s
    H    8     8                       3.2221848    0.00000   100%  17.6    0s
    H    8     8                       3.2218107    0.00000   100%  17.6    0s
    H   20    20                       3.1919278    0.00000   100%  19.5    0s
    H   28    28                       3.1173132    0.00000   100%  17.6    0s
    H   28    28                       3.0675093    0.00000   100%  17.6    0s
    H   42    42                       2.9246063    0.00000   100%  15.1    0s
    H   42    42                       2.9246061    0.00000   100%  15.1    0s
    H  129   119                       2.8790058    0.00000   100%  16.8    0s
    H  137   119                       2.3749703    0.00000   100%  16.2    0s
    H  140   122                       2.3480400    0.00000   100%  16.4    0s
    H  193   154                       2.3470520    0.00000   100%  16.8    0s
    H  193   154                       2.3350157    0.00000   100%  16.8    0s
    H  261   203                       2.2856679    0.00000   100%  18.8    0s
    H  261   203                       2.2816237    0.00000   100%  18.8    0s
    H  397   300                       2.2262348    0.00000   100%  18.3    0s
    H  578   427                       2.2262348    0.00000   100%  15.8    0s
    H  613   445                       2.2243915    0.00000   100%  15.4    0s
    H  677   464                       2.2243915    0.00000   100%  21.2    1s
    H  690   451                       2.2243915    0.00000   100%  21.0    1s
    H  983   555                       2.1436479    0.00000   100%  19.2    1s
    H  983   535                       2.1167331    0.00000   100%  19.2    1s
    H  994   522                       1.9835541    0.00000   100%  19.2    1s
    H 1016   516                       1.8483349    0.00000   100%  19.2    1s
    H 1027   504                       1.8477063    0.00000   100%  19.2    1s
    H 1049   490                       1.8337408    0.00000   100%  19.3    1s
    H 1166   525                       1.8313930    0.00000   100%  19.0    2s
    H 1166   510                       1.8308058    0.00000   100%  19.0    2s
    H 1166   496                       1.8306590    0.00000   100%  19.0    2s
    H 1166   483                       1.8306223    0.00000   100%  19.0    2s
    H 1513   621                       1.7444826    0.00000   100%  19.5    2s
    H 1513   621                       1.7429114    0.00000   100%  19.5    2s
    H 1575   659                       1.3750532    0.00000   100%  19.1    2s
    H 1634   698                       1.3750532    0.00000   100%  18.9    2s
    H 1634   644                       1.1849338    0.00000   100%  18.9    2s
    H 1688   682                       1.1812494    0.00000   100%  18.7    2s
    H 1688   682                       1.1804738    0.00000   100%  18.7    2s
    H 1688   682                       1.1804553    0.00000   100%  18.7    2s
    H 2762  1157                       1.1804552    0.00000   100%  18.7    3s
    H 3762  1520                       1.1628990    0.00000   100%  19.2    4s
    H 3762  1506                       1.1363409    0.00000   100%  19.2    4s
      3762  1508    0.44316   29  173    1.13634    0.00000   100%  19.2    5s
      8654  3090    0.68106   33  172    1.13634    0.01337  98.8%  21.6   10s
    H11705  3837                       1.1153172    0.07549  93.2%  22.1   13s
     12705  3928    0.12807   31  159    1.11532    0.10088  91.0%  22.4   15s
     17738  4941 infeasible   36         1.11532    0.16703  85.0%  22.6   20s
     23164  5908    0.46407   31  149    1.11532    0.26733  76.0%  22.8   25s
     28051  6773    0.65921   34  169    1.11532    0.30461  72.7%  22.9   30s
     33535  7865     cutoff   40         1.11532    0.34307  69.2%  22.6   35s
    H38677  8530                       1.0990252    0.37873  65.5%  22.3   39s
     38678  8533    0.84973   67  128    1.09903    0.37873  65.5%  22.3   40s
    H41614  8828                       1.0701372    0.40452  62.2%  22.2   43s
     43006  8982     cutoff   36         1.07014    0.42388  60.4%  22.1   45s
     47927  9248    0.58017   32  162    1.07014    0.46621  56.4%  22.0   50s
     52476  9528    0.50232   30  123    1.07014    0.50232  53.1%  21.8   55s
     57202  9870 infeasible   42         1.07014    0.53271  50.2%  21.8   60s
    H58061  9914                       1.0698466    0.53966  49.6%  21.8   60s
     61840 10129    0.89553   68  144    1.06985    0.55932  47.7%  21.7   65s
     66577 10376    1.05657   68  116    1.06985    0.58908  44.9%  21.6   70s
     71256 10498     cutoff   57         1.06985    0.61636  42.4%  21.5   75s
     76306 10720    0.68519   30  172    1.06985    0.64099  40.1%  21.3   80s
     81359 10886    0.66595   38  125    1.06985    0.66534  37.8%  21.0   85s
     86563 11078 infeasible   49         1.06985    0.68531  35.9%  20.8   90s
     91179 11149    0.85101   44  147    1.06985    0.70372  34.2%  20.6   95s
    H94966 11167                       1.0698466    0.72004  32.7%  20.5   98s
    H95969 11086                       1.0698450    0.72596  32.1%  20.4   99s
    H95969 11086                       1.0698438    0.72596  32.1%  20.4   99s
     96218 11070     cutoff   31         1.06984    0.72727  32.0%  20.4  100s
     100877 11130     cutoff   62         1.06984    0.74335  30.5%  20.2  105s
     105877 10968    1.03948   67   82    1.06984    0.76002  29.0%  20.1  110s
     111039 10820    0.99621   62   82    1.06984    0.77714  27.4%  19.9  115s
     116232 10767 infeasible   61         1.06984    0.79242  25.9%  19.7  120s
     121427 10323    0.80996   22  155    1.06984    0.80996  24.3%  19.5  125s
     126352  9759 infeasible   38         1.06984    0.82587  22.8%  19.3  130s
     131532  9319     cutoff   57         1.06984    0.84142  21.4%  19.2  135s
     136415  8748 infeasible   47         1.06984    0.85791  19.8%  19.0  140s
     141520  8066    1.00794   64  128    1.06984    0.87598  18.1%  18.8  145s
     146689  7125     cutoff   62         1.06984    0.89675  16.2%  18.7  150s
     151713  6357    0.91705   49  148    1.06984    0.91705  14.3%  18.5  155s
     156501  5384     cutoff   55         1.06984    0.94220  11.9%  18.4  160s
     161513  4780    1.05989   59   48    1.06984    0.96681  9.63%  18.2  165s
     166667  4306     cutoff   52         1.06984    0.98852  7.60%  18.0  170s
     171949  4072    1.06661   81  128    1.06984    1.00450  6.11%  17.7  175s
     177326  3635     cutoff   68         1.06984    1.02368  4.31%  17.4  180s
    *178570  3789             122       1.0698363    1.02595  4.10%  17.3  181s
     181906  3735    1.06464   70  100    1.06984    1.03282  3.46%  17.2  185s
     187279  3662    1.04963   71   96    1.06984    1.04045  2.75%  16.9  190s
     192616  3874    1.06684   73   68    1.06984    1.04637  2.19%  16.6  195s
     198429  3417    1.06928   64   96    1.06984    1.05310  1.56%  16.3  200s
     204147  2781    1.06434   76   98    1.06984    1.05987  0.93%  16.0  205s
     210594  3000     cutoff   79         1.06984    1.06231  0.70%  15.6  210s
     217442  3022    1.06950   81   64    1.06984    1.06453  0.50%  15.3  215s
     224402  3372    1.06968   88   68    1.06984    1.06616  0.34%  15.0  220s
     231412  3968    1.06978   89   80    1.06984    1.06658  0.30%  14.7  225s
     238797  4193    1.06772   81   94    1.06984    1.06695  0.27%  14.4  230s
     246092  3692    1.06932   80   80    1.06984    1.06754  0.21%  14.1  235s
     252821  2793     cutoff   73         1.06984    1.06860  0.12%  13.9  240s
     260120  2874    1.06977   97   38    1.06984    1.06928  0.05%  13.6  245s
     267405  3245    1.06980   90   99    1.06984    1.06941  0.04%  13.3  250s
     274941  3255    1.06951   83   68    1.06984    1.06950  0.03%  13.1  255s
     282153  2947     cutoff  101         1.06984    1.06961  0.02%  12.8  260s
     289230  2730    1.06983  110   48    1.06984    1.06972  0.01%  12.6  265s
     296752  2944    1.06983  105   35    1.06984    1.06974  0.01%  12.4  270s
     303899  2991    1.06977   98   80    1.06984    1.06976  0.01%  12.2  275s
     311487  2923    1.06978   95  100    1.06984    1.06978  0.01%  11.9  280s
     319117  2247     cutoff  107         1.06984    1.06980  0.00%  11.7  285s
     326518  1700    1.06983  105   64    1.06984    1.06982  0.00%  11.5  290s
    
    Cutting planes:
      Gomory: 6
      Implied bound: 18
      MIR: 5
      Flow cover: 67
      Inf proof: 1
      RLT: 17
      Relax-and-lift: 7
    
    Explored 333440 nodes (3786152 simplex iterations) in 294.65 seconds (200.56 work units)
    Thread count was 1 (of 96 available processors)
    
    Solution count 10: 1.06984 1.06984 1.06984 ... 1.1629
    
    Optimal solution found (tolerance 1.00e-06)
    Warning: max constraint violation (1.1010e-06) exceeds tolerance
    Warning: max general constraint violation (1.1010e-06) exceeds tolerance
    Best objective 1.069836281959e+00, best bound 1.069835228337e+00, gap 0.0001%
    
    User-callback calls 333497, time in user-callback 0.01 sec

... Solving fixed model...

    Gurobi Optimizer version 13.0.0 build v13.0.0rc1 (linux64 - "Oracle Linux Server 9.7")
    
    CPU model: AMD EPYC 7643 48-Core Processor, instruction set [SSE2|AVX|AVX2]
    Thread count: 48 physical cores, 96 logical processors, using up to 1 threads
    
    Non-default parameters:
    TimeLimit  300
    MIPGap  1e-06
    LogToConsole  0
    NonConvex  2
    Threads  1
    
    Optimize a model with 100 rows, 186 columns and 168 nonzeros (Min)
    Model fingerprint: 0xb1fff363
    Model has 16 linear objective coefficients
    Coefficient statistics:
      Matrix range     [1e+00, 1e+00]
      Objective range  [1e+00, 1e+00]
      Bounds range     [4e-04, 1e+00]
      RHS range        [1e+00, 1e+00]
    Presolve removed 100 rows and 186 columns
    Presolve time: 0.00s
    Presolve: All rows and columns removed
    Iteration    Objective       Primal Inf.    Dual Inf.      Time
           0    1.0698363e+00   0.000000e+00   0.000000e+00      0s
    
    Solved in 0 iterations and 0.00 seconds (0.00 work units)
    Optimal objective  1.069836282e+00
    
    User-callback calls 0, time in user-callback 0.00 sec

--- Reading solution for model GAMS_MODEL
***
*** Solver did not provide marginals for model GAMS_MODEL
***
--- Executing after solve: elapsed 0:04:54.696
--- model.gms(389) 3 Mb
--- model.gms(647) 5 Mb
--- Putfile results /local/scratch/a/sgusev/repos/k_means/data/gams_gurobi_gdp.binary_multiplication/no_mode/2026-02-19_03-11-46/original/results.dat
--- Putfile statresults /local/scratch/a/sgusev/repos/k_means/data/gams_gurobi_gdp.binary_multiplication/no_mode/2026-02-19_03-11-46/original/resultsstat.dat
*** Status: Normal completion
--- Job model.gms Stop 02/19/26 03:16:41 elapsed 0:04:54.696
Original problem solved. Time taken: 295.1849994659424 seconds
Original objective value: 1.069836281959378
