Solving original (integer) problem with strategy gdp.binary_multiplication...
--- Job model.gms Start 02/18/26 23:10:23 52.2.0 d8e408be LEX-LEG x86 64bit/Linux
--- Applying:
    /package/gams/52.2/gmsprmun.txt
--- GAMS Parameters defined
    Input /local/scratch/a/sgusev/repos/k_means/data/gams_gurobi_gdp.binary_multiplication/no_mode/2026-02-18_23-10-23/original/model.gms
    Output /local/scratch/a/sgusev/repos/k_means/data/gams_gurobi_gdp.binary_multiplication/no_mode/2026-02-18_23-10-23/original/output.lst
    ScrDir /local/scratch/a/sgusev/repos/k_means/data/gams_gurobi_gdp.binary_multiplication/no_mode/2026-02-18_23-10-23/original/225a/
    SysDir /package/gams/52.2/
    CurDir /local/scratch/a/sgusev/repos/k_means/data/gams_gurobi_gdp.binary_multiplication/no_mode/2026-02-18_23-10-23/original/
    LogOption 3
    AppendLog 1
Licensee: David Bernal / SECQUOIA Research Group         G251008+0003Ac-GEN
          Purdue University, Davidson School of Chemical EngineeringDCE4838
          225a/gamslice.dat
          5a82958a-fbca-4a23
          node:66820903 mem:995 cores:48 ipport:38889 v:2                  
          Evaluation license: Not for commercial or production use
          The time-limited license stops working on : Jun 30, 2027
System information: 48 physical cores and 995 Gb physical memory detected
GAMS 52.2.0   Copyright (C) 1987-2025 GAMS Development. All rights reserved
--- Starting compilation
--- model.gms(192) 2 Mb
--- $echo File /local/scratch/a/sgusev/repos/k_means/data/gams_gurobi_gdp.binary_multiplication/no_mode/2026-02-18_23-10-23/original/gurobi.opt
--- model.gms(351) 2 Mb
--- Starting execution: elapsed 0:00:00.006
--- model.gms(201) 3 Mb
--- Generating MINLP model GAMS_MODEL
--- model.gms(205) 5 Mb
---   43 rows  50 columns  195 non-zeroes
---   450 nl-code  150 nl-non-zeroes
---   30 discrete-columns
--- Range statistics (absolute non-zero finite values)
--- RHS       [min, max] : [ 1.000E+00, 1.000E+00] - Zero values observed as well
--- Bound     [min, max] : [ 1.000E+00, 6.000E+01] - Zero values observed as well
--- Matrix    [min, max] : [ 5.186E-01, 1.759E+00] - Zero values observed as well
--- model.gms(205) 3 Mb
--- Executing GUROBI (Solvelink=5): elapsed 0:00:00.009
Reading parameter(s) from "/local/scratch/a/sgusev/repos/k_means/data/gams_gurobi_gdp.binary_multiplication/no_mode/2026-02-18_23-10-23/original/gurobi.opt"
>>  NonConvex 2
>>  Threads 1
>>  MIPGap 1e-06
>>  MIPGapAbs 1e-10
>>  FeasibilityTol 1e-06
>>  OptimalityTol 1e-06
>>  IntFeasTol 1e-05
Finished reading from "/local/scratch/a/sgusev/repos/k_means/data/gams_gurobi_gdp.binary_multiplication/no_mode/2026-02-18_23-10-23/original/gurobi.opt"

... GRB_LICENSE_FILE = /local/scratch/a/sgusev/gurobi.lic

    Gurobi           52.2.0 d8e408be Dec 8, 2025           LEG x86 64bit/Linux    

... GAMS/Gurobi Link license.
... GMO Q Extraction (ThreePass): 0.00s

    Gurobi Optimizer version 13.0.0 build v13.0.0rc1 (linux64 - "Oracle Linux Server 9.7")
    
    CPU model: AMD EPYC 7643 48-Core Processor, instruction set [SSE2|AVX|AVX2]
    Thread count: 48 physical cores, 96 logical processors, using up to 1 threads
    
    Non-default parameters:
    TimeLimit  300
    MIPGap  1e-06
    LogToConsole  0
    NonConvex  2
    Threads  1
    
    Optimize a model with 42 rows, 79 columns and 64 nonzeros (Min)
    Model fingerprint: 0x9ecb7e5d
    Model has 10 linear objective coefficients
    Model has 30 general nonlinear constraints (120 nonlinear terms)
    Variable types: 49 continuous, 30 integer (0 binary)
    Coefficient statistics:
      Matrix range     [1e+00, 1e+00]
      Objective range  [1e+00, 1e+00]
      Bounds range     [1e+00, 6e+01]
      RHS range        [1e+00, 1e+00]
      NLCon coe range  [1e-01, 1e+00]
    Presolve model has 30 nlconstr
    Added 210 variables to disaggregate expressions
    Presolve removed 30 rows and 0 columns
    Presolve time: 0.00s
    Presolved: 522 rows, 320 columns, 1204 nonzeros
    Presolved model has 90 bilinear constraint(s)
    
    Solving non-convex MIQCP to global optimality
    
    Variable types: 290 continuous, 30 integer (30 binary)
    Found heuristic solution: objective 9.8065339
    
    Root relaxation: objective 0.000000e+00, 37 iterations, 0.00 seconds (0.00 work units)
    
        Nodes    |    Current Node    |     Objective Bounds      |     Work
     Expl Unexpl |  Obj  Depth IntInf | Incumbent    BestBd   Gap | It/Node Time
    
         0     0    0.00000    0   90    9.80653    0.00000   100%     -    0s
         0     0    0.00000    0  106    9.80653    0.00000   100%     -    0s
         0     0    0.00000    0  108    9.80653    0.00000   100%     -    0s
         0     0    0.00000    0  102    9.80653    0.00000   100%     -    0s
         0     0    0.00000    0  104    9.80653    0.00000   100%     -    0s
         0     0    0.00000    0  106    9.80653    0.00000   100%     -    0s
         0     0    0.00000    0  104    9.80653    0.00000   100%     -    0s
         0     0    0.00000    0  104    9.80653    0.00000   100%     -    0s
         0     0    0.00000    0  104    9.80653    0.00000   100%     -    0s
    H    0     0                       7.9005787    0.00000   100%     -    0s
    H    0     0                       7.4898499    0.00000   100%     -    0s
    H    0     0                       7.4565689    0.00000   100%     -    0s
         0     2    0.00000    0  104    7.45657    0.00000   100%     -    0s
    H    2     2                       7.3526298    0.00000   100%  15.5    0s
    H    3     3                       7.3526298    0.00000   100%  20.3    0s
    H    4     4                       7.3526297    0.00000   100%  23.8    0s
    H    5     5                       6.4851780    0.00000   100%  22.8    0s
    H    6     6                       6.4851780    0.00000   100%  25.3    0s
    H    6     6                       6.3489848    0.00000   100%  25.3    0s
    H    7     7                       6.2156765    0.00000   100%  24.7    0s
    H    7     7                       5.9904543    0.00000   100%  24.7    0s
    H    9     9                       5.9779638    0.00000   100%  24.6    0s
    H   38    33                       5.8385283    0.00000   100%  14.0    0s
    H   44    31                       5.7608351    0.00000   100%  12.9    0s
    H   64    47                       5.6600790    0.00000   100%  11.3    0s
    H   65    48                       5.6600790    0.00000   100%  11.1    0s
    H   65    48                       5.5615620    0.00000   100%  11.1    0s
    H   90    71                       5.5615619    0.00000   100%  10.1    0s
    H   90    71                       5.5580839    0.00000   100%  10.1    0s
    H  106    85                       5.1690236    0.00000   100%   9.4    0s
    H  150   107                       5.0360245    0.00000   100%  11.6    0s
    H  151    90                       4.1536847    0.00000   100%  11.5    0s
    H  160    97                       4.1536847    0.00000   100%  11.3    0s
    H  160    81                       3.6051735    0.00000   100%  11.3    0s
    H  174    89                       3.5683166    0.00000   100%  11.1    0s
    H  227   113                       3.5218850    0.00000   100%  10.8    0s
    H  457   221                       3.5205767    0.00000   100%  11.1    0s
    H  470   217                       3.3937070    0.00000   100%  11.4    0s
    H  472   209                       3.2840864    0.00000   100%  11.4    0s
    H  483   214                       3.2840864    0.00000   100%  11.3    0s
    H 1554   236                       3.2264908    1.86208  42.3%  18.0    1s
    * 1721   319             114       3.2264822    1.86208  42.3%  16.7    1s
      7119  1479    3.21663   60   80    3.22648    3.08208  4.48%   9.5    5s
     17563  2423    3.22570   65   40    3.22648    3.16700  1.84%   7.0   10s
     28453  2653    3.22305   61   80    3.22648    3.20522  0.66%   6.1   15s
     39563  3405     cutoff   64         3.22648    3.21482  0.36%   5.6   20s
     50148  3504    3.22581   73   50    3.22648    3.22126  0.16%   5.3   25s
     60856  4268     cutoff   69         3.22648    3.22310  0.10%   5.2   30s
     71533  4367    3.22611   64   30    3.22648    3.22441  0.06%   5.1   35s
     82534  4234     cutoff   67         3.22648    3.22525  0.04%   5.1   40s
     93428  3828    3.22613   66   40    3.22648    3.22573  0.02%   5.0   45s
     104974  3520    3.22644   82   50    3.22648    3.22610  0.01%   4.9   50s
     116860  3596    3.22647   85   40    3.22648    3.22625  0.01%   4.8   55s
     128933  3089    3.22648   97   37    3.22648    3.22635  0.00%   4.7   60s
     140795  2747     cutoff  100         3.22648    3.22642  0.00%   4.6   65s
     152655  1885    3.22646  109   42    3.22648    3.22646  0.00%   4.6   70s
    
    Cutting planes:
      Gomory: 2
      Implied bound: 1
      MIR: 5
      Flow cover: 39
      RLT: 3
    
    Explored 157554 nodes (712684 simplex iterations) in 72.01 seconds (47.65 work units)
    Thread count was 1 (of 96 available processors)
    
    Solution count 10: 3.22648 3.22649 3.28409 ... 5.03602
    
    Optimal solution found (tolerance 1.00e-06)
    Warning: max constraint violation (2.5702e-06) exceeds tolerance
    Warning: max general constraint violation (2.5702e-06) exceeds tolerance
    Best objective 3.226482234094e+00, best bound 3.226479058405e+00, gap 0.0001%
    
    User-callback calls 157591, time in user-callback 0.01 sec

... Solving fixed model...

    Gurobi Optimizer version 13.0.0 build v13.0.0rc1 (linux64 - "Oracle Linux Server 9.7")
    
    CPU model: AMD EPYC 7643 48-Core Processor, instruction set [SSE2|AVX|AVX2]
    Thread count: 48 physical cores, 96 logical processors, using up to 1 threads
    
    Non-default parameters:
    TimeLimit  300
    MIPGap  1e-06
    LogToConsole  0
    NonConvex  2
    Threads  1
    
    Optimize a model with 42 rows, 79 columns and 64 nonzeros (Min)
    Model fingerprint: 0xd860e268
    Model has 10 linear objective coefficients
    Coefficient statistics:
      Matrix range     [1e+00, 1e+00]
      Objective range  [1e+00, 1e+00]
      Bounds range     [8e-02, 1e+00]
      RHS range        [1e+00, 1e+00]
    Presolve removed 42 rows and 79 columns
    Presolve time: 0.00s
    Presolve: All rows and columns removed
    Iteration    Objective       Primal Inf.    Dual Inf.      Time
           0    3.2264822e+00   0.000000e+00   0.000000e+00      0s
    
    Solved in 0 iterations and 0.00 seconds (0.00 work units)
    Optimal objective  3.226482234e+00
    
    User-callback calls 0, time in user-callback 0.00 sec

--- Reading solution for model GAMS_MODEL
***
*** Solver did not provide marginals for model GAMS_MODEL
***
--- Executing after solve: elapsed 0:01:12.052
--- model.gms(208) 3 Mb
--- model.gms(351) 5 Mb
--- Putfile results /local/scratch/a/sgusev/repos/k_means/data/gams_gurobi_gdp.binary_multiplication/no_mode/2026-02-18_23-10-23/original/results.dat
--- Putfile statresults /local/scratch/a/sgusev/repos/k_means/data/gams_gurobi_gdp.binary_multiplication/no_mode/2026-02-18_23-10-23/original/resultsstat.dat
*** Status: Normal completion
--- Job model.gms Stop 02/18/26 23:11:35 elapsed 0:01:12.053
Original problem solved. Time taken: 72.5415108203888 seconds
Original objective value: 3.226482234094261
