Solving original (integer) problem with strategy gdp.hull...
--- Job model.gms Start 02/15/26 00:08:09 52.2.0 d8e408be LEX-LEG x86 64bit/Linux
--- Applying:
    /package/gams/52.2/gmsprmun.txt
--- GAMS Parameters defined
    Input /local/scratch/a/sgusev/repos/k_means/data/gams_gurobi_gdp.hull/no_mode/2026-02-15_00-08-08/original/model.gms
    Output /local/scratch/a/sgusev/repos/k_means/data/gams_gurobi_gdp.hull/no_mode/2026-02-15_00-08-08/original/output.lst
    ScrDir /local/scratch/a/sgusev/repos/k_means/data/gams_gurobi_gdp.hull/no_mode/2026-02-15_00-08-08/original/225a/
    SysDir /package/gams/52.2/
    CurDir /local/scratch/a/sgusev/repos/k_means/data/gams_gurobi_gdp.hull/no_mode/2026-02-15_00-08-08/original/
    LogOption 3
    AppendLog 1
Licensee: David Bernal / SECQUOIA Research Group         G251008+0003Ac-GEN
          Purdue University, Davidson School of Chemical EngineeringDCE4838
          225a/gamslice.dat
          5a82958a-fbca-4a23
          node:66820903 mem:995 cores:48 ipport:52781 v:2                  
          Evaluation license: Not for commercial or production use
          The time-limited license stops working on : Jun 30, 2027
System information: 48 physical cores and 995 Gb physical memory detected
GAMS 52.2.0   Copyright (C) 1987-2025 GAMS Development. All rights reserved
--- Starting compilation
--- model.gms(2815) 2 Mb
--- $echo File /local/scratch/a/sgusev/repos/k_means/data/gams_gurobi_gdp.hull/no_mode/2026-02-15_00-08-08/original/gurobi.opt
--- model.gms(4169) 2 Mb
--- Starting execution: elapsed 0:00:00.016
--- model.gms(2824) 3 Mb
--- Generating MINLP model GAMS_MODEL
--- model.gms(2828) 5 Mb
---   854 rows  434 columns  2,081 non-zeroes
---   2,108 nl-code  272 nl-non-zeroes
---   68 discrete-columns
--- Range statistics (absolute non-zero finite values)
--- RHS       [min, max] : [ 6.306E-07, 1.000E+00] - Zero values observed as well
--- Bound     [min, max] : [ 1.000E+00, 6.800E+01] - Zero values observed as well
--- Matrix    [min, max] : [ 6.306E-03, 6.800E+01]
--- model.gms(2828) 3 Mb
--- Executing GUROBI (Solvelink=5): elapsed 0:00:00.021
Reading parameter(s) from "/local/scratch/a/sgusev/repos/k_means/data/gams_gurobi_gdp.hull/no_mode/2026-02-15_00-08-08/original/gurobi.opt"
>>  NonConvex 2
>>  Threads 1
>>  MIPGap 1e-06
>>  MIPGapAbs 1e-10
>>  FeasibilityTol 1e-06
>>  OptimalityTol 1e-06
>>  IntFeasTol 1e-05
Finished reading from "/local/scratch/a/sgusev/repos/k_means/data/gams_gurobi_gdp.hull/no_mode/2026-02-15_00-08-08/original/gurobi.opt"

... GRB_LICENSE_FILE = /local/scratch/a/sgusev/gurobi.lic

    Gurobi           52.2.0 d8e408be Dec 8, 2025           LEG x86 64bit/Linux    

... GAMS/Gurobi Link license.
... GMO Q Extraction (ThreePass): 0.00s

    Gurobi Optimizer version 13.0.0 build v13.0.0rc1 (linux64 - "Oracle Linux Server 9.7")
    
    CPU model: AMD EPYC 7643 48-Core Processor, instruction set [SSE2|AVX|AVX2]
    Thread count: 48 physical cores, 96 logical processors, using up to 1 threads
    
    Non-default parameters:
    TimeLimit  300
    MIPGap  1e-06
    LogToConsole  0
    NonConvex  2
    Threads  1
    
    Optimize a model with 853 rows, 501 columns and 1859 nonzeros (Min)
    Model fingerprint: 0xf1ea3b6f
    Model has 17 linear objective coefficients
    Model has 68 general nonlinear constraints (408 nonlinear terms)
    Variable types: 433 continuous, 68 integer (0 binary)
    Coefficient statistics:
      Matrix range     [1e+00, 7e+01]
      Objective range  [1e+00, 1e+00]
      Bounds range     [1e+00, 7e+01]
      RHS range        [1e+00, 1e+00]
      NLCon coe range  [6e-07, 1e+00]
    Presolve model has 68 nlconstr
    Added 884 variables to disaggregate expressions
    Presolve removed 204 rows and 153 columns
    Presolve time: 0.01s
    Presolved: 2689 rows, 1233 columns, 6874 nonzeros
    Presolved model has 408 bilinear constraint(s)
    
    Solving non-convex MIQCP to global optimality
    
    Variable types: 1165 continuous, 68 integer (68 binary)
    Found heuristic solution: objective 12.2717491
    
    Root relaxation: objective 0.000000e+00, 387 iterations, 0.00 seconds (0.00 work units)
    
        Nodes    |    Current Node    |     Objective Bounds      |     Work
     Expl Unexpl |  Obj  Depth IntInf | Incumbent    BestBd   Gap | It/Node Time
    
         0     0    0.00000    0  205   12.27175    0.00000   100%     -    0s
         0     0    0.00000    0  200   12.27175    0.00000   100%     -    0s
         0     0    0.00000    0  171   12.27175    0.00000   100%     -    0s
         0     0    0.00000    0  172   12.27175    0.00000   100%     -    0s
         0     0    0.00000    0  172   12.27175    0.00000   100%     -    0s
         0     0    0.00000    0   83   12.27175    0.00000   100%     -    0s
         0     0    0.00000    0   83   12.27175    0.00000   100%     -    0s
         0     0    0.00000    0  156   12.27175    0.00000   100%     -    0s
         0     0    0.00000    0  155   12.27175    0.00000   100%     -    0s
         0     0    0.00000    0   79   12.27175    0.00000   100%     -    0s
         0     0    0.00000    0   79   12.27175    0.00000   100%     -    0s
    H    0     0                       8.8961576    0.00000   100%     -    0s
    H    0     0                       8.1037870    0.00000   100%     -    0s
    H    0     0                       7.7674551    0.00000   100%     -    0s
         0     2    0.00000    0   79    7.76746    0.00000   100%     -    0s
    H   31    31                       7.3629173    0.00000   100%  17.9    0s
    H   37    36                       7.3508243    0.00000   100%  16.3    0s
    H   56    51                       7.3508236    0.00000   100%  15.2    0s
    H  116   107                       7.2215663    0.00000   100%  10.7    0s
    H  120   110                       7.2215656    0.00000   100%  10.9    0s
    H  127   116                       7.1800040    0.00000   100%  10.8    0s
    H  128   117                       7.1800034    0.00000   100%  10.7    0s
    H  138   125                       7.1479663    0.00000   100%  11.1    0s
    H  138   125                       7.1479657    0.00000   100%  11.1    0s
    H  154   129                       7.0871219    0.00000   100%  10.4    0s
    H  154   129                       7.0871219    0.00000   100%  10.4    0s
    H  157   132                       7.0854837    0.00000   100%  10.3    0s
    H  164   138                       7.0702756    0.00000   100%   9.9    0s
    H  165   136                       7.0374200    0.00000   100%   9.8    0s
    H  220   171                       7.0374194    0.00000   100%  14.1    0s
    H  227   178                       7.0374194    0.00000   100%  14.1    0s
    H  377   257                       5.6491552    0.00000   100%  17.0    0s
    H  413   285                       5.6183580    0.00000   100%  16.1    1s
    H  589   398                       5.6183574    0.00000   100%  16.2    1s
    H  599   383                       3.4012844    0.00000   100%  16.0    1s
    H  601   366                       2.6102418    0.00000   100%  21.6    2s
    H  601   347                       2.5274121    0.00000   100%  21.6    2s
    H  601   329                       2.5268889    0.00000   100%  21.6    2s
    H  602   313                       2.5268111    0.00000   100%  21.6    2s
    H  602   297                       2.5253529    0.00000   100%  21.6    2s
    H  602   282                       2.5251158    0.00000   100%  21.6    2s
    H  602   268                       2.5251158    0.00000   100%  21.6    2s
    H  603   255                       2.5108554    0.00000   100%  21.6    2s
    H  604   243                       2.5041996    0.00000   100%  21.6    2s
    H  604   231                       2.5037670    0.00000   100%  21.6    2s
    H  604   219                       2.5029284    0.00000   100%  21.6    2s
    H  604   208                       2.5027178    0.00000   100%  21.6    2s
    H  604   197                       2.5025419    0.00000   100%  21.6    2s
    H  605   187                       2.5021087    0.00000   100%  21.9    2s
    H  605   178                       2.5020987    0.00000   100%  21.9    2s
    H  610   173                       2.4672035    0.00000   100%  22.2    2s
    H  699   203                       2.4671931    0.00000   100%  21.8    2s
    H  699   195                       2.4671919    0.00000   100%  21.8    2s
    H  792   204                       2.4671915    0.00000   100%  23.6    2s
    H 1081   324                       2.4671839    0.00000   100%  23.3    3s
    H 1185   381                       2.3315851    0.00000   100%  23.5    3s
    H 1239   422                       2.3315820    0.00000   100%  23.6    3s
      1969   828    1.56854   29   81    2.33158    0.00000   100%  22.8    5s
    H 2430   965                       2.3315819    0.00000   100%  22.4    5s
    H 2675  1052                       2.3315814    0.00000   100%  21.8    6s
    H 3011  1228                       2.3315808    0.00000   100%  21.8    6s
    H 4011  1555                       2.3315805    0.00000   100%  21.2    8s
    H 4457  1679                       2.2116457    0.01528  99.3%  20.8    9s
    H 4457  1674                       2.1976967    0.01528  99.3%  20.8    9s
    H 4457  1674                       2.1975123    0.01528  99.3%  20.8    9s
    H 4457  1674                       2.1974954    0.01528  99.3%  20.8    9s
    H 4457  1674                       2.1974236    0.01528  99.3%  20.8    9s
    H 4483  1677                       2.1974157    0.01528  99.3%  20.9    9s
    H 5101  1822                       2.1845367    0.11894  94.6%  20.8    9s
    H 5101  1815                       2.1721936    0.11894  94.5%  20.8    9s
    H 5101  1813                       2.1635181    0.11894  94.5%  20.8    9s
    H 5101  1813                       2.1634423    0.11894  94.5%  20.8    9s
      5102  1814    1.28446   21   34    2.16344    0.11894  94.5%  20.8   10s
    H 5103  1724                       2.1633855    0.11894  94.5%  20.8   10s
    H 5110  1641                       2.1633853    0.11894  94.5%  20.8   10s
    H 5169  1589                       2.1633710    0.11894  94.5%  21.8   11s
    H 5221  1521                       2.1633692    0.11894  94.5%  21.7   11s
    H 5221  1447                       2.1632241    0.11894  94.5%  21.7   11s
    H 5221  1376                       2.1632220    0.11894  94.5%  21.7   11s
    H 5325  1333                       2.1631859    0.11894  94.5%  21.6   11s
    H 5377  1288                       2.1447144    0.11894  94.5%  21.4   11s
    H 5377  1227                       2.1445179    0.11894  94.5%  21.4   11s
    H 5388  1167                       2.1444925    0.11894  94.5%  21.4   11s
      8449  1529    0.68063   55   97    2.14449    0.25638  88.0%  20.8   15s
    H 9183  1712                       2.0941710    0.36496  82.6%  20.6   15s
    H 9947  1981                       2.0918185    0.46535  77.8%  20.2   16s
     12805  2688    1.59394   37   60    2.09182    0.71345  65.9%  19.7   20s
     16080  3093    2.03033   82   23    2.09182    0.95421  54.4%  19.6   25s
     20291  3305     cutoff   42         2.09182    1.15570  44.8%  20.3   30s
     24841  2850    1.62667   45   76    2.09182    1.41827  32.2%  20.7   35s
     29619  2113     cutoff   45         2.09182    1.64457  21.4%  19.7   40s
     35018  2028    1.90401   53   28    2.09182    1.79709  14.1%  17.8   45s
     41566  2154    2.04359   94   19    2.09182    1.88465  9.90%  15.8   50s
     48153  1900    2.06456  100   14    2.09182    1.96495  6.06%  14.2   55s
     54717  1915    2.04148   93   17    2.09182    2.01720  3.57%  13.0   60s
    H60675  1697                       2.0918149    2.04902  2.05%  12.0   64s
    H60675  1697                       2.0918091    2.04902  2.05%  12.0   64s
     60926  1738    2.08818  106   16    2.09181    2.04985  2.01%  12.0   65s
     66855  1749    2.09163  100   11    2.09181    2.07140  0.98%  11.2   70s
     73650  1340    2.08816  109   19    2.09181    2.08444  0.35%  10.5   75s
     81062  1396    2.08958  116   20    2.09181    2.08902  0.13%   9.7   80s
     88517  1709     cutoff  122         2.09181    2.09024  0.08%   9.1   85s
     95948  1816    2.09095  118   24    2.09181    2.09069  0.05%   8.6   90s
     103130  1822     cutoff  119         2.09181    2.09114  0.03%   8.2   95s
     110342  1968     cutoff  131         2.09181    2.09138  0.02%   7.8  100s
     117483  2351    2.09176  130   14    2.09181    2.09148  0.02%   7.5  105s
     124795  2533    2.09163  130    4    2.09181    2.09153  0.01%   7.2  110s
     132070  2374    2.09179  128    7    2.09181    2.09158  0.01%   6.9  115s
    *139138  2148             142       2.0918054    2.09163  0.01%   6.7  119s
     139305  2145    2.09173  129   18    2.09181    2.09164  0.01%   6.7  120s
     145228  2010     cutoff  139         2.09181    2.09168  0.01%   6.5  125s
    *151139  1959             144       2.0918018    2.09171  0.00%   6.3  128s
     152715  1955     cutoff  138         2.09180    2.09172  0.00%   6.3  130s
     160332  1588     cutoff  136         2.09180    2.09175  0.00%   6.1  135s
    
    Cutting planes:
      Learned: 74
      Gomory: 6
      Implied bound: 17
      Projected implied bound: 10
      MIR: 8
      Flow cover: 90
      RLT: 22
      Relax-and-lift: 16
    
    Explored 167433 nodes (997956 simplex iterations) in 139.98 seconds (105.42 work units)
    Thread count was 1 (of 96 available processors)
    
    Solution count 10: 2.0918 2.0918 2.09181 ... 2.14471
    
    Optimal solution found (tolerance 1.00e-06)
    Warning: max constraint violation (1.3201e-06) exceeds tolerance
    Warning: max general constraint violation (1.3201e-06) exceeds tolerance
    Best objective 2.091801820632e+00, best bound 2.091799765705e+00, gap 0.0001%
    
    User-callback calls 167510, time in user-callback 0.01 sec

... Solving fixed model...

    Gurobi Optimizer version 13.0.0 build v13.0.0rc1 (linux64 - "Oracle Linux Server 9.7")
    
    CPU model: AMD EPYC 7643 48-Core Processor, instruction set [SSE2|AVX|AVX2]
    Thread count: 48 physical cores, 96 logical processors, using up to 1 threads
    
    Non-default parameters:
    TimeLimit  300
    MIPGap  1e-06
    LogToConsole  0
    NonConvex  2
    Threads  1
    
    Optimize a model with 853 rows, 501 columns and 1859 nonzeros (Min)
    Model fingerprint: 0x04fd3928
    Model has 17 linear objective coefficients
    Coefficient statistics:
      Matrix range     [1e+00, 7e+01]
      Objective range  [1e+00, 1e+00]
      Bounds range     [6e-07, 7e+01]
      RHS range        [1e+00, 1e+00]
    Presolve removed 853 rows and 501 columns
    Presolve time: 0.00s
    Presolve: All rows and columns removed
    Iteration    Objective       Primal Inf.    Dual Inf.      Time
           0    2.0918018e+00   0.000000e+00   0.000000e+00      0s
    
    Solved in 0 iterations and 0.00 seconds (0.00 work units)
    Optimal objective  2.091801825e+00
    
    User-callback calls 0, time in user-callback 0.00 sec

--- Reading solution for model GAMS_MODEL
***
*** Solver did not provide marginals for model GAMS_MODEL
***
--- Executing after solve: elapsed 0:02:20.045
--- model.gms(2831) 3 Mb
--- model.gms(4169) 5 Mb
--- Putfile results /local/scratch/a/sgusev/repos/k_means/data/gams_gurobi_gdp.hull/no_mode/2026-02-15_00-08-08/original/results.dat
--- Putfile statresults /local/scratch/a/sgusev/repos/k_means/data/gams_gurobi_gdp.hull/no_mode/2026-02-15_00-08-08/original/resultsstat.dat
*** Status: Normal completion
--- Job model.gms Stop 02/15/26 00:10:29 elapsed 0:02:20.047
Original problem solved. Time taken: 140.64684629440308 seconds
Original objective value: 2.091801825073282
