Solving original (integer) problem with strategy gdp.binary_multiplication...
--- Job model.gms Start 02/19/26 00:36:21 52.2.0 d8e408be LEX-LEG x86 64bit/Linux
--- Applying:
    /package/gams/52.2/gmsprmun.txt
--- GAMS Parameters defined
    Input /local/scratch/a/sgusev/repos/k_means/data/gams_gurobi_gdp.binary_multiplication/no_mode/2026-02-19_00-36-20/original/model.gms
    Output /local/scratch/a/sgusev/repos/k_means/data/gams_gurobi_gdp.binary_multiplication/no_mode/2026-02-19_00-36-20/original/output.lst
    ScrDir /local/scratch/a/sgusev/repos/k_means/data/gams_gurobi_gdp.binary_multiplication/no_mode/2026-02-19_00-36-20/original/225a/
    SysDir /package/gams/52.2/
    CurDir /local/scratch/a/sgusev/repos/k_means/data/gams_gurobi_gdp.binary_multiplication/no_mode/2026-02-19_00-36-20/original/
    LogOption 3
    AppendLog 1
Licensee: David Bernal / SECQUOIA Research Group         G251008+0003Ac-GEN
          Purdue University, Davidson School of Chemical EngineeringDCE4838
          225a/gamslice.dat
          5a82958a-fbca-4a23
          node:66820903 mem:995 cores:48 ipport:57587 v:2                  
          Evaluation license: Not for commercial or production use
          The time-limited license stops working on : Jun 30, 2027
System information: 48 physical cores and 995 Gb physical memory detected
GAMS 52.2.0   Copyright (C) 1987-2025 GAMS Development. All rights reserved
--- Starting compilation
--- model.gms(248) 2 Mb
--- $echo File /local/scratch/a/sgusev/repos/k_means/data/gams_gurobi_gdp.binary_multiplication/no_mode/2026-02-19_00-36-20/original/gurobi.opt
--- model.gms(444) 2 Mb
--- Starting execution: elapsed 0:00:00.006
--- model.gms(257) 3 Mb
--- Generating MINLP model GAMS_MODEL
--- model.gms(261) 5 Mb
---   63 rows  67 columns  245 non-zeroes
---   495 nl-code  180 nl-non-zeroes
---   45 discrete-columns
--- Range statistics (absolute non-zero finite values)
--- RHS       [min, max] : [ 1.000E+00, 1.000E+00] - Zero values observed as well
--- Bound     [min, max] : [ 1.000E+00, 6.000E+01] - Zero values observed as well
--- Matrix    [min, max] : [ 2.004E-01, 1.219E+00] - Zero values observed as well
--- model.gms(261) 3 Mb
--- Executing GUROBI (Solvelink=5): elapsed 0:00:00.009
Reading parameter(s) from "/local/scratch/a/sgusev/repos/k_means/data/gams_gurobi_gdp.binary_multiplication/no_mode/2026-02-19_00-36-20/original/gurobi.opt"
>>  NonConvex 2
>>  Threads 1
>>  MIPGap 1e-06
>>  MIPGapAbs 1e-10
>>  FeasibilityTol 1e-06
>>  OptimalityTol 1e-06
>>  IntFeasTol 1e-05
Finished reading from "/local/scratch/a/sgusev/repos/k_means/data/gams_gurobi_gdp.binary_multiplication/no_mode/2026-02-19_00-36-20/original/gurobi.opt"

... GRB_LICENSE_FILE = /local/scratch/a/sgusev/gurobi.lic

    Gurobi           52.2.0 d8e408be Dec 8, 2025           LEG x86 64bit/Linux    

... GAMS/Gurobi Link license.
... GMO Q Extraction (ThreePass): 0.00s

    Gurobi Optimizer version 13.0.0 build v13.0.0rc1 (linux64 - "Oracle Linux Server 9.7")
    
    CPU model: AMD EPYC 7643 48-Core Processor, instruction set [SSE2|AVX|AVX2]
    Thread count: 48 physical cores, 96 logical processors, using up to 1 threads
    
    Non-default parameters:
    TimeLimit  300
    MIPGap  1e-06
    LogToConsole  0
    NonConvex  2
    Threads  1
    
    Optimize a model with 62 rows, 111 columns and 94 nonzeros (Min)
    Model fingerprint: 0x19d69b07
    Model has 15 linear objective coefficients
    Model has 45 general nonlinear constraints (135 nonlinear terms)
    Variable types: 66 continuous, 45 integer (0 binary)
    Coefficient statistics:
      Matrix range     [1e+00, 1e+00]
      Objective range  [1e+00, 1e+00]
      Bounds range     [1e+00, 6e+01]
      RHS range        [1e+00, 1e+00]
      NLCon coe range  [4e-03, 1e+00]
    Presolve model has 45 nlconstr
    Added 225 variables to disaggregate expressions
    Presolve removed 45 rows and 0 columns
    Presolve time: 0.00s
    Presolved: 602 rows, 382 columns, 1399 nonzeros
    Presolved model has 90 bilinear constraint(s)
    
    Solving non-convex MIQCP to global optimality
    
    Variable types: 337 continuous, 45 integer (45 binary)
    Found heuristic solution: objective 8.6898944
    
    Root relaxation: objective 0.000000e+00, 36 iterations, 0.00 seconds (0.00 work units)
    
        Nodes    |    Current Node    |     Objective Bounds      |     Work
     Expl Unexpl |  Obj  Depth IntInf | Incumbent    BestBd   Gap | It/Node Time
    
         0     0    0.00000    0   90    8.68989    0.00000   100%     -    0s
    H    0     0                       8.3616038    0.00000   100%     -    0s
         0     0    0.00000    0  111    8.36160    0.00000   100%     -    0s
         0     0    0.00000    0  116    8.36160    0.00000   100%     -    0s
         0     0    0.00000    0  105    8.36160    0.00000   100%     -    0s
         0     0    0.00000    0  108    8.36160    0.00000   100%     -    0s
         0     0    0.00000    0  109    8.36160    0.00000   100%     -    0s
         0     0    0.00000    0  110    8.36160    0.00000   100%     -    0s
         0     0    0.00000    0  110    8.36160    0.00000   100%     -    0s
         0     0    0.00000    0   99    8.36160    0.00000   100%     -    0s
    H    0     0                       3.5840928    0.00000   100%     -    0s
    H    0     0                       3.5632169    0.00000   100%     -    0s
    H    0     0                       3.2114885    0.00000   100%     -    0s
         0     2    0.00000    0   96    3.21149    0.00000   100%     -    0s
    H    3     3                       3.0583557    0.00000   100%   8.3    0s
    H    6     6                       2.9218252    0.00000   100%  14.0    0s
    H  100    69                       2.6217093    0.00000   100%  18.1    0s
    H  101    64                       2.3765432    0.00000   100%  18.0    0s
    H  108    66                       2.1326967    0.00000   100%  17.5    0s
    H  108    66                       2.1310822    0.00000   100%  17.5    0s
    H  108    66                       2.1299490    0.00000   100%  17.5    0s
    H  109    67                       2.0610287    0.00000   100%  17.4    0s
    H  109    67                       2.0609924    0.00000   100%  17.4    0s
    H  109    67                       2.0609847    0.00000   100%  17.4    0s
    H  111    55                       1.6832355    0.00000   100%  17.3    0s
    H 1072   283                       1.6832355    0.56008  66.7%  19.3    0s
    H 1081   271                       1.6832355    0.56008  66.7%  19.5    1s
    H 2081   299                       1.6832326    0.75684  55.0%  19.2    1s
    H 2370   275                       1.6294783    0.88299  45.8%  19.1    1s
    * 4634   394              86       1.6294695    1.47410  9.54%  15.3    3s
      7810   301     cutoff   62         1.62947    1.61853  0.67%  11.9    5s
    
    Explored 15520 nodes (134835 simplex iterations) in 8.07 seconds (5.48 work units)
    Thread count was 1 (of 96 available processors)
    
    Solution count 10: 1.62947 1.62948 1.68323 ... 2.1327
    
    Optimal solution found (tolerance 1.00e-06)
    Warning: max constraint violation (1.5738e-06) exceeds tolerance
    Warning: max general constraint violation (1.5738e-06) exceeds tolerance
    Best objective 1.629469482212e+00, best bound 1.629467947999e+00, gap 0.0001%
    
    User-callback calls 15545, time in user-callback 0.00 sec

... Solving fixed model...

    Gurobi Optimizer version 13.0.0 build v13.0.0rc1 (linux64 - "Oracle Linux Server 9.7")
    
    CPU model: AMD EPYC 7643 48-Core Processor, instruction set [SSE2|AVX|AVX2]
    Thread count: 48 physical cores, 96 logical processors, using up to 1 threads
    
    Non-default parameters:
    TimeLimit  300
    MIPGap  1e-06
    LogToConsole  0
    NonConvex  2
    Threads  1
    
    Optimize a model with 62 rows, 111 columns and 94 nonzeros (Min)
    Model fingerprint: 0xad97de4f
    Model has 15 linear objective coefficients
    Coefficient statistics:
      Matrix range     [1e+00, 1e+00]
      Objective range  [1e+00, 1e+00]
      Bounds range     [2e-03, 1e+00]
      RHS range        [1e+00, 1e+00]
    Presolve removed 62 rows and 111 columns
    Presolve time: 0.00s
    Presolve: All rows and columns removed
    Iteration    Objective       Primal Inf.    Dual Inf.      Time
           0    1.6294695e+00   0.000000e+00   0.000000e+00      0s
    
    Solved in 0 iterations and 0.00 seconds (0.00 work units)
    Optimal objective  1.629469482e+00
    
    User-callback calls 0, time in user-callback 0.00 sec

--- Reading solution for model GAMS_MODEL
***
*** Solver did not provide marginals for model GAMS_MODEL
***
--- Executing after solve: elapsed 0:00:08.110
--- model.gms(264) 3 Mb
--- model.gms(444) 5 Mb
--- Putfile results /local/scratch/a/sgusev/repos/k_means/data/gams_gurobi_gdp.binary_multiplication/no_mode/2026-02-19_00-36-20/original/results.dat
--- Putfile statresults /local/scratch/a/sgusev/repos/k_means/data/gams_gurobi_gdp.binary_multiplication/no_mode/2026-02-19_00-36-20/original/resultsstat.dat
*** Status: Normal completion
--- Job model.gms Stop 02/19/26 00:36:29 elapsed 0:00:08.111
Original problem solved. Time taken: 8.594962358474731 seconds
Original objective value: 1.629469482211568
