Solving original (integer) problem with strategy gdp.binary_multiplication...
--- Job model.gms Start 02/19/26 01:25:35 52.2.0 d8e408be LEX-LEG x86 64bit/Linux
--- Applying:
    /package/gams/52.2/gmsprmun.txt
--- GAMS Parameters defined
    Input /local/scratch/a/sgusev/repos/k_means/data/gams_gurobi_gdp.binary_multiplication/no_mode/2026-02-19_01-25-34/original/model.gms
    Output /local/scratch/a/sgusev/repos/k_means/data/gams_gurobi_gdp.binary_multiplication/no_mode/2026-02-19_01-25-34/original/output.lst
    ScrDir /local/scratch/a/sgusev/repos/k_means/data/gams_gurobi_gdp.binary_multiplication/no_mode/2026-02-19_01-25-34/original/225a/
    SysDir /package/gams/52.2/
    CurDir /local/scratch/a/sgusev/repos/k_means/data/gams_gurobi_gdp.binary_multiplication/no_mode/2026-02-19_01-25-34/original/
    LogOption 3
    AppendLog 1
Licensee: David Bernal / SECQUOIA Research Group         G251008+0003Ac-GEN
          Purdue University, Davidson School of Chemical EngineeringDCE4838
          225a/gamslice.dat
          5a82958a-fbca-4a23
          node:66820903 mem:995 cores:48 ipport:53611 v:2                  
          Evaluation license: Not for commercial or production use
          The time-limited license stops working on : Jun 30, 2027
System information: 48 physical cores and 995 Gb physical memory detected
GAMS 52.2.0   Copyright (C) 1987-2025 GAMS Development. All rights reserved
--- Starting compilation
--- model.gms(261) 2 Mb
--- $echo File /local/scratch/a/sgusev/repos/k_means/data/gams_gurobi_gdp.binary_multiplication/no_mode/2026-02-19_01-25-34/original/gurobi.opt
--- model.gms(465) 2 Mb
--- Starting execution: elapsed 0:00:00.006
--- model.gms(270) 3 Mb
--- Generating MINLP model GAMS_MODEL
--- model.gms(274) 5 Mb
---   67 rows  71 columns  261 non-zeroes
---   528 nl-code  192 nl-non-zeroes
---   48 discrete-columns
--- Range statistics (absolute non-zero finite values)
--- RHS       [min, max] : [ 1.000E+00, 1.000E+00] - Zero values observed as well
--- Bound     [min, max] : [ 1.000E+00, 6.400E+01] - Zero values observed as well
--- Matrix    [min, max] : [ 8.324E-02, 1.586E+00] - Zero values observed as well
--- model.gms(274) 3 Mb
--- Executing GUROBI (Solvelink=5): elapsed 0:00:00.009
Reading parameter(s) from "/local/scratch/a/sgusev/repos/k_means/data/gams_gurobi_gdp.binary_multiplication/no_mode/2026-02-19_01-25-34/original/gurobi.opt"
>>  NonConvex 2
>>  Threads 1
>>  MIPGap 1e-06
>>  MIPGapAbs 1e-10
>>  FeasibilityTol 1e-06
>>  OptimalityTol 1e-06
>>  IntFeasTol 1e-05
Finished reading from "/local/scratch/a/sgusev/repos/k_means/data/gams_gurobi_gdp.binary_multiplication/no_mode/2026-02-19_01-25-34/original/gurobi.opt"

... GRB_LICENSE_FILE = /local/scratch/a/sgusev/gurobi.lic

    Gurobi           52.2.0 d8e408be Dec 8, 2025           LEG x86 64bit/Linux    

... GAMS/Gurobi Link license.
... GMO Q Extraction (ThreePass): 0.00s

    Gurobi Optimizer version 13.0.0 build v13.0.0rc1 (linux64 - "Oracle Linux Server 9.7")
    
    CPU model: AMD EPYC 7643 48-Core Processor, instruction set [SSE2|AVX|AVX2]
    Thread count: 48 physical cores, 96 logical processors, using up to 1 threads
    
    Non-default parameters:
    TimeLimit  300
    MIPGap  1e-06
    LogToConsole  0
    NonConvex  2
    Threads  1
    
    Optimize a model with 66 rows, 118 columns and 100 nonzeros (Min)
    Model fingerprint: 0x2769c8e1
    Model has 16 linear objective coefficients
    Model has 48 general nonlinear constraints (144 nonlinear terms)
    Variable types: 70 continuous, 48 integer (0 binary)
    Coefficient statistics:
      Matrix range     [1e+00, 1e+00]
      Objective range  [1e+00, 1e+00]
      Bounds range     [1e+00, 6e+01]
      RHS range        [1e+00, 1e+00]
      NLCon coe range  [4e-02, 1e+00]
    Presolve model has 48 nlconstr
    Added 240 variables to disaggregate expressions
    Presolve removed 48 rows and 0 columns
    Presolve time: 0.00s
    Presolved: 642 rows, 407 columns, 1492 nonzeros
    Presolved model has 96 bilinear constraint(s)
    
    Solving non-convex MIQCP to global optimality
    
    Variable types: 359 continuous, 48 integer (48 binary)
    Found heuristic solution: objective 10.1601589
    
    Root relaxation: objective 0.000000e+00, 113 iterations, 0.00 seconds (0.00 work units)
    
        Nodes    |    Current Node    |     Objective Bounds      |     Work
     Expl Unexpl |  Obj  Depth IntInf | Incumbent    BestBd   Gap | It/Node Time
    
         0     0    0.00000    0   66   10.16016    0.00000   100%     -    0s
         0     0    0.00000    0   88   10.16016    0.00000   100%     -    0s
         0     0    0.00000    0   88   10.16016    0.00000   100%     -    0s
         0     0    0.00000    0  115   10.16016    0.00000   100%     -    0s
         0     0    0.00000    0  102   10.16016    0.00000   100%     -    0s
    H    0     0                       9.5333432    0.00000   100%     -    0s
         0     0    0.00000    0  100    9.53334    0.00000   100%     -    0s
         0     0    0.00000    0  112    9.53334    0.00000   100%     -    0s
         0     0    0.00000    0  108    9.53334    0.00000   100%     -    0s
         0     0    0.00000    0  108    9.53334    0.00000   100%     -    0s
         0     0    0.00000    0  108    9.53334    0.00000   100%     -    0s
    H    0     0                       6.4853294    0.00000   100%     -    0s
    H    0     0                       5.8984720    0.00000   100%     -    0s
    H    0     0                       5.6599968    0.00000   100%     -    0s
         0     2    0.00000    0  108    5.66000    0.00000   100%     -    0s
    H    2     2                       5.1149120    0.00000   100%   4.0    0s
    H    2     2                       4.6656469    0.00000   100%   4.0    0s
    H    3     3                       4.1082306    0.00000   100%  10.7    0s
    H    4     4                       4.0517525    0.00000   100%  11.8    0s
    H    9     9                       3.8834699    0.00000   100%  19.9    0s
    H  100    77                       3.8561927    0.00000   100%  19.6    0s
    H  101    78                       3.8390860    0.00000   100%  19.6    0s
    H  117    77                       3.2627122    0.00000   100%  20.2    0s
    H  179   102                       3.1385818    0.00000   100%  21.3    0s
    H  179   102                       3.1381779    0.00000   100%  21.3    0s
    H  179   102                       3.1381619    0.00000   100%  21.3    0s
    H  943   361                       3.0723737    0.21636  93.0%  21.0    1s
    H  943   344                       3.0358238    0.21636  92.9%  21.0    1s
    H  944   329                       3.0096179    0.21636  92.8%  20.9    1s
    H 1225   381                       2.9982738    0.21636  92.8%  20.8    1s
    H 1441   391                       2.9982738    0.21636  92.8%  20.5    1s
    H 1532   421                       2.9105692    0.24487  91.6%  19.9    1s
    H 2539   598                       2.8830634    1.13793  60.5%  18.4    2s
    H 2539   598                       2.8814570    1.13793  60.5%  18.4    2s
    H 2539   598                       2.8810647    1.13793  60.5%  18.4    2s
    H 2539   598                       2.8784384    1.13793  60.5%  18.4    2s
    H 2539   598                       2.8784371    1.13793  60.5%  18.4    2s
    H 2539   598                       2.8784322    1.13793  60.5%  18.4    2s
    H 4236   689                       2.8380858    1.80145  36.5%  17.2    3s
      6686   648     cutoff   45         2.83809    2.25113  20.7%  15.9    5s
    *11108   638              78       2.8380824    2.66315  6.16%  13.0    7s
    *11111   637              78       2.8380782    2.66315  6.16%  13.0    7s
    *11134   636              80       2.8380748    2.66315  6.16%  13.0    7s
     16182   892    2.82791   61   32    2.83807    2.75638  2.88%  11.0   10s
     27590   628     cutoff   63         2.83807    2.83396  0.14%   8.9   15s
    *30521   105              85       2.8380743    2.83799  0.00%   8.5   16s
    
    Explored 30725 nodes (259683 simplex iterations) in 16.20 seconds (11.08 work units)
    Thread count was 1 (of 96 available processors)
    
    Solution count 10: 2.83807 2.83807 2.83808 ... 2.88146
    
    Optimal solution found (tolerance 1.00e-06)
    Best objective 2.838074321502e+00, best bound 2.838071986157e+00, gap 0.0001%
    
    User-callback calls 30763, time in user-callback 0.00 sec

... Solving fixed model...

    Gurobi Optimizer version 13.0.0 build v13.0.0rc1 (linux64 - "Oracle Linux Server 9.7")
    
    CPU model: AMD EPYC 7643 48-Core Processor, instruction set [SSE2|AVX|AVX2]
    Thread count: 48 physical cores, 96 logical processors, using up to 1 threads
    
    Non-default parameters:
    TimeLimit  300
    MIPGap  1e-06
    LogToConsole  0
    NonConvex  2
    Threads  1
    
    Optimize a model with 66 rows, 118 columns and 100 nonzeros (Min)
    Model fingerprint: 0xfe7b7a1d
    Model has 16 linear objective coefficients
    Coefficient statistics:
      Matrix range     [1e+00, 1e+00]
      Objective range  [1e+00, 1e+00]
      Bounds range     [2e-02, 1e+00]
      RHS range        [1e+00, 1e+00]
    Presolve removed 66 rows and 118 columns
    Presolve time: 0.00s
    Presolve: All rows and columns removed
    Iteration    Objective       Primal Inf.    Dual Inf.      Time
           0    2.8380743e+00   0.000000e+00   0.000000e+00      0s
    
    Solved in 0 iterations and 0.00 seconds (0.00 work units)
    Optimal objective  2.838074322e+00
    
    User-callback calls 0, time in user-callback 0.00 sec

--- Reading solution for model GAMS_MODEL
***
*** Solver did not provide marginals for model GAMS_MODEL
***
--- Executing after solve: elapsed 0:00:16.241
--- model.gms(277) 3 Mb
--- model.gms(465) 5 Mb
--- Putfile results /local/scratch/a/sgusev/repos/k_means/data/gams_gurobi_gdp.binary_multiplication/no_mode/2026-02-19_01-25-34/original/results.dat
--- Putfile statresults /local/scratch/a/sgusev/repos/k_means/data/gams_gurobi_gdp.binary_multiplication/no_mode/2026-02-19_01-25-34/original/resultsstat.dat
*** Status: Normal completion
--- Job model.gms Stop 02/19/26 01:25:51 elapsed 0:00:16.242
Original problem solved. Time taken: 16.71910572052002 seconds
Original objective value: 2.838074321501734
