Solving original (integer) problem with strategy gdp.binary_multiplication...
--- Job model.gms Start 02/19/26 03:10:25 52.2.0 d8e408be LEX-LEG x86 64bit/Linux
--- Applying:
    /package/gams/52.2/gmsprmun.txt
--- GAMS Parameters defined
    Input /local/scratch/a/sgusev/repos/k_means/data/gams_gurobi_gdp.binary_multiplication/no_mode/2026-02-19_03-10-24/original/model.gms
    Output /local/scratch/a/sgusev/repos/k_means/data/gams_gurobi_gdp.binary_multiplication/no_mode/2026-02-19_03-10-24/original/output.lst
    ScrDir /local/scratch/a/sgusev/repos/k_means/data/gams_gurobi_gdp.binary_multiplication/no_mode/2026-02-19_03-10-24/original/225a/
    SysDir /package/gams/52.2/
    CurDir /local/scratch/a/sgusev/repos/k_means/data/gams_gurobi_gdp.binary_multiplication/no_mode/2026-02-19_03-10-24/original/
    LogOption 3
    AppendLog 1
Licensee: David Bernal / SECQUOIA Research Group         G251008+0003Ac-GEN
          Purdue University, Davidson School of Chemical EngineeringDCE4838
          225a/gamslice.dat
          5a82958a-fbca-4a23
          node:66820903 mem:995 cores:48 ipport:57283 v:2                  
          Evaluation license: Not for commercial or production use
          The time-limited license stops working on : Jun 30, 2027
System information: 48 physical cores and 995 Gb physical memory detected
GAMS 52.2.0   Copyright (C) 1987-2025 GAMS Development. All rights reserved
--- Starting compilation
--- model.gms(333) 2 Mb
--- $echo File /local/scratch/a/sgusev/repos/k_means/data/gams_gurobi_gdp.binary_multiplication/no_mode/2026-02-19_03-10-24/original/gurobi.opt
--- model.gms(582) 2 Mb
--- Starting execution: elapsed 0:00:00.006
--- model.gms(342) 3 Mb
--- Generating MINLP model GAMS_MODEL
--- model.gms(346) 5 Mb
---   89 rows  94 columns  364 non-zeroes
---   748 nl-code  272 nl-non-zeroes
---   68 discrete-columns
--- Range statistics (absolute non-zero finite values)
--- RHS       [min, max] : [ 1.000E+00, 1.000E+00] - Zero values observed as well
--- Bound     [min, max] : [ 1.000E+00, 6.800E+01] - Zero values observed as well
--- Matrix    [min, max] : [ 6.306E-03, 1.570E+00] - Zero values observed as well
--- model.gms(346) 3 Mb
--- Executing GUROBI (Solvelink=5): elapsed 0:00:00.009
Reading parameter(s) from "/local/scratch/a/sgusev/repos/k_means/data/gams_gurobi_gdp.binary_multiplication/no_mode/2026-02-19_03-10-24/original/gurobi.opt"
>>  NonConvex 2
>>  Threads 1
>>  MIPGap 1e-06
>>  MIPGapAbs 1e-10
>>  FeasibilityTol 1e-06
>>  OptimalityTol 1e-06
>>  IntFeasTol 1e-05
Finished reading from "/local/scratch/a/sgusev/repos/k_means/data/gams_gurobi_gdp.binary_multiplication/no_mode/2026-02-19_03-10-24/original/gurobi.opt"

... GRB_LICENSE_FILE = /local/scratch/a/sgusev/gurobi.lic

    Gurobi           52.2.0 d8e408be Dec 8, 2025           LEG x86 64bit/Linux    

... GAMS/Gurobi Link license.
... GMO Q Extraction (ThreePass): 0.00s

    Gurobi Optimizer version 13.0.0 build v13.0.0rc1 (linux64 - "Oracle Linux Server 9.7")
    
    CPU model: AMD EPYC 7643 48-Core Processor, instruction set [SSE2|AVX|AVX2]
    Thread count: 48 physical cores, 96 logical processors, using up to 1 threads
    
    Non-default parameters:
    TimeLimit  300
    MIPGap  1e-06
    LogToConsole  0
    NonConvex  2
    Threads  1
    
    Optimize a model with 88 rows, 161 columns and 142 nonzeros (Min)
    Model fingerprint: 0xeb4d19ec
    Model has 17 linear objective coefficients
    Model has 68 general nonlinear constraints (204 nonlinear terms)
    Variable types: 93 continuous, 68 integer (0 binary)
    Coefficient statistics:
      Matrix range     [1e+00, 1e+00]
      Objective range  [1e+00, 1e+00]
      Bounds range     [1e+00, 7e+01]
      RHS range        [1e+00, 1e+00]
      NLCon coe range  [4e-02, 1e+00]
    Presolve model has 68 nlconstr
    Added 340 variables to disaggregate expressions
    Presolve removed 68 rows and 0 columns
    Presolve time: 0.00s
    Presolved: 904 rows, 570 columns, 2114 nonzeros
    Presolved model has 136 bilinear constraint(s)
    
    Solving non-convex MIQCP to global optimality
    
    Variable types: 502 continuous, 68 integer (68 binary)
    Found heuristic solution: objective 12.2717491
    
    Root relaxation: objective 0.000000e+00, 145 iterations, 0.00 seconds (0.00 work units)
    
        Nodes    |    Current Node    |     Objective Bounds      |     Work
     Expl Unexpl |  Obj  Depth IntInf | Incumbent    BestBd   Gap | It/Node Time
    
         0     0    0.00000    0   91   12.27175    0.00000   100%     -    0s
         0     0    0.00000    0  105   12.27175    0.00000   100%     -    0s
         0     0    0.00000    0  156   12.27175    0.00000   100%     -    0s
         0     0    0.00000    0  161   12.27175    0.00000   100%     -    0s
         0     0    0.00000    0  138   12.27175    0.00000   100%     -    0s
    H    0     0                      11.4993281    0.00000   100%     -    0s
         0     0    0.00000    0  138   11.49933    0.00000   100%     -    0s
         0     0    0.00000    0  158   11.49933    0.00000   100%     -    0s
         0     0    0.00000    0  153   11.49933    0.00000   100%     -    0s
    H    0     0                       8.2297940    0.00000   100%     -    0s
         0     0    0.00000    0  141    8.22979    0.00000   100%     -    0s
         0     0    0.00000    0  156    8.22979    0.00000   100%     -    0s
         0     0    0.00000    0  149    8.22979    0.00000   100%     -    0s
    H    0     0                       6.8143696    0.00000   100%     -    0s
         0     0    0.00000    0  158    6.81437    0.00000   100%     -    0s
         0     0    0.00000    0  161    6.81437    0.00000   100%     -    0s
         0     0    0.00000    0  150    6.81437    0.00000   100%     -    0s
         0     0    0.00000    0  150    6.81437    0.00000   100%     -    0s
         0     0    0.00000    0  148    6.81437    0.00000   100%     -    0s
         0     2    0.00000    0  136    6.81437    0.00000   100%     -    0s
    H    1     1                       6.0742948    0.00000   100%   0.0    0s
    H    1     1                       6.0461650    0.00000   100%   0.0    0s
    H    2     2                       5.3736492    0.00000   100%   0.5    0s
    H    3     3                       4.4607740    0.00000   100%   1.7    0s
    H    9     9                       4.3696956    0.00000   100%   5.2    0s
    H  453   318                       4.3279419    0.00000   100%  15.6    0s
    H  500   359                       4.2621616    0.00000   100%  14.9    0s
    H  550   405                       4.2578566    0.00000   100%  14.2    0s
    H  550   405                       4.2406210    0.00000   100%  14.2    0s
    H  550   405                       4.2397812    0.00000   100%  14.2    0s
    H  597   428                       4.2180264    0.00000   100%  14.1    0s
    H  616   425                       4.1805080    0.00000   100%  13.8    0s
    H  619   406                       4.1390811    0.00000   100%  13.8    0s
    H  627   390                       3.0811778    0.00000   100%  13.6    0s
    H  631   373                       2.3712568    0.00000   100%  13.5    1s
    H  631   354                       2.3643706    0.00000   100%  13.5    1s
    H  631   336                       2.3631164    0.00000   100%  13.5    1s
    H  631   319                       2.3629279    0.00000   100%  13.5    1s
    H  631   303                       2.3626463    0.00000   100%  13.5    1s
    H  635   289                       2.3386691    0.00000   100%  19.8    1s
    H  641   279                       2.3374179    0.00000   100%  19.8    1s
    H  641   265                       2.3372428    0.00000   100%  19.8    1s
    H  641   251                       2.3372338    0.00000   100%  19.8    1s
    H  644   241                       2.3300597    0.00000   100%  19.8    1s
    H  644   229                       2.3287899    0.00000   100%  19.8    1s
    H  644   217                       2.3276891    0.00000   100%  19.8    1s
    H  644   207                       2.3275597    0.00000   100%  19.8    1s
    H  653   199                       2.3085398    0.00000   100%  20.7    1s
    H  653   190                       2.3035657    0.00000   100%  20.7    1s
    H  653   180                       2.3016324    0.00000   100%  20.7    1s
    H  653   172                       2.2999843    0.00000   100%  20.7    1s
    H  653   163                       2.2961620    0.00000   100%  20.7    1s
    H  653   155                       2.2945578    0.00000   100%  20.7    1s
    H  684   158                       2.2239248    0.00000   100%  22.6    1s
    H  684   151                       2.2200609    0.00000   100%  22.6    1s
    H  684   144                       2.2168104    0.00000   100%  22.6    1s
    H  684   137                       2.2165488    0.00000   100%  22.6    1s
    H 1003   208                       2.2013606    0.00000   100%  24.7    1s
    H 1003   208                       2.1785742    0.00000   100%  24.7    1s
    H 1291   421                       2.1785665    0.00000   100%  24.0    2s
    H 1291   421                       2.1765234    0.00000   100%  24.0    2s
    H 1291   421                       2.1721152    0.00000   100%  24.0    2s
    H 1291   421                       2.1717983    0.00000   100%  24.0    2s
    H 1291   421                       2.1701678    0.00000   100%  24.0    2s
    H 1424   502                       2.1701670    0.00000   100%  24.6    2s
    H 1481   532                       2.1701662    0.00000   100%  25.0    2s
    H 1849   646                       2.1701187    0.00000   100%  28.3    2s
    H 2851   950                       2.1701136    0.16732  92.3%  28.8    3s
      4193  1389    1.21298   22  154    2.17011    0.28488  86.9%  28.9    5s
    H 5822  1783                       2.1524796    0.44927  79.1%  28.3    6s
    H 9122  2575                       2.1457063    0.67684  68.5%  26.4    9s
    H 9554  2746                       2.1457063    0.69156  67.8%  26.1    9s
    H10173  2741                       2.0918191    0.71285  65.9%  26.0    9s
     10202  2748    1.17517   43  146    2.09182    0.71289  65.9%  26.0   11s
     14344  3160    1.61979   27  133    2.09182    0.91567  56.2%  24.9   15s
     19787  3406    1.18399   43  146    2.09182    1.16864  44.1%  23.7   20s
     25390  2866    2.06774   41  136    2.09182    1.43153  31.6%  22.8   25s
     31791  1482     cutoff   44         2.09182    1.72084  17.7%  21.4   30s
     38296  1139    2.08092   61   51    2.09182    1.96146  6.23%  19.5   35s
    *41698  1425             112       2.0918032    2.02059  3.40%  18.5   37s
     44825  1624     cutoff   67         2.09180    2.03790  2.58%  17.7   40s
     51581  1672    2.08033   66   85    2.09180    2.05831  1.60%  16.2   45s
     58508  1553    2.09159   75   68    2.09180    2.07734  0.69%  15.3   50s
     66323  1622    2.09102   78   51    2.09180    2.08512  0.32%  14.4   55s
     73734  1823    2.09086   85   85    2.09180    2.08965  0.10%  13.7   60s
     81833  1740    2.09179   94   34    2.09180    2.09075  0.05%  12.9   65s
     90604  1597    2.09131   93   85    2.09180    2.09122  0.03%  12.2   70s
     98961  1308     cutoff  101         2.09180    2.09163  0.01%  11.7   75s
     107565   620    2.09179  100   51    2.09180    2.09175  0.00%  11.2   80s
    
    Cutting planes:
      Implied bound: 2
      MIR: 2
      Flow cover: 37
      RLT: 15
    
    Explored 108947 nodes (1210037 simplex iterations) in 80.82 seconds (55.73 work units)
    Thread count was 1 (of 96 available processors)
    
    Solution count 10: 2.0918 2.09182 2.14571 ... 2.1718
    
    Optimal solution found (tolerance 1.00e-06)
    Warning: max constraint violation (1.8611e-06) exceeds tolerance
    Warning: max general constraint violation (1.8611e-06) exceeds tolerance
    Best objective 2.091803243158e+00, best bound 2.091801206772e+00, gap 0.0001%
    
    User-callback calls 109013, time in user-callback 0.00 sec

... Solving fixed model...

    Gurobi Optimizer version 13.0.0 build v13.0.0rc1 (linux64 - "Oracle Linux Server 9.7")
    
    CPU model: AMD EPYC 7643 48-Core Processor, instruction set [SSE2|AVX|AVX2]
    Thread count: 48 physical cores, 96 logical processors, using up to 1 threads
    
    Non-default parameters:
    TimeLimit  300
    MIPGap  1e-06
    LogToConsole  0
    NonConvex  2
    Threads  1
    
    Optimize a model with 88 rows, 161 columns and 142 nonzeros (Min)
    Model fingerprint: 0xfc9193dc
    Model has 17 linear objective coefficients
    Coefficient statistics:
      Matrix range     [1e+00, 1e+00]
      Objective range  [1e+00, 1e+00]
      Bounds range     [7e-04, 1e+00]
      RHS range        [1e+00, 1e+00]
    Presolve removed 88 rows and 161 columns
    Presolve time: 0.00s
    Presolve: All rows and columns removed
    Iteration    Objective       Primal Inf.    Dual Inf.      Time
           0    2.0918032e+00   0.000000e+00   0.000000e+00      0s
    
    Solved in 0 iterations and 0.00 seconds (0.00 work units)
    Optimal objective  2.091803243e+00
    
    User-callback calls 0, time in user-callback 0.00 sec

--- Reading solution for model GAMS_MODEL
***
*** Solver did not provide marginals for model GAMS_MODEL
***
--- Executing after solve: elapsed 0:01:20.880
--- model.gms(349) 3 Mb
--- model.gms(582) 5 Mb
--- Putfile results /local/scratch/a/sgusev/repos/k_means/data/gams_gurobi_gdp.binary_multiplication/no_mode/2026-02-19_03-10-24/original/results.dat
--- Putfile statresults /local/scratch/a/sgusev/repos/k_means/data/gams_gurobi_gdp.binary_multiplication/no_mode/2026-02-19_03-10-24/original/resultsstat.dat
*** Status: Normal completion
--- Job model.gms Stop 02/19/26 03:11:46 elapsed 0:01:20.880
Original problem solved. Time taken: 81.39149951934814 seconds
Original objective value: 2.091803243158487
