Solving original (integer) problem with strategy gdp.binary_multiplication...
--- Job model.gms Start 02/18/26 23:25:27 52.2.0 d8e408be LEX-LEG x86 64bit/Linux
--- Applying:
    /package/gams/52.2/gmsprmun.txt
--- GAMS Parameters defined
    Input /local/scratch/a/sgusev/repos/k_means/data/gams_gurobi_gdp.binary_multiplication/no_mode/2026-02-18_23-25-27/original/model.gms
    Output /local/scratch/a/sgusev/repos/k_means/data/gams_gurobi_gdp.binary_multiplication/no_mode/2026-02-18_23-25-27/original/output.lst
    ScrDir /local/scratch/a/sgusev/repos/k_means/data/gams_gurobi_gdp.binary_multiplication/no_mode/2026-02-18_23-25-27/original/225a/
    SysDir /package/gams/52.2/
    CurDir /local/scratch/a/sgusev/repos/k_means/data/gams_gurobi_gdp.binary_multiplication/no_mode/2026-02-18_23-25-27/original/
    LogOption 3
    AppendLog 1
Licensee: David Bernal / SECQUOIA Research Group         G251008+0003Ac-GEN
          Purdue University, Davidson School of Chemical EngineeringDCE4838
          225a/gamslice.dat
          5a82958a-fbca-4a23
          node:66820903 mem:995 cores:48 ipport:50469 v:2                  
          Evaluation license: Not for commercial or production use
          The time-limited license stops working on : Jun 30, 2027
System information: 48 physical cores and 995 Gb physical memory detected
GAMS 52.2.0   Copyright (C) 1987-2025 GAMS Development. All rights reserved
--- Starting compilation
--- model.gms(218) 2 Mb
--- $echo File /local/scratch/a/sgusev/repos/k_means/data/gams_gurobi_gdp.binary_multiplication/no_mode/2026-02-18_23-25-27/original/gurobi.opt
--- model.gms(393) 2 Mb
--- Starting execution: elapsed 0:00:00.006
--- model.gms(227) 3 Mb
--- Generating MINLP model GAMS_MODEL
--- model.gms(231) 5 Mb
---   51 rows  58 columns  233 non-zeroes
---   540 nl-code  180 nl-non-zeroes
---   36 discrete-columns
--- Range statistics (absolute non-zero finite values)
--- RHS       [min, max] : [ 1.000E+00, 1.000E+00] - Zero values observed as well
--- Bound     [min, max] : [ 1.000E+00, 7.200E+01] - Zero values observed as well
--- Matrix    [min, max] : [ 1.175E-01, 1.827E+00] - Zero values observed as well
--- model.gms(231) 3 Mb
--- Executing GUROBI (Solvelink=5): elapsed 0:00:00.009
Reading parameter(s) from "/local/scratch/a/sgusev/repos/k_means/data/gams_gurobi_gdp.binary_multiplication/no_mode/2026-02-18_23-25-27/original/gurobi.opt"
>>  NonConvex 2
>>  Threads 1
>>  MIPGap 1e-06
>>  MIPGapAbs 1e-10
>>  FeasibilityTol 1e-06
>>  OptimalityTol 1e-06
>>  IntFeasTol 1e-05
Finished reading from "/local/scratch/a/sgusev/repos/k_means/data/gams_gurobi_gdp.binary_multiplication/no_mode/2026-02-18_23-25-27/original/gurobi.opt"

... GRB_LICENSE_FILE = /local/scratch/a/sgusev/gurobi.lic

    Gurobi           52.2.0 d8e408be Dec 8, 2025           LEG x86 64bit/Linux    

... GAMS/Gurobi Link license.
... GMO Q Extraction (ThreePass): 0.00s

    Gurobi Optimizer version 13.0.0 build v13.0.0rc1 (linux64 - "Oracle Linux Server 9.7")
    
    CPU model: AMD EPYC 7643 48-Core Processor, instruction set [SSE2|AVX|AVX2]
    Thread count: 48 physical cores, 96 logical processors, using up to 1 threads
    
    Non-default parameters:
    TimeLimit  300
    MIPGap  1e-06
    LogToConsole  0
    NonConvex  2
    Threads  1
    
    Optimize a model with 50 rows, 93 columns and 76 nonzeros (Min)
    Model fingerprint: 0xd3db828c
    Model has 12 linear objective coefficients
    Model has 36 general nonlinear constraints (144 nonlinear terms)
    Variable types: 57 continuous, 36 integer (0 binary)
    Coefficient statistics:
      Matrix range     [1e+00, 1e+00]
      Objective range  [1e+00, 1e+00]
      Bounds range     [1e+00, 7e+01]
      RHS range        [1e+00, 1e+00]
      NLCon coe range  [2e-02, 9e-01]
    Presolve model has 36 nlconstr
    Added 252 variables to disaggregate expressions
    Presolve removed 36 rows and 0 columns
    Presolve time: 0.00s
    Presolved: 626 rows, 382 columns, 1444 nonzeros
    Presolved model has 108 bilinear constraint(s)
    
    Solving non-convex MIQCP to global optimality
    
    Variable types: 346 continuous, 36 integer (36 binary)
    Found heuristic solution: objective 8.9543635
    
    Root relaxation: objective 0.000000e+00, 142 iterations, 0.00 seconds (0.00 work units)
    
        Nodes    |    Current Node    |     Objective Bounds      |     Work
     Expl Unexpl |  Obj  Depth IntInf | Incumbent    BestBd   Gap | It/Node Time
    
         0     0    0.00000    0   60    8.95436    0.00000   100%     -    0s
         0     0    0.00000    0   72    8.95436    0.00000   100%     -    0s
         0     0    0.00000    0  110    8.95436    0.00000   100%     -    0s
         0     0    0.00000    0  110    8.95436    0.00000   100%     -    0s
         0     0    0.00000    0  110    8.95436    0.00000   100%     -    0s
         0     0    0.00000    0  108    8.95436    0.00000   100%     -    0s
         0     0    0.00000    0  108    8.95436    0.00000   100%     -    0s
         0     0    0.00000    0  108    8.95436    0.00000   100%     -    0s
         0     0    0.00000    0  122    8.95436    0.00000   100%     -    0s
         0     0    0.00000    0  122    8.95436    0.00000   100%     -    0s
         0     0    0.00000    0  122    8.95436    0.00000   100%     -    0s
         0     0    0.00000    0  120    8.95436    0.00000   100%     -    0s
    H    0     0                       7.4949424    0.00000   100%     -    0s
    H    0     0                       7.4375600    0.00000   100%     -    0s
    H    0     0                       7.3564998    0.00000   100%     -    0s
    H    0     0                       7.1621635    0.00000   100%     -    0s
    H    0     0                       7.1621635    0.00000   100%     -    0s
    H    0     0                       7.1621635    0.00000   100%     -    0s
         0     2    0.00000    0  119    7.16216    0.00000   100%     -    0s
    H    1     1                       7.0995337    0.00000   100%   0.0    0s
    H    3     3                       6.9320786    0.00000   100%  13.7    0s
    H    9     9                       6.9202119    0.00000   100%  16.6    0s
    H   13    13                       6.2543552    0.00000   100%  13.4    0s
    H   16    16                       6.2269891    0.00000   100%  12.6    0s
    H   30    30                       5.5435484    0.00000   100%  11.9    0s
    H   31    31                       5.5113159    0.00000   100%  11.6    0s
    H   31    31                       4.9632931    0.00000   100%  11.6    0s
    H   33    33                       4.4444734    0.00000   100%  11.4    0s
    H   88    78                       4.4444734    0.00000   100%   9.1    0s
    H  320   207                       4.4117335    0.00000   100%  12.4    0s
    H  320   207                       4.4026854    0.00000   100%  12.4    0s
    H  320   207                       4.4008378    0.00000   100%  12.4    0s
    H  320   207                       4.4008246    0.00000   100%  12.4    0s
    H  748   444                       4.4008246    0.00000   100%  15.5    1s
    H 1015   503                       4.3978381    0.00000   100%  15.3    1s
    H 1126   481                       4.0170563    0.00000   100%  16.4    1s
    H 1129   460                       4.0170563    0.00000   100%  16.4    1s
    H 1265   527                       4.0170563    0.00000   100%  15.3    1s
    H 1334   529                       3.8795344    0.00000   100%  15.1    1s
    H 1345   516                       3.8795344    0.00000   100%  15.1    1s
    H 2132   818                       3.8540682    0.51801  86.6%  15.5    2s
    H 2133   603                       3.6165128    0.51801  85.7%  15.5    2s
      5466  1147     cutoff   29         3.61651    1.81625  49.8%  16.6    5s
    H 5814  1153                       3.6165128    1.91164  47.1%  16.5    5s
    H 8460  1093                       3.6165128    2.56377  29.1%  16.2    7s
    H 8512  1093                       3.6165128    2.57333  28.8%  16.1    7s
     11668   809    3.38005   40   84    3.61651    3.09546  14.4%  15.1   10s
     19913   899    3.60727   62   59    3.61651    3.49751  3.29%  12.0   15s
     29712  1632    3.60851   73   96    3.61651    3.57806  1.06%   9.6   20s
     39730  2192    3.61558   80   60    3.61651    3.60447  0.33%   8.4   25s
     49444  3080    3.61642   85   59    3.61651    3.60842  0.22%   7.9   30s
     59562  2938    3.61581   88   60    3.61651    3.61168  0.13%   7.3   35s
    *65349  2735             117       3.6165052    3.61343  0.09%   7.0   37s
     69444  2888     cutoff   87         3.61651    3.61411  0.07%   6.9   40s
     79715  2521     cutoff   92         3.61651    3.61533  0.03%   6.6   45s
     90240  2614    3.61642   96   48    3.61651    3.61595  0.02%   6.3   50s
     101121  2067    3.61650  111   25    3.61651    3.61630  0.01%   6.0   55s
     111930  1860     cutoff   86         3.61651    3.61639  0.00%   5.8   60s
     123091   305    3.61650  109   36    3.61651    3.61650  0.00%   5.7   65s
    
    Cutting planes:
      Gomory: 4
      Implied bound: 4
      MIR: 10
      Flow cover: 37
      RLT: 8
      Relax-and-lift: 1
    
    Explored 123334 nodes (699436 simplex iterations) in 65.11 seconds (44.40 work units)
    Thread count was 1 (of 96 available processors)
    
    Solution count 10: 3.61651 3.61651 3.85407 ... 4.41173
    
    Optimal solution found (tolerance 1.00e-06)
    Warning: max constraint violation (1.9850e-06) exceeds tolerance
    Warning: max general constraint violation (1.9850e-06) exceeds tolerance
    Best objective 3.616505207183e+00, best bound 3.616501606096e+00, gap 0.0001%
    
    User-callback calls 123374, time in user-callback 0.01 sec

... Solving fixed model...

    Gurobi Optimizer version 13.0.0 build v13.0.0rc1 (linux64 - "Oracle Linux Server 9.7")
    
    CPU model: AMD EPYC 7643 48-Core Processor, instruction set [SSE2|AVX|AVX2]
    Thread count: 48 physical cores, 96 logical processors, using up to 1 threads
    
    Non-default parameters:
    TimeLimit  300
    MIPGap  1e-06
    LogToConsole  0
    NonConvex  2
    Threads  1
    
    Optimize a model with 50 rows, 93 columns and 76 nonzeros (Min)
    Model fingerprint: 0x0357f8cd
    Model has 12 linear objective coefficients
    Coefficient statistics:
      Matrix range     [1e+00, 1e+00]
      Objective range  [1e+00, 1e+00]
      Bounds range     [5e-02, 1e+00]
      RHS range        [1e+00, 1e+00]
    Presolve removed 50 rows and 93 columns
    Presolve time: 0.00s
    Presolve: All rows and columns removed
    Iteration    Objective       Primal Inf.    Dual Inf.      Time
           0    3.6165052e+00   0.000000e+00   0.000000e+00      0s
    
    Solved in 0 iterations and 0.00 seconds (0.00 work units)
    Optimal objective  3.616505207e+00
    
    User-callback calls 0, time in user-callback 0.00 sec

--- Reading solution for model GAMS_MODEL
***
*** Solver did not provide marginals for model GAMS_MODEL
***
--- Executing after solve: elapsed 0:01:05.156
--- model.gms(234) 3 Mb
--- model.gms(393) 5 Mb
--- Putfile results /local/scratch/a/sgusev/repos/k_means/data/gams_gurobi_gdp.binary_multiplication/no_mode/2026-02-18_23-25-27/original/results.dat
--- Putfile statresults /local/scratch/a/sgusev/repos/k_means/data/gams_gurobi_gdp.binary_multiplication/no_mode/2026-02-18_23-25-27/original/resultsstat.dat
*** Status: Normal completion
--- Job model.gms Stop 02/18/26 23:26:32 elapsed 0:01:05.157
Original problem solved. Time taken: 65.63004660606384 seconds
Original objective value: 3.616505207183235
