Solving original (integer) problem with strategy gdp.binary_multiplication...
--- Job model.gms Start 02/18/26 23:24:00 52.2.0 d8e408be LEX-LEG x86 64bit/Linux
--- Applying:
    /package/gams/52.2/gmsprmun.txt
--- GAMS Parameters defined
    Input /local/scratch/a/sgusev/repos/k_means/data/gams_gurobi_gdp.binary_multiplication/no_mode/2026-02-18_23-23-59/original/model.gms
    Output /local/scratch/a/sgusev/repos/k_means/data/gams_gurobi_gdp.binary_multiplication/no_mode/2026-02-18_23-23-59/original/output.lst
    ScrDir /local/scratch/a/sgusev/repos/k_means/data/gams_gurobi_gdp.binary_multiplication/no_mode/2026-02-18_23-23-59/original/225a/
    SysDir /package/gams/52.2/
    CurDir /local/scratch/a/sgusev/repos/k_means/data/gams_gurobi_gdp.binary_multiplication/no_mode/2026-02-18_23-23-59/original/
    LogOption 3
    AppendLog 1
Licensee: David Bernal / SECQUOIA Research Group         G251008+0003Ac-GEN
          Purdue University, Davidson School of Chemical EngineeringDCE4838
          225a/gamslice.dat
          5a82958a-fbca-4a23
          node:66820903 mem:995 cores:48 ipport:46749 v:2                  
          Evaluation license: Not for commercial or production use
          The time-limited license stops working on : Jun 30, 2027
System information: 48 physical cores and 995 Gb physical memory detected
GAMS 52.2.0   Copyright (C) 1987-2025 GAMS Development. All rights reserved
--- Starting compilation
--- model.gms(222) 2 Mb
--- $echo File /local/scratch/a/sgusev/repos/k_means/data/gams_gurobi_gdp.binary_multiplication/no_mode/2026-02-18_23-23-59/original/gurobi.opt
--- model.gms(402) 2 Mb
--- Starting execution: elapsed 0:00:00.006
--- model.gms(231) 3 Mb
--- Generating MINLP model GAMS_MODEL
--- model.gms(235) 5 Mb
---   55 rows  59 columns  213 non-zeroes
---   429 nl-code  156 nl-non-zeroes
---   39 discrete-columns
--- Range statistics (absolute non-zero finite values)
--- RHS       [min, max] : [ 1.000E+00, 1.000E+00] - Zero values observed as well
--- Bound     [min, max] : [ 1.000E+00, 5.200E+01] - Zero values observed as well
--- Matrix    [min, max] : [ 8.117E-02, 1.895E+00] - Zero values observed as well
--- model.gms(235) 3 Mb
--- Executing GUROBI (Solvelink=5): elapsed 0:00:00.009
Reading parameter(s) from "/local/scratch/a/sgusev/repos/k_means/data/gams_gurobi_gdp.binary_multiplication/no_mode/2026-02-18_23-23-59/original/gurobi.opt"
>>  NonConvex 2
>>  Threads 1
>>  MIPGap 1e-06
>>  MIPGapAbs 1e-10
>>  FeasibilityTol 1e-06
>>  OptimalityTol 1e-06
>>  IntFeasTol 1e-05
Finished reading from "/local/scratch/a/sgusev/repos/k_means/data/gams_gurobi_gdp.binary_multiplication/no_mode/2026-02-18_23-23-59/original/gurobi.opt"

... GRB_LICENSE_FILE = /local/scratch/a/sgusev/gurobi.lic

    Gurobi           52.2.0 d8e408be Dec 8, 2025           LEG x86 64bit/Linux    

... GAMS/Gurobi Link license.
... GMO Q Extraction (ThreePass): 0.00s

    Gurobi Optimizer version 13.0.0 build v13.0.0rc1 (linux64 - "Oracle Linux Server 9.7")
    
    CPU model: AMD EPYC 7643 48-Core Processor, instruction set [SSE2|AVX|AVX2]
    Thread count: 48 physical cores, 96 logical processors, using up to 1 threads
    
    Non-default parameters:
    TimeLimit  300
    MIPGap  1e-06
    LogToConsole  0
    NonConvex  2
    Threads  1
    
    Optimize a model with 54 rows, 97 columns and 82 nonzeros (Min)
    Model fingerprint: 0x340a4081
    Model has 13 linear objective coefficients
    Model has 39 general nonlinear constraints (117 nonlinear terms)
    Variable types: 58 continuous, 39 integer (0 binary)
    Coefficient statistics:
      Matrix range     [1e+00, 1e+00]
      Objective range  [1e+00, 1e+00]
      Bounds range     [1e+00, 5e+01]
      RHS range        [1e+00, 1e+00]
      NLCon coe range  [7e-02, 1e+00]
    Presolve model has 39 nlconstr
    Added 195 variables to disaggregate expressions
    Presolve removed 39 rows and 0 columns
    Presolve time: 0.00s
    Presolved: 522 rows, 332 columns, 1213 nonzeros
    Presolved model has 78 bilinear constraint(s)
    
    Solving non-convex MIQCP to global optimality
    
    Variable types: 293 continuous, 39 integer (39 binary)
    Found heuristic solution: objective 8.8773359
    
    Root relaxation: objective 0.000000e+00, 101 iterations, 0.00 seconds (0.00 work units)
    
        Nodes    |    Current Node    |     Objective Bounds      |     Work
     Expl Unexpl |  Obj  Depth IntInf | Incumbent    BestBd   Gap | It/Node Time
    
         0     0    0.00000    0   52    8.87734    0.00000   100%     -    0s
         0     0    0.00000    0   70    8.87734    0.00000   100%     -    0s
         0     0    0.00000    0   89    8.87734    0.00000   100%     -    0s
         0     0    0.00000    0   88    8.87734    0.00000   100%     -    0s
         0     0    0.00000    0   89    8.87734    0.00000   100%     -    0s
         0     0    0.00000    0   97    8.87734    0.00000   100%     -    0s
         0     0    0.00000    0   86    8.87734    0.00000   100%     -    0s
    H    0     0                       8.4808726    0.00000   100%     -    0s
         0     0    0.00000    0   88    8.48087    0.00000   100%     -    0s
         0     0    0.00000    0   85    8.48087    0.00000   100%     -    0s
         0     0    0.00000    0   82    8.48087    0.00000   100%     -    0s
         0     0    0.00000    0   82    8.48087    0.00000   100%     -    0s
    H    0     0                       2.5481197    0.00000   100%     -    0s
    H    0     0                       2.5091982    0.00000   100%     -    0s
    H    0     0                       2.3856493    0.00000   100%     -    0s
    H    0     0                       2.0152436    0.00000   100%     -    0s
         0     2    0.00000    0   82    2.01524    0.00000   100%     -    0s
    H    2     2                       2.0072301    0.00000   100%  12.0    0s
    H    6     6                       1.8031652    0.00000   100%  11.3    0s
    H  153    61                       1.7239494    0.00000   100%  17.1    0s
    H  273    72                       1.7151842    0.00000   100%  20.5    0s
    H  487    84                       1.6918205    0.60497  64.2%  20.4    0s
    H  837   128                       1.4632239    0.82452  43.7%  18.4    0s
    * 4894   233              82       1.4632193    1.46018  0.21%  10.1    2s
    * 4896   222              83       1.4632166    1.46018  0.21%  10.1    2s
      9988   606     cutoff   48         1.46322    1.46018  0.21%   8.6    5s
    
    Explored 17290 nodes (130174 simplex iterations) in 7.82 seconds (5.06 work units)
    Thread count was 1 (of 96 available processors)
    
    Solution count 10: 1.46322 1.46322 1.46322 ... 2.38565
    
    Optimal solution found (tolerance 1.00e-06)
    Warning: max constraint violation (1.3625e-06) exceeds tolerance
    Warning: max general constraint violation (1.3625e-06) exceeds tolerance
    Best objective 1.463216630529e+00, best bound 1.463215335584e+00, gap 0.0001%
    
    User-callback calls 17310, time in user-callback 0.00 sec

... Solving fixed model...

    Gurobi Optimizer version 13.0.0 build v13.0.0rc1 (linux64 - "Oracle Linux Server 9.7")
    
    CPU model: AMD EPYC 7643 48-Core Processor, instruction set [SSE2|AVX|AVX2]
    Thread count: 48 physical cores, 96 logical processors, using up to 1 threads
    
    Non-default parameters:
    TimeLimit  300
    MIPGap  1e-06
    LogToConsole  0
    NonConvex  2
    Threads  1
    
    Optimize a model with 54 rows, 97 columns and 82 nonzeros (Min)
    Model fingerprint: 0x48ed2d7b
    Model has 13 linear objective coefficients
    Coefficient statistics:
      Matrix range     [1e+00, 1e+00]
      Objective range  [1e+00, 1e+00]
      Bounds range     [2e-02, 1e+00]
      RHS range        [1e+00, 1e+00]
    Presolve removed 54 rows and 97 columns
    Presolve time: 0.00s
    Presolve: All rows and columns removed
    Iteration    Objective       Primal Inf.    Dual Inf.      Time
           0    1.4632166e+00   0.000000e+00   0.000000e+00      0s
    
    Solved in 0 iterations and 0.00 seconds (0.00 work units)
    Optimal objective  1.463216631e+00
    
    User-callback calls 0, time in user-callback 0.00 sec

--- Reading solution for model GAMS_MODEL
***
*** Solver did not provide marginals for model GAMS_MODEL
***
--- Executing after solve: elapsed 0:00:07.862
--- model.gms(238) 3 Mb
--- model.gms(402) 5 Mb
--- Putfile results /local/scratch/a/sgusev/repos/k_means/data/gams_gurobi_gdp.binary_multiplication/no_mode/2026-02-18_23-23-59/original/results.dat
--- Putfile statresults /local/scratch/a/sgusev/repos/k_means/data/gams_gurobi_gdp.binary_multiplication/no_mode/2026-02-18_23-23-59/original/resultsstat.dat
*** Status: Normal completion
--- Job model.gms Stop 02/18/26 23:24:08 elapsed 0:00:07.862
Original problem solved. Time taken: 8.35311508178711 seconds
Original objective value: 1.463216630528736
