Solving original (integer) problem with strategy gdp.binary_multiplication...
--- Job model.gms Start 02/19/26 01:25:52 52.2.0 d8e408be LEX-LEG x86 64bit/Linux
--- Applying:
    /package/gams/52.2/gmsprmun.txt
--- GAMS Parameters defined
    Input /local/scratch/a/sgusev/repos/k_means/data/gams_gurobi_gdp.binary_multiplication/no_mode/2026-02-19_01-25-52/original/model.gms
    Output /local/scratch/a/sgusev/repos/k_means/data/gams_gurobi_gdp.binary_multiplication/no_mode/2026-02-19_01-25-52/original/output.lst
    ScrDir /local/scratch/a/sgusev/repos/k_means/data/gams_gurobi_gdp.binary_multiplication/no_mode/2026-02-19_01-25-52/original/225a/
    SysDir /package/gams/52.2/
    CurDir /local/scratch/a/sgusev/repos/k_means/data/gams_gurobi_gdp.binary_multiplication/no_mode/2026-02-19_01-25-52/original/
    LogOption 3
    AppendLog 1
Licensee: David Bernal / SECQUOIA Research Group         G251008+0003Ac-GEN
          Purdue University, Davidson School of Chemical EngineeringDCE4838
          225a/gamslice.dat
          5a82958a-fbca-4a23
          node:66820903 mem:995 cores:48 ipport:53835 v:2                  
          Evaluation license: Not for commercial or production use
          The time-limited license stops working on : Jun 30, 2027
System information: 48 physical cores and 995 Gb physical memory detected
GAMS 52.2.0   Copyright (C) 1987-2025 GAMS Development. All rights reserved
--- Starting compilation
--- model.gms(301) 2 Mb
--- $echo File /local/scratch/a/sgusev/repos/k_means/data/gams_gurobi_gdp.binary_multiplication/no_mode/2026-02-19_01-25-52/original/gurobi.opt
--- model.gms(530) 2 Mb
--- Starting execution: elapsed 0:00:00.006
--- model.gms(310) 3 Mb
--- Generating MINLP model GAMS_MODEL
--- model.gms(314) 5 Mb
---   79 rows  84 columns  322 non-zeroes
---   660 nl-code  240 nl-non-zeroes
---   60 discrete-columns
--- Range statistics (absolute non-zero finite values)
--- RHS       [min, max] : [ 1.000E+00, 1.000E+00] - Zero values observed as well
--- Bound     [min, max] : [ 1.000E+00, 6.000E+01] - Zero values observed as well
--- Matrix    [min, max] : [ 6.800E-02, 1.731E+00] - Zero values observed as well
--- model.gms(314) 3 Mb
--- Executing GUROBI (Solvelink=5): elapsed 0:00:00.009
Reading parameter(s) from "/local/scratch/a/sgusev/repos/k_means/data/gams_gurobi_gdp.binary_multiplication/no_mode/2026-02-19_01-25-52/original/gurobi.opt"
>>  NonConvex 2
>>  Threads 1
>>  MIPGap 1e-06
>>  MIPGapAbs 1e-10
>>  FeasibilityTol 1e-06
>>  OptimalityTol 1e-06
>>  IntFeasTol 1e-05
Finished reading from "/local/scratch/a/sgusev/repos/k_means/data/gams_gurobi_gdp.binary_multiplication/no_mode/2026-02-19_01-25-52/original/gurobi.opt"

... GRB_LICENSE_FILE = /local/scratch/a/sgusev/gurobi.lic

    Gurobi           52.2.0 d8e408be Dec 8, 2025           LEG x86 64bit/Linux    

... GAMS/Gurobi Link license.
... GMO Q Extraction (ThreePass): 0.00s

    Gurobi Optimizer version 13.0.0 build v13.0.0rc1 (linux64 - "Oracle Linux Server 9.7")
    
    CPU model: AMD EPYC 7643 48-Core Processor, instruction set [SSE2|AVX|AVX2]
    Thread count: 48 physical cores, 96 logical processors, using up to 1 threads
    
    Non-default parameters:
    TimeLimit  300
    MIPGap  1e-06
    LogToConsole  0
    NonConvex  2
    Threads  1
    
    Optimize a model with 78 rows, 143 columns and 126 nonzeros (Min)
    Model fingerprint: 0x78616620
    Model has 15 linear objective coefficients
    Model has 60 general nonlinear constraints (180 nonlinear terms)
    Variable types: 83 continuous, 60 integer (0 binary)
    Coefficient statistics:
      Matrix range     [1e+00, 1e+00]
      Objective range  [1e+00, 1e+00]
      Bounds range     [1e+00, 6e+01]
      RHS range        [1e+00, 1e+00]
      NLCon coe range  [3e-02, 1e+00]
    Presolve model has 60 nlconstr
    Added 300 variables to disaggregate expressions
    Presolve removed 60 rows and 0 columns
    Presolve time: 0.00s
    Presolved: 798 rows, 504 columns, 1866 nonzeros
    Presolved model has 120 bilinear constraint(s)
    
    Solving non-convex MIQCP to global optimality
    
    Variable types: 444 continuous, 60 integer (60 binary)
    Found heuristic solution: objective 11.4333578
    
    Root relaxation: objective 0.000000e+00, 81 iterations, 0.00 seconds (0.00 work units)
    
        Nodes    |    Current Node    |     Objective Bounds      |     Work
     Expl Unexpl |  Obj  Depth IntInf | Incumbent    BestBd   Gap | It/Node Time
    
         0     0    0.00000    0   75   11.43336    0.00000   100%     -    0s
         0     0    0.00000    0  101   11.43336    0.00000   100%     -    0s
         0     0    0.00000    0  116   11.43336    0.00000   100%     -    0s
         0     0    0.00000    0  115   11.43336    0.00000   100%     -    0s
         0     0    0.00000    0  124   11.43336    0.00000   100%     -    0s
         0     0    0.00000    0  134   11.43336    0.00000   100%     -    0s
         0     0    0.00000    0  134   11.43336    0.00000   100%     -    0s
         0     0    0.00000    0  134   11.43336    0.00000   100%     -    0s
         0     0    0.00000    0  124   11.43336    0.00000   100%     -    0s
    H    0     0                       9.2025420    0.00000   100%     -    0s
    H    0     0                       9.1751363    0.00000   100%     -    0s
    H    0     0                       7.1554493    0.00000   100%     -    0s
         0     2    0.00000    0  124    7.15545    0.00000   100%     -    0s
    H    6     6                       7.0887942    0.00000   100%   8.3    0s
    H   10    10                       6.7317937    0.00000   100%   7.3    0s
    H   12    12                       6.6227285    0.00000   100%  10.3    0s
    H   12    12                       6.5365540    0.00000   100%  10.3    0s
    H   15    15                       6.5331276    0.00000   100%   9.9    0s
    H   15    15                       6.5327442    0.00000   100%   9.9    0s
    H   15    15                       6.5313851    0.00000   100%   9.9    0s
    H   17    17                       5.5764735    0.00000   100%  12.4    0s
    H   20    20                       5.1984013    0.00000   100%  13.0    0s
    H   25    25                       5.1231666    0.00000   100%  13.7    0s
    H   25    25                       5.0555402    0.00000   100%  13.7    0s
    H   43    43                       5.0280524    0.00000   100%  12.7    0s
    H   55    55                       4.4329989    0.00000   100%  13.0    0s
    H   56    54                       3.8173647    0.00000   100%  12.8    0s
    H   57    53                       3.6388245    0.00000   100%  12.6    0s
    H   73    67                       3.5746547    0.00000   100%  11.6    0s
    H  188   147                       3.0479896    0.00000   100%  15.9    0s
    H  188   147                       2.9863601    0.00000   100%  15.9    0s
    H  188   147                       2.9480679    0.00000   100%  15.9    0s
    H  188   147                       2.9469632    0.00000   100%  15.9    0s
    H  533   370                       2.7580285    0.00000   100%  16.2    0s
    H  558   389                       2.7560721    0.00000   100%  15.9    0s
    H  578   383                       2.7034905    0.00000   100%  16.4    0s
    H  578   383                       2.7031183    0.00000   100%  16.4    0s
    H  578   383                       2.7023056    0.00000   100%  16.4    0s
    H  578   383                       2.7010771    0.00000   100%  16.4    0s
    H  578   383                       2.7001851    0.00000   100%  16.4    0s
    H  674   406                       2.7001558    0.00000   100%  21.7    1s
    H  674   385                       2.6990835    0.00000   100%  21.7    1s
    H  674   366                       2.6985339    0.00000   100%  21.7    1s
    H  674   347                       2.6982537    0.00000   100%  21.7    1s
    H  674   330                       2.6971442    0.00000   100%  21.7    1s
    H  680   317                       2.6971177    0.00000   100%  22.1    1s
    H  682   303                       2.6971103    0.00000   100%  22.2    1s
    H  690   293                       2.6893077    0.00000   100%  22.4    1s
    H  690   279                       2.6855602    0.00000   100%  22.4    1s
    H  690   265                       2.6843209    0.00000   100%  22.4    1s
    H  690   252                       2.6840071    0.00000   100%  22.4    1s
    H  690   240                       2.6839928    0.00000   100%  22.4    1s
    H  690   228                       2.6839923    0.00000   100%  22.4    1s
    H  696   219                       2.6684447    0.00000   100%  22.6    1s
    H  696   209                       2.6681118    0.00000   100%  22.6    1s
    H 1303   416                       2.5569916    0.00000   100%  23.1    2s
    H 1344   441                       2.5569910    0.00000   100%  22.9    2s
    H 1517   516                       2.5550360    0.00000   100%  22.3    2s
    H 1517   516                       2.5543354    0.00000   100%  22.3    2s
    H 1632   566                       2.5254351    0.00000   100%  22.1    2s
    H 1632   566                       2.5237584    0.00000   100%  22.1    2s
    H 1678   570                       2.4238711    0.00000   100%  22.3    2s
    H 1678   570                       2.4234918    0.00000   100%  22.3    2s
    H 1678   570                       2.4233051    0.00000   100%  22.3    2s
    H 1806   613                       2.4233018    0.00000   100%  22.5    2s
    H 2806  1015                       2.4233005    0.00000   100%  22.9    3s
    H 3060  1083                       2.4232720    0.00633   100%  23.0    3s
    H 3060  1081                       2.4227316    0.00633   100%  23.0    3s
    H 3060  1081                       2.4226726    0.00633   100%  23.0    3s
      4277  1379    1.52484   31  132    2.42267    0.22466  90.7%  23.4    5s
    H 4792  1478                       2.3167382    0.27884  88.0%  23.0    5s
    H 5209  1531                       2.1718031    0.31699  85.4%  23.2    5s
    H 6471  1719                       2.1324870    0.56772  73.4%  23.5    7s
      9480  1758     cutoff   60         2.13249    1.06142  50.2%  22.7   10s
    H10619  1765                       2.1247329    1.16698  45.1%  22.4   12s
     13495  1855     cutoff   45         2.12473    1.41975  33.2%  21.6   15s
    *16728  2274             116       2.1247198    1.57876  25.7%  20.0   17s
     19321  2272     cutoff   65         2.12472    1.69140  20.4%  18.8   20s
     26333  1980    2.11519   67   75    2.12472    1.85770  12.6%  16.5   25s
     33481  1685    2.12439   67   75    2.12472    2.04518  3.74%  14.7   30s
     41024  1855     cutoff   69         2.12472    2.09566  1.37%  13.4   35s
     48450  1971    2.12230   80   75    2.12472    2.11103  0.64%  12.5   40s
     56218  1957    2.11876   77   75    2.12472    2.11726  0.35%  11.7   45s
     64488  2675    2.12457   81   45    2.12472    2.11966  0.24%  10.9   50s
     73514  2975    2.12427   83   60    2.12472    2.12145  0.15%  10.3   55s
     82437  3328     cutoff  107         2.12472    2.12204  0.13%   9.7   60s
     91551  3542    2.12362   86   75    2.12472    2.12264  0.10%   9.3   65s
     100703  3192    2.12446   90   60    2.12472    2.12350  0.06%   8.9   70s
     109998  3251     cutoff   98         2.12472    2.12383  0.04%   8.6   75s
     119464  3393    2.12455   97   30    2.12472    2.12405  0.03%   8.3   80s
     128459  2962    2.12453   91   60    2.12472    2.12430  0.02%   8.1   85s
     137808  2551     cutoff  107         2.12472    2.12455  0.01%   7.8   90s
     146823  1554     cutoff  110         2.12472    2.12466  0.00%   7.6   95s
    
    Cutting planes:
      Gomory: 5
      Implied bound: 14
      MIR: 11
      Flow cover: 117
      Inf proof: 1
      RLT: 20
      Relax-and-lift: 1
    
    Explored 152638 nodes (1145762 simplex iterations) in 98.53 seconds (68.24 work units)
    Thread count was 1 (of 96 available processors)
    
    Solution count 10: 2.12472 2.12473 2.13249 ... 2.4233
    
    Optimal solution found (tolerance 1.00e-06)
    Warning: max constraint violation (1.4788e-06) exceeds tolerance
    Warning: max general constraint violation (1.4788e-06) exceeds tolerance
    Best objective 2.124719812705e+00, best bound 2.124717691150e+00, gap 0.0001%
    
    User-callback calls 152707, time in user-callback 0.01 sec

... Solving fixed model...

    Gurobi Optimizer version 13.0.0 build v13.0.0rc1 (linux64 - "Oracle Linux Server 9.7")
    
    CPU model: AMD EPYC 7643 48-Core Processor, instruction set [SSE2|AVX|AVX2]
    Thread count: 48 physical cores, 96 logical processors, using up to 1 threads
    
    Non-default parameters:
    TimeLimit  300
    MIPGap  1e-06
    LogToConsole  0
    NonConvex  2
    Threads  1
    
    Optimize a model with 78 rows, 143 columns and 126 nonzeros (Min)
    Model fingerprint: 0x6450e271
    Model has 15 linear objective coefficients
    Coefficient statistics:
      Matrix range     [1e+00, 1e+00]
      Objective range  [1e+00, 1e+00]
      Bounds range     [2e-02, 1e+00]
      RHS range        [1e+00, 1e+00]
    Presolve removed 78 rows and 143 columns
    Presolve time: 0.00s
    Presolve: All rows and columns removed
    Iteration    Objective       Primal Inf.    Dual Inf.      Time
           0    2.1247198e+00   0.000000e+00   0.000000e+00      0s
    
    Solved in 0 iterations and 0.00 seconds (0.00 work units)
    Optimal objective  2.124719813e+00
    
    User-callback calls 0, time in user-callback 0.00 sec

--- Reading solution for model GAMS_MODEL
***
*** Solver did not provide marginals for model GAMS_MODEL
***
--- Executing after solve: elapsed 0:01:38.570
--- model.gms(317) 3 Mb
--- model.gms(530) 5 Mb
--- Putfile results /local/scratch/a/sgusev/repos/k_means/data/gams_gurobi_gdp.binary_multiplication/no_mode/2026-02-19_01-25-52/original/results.dat
--- Putfile statresults /local/scratch/a/sgusev/repos/k_means/data/gams_gurobi_gdp.binary_multiplication/no_mode/2026-02-19_01-25-52/original/resultsstat.dat
*** Status: Normal completion
--- Job model.gms Stop 02/19/26 01:27:31 elapsed 0:01:38.570
Original problem solved. Time taken: 99.05349063873291 seconds
Original objective value: 2.124719812705238
