Solving original (integer) problem with strategy gdp.binary_multiplication...
--- Job model.gms Start 02/18/26 23:12:22 52.2.0 d8e408be LEX-LEG x86 64bit/Linux
--- Applying:
    /package/gams/52.2/gmsprmun.txt
--- GAMS Parameters defined
    Input /local/scratch/a/sgusev/repos/k_means/data/gams_gurobi_gdp.binary_multiplication/no_mode/2026-02-18_23-12-21/original/model.gms
    Output /local/scratch/a/sgusev/repos/k_means/data/gams_gurobi_gdp.binary_multiplication/no_mode/2026-02-18_23-12-21/original/output.lst
    ScrDir /local/scratch/a/sgusev/repos/k_means/data/gams_gurobi_gdp.binary_multiplication/no_mode/2026-02-18_23-12-21/original/225a/
    SysDir /package/gams/52.2/
    CurDir /local/scratch/a/sgusev/repos/k_means/data/gams_gurobi_gdp.binary_multiplication/no_mode/2026-02-18_23-12-21/original/
    LogOption 3
    AppendLog 1
Licensee: David Bernal / SECQUOIA Research Group         G251008+0003Ac-GEN
          Purdue University, Davidson School of Chemical EngineeringDCE4838
          225a/gamslice.dat
          5a82958a-fbca-4a23
          node:66820903 mem:995 cores:48 ipport:57685 v:2                  
          Evaluation license: Not for commercial or production use
          The time-limited license stops working on : Jun 30, 2027
System information: 48 physical cores and 995 Gb physical memory detected
GAMS 52.2.0   Copyright (C) 1987-2025 GAMS Development. All rights reserved
--- Starting compilation
--- model.gms(259) 2 Mb
--- $echo File /local/scratch/a/sgusev/repos/k_means/data/gams_gurobi_gdp.binary_multiplication/no_mode/2026-02-18_23-12-21/original/gurobi.opt
--- model.gms(461) 2 Mb
--- Starting execution: elapsed 0:00:00.006
--- model.gms(268) 3 Mb
--- Generating MINLP model GAMS_MODEL
--- model.gms(272) 5 Mb
---   65 rows  71 columns  269 non-zeroes
---   550 nl-code  200 nl-non-zeroes
---   50 discrete-columns
--- Range statistics (absolute non-zero finite values)
--- RHS       [min, max] : [ 1.000E+00, 1.000E+00] - Zero values observed as well
--- Bound     [min, max] : [ 1.000E+00, 4.000E+01] - Zero values observed as well
--- Matrix    [min, max] : [ 1.296E-02, 1.397E+00] - Zero values observed as well
--- model.gms(272) 3 Mb
--- Executing GUROBI (Solvelink=5): elapsed 0:00:00.009
Reading parameter(s) from "/local/scratch/a/sgusev/repos/k_means/data/gams_gurobi_gdp.binary_multiplication/no_mode/2026-02-18_23-12-21/original/gurobi.opt"
>>  NonConvex 2
>>  Threads 1
>>  MIPGap 1e-06
>>  MIPGapAbs 1e-10
>>  FeasibilityTol 1e-06
>>  OptimalityTol 1e-06
>>  IntFeasTol 1e-05
Finished reading from "/local/scratch/a/sgusev/repos/k_means/data/gams_gurobi_gdp.binary_multiplication/no_mode/2026-02-18_23-12-21/original/gurobi.opt"

... GRB_LICENSE_FILE = /local/scratch/a/sgusev/gurobi.lic

    Gurobi           52.2.0 d8e408be Dec 8, 2025           LEG x86 64bit/Linux    

... GAMS/Gurobi Link license.
... GMO Q Extraction (ThreePass): 0.00s

    Gurobi Optimizer version 13.0.0 build v13.0.0rc1 (linux64 - "Oracle Linux Server 9.7")
    
    CPU model: AMD EPYC 7643 48-Core Processor, instruction set [SSE2|AVX|AVX2]
    Thread count: 48 physical cores, 96 logical processors, using up to 1 threads
    
    Non-default parameters:
    TimeLimit  300
    MIPGap  1e-06
    LogToConsole  0
    NonConvex  2
    Threads  1
    
    Optimize a model with 64 rows, 120 columns and 108 nonzeros (Min)
    Model fingerprint: 0xfba53b09
    Model has 10 linear objective coefficients
    Model has 50 general nonlinear constraints (150 nonlinear terms)
    Variable types: 70 continuous, 50 integer (0 binary)
    Coefficient statistics:
      Matrix range     [1e+00, 1e+00]
      Objective range  [1e+00, 1e+00]
      Bounds range     [1e+00, 4e+01]
      RHS range        [1e+00, 1e+00]
      NLCon coe range  [1e-02, 9e-01]
    Presolve model has 50 nlconstr
    Added 250 variables to disaggregate expressions
    Presolve removed 50 rows and 0 columns
    Presolve time: 0.00s
    Presolved: 664 rows, 421 columns, 1558 nonzeros
    Presolved model has 100 bilinear constraint(s)
    
    Solving non-convex MIQCP to global optimality
    
    Variable types: 371 continuous, 50 integer (50 binary)
    Found heuristic solution: objective 5.7099075
    
    Root relaxation: objective 0.000000e+00, 42 iterations, 0.00 seconds (0.00 work units)
    
        Nodes    |    Current Node    |     Objective Bounds      |     Work
     Expl Unexpl |  Obj  Depth IntInf | Incumbent    BestBd   Gap | It/Node Time
    
         0     0    0.00000    0  100    5.70991    0.00000   100%     -    0s
         0     0    0.00000    0  114    5.70991    0.00000   100%     -    0s
         0     0    0.00000    0  110    5.70991    0.00000   100%     -    0s
         0     0    0.00000    0  106    5.70991    0.00000   100%     -    0s
    H    0     0                       4.1406835    0.00000   100%     -    0s
         0     0    0.00000    0  106    4.14068    0.00000   100%     -    0s
         0     0    0.00000    0  110    4.14068    0.00000   100%     -    0s
         0     0    0.00000    0  110    4.14068    0.00000   100%     -    0s
         0     0    0.00000    0  110    4.14068    0.00000   100%     -    0s
         0     0    0.00000    0  104    4.14068    0.00000   100%     -    0s
    H    0     0                       2.2861903    0.00000   100%     -    0s
    H    0     0                       2.2830519    0.00000   100%     -    0s
    H    0     0                       1.9678922    0.00000   100%     -    0s
         0     2    0.00000    0  104    1.96789    0.00000   100%     -    0s
    H   12    12                       1.9349691    0.00000   100%  11.4    0s
    H   12    12                       1.9267383    0.00000   100%  11.4    0s
    H   12    12                       1.9246806    0.00000   100%  11.4    0s
    H   12    12                       1.9241662    0.00000   100%  11.4    0s
    H   12    12                       1.9240376    0.00000   100%  11.4    0s
    H   12    12                       1.9240054    0.00000   100%  11.4    0s
    H   17    17                       1.8819281    0.00000   100%  14.2    0s
    H   33    29                       1.8452123    0.00000   100%  20.8    0s
    H   33    29                       1.8446295    0.00000   100%  20.8    0s
    H   33    27                       1.5767467    0.00000   100%  20.8    0s
    H   45    27                       1.5104836    0.00000   100%  19.7    0s
    H   62    43                       0.9346365    0.00000   100%  19.0    0s
    H   63    34                       0.4080923    0.00000   100%  18.8    0s
    H  846   166                       0.4080923    0.00000   100%  17.7    0s
    H  846   166                       0.4080923    0.00000   100%  17.7    0s
    H 3099   464                       0.4080902    0.08882  78.2%  19.2    2s
    H 4099   498                       0.4080901    0.20786  49.1%  18.3    3s
      6265   746    0.37360   39   70    0.40809    0.30863  24.4%  16.2    5s
     13854  1956     cutoff   39         0.40809    0.34884  14.5%  11.0   10s
     22815  1905    0.40574   46   50    0.40809    0.37907  7.11%   9.6   15s
     32060  1188     cutoff   48         0.40809    0.39967  2.06%   8.6   20s
    *33931  1385              88       0.4080874    0.40105  1.72%   8.4   20s
     42418  1380    0.40749   60   40    0.40809    0.40710  0.24%   7.4   25s
    *46112  1105              80       0.4080868    0.40780  0.07%   7.1   26s
    *48676   897              83       0.4080862    0.40794  0.04%   6.9   27s
    
    Cutting planes:
      Learned: 1
      PSD: 1
    
    Explored 53238 nodes (353351 simplex iterations) in 29.94 seconds (20.30 work units)
    Thread count was 1 (of 96 available processors)
    
    Solution count 10: 0.408086 0.408087 0.408087 ... 1.57675
    
    Optimal solution found (tolerance 1.00e-06)
    Warning: max constraint violation (1.1903e-06) exceeds tolerance
    Warning: max general constraint violation (1.1903e-06) exceeds tolerance
    Best objective 4.080861723326e-01, best bound 4.080858418178e-01, gap 0.0001%
    
    User-callback calls 53267, time in user-callback 0.00 sec

... Solving fixed model...

    Gurobi Optimizer version 13.0.0 build v13.0.0rc1 (linux64 - "Oracle Linux Server 9.7")
    
    CPU model: AMD EPYC 7643 48-Core Processor, instruction set [SSE2|AVX|AVX2]
    Thread count: 48 physical cores, 96 logical processors, using up to 1 threads
    
    Non-default parameters:
    TimeLimit  300
    MIPGap  1e-06
    LogToConsole  0
    NonConvex  2
    Threads  1
    
    Optimize a model with 64 rows, 120 columns and 108 nonzeros (Min)
    Model fingerprint: 0x991f4f46
    Model has 10 linear objective coefficients
    Coefficient statistics:
      Matrix range     [1e+00, 1e+00]
      Objective range  [1e+00, 1e+00]
      Bounds range     [7e-03, 1e+00]
      RHS range        [1e+00, 1e+00]
    Presolve removed 64 rows and 120 columns
    Presolve time: 0.00s
    Presolve: All rows and columns removed
    Iteration    Objective       Primal Inf.    Dual Inf.      Time
           0    4.0808617e-01   0.000000e+00   0.000000e+00      0s
    
    Solved in 0 iterations and 0.00 seconds (0.00 work units)
    Optimal objective  4.080861723e-01
    
    User-callback calls 0, time in user-callback 0.00 sec

--- Reading solution for model GAMS_MODEL
***
*** Solver did not provide marginals for model GAMS_MODEL
***
--- Executing after solve: elapsed 0:00:29.976
--- model.gms(275) 3 Mb
--- model.gms(461) 5 Mb
--- Putfile results /local/scratch/a/sgusev/repos/k_means/data/gams_gurobi_gdp.binary_multiplication/no_mode/2026-02-18_23-12-21/original/results.dat
--- Putfile statresults /local/scratch/a/sgusev/repos/k_means/data/gams_gurobi_gdp.binary_multiplication/no_mode/2026-02-18_23-12-21/original/resultsstat.dat
*** Status: Normal completion
--- Job model.gms Stop 02/18/26 23:12:51 elapsed 0:00:29.977
Original problem solved. Time taken: 30.463245630264282 seconds
Original objective value: 0.408086172332587
