Solving original (integer) problem with strategy gdp.binary_multiplication...
--- Job model.gms Start 02/19/26 03:16:42 52.2.0 d8e408be LEX-LEG x86 64bit/Linux
--- Applying:
    /package/gams/52.2/gmsprmun.txt
--- GAMS Parameters defined
    Input /local/scratch/a/sgusev/repos/k_means/data/gams_gurobi_gdp.binary_multiplication/no_mode/2026-02-19_03-16-42/original/model.gms
    Output /local/scratch/a/sgusev/repos/k_means/data/gams_gurobi_gdp.binary_multiplication/no_mode/2026-02-19_03-16-42/original/output.lst
    ScrDir /local/scratch/a/sgusev/repos/k_means/data/gams_gurobi_gdp.binary_multiplication/no_mode/2026-02-19_03-16-42/original/225a/
    SysDir /package/gams/52.2/
    CurDir /local/scratch/a/sgusev/repos/k_means/data/gams_gurobi_gdp.binary_multiplication/no_mode/2026-02-19_03-16-42/original/
    LogOption 3
    AppendLog 1
Licensee: David Bernal / SECQUOIA Research Group         G251008+0003Ac-GEN
          Purdue University, Davidson School of Chemical EngineeringDCE4838
          225a/gamslice.dat
          5a82958a-fbca-4a23
          node:66820903 mem:995 cores:48 ipport:33091 v:2                  
          Evaluation license: Not for commercial or production use
          The time-limited license stops working on : Jun 30, 2027
System information: 48 physical cores and 995 Gb physical memory detected
GAMS 52.2.0   Copyright (C) 1987-2025 GAMS Development. All rights reserved
--- Starting compilation
--- model.gms(283) 2 Mb
--- $echo File /local/scratch/a/sgusev/repos/k_means/data/gams_gurobi_gdp.binary_multiplication/no_mode/2026-02-19_03-16-42/original/gurobi.opt
--- model.gms(498) 2 Mb
--- Starting execution: elapsed 0:00:00.006
--- model.gms(292) 3 Mb
--- Generating MINLP model GAMS_MODEL
--- model.gms(296) 5 Mb
---   71 rows  78 columns  328 non-zeroes
---   765 nl-code  255 nl-non-zeroes
---   51 discrete-columns
--- Range statistics (absolute non-zero finite values)
--- RHS       [min, max] : [ 1.000E+00, 1.000E+00] - Zero values observed as well
--- Bound     [min, max] : [ 1.000E+00, 1.020E+02] - Zero values observed as well
--- Matrix    [min, max] : [ 1.443E-01, 2.035E+00] - Zero values observed as well
--- model.gms(296) 3 Mb
--- Executing GUROBI (Solvelink=5): elapsed 0:00:00.009
Reading parameter(s) from "/local/scratch/a/sgusev/repos/k_means/data/gams_gurobi_gdp.binary_multiplication/no_mode/2026-02-19_03-16-42/original/gurobi.opt"
>>  NonConvex 2
>>  Threads 1
>>  MIPGap 1e-06
>>  MIPGapAbs 1e-10
>>  FeasibilityTol 1e-06
>>  OptimalityTol 1e-06
>>  IntFeasTol 1e-05
Finished reading from "/local/scratch/a/sgusev/repos/k_means/data/gams_gurobi_gdp.binary_multiplication/no_mode/2026-02-19_03-16-42/original/gurobi.opt"

... GRB_LICENSE_FILE = /local/scratch/a/sgusev/gurobi.lic

    Gurobi           52.2.0 d8e408be Dec 8, 2025           LEG x86 64bit/Linux    

... GAMS/Gurobi Link license.
... GMO Q Extraction (ThreePass): 0.00s

    Gurobi Optimizer version 13.0.0 build v13.0.0rc1 (linux64 - "Oracle Linux Server 9.7")
    
    CPU model: AMD EPYC 7643 48-Core Processor, instruction set [SSE2|AVX|AVX2]
    Thread count: 48 physical cores, 96 logical processors, using up to 1 threads
    
    Non-default parameters:
    TimeLimit  300
    MIPGap  1e-06
    LogToConsole  0
    NonConvex  2
    Threads  1
    
    Optimize a model with 70 rows, 128 columns and 106 nonzeros (Min)
    Model fingerprint: 0x98cc74f1
    Model has 17 linear objective coefficients
    Model has 51 general nonlinear constraints (204 nonlinear terms)
    Variable types: 77 continuous, 51 integer (0 binary)
    Coefficient statistics:
      Matrix range     [1e+00, 1e+00]
      Objective range  [1e+00, 1e+00]
      Bounds range     [1e+00, 1e+02]
      RHS range        [1e+00, 1e+00]
      NLCon coe range  [3e-02, 1e+00]
    Presolve model has 51 nlconstr
    Added 357 variables to disaggregate expressions
    Presolve removed 51 rows and 0 columns
    Presolve time: 0.00s
    Presolved: 886 rows, 537 columns, 2044 nonzeros
    Presolved model has 153 bilinear constraint(s)
    
    Solving non-convex MIQCP to global optimality
    
    Variable types: 486 continuous, 51 integer (51 binary)
    Found heuristic solution: objective 15.7153984
    
    Root relaxation: objective 0.000000e+00, 267 iterations, 0.00 seconds (0.00 work units)
    
        Nodes    |    Current Node    |     Objective Bounds      |     Work
     Expl Unexpl |  Obj  Depth IntInf | Incumbent    BestBd   Gap | It/Node Time
    
         0     0    0.00000    0  153   15.71540    0.00000   100%     -    0s
    H    0     0                      13.7379932    0.00000   100%     -    0s
         0     0    0.00000    0  164   13.73799    0.00000   100%     -    0s
         0     0    0.00000    0  185   13.73799    0.00000   100%     -    0s
         0     0    0.00000    0  174   13.73799    0.00000   100%     -    0s
         0     0    0.00000    0  180   13.73799    0.00000   100%     -    0s
         0     0    0.00000    0  178   13.73799    0.00000   100%     -    0s
         0     0    0.00000    0  178   13.73799    0.00000   100%     -    0s
         0     0    0.00000    0  178   13.73799    0.00000   100%     -    0s
         0     0    0.00000    0  169   13.73799    0.00000   100%     -    0s
    H    0     0                      12.8467833    0.00000   100%     -    0s
    H    0     0                       9.7069881    0.00000   100%     -    0s
         0     2    0.00000    0  154    9.70699    0.00000   100%     -    0s
    H    3     3                       9.0878919    0.00000   100%  13.3    0s
    H    4     4                       9.0878919    0.00000   100%  12.5    0s
    H   10    10                       9.0878919    0.00000   100%  16.4    0s
    H  956   574                       8.6885324    0.00000   100%  26.2    2s
    H  967   549                       8.1429409    0.00000   100%  26.0    2s
    H 1040   562                       8.1429409    0.00000   100%  25.3    2s
    H 1070   550                       8.1429409    0.00000   100%  25.4    2s
    H 1275   610                       8.1429409    0.00000   100%  27.1    2s
    H 1321   609                       8.1429409    0.00000   100%  26.8    2s
    H 1370   513                       7.4332314    0.00000   100%  26.7    2s
    H 1484   547                       7.4328247    0.00000   100%  26.3    2s
    H 2484   995                       7.3747092    0.90631  87.7%  27.4    3s
      3549  1423    6.66724   38  147    7.37471    1.34806  81.7%  27.7    5s
    H 6834  2399                       7.2398342    2.27814  68.5%  28.4    8s
    H 6870  2412                       7.2398342    2.28121  68.5%  28.4    8s
      8513  2867     cutoff   40         7.23983    2.55215  64.7%  28.0   10s
     13707  4001    3.23498   23  177    7.23983    3.23498  55.3%  28.0   15s
     18876  4946    5.65405   36  158    7.23983    3.69107  49.0%  27.6   20s
     23672  5630     cutoff   38         7.23983    4.01926  44.5%  27.3   25s
     28064  6056    5.82354   31  152    7.23983    4.24587  41.4%  27.3   30s
     33012  6449    4.78674   29  166    7.23983    4.49519  37.9%  26.9   35s
     37809  6763     cutoff   34         7.23983    4.71150  34.9%  26.7   40s
    H39580  6867                       7.2256534    4.78055  33.8%  26.5   41s
    H39581  6868                       7.2256534    4.78055  33.8%  26.5   42s
    H40274  6884                       7.2256534    4.80956  33.4%  26.5   42s
     42006  6912    5.81059   28  166    7.22565    4.88995  32.3%  26.4   45s
     46680  6896     cutoff   31         7.22565    5.09071  29.5%  26.1   50s
     50803  6843     cutoff   45         7.22565    5.23473  27.6%  25.9   55s
     55333  6556 infeasible   33         7.22565    5.42988  24.9%  25.7   60s
     59990  6102     cutoff   27         7.22565    5.63278  22.0%  25.5   65s
     64467  5578    6.79609   32  155    7.22565    5.83362  19.3%  25.1   70s
     68887  4646    6.67254   53  120    7.22565    6.06948  16.0%  24.8   75s
     73818  3844     cutoff   37         7.22565    6.31021  12.7%  24.3   80s
     79053  3416 infeasible   35         7.22565    6.49397  10.1%  23.6   85s
     84307  3111    6.93468   45  136    7.22565    6.64373  8.05%  22.9   90s
     89511  2897     cutoff   62         7.22565    6.77336  6.26%  22.3   95s
     95092  2854     cutoff   65         7.22565    6.89218  4.62%  21.6  100s
    *96228  3306             134       7.2256387    6.90477  4.44%  21.4  100s
     100309  3457    7.13281   62   50    7.22564    6.96257  3.64%  21.0  105s
     105775  2974    7.20604   73  119    7.22564    7.07619  2.07%  20.4  110s
     111473  3022    7.17704   75  102    7.22564    7.14102  1.17%  19.8  115s
     117974  3105     cutoff   80         7.22564    7.17345  0.72%  19.2  120s
     124613  3242    7.20629   72   85    7.22564    7.18763  0.53%  18.6  125s
     130989  3030    7.21980   82  117    7.22564    7.19891  0.37%  18.0  130s
     137855  3024    7.21594   85   84    7.22564    7.20950  0.22%  17.5  135s
     144996  3431     cutoff   90         7.22564    7.21364  0.17%  16.9  140s
     151861  3502    7.22152   90   67    7.22564    7.21627  0.13%  16.5  145s
     158903  3448    7.22528   87   85    7.22564    7.21868  0.10%  16.0  150s
     165873  3682    7.22298   89  119    7.22564    7.22037  0.07%  15.6  155s
     173274  3715    7.22392   86   85    7.22564    7.22162  0.06%  15.2  160s
     180778  3879    7.22518  103   68    7.22564    7.22254  0.04%  14.8  165s
     188407  3674    7.22510  102   68    7.22564    7.22339  0.03%  14.5  170s
     195786  3745     cutoff  106         7.22564    7.22395  0.02%  14.2  175s
     203485  3434    7.22552  105   84    7.22564    7.22438  0.02%  13.8  180s
     210645  3492     cutoff  100         7.22564    7.22480  0.01%  13.6  185s
     218236  3301    7.22547  106  101    7.22564    7.22506  0.01%  13.3  190s
     225889  3078    7.22562  115   85    7.22564    7.22526  0.01%  13.1  195s
     233309  2736    7.22548  114  101    7.22564    7.22538  0.00%  12.8  200s
     240971  2344     cutoff  120         7.22564    7.22548  0.00%  12.6  205s
     248750  1951     cutoff  120         7.22564    7.22556  0.00%  12.4  210s
     256371   978    7.22564  128   34    7.22564    7.22562  0.00%  12.2  215s
    
    Cutting planes:
      Gomory: 8
      Implied bound: 2
      MIR: 14
      Flow cover: 68
      RLT: 9
    
    Explored 257793 nodes (3127242 simplex iterations) in 215.95 seconds (150.12 work units)
    Thread count was 1 (of 96 available processors)
    
    Solution count 10: 7.22564 7.22565 7.23983 ... 9.70699
    
    Optimal solution found (tolerance 1.00e-06)
    Warning: max constraint violation (1.9469e-06) exceeds tolerance
    Warning: max general constraint violation (1.9469e-06) exceeds tolerance
    Best objective 7.225638726075e+00, best bound 7.225631500585e+00, gap 0.0001%
    
    User-callback calls 257819, time in user-callback 0.01 sec

... Solving fixed model...

    Gurobi Optimizer version 13.0.0 build v13.0.0rc1 (linux64 - "Oracle Linux Server 9.7")
    
    CPU model: AMD EPYC 7643 48-Core Processor, instruction set [SSE2|AVX|AVX2]
    Thread count: 48 physical cores, 96 logical processors, using up to 1 threads
    
    Non-default parameters:
    TimeLimit  300
    MIPGap  1e-06
    LogToConsole  0
    NonConvex  2
    Threads  1
    
    Optimize a model with 70 rows, 128 columns and 106 nonzeros (Min)
    Model fingerprint: 0xff9cc373
    Model has 17 linear objective coefficients
    Coefficient statistics:
      Matrix range     [1e+00, 1e+00]
      Objective range  [1e+00, 1e+00]
      Bounds range     [2e-02, 1e+00]
      RHS range        [1e+00, 1e+00]
    Presolve removed 70 rows and 128 columns
    Presolve time: 0.00s
    Presolve: All rows and columns removed
    Iteration    Objective       Primal Inf.    Dual Inf.      Time
           0    7.2256387e+00   0.000000e+00   0.000000e+00      0s
    
    Solved in 0 iterations and 0.00 seconds (0.00 work units)
    Optimal objective  7.225638726e+00
    
    User-callback calls 0, time in user-callback 0.00 sec

--- Reading solution for model GAMS_MODEL
***
*** Solver did not provide marginals for model GAMS_MODEL
***
--- Executing after solve: elapsed 0:03:35.991
--- model.gms(299) 3 Mb
--- model.gms(498) 5 Mb
--- Putfile results /local/scratch/a/sgusev/repos/k_means/data/gams_gurobi_gdp.binary_multiplication/no_mode/2026-02-19_03-16-42/original/results.dat
--- Putfile statresults /local/scratch/a/sgusev/repos/k_means/data/gams_gurobi_gdp.binary_multiplication/no_mode/2026-02-19_03-16-42/original/resultsstat.dat
*** Status: Normal completion
--- Job model.gms Stop 02/19/26 03:20:18 elapsed 0:03:35.992
Original problem solved. Time taken: 216.48090529441833 seconds
Original objective value: 7.2256387260754
