Solving original (integer) problem with strategy gdp.binary_multiplication...
--- Job model.gms Start 02/19/26 02:18:07 52.2.0 d8e408be LEX-LEG x86 64bit/Linux
--- Applying:
    /package/gams/52.2/gmsprmun.txt
--- GAMS Parameters defined
    Input /local/scratch/a/sgusev/repos/k_means/data/gams_gurobi_gdp.binary_multiplication/no_mode/2026-02-19_02-18-07/original/model.gms
    Output /local/scratch/a/sgusev/repos/k_means/data/gams_gurobi_gdp.binary_multiplication/no_mode/2026-02-19_02-18-07/original/output.lst
    ScrDir /local/scratch/a/sgusev/repos/k_means/data/gams_gurobi_gdp.binary_multiplication/no_mode/2026-02-19_02-18-07/original/225a/
    SysDir /package/gams/52.2/
    CurDir /local/scratch/a/sgusev/repos/k_means/data/gams_gurobi_gdp.binary_multiplication/no_mode/2026-02-19_02-18-07/original/
    LogOption 3
    AppendLog 1
Licensee: David Bernal / SECQUOIA Research Group         G251008+0003Ac-GEN
          Purdue University, Davidson School of Chemical EngineeringDCE4838
          225a/gamslice.dat
          5a82958a-fbca-4a23
          node:66820903 mem:995 cores:48 ipport:39775 v:2                  
          Evaluation license: Not for commercial or production use
          The time-limited license stops working on : Jun 30, 2027
System information: 48 physical cores and 995 Gb physical memory detected
GAMS 52.2.0   Copyright (C) 1987-2025 GAMS Development. All rights reserved
--- Starting compilation
--- model.gms(317) 2 Mb
--- $echo File /local/scratch/a/sgusev/repos/k_means/data/gams_gurobi_gdp.binary_multiplication/no_mode/2026-02-19_02-18-07/original/gurobi.opt
--- model.gms(556) 2 Mb
--- Starting execution: elapsed 0:00:00.006
--- model.gms(326) 3 Mb
--- Generating MINLP model GAMS_MODEL
--- model.gms(330) 5 Mb
---   84 rows  89 columns  343 non-zeroes
---   704 nl-code  256 nl-non-zeroes
---   64 discrete-columns
--- Range statistics (absolute non-zero finite values)
--- RHS       [min, max] : [ 1.000E+00, 1.000E+00] - Zero values observed as well
--- Bound     [min, max] : [ 1.000E+00, 6.400E+01] - Zero values observed as well
--- Matrix    [min, max] : [ 1.410E-01, 1.177E+00] - Zero values observed as well
--- model.gms(330) 3 Mb
--- Executing GUROBI (Solvelink=5): elapsed 0:00:00.008
Reading parameter(s) from "/local/scratch/a/sgusev/repos/k_means/data/gams_gurobi_gdp.binary_multiplication/no_mode/2026-02-19_02-18-07/original/gurobi.opt"
>>  NonConvex 2
>>  Threads 1
>>  MIPGap 1e-06
>>  MIPGapAbs 1e-10
>>  FeasibilityTol 1e-06
>>  OptimalityTol 1e-06
>>  IntFeasTol 1e-05
Finished reading from "/local/scratch/a/sgusev/repos/k_means/data/gams_gurobi_gdp.binary_multiplication/no_mode/2026-02-19_02-18-07/original/gurobi.opt"

... GRB_LICENSE_FILE = /local/scratch/a/sgusev/gurobi.lic

    Gurobi           52.2.0 d8e408be Dec 8, 2025           LEG x86 64bit/Linux    

... GAMS/Gurobi Link license.
... GMO Q Extraction (ThreePass): 0.00s

    Gurobi Optimizer version 13.0.0 build v13.0.0rc1 (linux64 - "Oracle Linux Server 9.7")
    
    CPU model: AMD EPYC 7643 48-Core Processor, instruction set [SSE2|AVX|AVX2]
    Thread count: 48 physical cores, 96 logical processors, using up to 1 threads
    
    Non-default parameters:
    TimeLimit  300
    MIPGap  1e-06
    LogToConsole  0
    NonConvex  2
    Threads  1
    
    Optimize a model with 83 rows, 152 columns and 134 nonzeros (Min)
    Model fingerprint: 0x7b5e466b
    Model has 16 linear objective coefficients
    Model has 64 general nonlinear constraints (192 nonlinear terms)
    Variable types: 88 continuous, 64 integer (0 binary)
    Coefficient statistics:
      Matrix range     [1e+00, 1e+00]
      Objective range  [1e+00, 1e+00]
      Bounds range     [1e+00, 6e+01]
      RHS range        [1e+00, 1e+00]
      NLCon coe range  [2e-02, 1e+00]
    Presolve model has 64 nlconstr
    Added 320 variables to disaggregate expressions
    Presolve removed 64 rows and 0 columns
    Presolve time: 0.00s
    Presolved: 851 rows, 537 columns, 1990 nonzeros
    Presolved model has 128 bilinear constraint(s)
    
    Solving non-convex MIQCP to global optimality
    
    Variable types: 473 continuous, 64 integer (64 binary)
    Found heuristic solution: objective 9.7260101
    
    Root relaxation: objective 0.000000e+00, 185 iterations, 0.00 seconds (0.00 work units)
    
        Nodes    |    Current Node    |     Objective Bounds      |     Work
     Expl Unexpl |  Obj  Depth IntInf | Incumbent    BestBd   Gap | It/Node Time
    
         0     0    0.00000    0   32    9.72601    0.00000   100%     -    0s
    H    0     0                       9.3514461    0.00000   100%     -    0s
         0     0    0.00000    0  108    9.35145    0.00000   100%     -    0s
         0     0    0.00000    0  132    9.35145    0.00000   100%     -    0s
         0     0    0.00000    0  132    9.35145    0.00000   100%     -    0s
    H    0     0                       9.0115553    0.00000   100%     -    0s
    H    0     0                       8.3743148    0.00000   100%     -    0s
         0     0    0.00000    0  132    8.37431    0.00000   100%     -    0s
         0     0    0.00000    0  151    8.37431    0.00000   100%     -    0s
         0     0    0.00000    0  140    8.37431    0.00000   100%     -    0s
    H    0     0                       6.6906099    0.00000   100%     -    0s
         0     0    0.00000    0  140    6.69061    0.00000   100%     -    0s
         0     0    0.00000    0  147    6.69061    0.00000   100%     -    0s
         0     0    0.00000    0  144    6.69061    0.00000   100%     -    0s
         0     0    0.00000    0  144    6.69061    0.00000   100%     -    0s
         0     0    0.00000    0  144    6.69061    0.00000   100%     -    0s
    H    0     0                       6.6203499    0.00000   100%     -    0s
    H    0     0                       6.5164846    0.00000   100%     -    0s
    H    0     0                       6.3764513    0.00000   100%     -    0s
    H    0     0                       3.2373896    0.00000   100%     -    0s
         0     2    0.00000    0  144    3.23739    0.00000   100%     -    0s
    H   10    10                       3.1692821    0.00000   100%  16.5    0s
    H   11    11                       3.1683141    0.00000   100%  16.0    0s
    H   11    11                       3.1633077    0.00000   100%  16.0    0s
    H   11    11                       3.1598794    0.00000   100%  16.0    0s
    H   11    11                       3.1590971    0.00000   100%  16.0    0s
    H   12    12                       3.0639294    0.00000   100%  15.3    0s
    H   12    12                       3.0548730    0.00000   100%  15.3    0s
    H   12    12                       3.0548611    0.00000   100%  15.3    0s
    H   17    17                       2.9938301    0.00000   100%  18.2    0s
    H   17    17                       2.9894165    0.00000   100%  18.2    0s
    H   17    17                       2.9892072    0.00000   100%  18.2    0s
    H   17    17                       2.9890000    0.00000   100%  18.2    0s
    H   24    24                       2.7646193    0.00000   100%  16.7    0s
    H   24    24                       2.5550313    0.00000   100%  16.7    0s
    H   35    26                       2.5395130    0.00000   100%  23.5    0s
    H   35    26                       2.5377828    0.00000   100%  23.5    0s
    H   35    26                       2.5360855    0.00000   100%  23.5    0s
    H   35    26                       2.5359883    0.00000   100%  23.5    0s
    H   55    40                       2.4909983    0.00000   100%  22.8    0s
    H  571   350                       2.4876392    0.00000   100%  18.2    0s
    H  592   349                       2.4171417    0.00000   100%  18.1    0s
    H  826   456                       2.3114914    0.00000   100%  22.7    1s
    H  834   442                       2.2886036    0.00000   100%  22.6    1s
    H  864   436                       2.2773308    0.00000   100%  22.5    1s
    H  864   418                       2.2222802    0.00000   100%  22.5    1s
    H  868   399                       2.1222009    0.00000   100%  22.4    1s
    H  868   383                       2.1205267    0.00000   100%  22.4    1s
    H  868   367                       2.1130107    0.00000   100%  22.4    1s
    H  868   352                       2.1122846    0.00000   100%  22.4    1s
    H  868   338                       2.1122783    0.00000   100%  22.4    1s
    H  890   328                       1.9209071    0.00000   100%  22.1    1s
    H  906   312                       1.8472162    0.00000   100%  22.1    1s
    H  962   299                       1.6805053    0.00000   100%  22.1    1s
    H 1571   454                       1.6803232    0.00000   100%  22.1    2s
    H 1571   454                       1.6802962    0.00000   100%  22.1    2s
    H 1571   454                       1.6802817    0.00000   100%  22.1    2s
    H 1615   468                       1.6769880    0.00000   100%  22.0    2s
    H 1615   468                       1.6769836    0.00000   100%  22.0    2s
    H 1615   468                       1.6769802    0.00000   100%  22.0    2s
    H 1634   470                       1.6032318    0.00000   100%  21.8    2s
    H 2634   829                       1.6032246    0.03617  97.7%  22.1    3s
    H 2634   829                       1.6032235    0.03617  97.7%  22.1    3s
      3888  1168    0.54673   34  136    1.60322    0.16382  89.8%  21.8    5s
    H 3985  1222                       1.5948140    0.16394  89.7%  21.6    5s
    H 5025  1470                       1.5680691    0.25834  83.5%  21.0    6s
    H 7607  2209                       1.5666996    0.42153  73.1%  19.8    8s
    H 9117  2591                       1.5527340    0.49286  68.3%  19.3    9s
      9768  2772    0.95321   16  136    1.55273    0.52417  66.2%  19.0   10s
    H10432  2939                       1.5506326    0.54669  64.7%  19.0   11s
    H10432  2939                       1.5503288    0.54669  64.7%  19.0   11s
    H11441  3067                       1.5503263    0.59873  61.4%  18.9   12s
    H12615  3194                       1.5250540    0.63410  58.4%  18.8   13s
    H13882  3376                       1.5106738    0.67618  55.2%  18.7   14s
     13906  3379    0.84114   24  134    1.51067    0.67740  55.2%  18.7   15s
    H19041  4027                       1.5106736    0.78590  48.0%  18.0   19s
    H19390  4027                       1.4976583    0.78990  47.3%  17.9   20s
    H19390  4027                       1.4976539    0.78990  47.3%  17.9   20s
    H20393  4188                       1.4969314    0.80772  46.0%  17.8   21s
    H20393  4188                       1.4969303    0.80772  46.0%  17.8   21s
     24903  4753 infeasible   52         1.49693    0.87298  41.7%  17.3   25s
     30937  5374     cutoff   43         1.49693    0.94007  37.2%  16.7   30s
     37098  5728    1.35786   39  108    1.49693    1.00145  33.1%  16.3   35s
     44223  6087     cutoff   44         1.49693    1.05133  29.8%  15.7   40s
     51364  6053    1.46370   48   89    1.49693    1.10118  26.4%  15.3   45s
     58509  5860    1.24865   30  130    1.49693    1.14357  23.6%  15.0   50s
     65057  5428    1.29028   41   97    1.49693    1.18127  21.1%  14.8   55s
     72164  4789    1.23084   34  126    1.49693    1.22513  18.2%  14.6   60s
     78693  3858    1.48396   45   80    1.49693    1.27261  15.0%  14.5   65s
     84636  2653    1.32990   44  112    1.49693    1.32990  11.2%  14.5   70s
     91143  1492     cutoff   49         1.49693    1.41528  5.45%  14.3   75s
     98146  1325     cutoff   65         1.49693    1.46213  2.32%  14.0   80s
     105686  1153    1.48764   60   48    1.49693    1.48028  1.11%  13.6   85s
    *111042   899             101       1.4969240    1.49270  0.28%  13.4   88s
     112640   939     cutoff   77         1.49692    1.49420  0.18%  13.2   90s
     120212  1801     cutoff   76         1.49692    1.49556  0.09%  12.8   95s
     128735  2756    1.49678   82   44    1.49692    1.49634  0.04%  12.3  100s
     137168  4127     cutoff   89         1.49692    1.49644  0.03%  11.8  105s
     145874  5083    1.49668   82   16    1.49692    1.49648  0.03%  11.5  110s
     154829  5932    1.49657   89   28    1.49692    1.49651  0.03%  11.1  115s
     164142  6599     cutoff   90         1.49692    1.49653  0.03%  10.8  120s
     173429  7026    1.49656   84   32    1.49692    1.49655  0.02%  10.4  125s
     182595  7218     cutoff   83         1.49692    1.49657  0.02%  10.1  130s
     191570  7395    1.49683   84   18    1.49692    1.49658  0.02%   9.9  135s
     200545  7388    1.49672   81   28    1.49692    1.49660  0.02%   9.6  140s
     209363  7576    1.49673   77   16    1.49692    1.49661  0.02%   9.4  145s
     218488  7469     cutoff   86         1.49692    1.49663  0.02%   9.1  150s
     226990  7603    1.49675   93   35    1.49692    1.49665  0.02%   8.9  155s
     236025  7616     cutoff   84         1.49692    1.49668  0.02%   8.8  160s
     245050  8065     cutoff   82         1.49692    1.49670  0.02%   8.6  165s
     254468  8557    1.49687   96   19    1.49692    1.49671  0.01%   8.5  170s
     264247  8904    1.49674   87   33    1.49692    1.49673  0.01%   8.4  175s
     274074  8965    1.49677   92   35    1.49692    1.49673  0.01%   8.3  180s
     283783  8884    1.49684   86   19    1.49692    1.49674  0.01%   8.2  185s
     293242  8681     cutoff   95         1.49692    1.49675  0.01%   8.1  190s
     302555  8420    1.49681   94   33    1.49692    1.49676  0.01%   8.0  195s
     311935  8016    1.49692   92   19    1.49692    1.49677  0.01%   7.9  200s
     320571  7730     cutoff   93         1.49692    1.49678  0.01%   7.8  205s
     329549  7290     cutoff   91         1.49692    1.49679  0.01%   7.7  210s
     338414  6775    1.49690   82   48    1.49692    1.49680  0.01%   7.6  215s
     347569  6296    1.49685   86   48    1.49692    1.49681  0.01%   7.6  220s
     356503  5794    1.49685   89   21    1.49692    1.49683  0.01%   7.5  225s
     365458  5339    1.49687   84   28    1.49692    1.49684  0.01%   7.4  230s
     374555  4650     cutoff   85         1.49692    1.49686  0.00%   7.3  235s
     383404  3487    1.49690   82   76    1.49692    1.49688  0.00%   7.3  240s
     391851   716     cutoff   90         1.49692    1.49691  0.00%   7.2  245s
    
    Cutting planes:
      Gomory: 4
      Implied bound: 12
      Projected implied bound: 1
      MIR: 3
      Flow cover: 48
      RLT: 8
    
    Explored 392573 nodes (2820891 simplex iterations) in 245.38 seconds (173.64 work units)
    Thread count was 1 (of 96 available processors)
    
    Solution count 10: 1.49692 1.49693 1.49693 ... 1.55033
    
    Optimal solution found (tolerance 1.00e-06)
    Warning: max constraint violation (1.6846e-06) exceeds tolerance
    Warning: max general constraint violation (1.6846e-06) exceeds tolerance
    Best objective 1.496924015756e+00, best bound 1.496922522483e+00, gap 0.0001%
    
    User-callback calls 392645, time in user-callback 0.02 sec

... Solving fixed model...

    Gurobi Optimizer version 13.0.0 build v13.0.0rc1 (linux64 - "Oracle Linux Server 9.7")
    
    CPU model: AMD EPYC 7643 48-Core Processor, instruction set [SSE2|AVX|AVX2]
    Thread count: 48 physical cores, 96 logical processors, using up to 1 threads
    
    Non-default parameters:
    TimeLimit  300
    MIPGap  1e-06
    LogToConsole  0
    NonConvex  2
    Threads  1
    
    Optimize a model with 83 rows, 152 columns and 134 nonzeros (Min)
    Model fingerprint: 0xb5b4b851
    Model has 16 linear objective coefficients
    Coefficient statistics:
      Matrix range     [1e+00, 1e+00]
      Objective range  [1e+00, 1e+00]
      Bounds range     [4e-03, 1e+00]
      RHS range        [1e+00, 1e+00]
    Presolve removed 83 rows and 152 columns
    Presolve time: 0.00s
    Presolve: All rows and columns removed
    Iteration    Objective       Primal Inf.    Dual Inf.      Time
           0    1.4969240e+00   0.000000e+00   0.000000e+00      0s
    
    Solved in 0 iterations and 0.00 seconds (0.00 work units)
    Optimal objective  1.496924016e+00
    
    User-callback calls 0, time in user-callback 0.00 sec

--- Reading solution for model GAMS_MODEL
***
*** Solver did not provide marginals for model GAMS_MODEL
***
--- Executing after solve: elapsed 0:04:05.416
--- model.gms(333) 3 Mb
--- model.gms(556) 5 Mb
--- Putfile results /local/scratch/a/sgusev/repos/k_means/data/gams_gurobi_gdp.binary_multiplication/no_mode/2026-02-19_02-18-07/original/results.dat
--- Putfile statresults /local/scratch/a/sgusev/repos/k_means/data/gams_gurobi_gdp.binary_multiplication/no_mode/2026-02-19_02-18-07/original/resultsstat.dat
*** Status: Normal completion
--- Job model.gms Stop 02/19/26 02:22:12 elapsed 0:04:05.416
Original problem solved. Time taken: 245.89777517318726 seconds
Original objective value: 1.496924015755567
