Solving original (integer) problem with strategy gdp.hull...
--- Job model.gms Start 02/14/26 17:16:55 52.2.0 d8e408be LEX-LEG x86 64bit/Linux
--- Applying:
    /package/gams/52.2/gmsprmun.txt
--- GAMS Parameters defined
    Input /local/scratch/a/sgusev/repos/k_means/data/gams_gurobi_gdp.hull/no_mode/2026-02-14_17-16-55/original/model.gms
    Output /local/scratch/a/sgusev/repos/k_means/data/gams_gurobi_gdp.hull/no_mode/2026-02-14_17-16-55/original/output.lst
    ScrDir /local/scratch/a/sgusev/repos/k_means/data/gams_gurobi_gdp.hull/no_mode/2026-02-14_17-16-55/original/225a/
    SysDir /package/gams/52.2/
    CurDir /local/scratch/a/sgusev/repos/k_means/data/gams_gurobi_gdp.hull/no_mode/2026-02-14_17-16-55/original/
    LogOption 3
    AppendLog 1
Licensee: David Bernal / SECQUOIA Research Group         G251008+0003Ac-GEN
          Purdue University, Davidson School of Chemical EngineeringDCE4838
          225a/gamslice.dat
          5a82958a-fbca-4a23
          node:66820903 mem:995 cores:48 ipport:57991 v:2                  
          Evaluation license: Not for commercial or production use
          The time-limited license stops working on : Jun 30, 2027
System information: 48 physical cores and 995 Gb physical memory detected
GAMS 52.2.0   Copyright (C) 1987-2025 GAMS Development. All rights reserved
--- Starting compilation
--- model.gms(2079) 2 Mb
--- $echo File /local/scratch/a/sgusev/repos/k_means/data/gams_gurobi_gdp.hull/no_mode/2026-02-14_17-16-55/original/gurobi.opt
--- model.gms(3091) 2 Mb
--- Starting execution: elapsed 0:00:00.013
--- model.gms(2088) 3 Mb
--- Generating MINLP model GAMS_MODEL
--- model.gms(2092) 5 Mb
---   625 rows  321 columns  1,529 non-zeroes
---   1,550 nl-code  200 nl-non-zeroes
---   50 discrete-columns
--- Range statistics (absolute non-zero finite values)
--- RHS       [min, max] : [ 1.296E-06, 1.000E+00] - Zero values observed as well
--- Bound     [min, max] : [ 1.000E+00, 4.000E+01] - Zero values observed as well
--- Matrix    [min, max] : [ 1.296E-02, 4.000E+01]
--- model.gms(2092) 3 Mb
--- Executing GUROBI (Solvelink=5): elapsed 0:00:00.017
Reading parameter(s) from "/local/scratch/a/sgusev/repos/k_means/data/gams_gurobi_gdp.hull/no_mode/2026-02-14_17-16-55/original/gurobi.opt"
>>  NonConvex 2
>>  Threads 1
>>  MIPGap 1e-06
>>  MIPGapAbs 1e-10
>>  FeasibilityTol 1e-06
>>  OptimalityTol 1e-06
>>  IntFeasTol 1e-05
Finished reading from "/local/scratch/a/sgusev/repos/k_means/data/gams_gurobi_gdp.hull/no_mode/2026-02-14_17-16-55/original/gurobi.opt"

... GRB_LICENSE_FILE = /local/scratch/a/sgusev/gurobi.lic

    Gurobi           52.2.0 d8e408be Dec 8, 2025           LEG x86 64bit/Linux    

... GAMS/Gurobi Link license.
... GMO Q Extraction (ThreePass): 0.00s

    Gurobi Optimizer version 13.0.0 build v13.0.0rc1 (linux64 - "Oracle Linux Server 9.7")
    
    CPU model: AMD EPYC 7643 48-Core Processor, instruction set [SSE2|AVX|AVX2]
    Thread count: 48 physical cores, 96 logical processors, using up to 1 threads
    
    Non-default parameters:
    TimeLimit  300
    MIPGap  1e-06
    LogToConsole  0
    NonConvex  2
    Threads  1
    
    Optimize a model with 624 rows, 370 columns and 1368 nonzeros (Min)
    Model fingerprint: 0x1bb40606
    Model has 10 linear objective coefficients
    Model has 50 general nonlinear constraints (300 nonlinear terms)
    Variable types: 320 continuous, 50 integer (0 binary)
    Coefficient statistics:
      Matrix range     [1e+00, 4e+01]
      Objective range  [1e+00, 1e+00]
      Bounds range     [1e+00, 4e+01]
      RHS range        [1e+00, 1e+00]
      NLCon coe range  [1e-06, 1e+00]
    Presolve model has 50 nlconstr
    Added 650 variables to disaggregate expressions
    Presolve removed 150 rows and 110 columns
    Presolve time: 0.00s
    Presolved: 1974 rows, 911 columns, 5058 nonzeros
    Presolved model has 300 bilinear constraint(s)
    
    Solving non-convex MIQCP to global optimality
    
    Variable types: 861 continuous, 50 integer (50 binary)
    Found heuristic solution: objective 5.7099075
    
    Root relaxation: objective 0.000000e+00, 280 iterations, 0.00 seconds (0.00 work units)
    
        Nodes    |    Current Node    |     Objective Bounds      |     Work
     Expl Unexpl |  Obj  Depth IntInf | Incumbent    BestBd   Gap | It/Node Time
    
         0     0    0.00000    0  150    5.70991    0.00000   100%     -    0s
         0     0    0.00000    0  150    5.70991    0.00000   100%     -    0s
         0     0    0.00000    0  108    5.70991    0.00000   100%     -    0s
         0     0    0.00000    0   84    5.70991    0.00000   100%     -    0s
         0     0    0.00000    0   84    5.70991    0.00000   100%     -    0s
         0     0    0.00000    0   57    5.70991    0.00000   100%     -    0s
         0     0    0.00000    0   57    5.70991    0.00000   100%     -    0s
         0     0    0.00000    0  109    5.70991    0.00000   100%     -    0s
         0     0    0.00000    0  109    5.70991    0.00000   100%     -    0s
         0     0    0.00000    0   45    5.70991    0.00000   100%     -    0s
         0     0    0.00000    0   45    5.70991    0.00000   100%     -    0s
    H    0     0                       2.3136086    0.00000   100%     -    0s
    H    0     0                       1.5165205    0.00000   100%     -    0s
         0     2    0.00000    0   45    1.51652    0.00000   100%     -    0s
    H    1     1                       1.5165205    0.00000   100%   0.0    0s
    H    4     4                       1.4966382    0.00000   100%   6.2    0s
    H    6     6                       1.3231807    0.00000   100%   8.3    0s
    H   94    68                       1.2583548    0.00000   100%  11.0    0s
    H  152    99                       0.8467026    0.00000   100%  13.0    0s
    H  270   117                       0.4080923    0.00000   100%  14.7    0s
    H 3196   326                       0.4080923    0.00000   100%  17.0    4s
      3746   395     cutoff   21         0.40809    0.01065  97.4%  16.5    5s
     11687   987    0.39616   45    9    0.40809    0.30481  25.3%   9.5   10s
     21305   496    0.40590   50   16    0.40809    0.39350  3.58%   6.5   15s
    *23077   366              86       0.4080897    0.40451  0.88%   6.1   15s
    *23078   353              86       0.4080882    0.40451  0.88%   6.1   15s
    *23540   289              75       0.4080868    0.40671  0.34%   6.0   16s
    *24868   211              82       0.4080859    0.40791  0.04%   5.7   16s
    
    Cutting planes:
      Learned: 38
      Gomory: 2
      Implied bound: 13
      MIR: 4
      Flow cover: 16
      RLT: 21
      Relax-and-lift: 3
    
    Explored 26006 nodes (144604 simplex iterations) in 17.45 seconds (12.07 work units)
    Thread count was 1 (of 96 available processors)
    
    Solution count 10: 0.408086 0.408086 0.408087 ... 1.32318
    
    Optimal solution found (tolerance 1.00e-06)
    Warning: max constraint violation (1.8560e-06) exceeds tolerance
    Warning: max general constraint violation (1.8560e-06) exceeds tolerance
    Best objective 4.080859424374e-01, best bound 4.080857749147e-01, gap 0.0000%
    
    User-callback calls 26024, time in user-callback 0.00 sec

... Solving fixed model...

    Gurobi Optimizer version 13.0.0 build v13.0.0rc1 (linux64 - "Oracle Linux Server 9.7")
    
    CPU model: AMD EPYC 7643 48-Core Processor, instruction set [SSE2|AVX|AVX2]
    Thread count: 48 physical cores, 96 logical processors, using up to 1 threads
    
    Non-default parameters:
    TimeLimit  300
    MIPGap  1e-06
    LogToConsole  0
    NonConvex  2
    Threads  1
    
    Optimize a model with 624 rows, 370 columns and 1368 nonzeros (Min)
    Model fingerprint: 0x4eec1ac3
    Model has 10 linear objective coefficients
    Coefficient statistics:
      Matrix range     [1e+00, 4e+01]
      Objective range  [1e+00, 1e+00]
      Bounds range     [1e-09, 4e+01]
      RHS range        [1e+00, 1e+00]
    Presolve removed 624 rows and 370 columns
    Presolve time: 0.00s
    Presolve: All rows and columns removed
    Iteration    Objective       Primal Inf.    Dual Inf.      Time
           0    4.0808594e-01   0.000000e+00   0.000000e+00      0s
    
    Solved in 0 iterations and 0.00 seconds (0.00 work units)
    Optimal objective  4.080859430e-01
    
    User-callback calls 0, time in user-callback 0.00 sec

--- Reading solution for model GAMS_MODEL
***
*** Solver did not provide marginals for model GAMS_MODEL
***
--- Executing after solve: elapsed 0:00:17.497
--- model.gms(2095) 3 Mb
--- model.gms(3091) 5 Mb
--- Putfile results /local/scratch/a/sgusev/repos/k_means/data/gams_gurobi_gdp.hull/no_mode/2026-02-14_17-16-55/original/results.dat
--- Putfile statresults /local/scratch/a/sgusev/repos/k_means/data/gams_gurobi_gdp.hull/no_mode/2026-02-14_17-16-55/original/resultsstat.dat
*** Status: Normal completion
--- Job model.gms Stop 02/14/26 17:17:13 elapsed 0:00:17.499
Original problem solved. Time taken: 18.055347204208374 seconds
Original objective value: 0.408085942967634
