Solving original (integer) problem with strategy gdp.hull...
--- Job model.gms Start 02/14/26 17:29:49 52.2.0 d8e408be LEX-LEG x86 64bit/Linux
--- Applying:
    /package/gams/52.2/gmsprmun.txt
--- GAMS Parameters defined
    Input /local/scratch/a/sgusev/repos/k_means/data/gams_gurobi_gdp.hull/no_mode/2026-02-14_17-29-48/original/model.gms
    Output /local/scratch/a/sgusev/repos/k_means/data/gams_gurobi_gdp.hull/no_mode/2026-02-14_17-29-48/original/output.lst
    ScrDir /local/scratch/a/sgusev/repos/k_means/data/gams_gurobi_gdp.hull/no_mode/2026-02-14_17-29-48/original/225a/
    SysDir /package/gams/52.2/
    CurDir /local/scratch/a/sgusev/repos/k_means/data/gams_gurobi_gdp.hull/no_mode/2026-02-14_17-29-48/original/
    LogOption 3
    AppendLog 1
Licensee: David Bernal / SECQUOIA Research Group         G251008+0003Ac-GEN
          Purdue University, Davidson School of Chemical EngineeringDCE4838
          225a/gamslice.dat
          5a82958a-fbca-4a23
          node:66820903 mem:995 cores:48 ipport:34097 v:2                  
          Evaluation license: Not for commercial or production use
          The time-limited license stops working on : Jun 30, 2027
System information: 48 physical cores and 995 Gb physical memory detected
GAMS 52.2.0   Copyright (C) 1987-2025 GAMS Development. All rights reserved
--- Starting compilation
--- model.gms(1652) 2 Mb
--- $echo File /local/scratch/a/sgusev/repos/k_means/data/gams_gurobi_gdp.hull/no_mode/2026-02-14_17-29-48/original/gurobi.opt
--- model.gms(2469) 2 Mb
--- Starting execution: elapsed 0:00:00.011
--- model.gms(1661) 3 Mb
--- Generating MINLP model GAMS_MODEL
--- model.gms(1665) 5 Mb
---   497 rows  254 columns  1,201 non-zeroes
---   1,209 nl-code  156 nl-non-zeroes
---   39 discrete-columns
--- Range statistics (absolute non-zero finite values)
--- RHS       [min, max] : [ 8.117E-06, 1.000E+00] - Zero values observed as well
--- Bound     [min, max] : [ 1.000E+00, 5.200E+01] - Zero values observed as well
--- Matrix    [min, max] : [ 8.117E-02, 5.200E+01]
--- model.gms(1665) 3 Mb
--- Executing GUROBI (Solvelink=5): elapsed 0:00:00.015
Reading parameter(s) from "/local/scratch/a/sgusev/repos/k_means/data/gams_gurobi_gdp.hull/no_mode/2026-02-14_17-29-48/original/gurobi.opt"
>>  NonConvex 2
>>  Threads 1
>>  MIPGap 1e-06
>>  MIPGapAbs 1e-10
>>  FeasibilityTol 1e-06
>>  OptimalityTol 1e-06
>>  IntFeasTol 1e-05
Finished reading from "/local/scratch/a/sgusev/repos/k_means/data/gams_gurobi_gdp.hull/no_mode/2026-02-14_17-29-48/original/gurobi.opt"

... GRB_LICENSE_FILE = /local/scratch/a/sgusev/gurobi.lic

    Gurobi           52.2.0 d8e408be Dec 8, 2025           LEG x86 64bit/Linux    

... GAMS/Gurobi Link license.
... GMO Q Extraction (ThreePass): 0.00s

    Gurobi Optimizer version 13.0.0 build v13.0.0rc1 (linux64 - "Oracle Linux Server 9.7")
    
    CPU model: AMD EPYC 7643 48-Core Processor, instruction set [SSE2|AVX|AVX2]
    Thread count: 48 physical cores, 96 logical processors, using up to 1 threads
    
    Non-default parameters:
    TimeLimit  300
    MIPGap  1e-06
    LogToConsole  0
    NonConvex  2
    Threads  1
    
    Optimize a model with 496 rows, 292 columns and 1070 nonzeros (Min)
    Model fingerprint: 0x1c8ddf4a
    Model has 13 linear objective coefficients
    Model has 39 general nonlinear constraints (234 nonlinear terms)
    Variable types: 253 continuous, 39 integer (0 binary)
    Coefficient statistics:
      Matrix range     [1e+00, 5e+01]
      Objective range  [1e+00, 1e+00]
      Bounds range     [1e+00, 5e+01]
      RHS range        [1e+00, 1e+00]
      NLCon coe range  [8e-06, 1e+00]
    Presolve model has 39 nlconstr
    Added 507 variables to disaggregate expressions
    Presolve removed 117 rows and 91 columns
    Presolve time: 0.00s
    Presolved: 1549 rows, 709 columns, 3943 nonzeros
    Presolved model has 234 bilinear constraint(s)
    
    Solving non-convex MIQCP to global optimality
    
    Variable types: 670 continuous, 39 integer (39 binary)
    Found heuristic solution: objective 8.8773359
    
    Root relaxation: objective 0.000000e+00, 237 iterations, 0.00 seconds (0.00 work units)
    
        Nodes    |    Current Node    |     Objective Bounds      |     Work
     Expl Unexpl |  Obj  Depth IntInf | Incumbent    BestBd   Gap | It/Node Time
    
         0     0    0.00000    0  117    8.87734    0.00000   100%     -    0s
         0     0    0.00000    0  117    8.87734    0.00000   100%     -    0s
         0     0    0.00000    0  158    8.87734    0.00000   100%     -    0s
         0     0    0.00000    0  121    8.87734    0.00000   100%     -    0s
         0     0    0.00000    0  121    8.87734    0.00000   100%     -    0s
         0     0    0.00000    0   70    8.87734    0.00000   100%     -    0s
         0     0    0.00000    0   83    8.87734    0.00000   100%     -    0s
         0     0    0.00000    0   74    8.87734    0.00000   100%     -    0s
         0     0    0.00000    0   74    8.87734    0.00000   100%     -    0s
         0     0    0.00000    0   52    8.87734    0.00000   100%     -    0s
         0     0    0.00000    0   52    8.87734    0.00000   100%     -    0s
    H    0     0                       3.3474801    0.00000   100%     -    0s
    H    0     0                       3.3346342    0.00000   100%     -    0s
    H    0     0                       2.8114669    0.00000   100%     -    0s
         0     2    0.00000    0   52    2.81147    0.00000   100%     -    0s
    H    9     9                       2.1439591    0.00000   100%  23.9    0s
    H  258    72                       1.4632239    0.00000   100%  17.5    0s
    * 2441   198              68       1.4632191    1.38305  5.48%   9.6    2s
    * 2442   191              68       1.4632156    1.38305  5.48%   9.6    2s
    * 4901   279             123       1.4632123    1.46238  0.06%   7.2    4s
    * 4903   264             124       1.4632102    1.46238  0.06%   7.2    4s
      5807   291    1.46238   87   16    1.46321    1.46238  0.06%   7.5    5s
    
    Cutting planes:
      Learned: 32
    
    Explored 14061 nodes (76362 simplex iterations) in 9.36 seconds (6.43 work units)
    Thread count was 1 (of 96 available processors)
    
    Solution count 10: 1.46321 1.46321 1.46322 ... 8.87734
    
    Optimal solution found (tolerance 1.00e-06)
    Warning: max constraint violation (1.5051e-06) exceeds tolerance
    Warning: max general constraint violation (1.5051e-06) exceeds tolerance
    Best objective 1.463210232125e+00, best bound 1.463210232125e+00, gap 0.0000%
    
    User-callback calls 14072, time in user-callback 0.00 sec

... Solving fixed model...

    Gurobi Optimizer version 13.0.0 build v13.0.0rc1 (linux64 - "Oracle Linux Server 9.7")
    
    CPU model: AMD EPYC 7643 48-Core Processor, instruction set [SSE2|AVX|AVX2]
    Thread count: 48 physical cores, 96 logical processors, using up to 1 threads
    
    Non-default parameters:
    TimeLimit  300
    MIPGap  1e-06
    LogToConsole  0
    NonConvex  2
    Threads  1
    
    Optimize a model with 496 rows, 292 columns and 1070 nonzeros (Min)
    Model fingerprint: 0x4f2511be
    Model has 13 linear objective coefficients
    Coefficient statistics:
      Matrix range     [1e+00, 5e+01]
      Objective range  [1e+00, 1e+00]
      Bounds range     [2e-02, 5e+01]
      RHS range        [1e+00, 1e+00]
    Presolve removed 496 rows and 292 columns
    Presolve time: 0.00s
    Presolve: All rows and columns removed
    Iteration    Objective       Primal Inf.    Dual Inf.      Time
           0    1.4632102e+00   0.000000e+00   0.000000e+00      0s
    
    Solved in 0 iterations and 0.00 seconds (0.00 work units)
    Optimal objective  1.463210232e+00
    
    User-callback calls 0, time in user-callback 0.00 sec

--- Reading solution for model GAMS_MODEL
***
*** Solver did not provide marginals for model GAMS_MODEL
***
--- Executing after solve: elapsed 0:00:09.403
--- model.gms(1668) 3 Mb
--- model.gms(2469) 5 Mb
--- Putfile results /local/scratch/a/sgusev/repos/k_means/data/gams_gurobi_gdp.hull/no_mode/2026-02-14_17-29-48/original/results.dat
--- Putfile statresults /local/scratch/a/sgusev/repos/k_means/data/gams_gurobi_gdp.hull/no_mode/2026-02-14_17-29-48/original/resultsstat.dat
*** Status: Normal completion
--- Job model.gms Stop 02/14/26 17:29:58 elapsed 0:00:09.405
Original problem solved. Time taken: 9.965016603469849 seconds
Original objective value: 1.463210232126674
