Solving original (integer) problem with strategy gdp.binary_multiplication...
--- Job model.gms Start 02/18/26 23:24:09 52.2.0 d8e408be LEX-LEG x86 64bit/Linux
--- Applying:
    /package/gams/52.2/gmsprmun.txt
--- GAMS Parameters defined
    Input /local/scratch/a/sgusev/repos/k_means/data/gams_gurobi_gdp.binary_multiplication/no_mode/2026-02-18_23-24-08/original/model.gms
    Output /local/scratch/a/sgusev/repos/k_means/data/gams_gurobi_gdp.binary_multiplication/no_mode/2026-02-18_23-24-08/original/output.lst
    ScrDir /local/scratch/a/sgusev/repos/k_means/data/gams_gurobi_gdp.binary_multiplication/no_mode/2026-02-18_23-24-08/original/225a/
    SysDir /package/gams/52.2/
    CurDir /local/scratch/a/sgusev/repos/k_means/data/gams_gurobi_gdp.binary_multiplication/no_mode/2026-02-18_23-24-08/original/
    LogOption 3
    AppendLog 1
Licensee: David Bernal / SECQUOIA Research Group         G251008+0003Ac-GEN
          Purdue University, Davidson School of Chemical EngineeringDCE4838
          225a/gamslice.dat
          5a82958a-fbca-4a23
          node:66820903 mem:995 cores:48 ipport:51203 v:2                  
          Evaluation license: Not for commercial or production use
          The time-limited license stops working on : Jun 30, 2027
System information: 48 physical cores and 995 Gb physical memory detected
GAMS 52.2.0   Copyright (C) 1987-2025 GAMS Development. All rights reserved
--- Starting compilation
--- model.gms(253) 2 Mb
--- $echo File /local/scratch/a/sgusev/repos/k_means/data/gams_gurobi_gdp.binary_multiplication/no_mode/2026-02-18_23-24-08/original/gurobi.opt
--- model.gms(452) 2 Mb
--- Starting execution: elapsed 0:00:00.006
--- model.gms(262) 3 Mb
--- Generating MINLP model GAMS_MODEL
--- model.gms(266) 5 Mb
---   64 rows  69 columns  259 non-zeroes
---   528 nl-code  192 nl-non-zeroes
---   48 discrete-columns
--- Range statistics (absolute non-zero finite values)
--- RHS       [min, max] : [ 1.000E+00, 1.000E+00] - Zero values observed as well
--- Bound     [min, max] : [ 1.000E+00, 4.800E+01] - Zero values observed as well
--- Matrix    [min, max] : [ 6.188E-02, 1.190E+00] - Zero values observed as well
--- model.gms(266) 3 Mb
--- Executing GUROBI (Solvelink=5): elapsed 0:00:00.009
Reading parameter(s) from "/local/scratch/a/sgusev/repos/k_means/data/gams_gurobi_gdp.binary_multiplication/no_mode/2026-02-18_23-24-08/original/gurobi.opt"
>>  NonConvex 2
>>  Threads 1
>>  MIPGap 1e-06
>>  MIPGapAbs 1e-10
>>  FeasibilityTol 1e-06
>>  OptimalityTol 1e-06
>>  IntFeasTol 1e-05
Finished reading from "/local/scratch/a/sgusev/repos/k_means/data/gams_gurobi_gdp.binary_multiplication/no_mode/2026-02-18_23-24-08/original/gurobi.opt"

... GRB_LICENSE_FILE = /local/scratch/a/sgusev/gurobi.lic

    Gurobi           52.2.0 d8e408be Dec 8, 2025           LEG x86 64bit/Linux    

... GAMS/Gurobi Link license.
... GMO Q Extraction (ThreePass): 0.00s

    Gurobi Optimizer version 13.0.0 build v13.0.0rc1 (linux64 - "Oracle Linux Server 9.7")
    
    CPU model: AMD EPYC 7643 48-Core Processor, instruction set [SSE2|AVX|AVX2]
    Thread count: 48 physical cores, 96 logical processors, using up to 1 threads
    
    Non-default parameters:
    TimeLimit  300
    MIPGap  1e-06
    LogToConsole  0
    NonConvex  2
    Threads  1
    
    Optimize a model with 63 rows, 116 columns and 102 nonzeros (Min)
    Model fingerprint: 0x71fe7ae8
    Model has 12 linear objective coefficients
    Model has 48 general nonlinear constraints (144 nonlinear terms)
    Variable types: 68 continuous, 48 integer (0 binary)
    Coefficient statistics:
      Matrix range     [1e+00, 1e+00]
      Objective range  [1e+00, 1e+00]
      Bounds range     [1e+00, 5e+01]
      RHS range        [1e+00, 1e+00]
      NLCon coe range  [3e-02, 1e+00]
    Presolve model has 48 nlconstr
    Added 240 variables to disaggregate expressions
    Presolve removed 48 rows and 0 columns
    Presolve time: 0.00s
    Presolved: 639 rows, 405 columns, 1494 nonzeros
    Presolved model has 96 bilinear constraint(s)
    
    Solving non-convex MIQCP to global optimality
    
    Variable types: 357 continuous, 48 integer (48 binary)
    Found heuristic solution: objective 6.9885710
    
    Root relaxation: objective 0.000000e+00, 32 iterations, 0.00 seconds (0.00 work units)
    
        Nodes    |    Current Node    |     Objective Bounds      |     Work
     Expl Unexpl |  Obj  Depth IntInf | Incumbent    BestBd   Gap | It/Node Time
    
         0     0    0.00000    0   96    6.98857    0.00000   100%     -    0s
    H    0     0                       6.8213369    0.00000   100%     -    0s
         0     0    0.00000    0  117    6.82134    0.00000   100%     -    0s
         0     0    0.00000    0  119    6.82134    0.00000   100%     -    0s
         0     0    0.00000    0  106    6.82134    0.00000   100%     -    0s
         0     0    0.00000    0  110    6.82134    0.00000   100%     -    0s
         0     0    0.00000    0  106    6.82134    0.00000   100%     -    0s
         0     0    0.00000    0  102    6.82134    0.00000   100%     -    0s
         0     0    0.00000    0  102    6.82134    0.00000   100%     -    0s
    H    0     0                       5.4805811    0.00000   100%     -    0s
    H    0     0                       5.2058308    0.00000   100%     -    0s
    H    0     0                       5.1868547    0.00000   100%     -    0s
    H    0     0                       5.1867565    0.00000   100%     -    0s
    H    0     0                       4.5122588    0.00000   100%     -    0s
    H    0     0                       2.9132726    0.00000   100%     -    0s
         0     2    0.00000    0  102    2.91327    0.00000   100%     -    0s
    H    4     4                       2.6728709    0.00000   100%  12.0    0s
    H    4     4                       2.3878793    0.00000   100%  12.0    0s
    H    4     4                       2.3771437    0.00000   100%  12.0    0s
    H    5     5                       2.1773374    0.00000   100%  10.0    0s
    H    7     7                       2.1773374    0.00000   100%  12.1    0s
    H    8     8                       2.1162179    0.00000   100%  12.5    0s
    H   11    11                       1.8923953    0.00000   100%  17.4    0s
    H   11    11                       1.8747526    0.00000   100%  17.4    0s
    H   11    11                       1.8741347    0.00000   100%  17.4    0s
    H   11    11                       1.8736707    0.00000   100%  17.4    0s
    H   93    55                       1.8055459    0.00000   100%  16.7    0s
    H   97    52                       1.7440452    0.00000   100%  16.5    0s
    H  129    72                       1.7388329    0.00000   100%  19.0    0s
    H  489   210                       1.7344134    0.00000   100%  17.1    0s
    H  526   236                       1.6749956    0.00000   100%  16.7    0s
    H  583   281                       1.6271075    0.00000   100%  15.9    0s
    H  850   350                       1.5581109    0.00000   100%  16.4    0s
    H  852   334                       1.5158933    0.00000   100%  18.5    0s
    H  852   317                       1.3723312    0.00000   100%  18.5    0s
    H  854   302                       1.3667084    0.00000   100%  18.6    0s
    H  855   288                       1.3411736    0.00000   100%  18.8    0s
    H  855   273                       1.3409610    0.00000   100%  18.8    0s
    H  859   261                       1.3409605    0.00000   100%  18.7    1s
    H  862   250                       1.3378104    0.00000   100%  18.9    1s
    H  862   238                       1.3372223    0.00000   100%  18.9    1s
    H  862   226                       1.3371728    0.00000   100%  18.9    1s
    H  865   217                       1.3359432    0.00000   100%  18.9    1s
    H  865   206                       1.3358667    0.00000   100%  18.9    1s
    H  890   198                       1.3357987    0.00000   100%  19.4    1s
    H  931   188                       1.3342523    0.00000   100%  19.7    1s
    H  931   179                       1.3311118    0.00000   100%  19.7    1s
    H  931   171                       1.3306237    0.00000   100%  19.7    1s
    H  931   162                       1.3305973    0.00000   100%  19.7    1s
    H  950   162                       1.2819514    0.00000   100%  19.9    1s
    H  950   155                       1.2817872    0.00000   100%  19.9    1s
    H  977   151                       1.2817547    0.00000   100%  19.8    1s
    H  977   144                       1.2817384    0.00000   100%  19.8    1s
    H  978   139                       1.2791814    0.00000   100%  19.8    1s
    H  978   133                       1.2779418    0.00000   100%  19.8    1s
    H  979   126                       1.2074570    0.00000   100%  19.8    1s
    H 1302   175                       1.1261336    0.00000   100%  19.2    1s
    H 1302   172                       1.1202445    0.00000   100%  19.2    1s
    H 1302   172                       1.1194321    0.00000   100%  19.2    1s
    H 1366   179                       1.0225196    0.00000   100%  19.3    1s
    H 1366   179                       1.0223222    0.00000   100%  19.3    1s
    H 1379   183                       1.0106628    0.00000   100%  19.3    1s
    H 1398   196                       1.0043781    0.00000   100%  19.2    1s
    H 1398   194                       0.9981773    0.00000   100%  19.2    1s
    H 1398   194                       0.9981737    0.00000   100%  19.2    1s
    H 1401   184                       0.9508466    0.00000   100%  19.2    1s
    H 4887   642                       0.9484652    0.28317  70.1%  18.3    4s
      5688   552    0.62348   37   58    0.94847    0.37214  60.8%  18.0    5s
     14016   981    0.92621   51   60    0.94847    0.90833  4.23%  12.4   10s
     23978  1608     cutoff   60         0.94847    0.94437  0.43%   9.6   15s
     32552  1796    0.94813   63   48    0.94847    0.94694  0.16%   8.6   20s
    *36278  1733              92       0.9484585    0.94757  0.09%   8.2   21s
     42540  1277    0.94845   71   48    0.94846    0.94803  0.05%   7.7   25s
    
    Cutting planes:
      Gomory: 8
      Implied bound: 15
      MIR: 4
      Flow cover: 47
      RLT: 11
      Relax-and-lift: 2
    
    Explored 52999 nodes (365540 simplex iterations) in 29.43 seconds (19.75 work units)
    Thread count was 1 (of 96 available processors)
    
    Solution count 10: 0.948458 0.948465 0.950847 ... 1.11943
    
    Optimal solution found (tolerance 1.00e-06)
    Warning: max constraint violation (1.4696e-06) exceeds tolerance
    Warning: max general constraint violation (1.4696e-06) exceeds tolerance
    Best objective 9.484584545560e-01, best bound 9.484575435935e-01, gap 0.0001%
    
    User-callback calls 53063, time in user-callback 0.00 sec

... Solving fixed model...

    Gurobi Optimizer version 13.0.0 build v13.0.0rc1 (linux64 - "Oracle Linux Server 9.7")
    
    CPU model: AMD EPYC 7643 48-Core Processor, instruction set [SSE2|AVX|AVX2]
    Thread count: 48 physical cores, 96 logical processors, using up to 1 threads
    
    Non-default parameters:
    TimeLimit  300
    MIPGap  1e-06
    LogToConsole  0
    NonConvex  2
    Threads  1
    
    Optimize a model with 63 rows, 116 columns and 102 nonzeros (Min)
    Model fingerprint: 0x27437a25
    Model has 12 linear objective coefficients
    Coefficient statistics:
      Matrix range     [1e+00, 1e+00]
      Objective range  [1e+00, 1e+00]
      Bounds range     [1e-02, 1e+00]
      RHS range        [1e+00, 1e+00]
    Presolve removed 63 rows and 116 columns
    Presolve time: 0.00s
    Presolve: All rows and columns removed
    Iteration    Objective       Primal Inf.    Dual Inf.      Time
           0    9.4845845e-01   0.000000e+00   0.000000e+00      0s
    
    Solved in 0 iterations and 0.00 seconds (0.00 work units)
    Optimal objective  9.484584546e-01
    
    User-callback calls 0, time in user-callback 0.00 sec

--- Reading solution for model GAMS_MODEL
***
*** Solver did not provide marginals for model GAMS_MODEL
***
--- Executing after solve: elapsed 0:00:29.470
--- model.gms(269) 3 Mb
--- model.gms(452) 5 Mb
--- Putfile results /local/scratch/a/sgusev/repos/k_means/data/gams_gurobi_gdp.binary_multiplication/no_mode/2026-02-18_23-24-08/original/results.dat
--- Putfile statresults /local/scratch/a/sgusev/repos/k_means/data/gams_gurobi_gdp.binary_multiplication/no_mode/2026-02-18_23-24-08/original/resultsstat.dat
*** Status: Normal completion
--- Job model.gms Stop 02/18/26 23:24:38 elapsed 0:00:29.471
Original problem solved. Time taken: 29.96501135826111 seconds
Original objective value: 0.948458454555994
