Solving original (integer) problem with strategy gdp.hull...
--- Job model.gms Start 02/14/26 18:57:31 52.2.0 d8e408be LEX-LEG x86 64bit/Linux
--- Applying:
    /package/gams/52.2/gmsprmun.txt
--- GAMS Parameters defined
    Input /local/scratch/a/sgusev/repos/k_means/data/gams_gurobi_gdp.hull/no_mode/2026-02-14_18-57-31/original/model.gms
    Output /local/scratch/a/sgusev/repos/k_means/data/gams_gurobi_gdp.hull/no_mode/2026-02-14_18-57-31/original/output.lst
    ScrDir /local/scratch/a/sgusev/repos/k_means/data/gams_gurobi_gdp.hull/no_mode/2026-02-14_18-57-31/original/225a/
    SysDir /package/gams/52.2/
    CurDir /local/scratch/a/sgusev/repos/k_means/data/gams_gurobi_gdp.hull/no_mode/2026-02-14_18-57-31/original/
    LogOption 3
    AppendLog 1
Licensee: David Bernal / SECQUOIA Research Group         G251008+0003Ac-GEN
          Purdue University, Davidson School of Chemical EngineeringDCE4838
          225a/gamslice.dat
          5a82958a-fbca-4a23
          node:66820903 mem:995 cores:48 ipport:45677 v:2                  
          Evaluation license: Not for commercial or production use
          The time-limited license stops working on : Jun 30, 2027
System information: 48 physical cores and 995 Gb physical memory detected
GAMS 52.2.0   Copyright (C) 1987-2025 GAMS Development. All rights reserved
--- Starting compilation
--- model.gms(1898) 2 Mb
--- $echo File /local/scratch/a/sgusev/repos/k_means/data/gams_gurobi_gdp.hull/no_mode/2026-02-14_18-57-31/original/gurobi.opt
--- model.gms(2829) 2 Mb
--- Starting execution: elapsed 0:00:00.013
--- model.gms(1907) 3 Mb
--- Generating MINLP model GAMS_MODEL
--- model.gms(1911) 5 Mb
---   573 rows  292 columns  1,385 non-zeroes
---   1,395 nl-code  180 nl-non-zeroes
---   45 discrete-columns
--- Range statistics (absolute non-zero finite values)
--- RHS       [min, max] : [ 2.004E-05, 1.000E+00] - Zero values observed as well
--- Bound     [min, max] : [ 1.000E+00, 6.000E+01] - Zero values observed as well
--- Matrix    [min, max] : [ 8.093E-03, 6.000E+01]
--- model.gms(1911) 3 Mb
--- Executing GUROBI (Solvelink=5): elapsed 0:00:00.017
Reading parameter(s) from "/local/scratch/a/sgusev/repos/k_means/data/gams_gurobi_gdp.hull/no_mode/2026-02-14_18-57-31/original/gurobi.opt"
>>  NonConvex 2
>>  Threads 1
>>  MIPGap 1e-06
>>  MIPGapAbs 1e-10
>>  FeasibilityTol 1e-06
>>  OptimalityTol 1e-06
>>  IntFeasTol 1e-05
Finished reading from "/local/scratch/a/sgusev/repos/k_means/data/gams_gurobi_gdp.hull/no_mode/2026-02-14_18-57-31/original/gurobi.opt"

... GRB_LICENSE_FILE = /local/scratch/a/sgusev/gurobi.lic

    Gurobi           52.2.0 d8e408be Dec 8, 2025           LEG x86 64bit/Linux    

... GAMS/Gurobi Link license.
... GMO Q Extraction (ThreePass): 0.00s

    Gurobi Optimizer version 13.0.0 build v13.0.0rc1 (linux64 - "Oracle Linux Server 9.7")
    
    CPU model: AMD EPYC 7643 48-Core Processor, instruction set [SSE2|AVX|AVX2]
    Thread count: 48 physical cores, 96 logical processors, using up to 1 threads
    
    Non-default parameters:
    TimeLimit  300
    MIPGap  1e-06
    LogToConsole  0
    NonConvex  2
    Threads  1
    
    Optimize a model with 572 rows, 336 columns and 1234 nonzeros (Min)
    Model fingerprint: 0x1fc8f248
    Model has 15 linear objective coefficients
    Model has 45 general nonlinear constraints (270 nonlinear terms)
    Variable types: 291 continuous, 45 integer (0 binary)
    Coefficient statistics:
      Matrix range     [1e+00, 6e+01]
      Objective range  [1e+00, 1e+00]
      Bounds range     [1e+00, 6e+01]
      RHS range        [1e+00, 1e+00]
      NLCon coe range  [2e-05, 1e+00]
    Presolve model has 45 nlconstr
    Added 585 variables to disaggregate expressions
    Presolve removed 135 rows and 105 columns
    Presolve time: 0.00s
    Presolved: 1787 rows, 817 columns, 4549 nonzeros
    Presolved model has 270 bilinear constraint(s)
    
    Solving non-convex MIQCP to global optimality
    
    Variable types: 772 continuous, 45 integer (45 binary)
    Found heuristic solution: objective 8.6898944
    
    Root relaxation: objective 0.000000e+00, 263 iterations, 0.00 seconds (0.00 work units)
    
        Nodes    |    Current Node    |     Objective Bounds      |     Work
     Expl Unexpl |  Obj  Depth IntInf | Incumbent    BestBd   Gap | It/Node Time
    
         0     0    0.00000    0  135    8.68989    0.00000   100%     -    0s
         0     0    0.00000    0  135    8.68989    0.00000   100%     -    0s
         0     0    0.00000    0  156    8.68989    0.00000   100%     -    0s
         0     0    0.00000    0  153    8.68989    0.00000   100%     -    0s
         0     0    0.00000    0  153    8.68989    0.00000   100%     -    0s
         0     0    0.00000    0   71    8.68989    0.00000   100%     -    0s
         0     0    0.00000    0   90    8.68989    0.00000   100%     -    0s
         0     0    0.00000    0  121    8.68989    0.00000   100%     -    0s
         0     0    0.00000    0  121    8.68989    0.00000   100%     -    0s
         0     0    0.00000    0   63    8.68989    0.00000   100%     -    0s
         0     0    0.00000    0   63    8.68989    0.00000   100%     -    0s
    H    0     0                       3.1387552    0.00000   100%     -    0s
    H    0     0                       1.9350410    0.00000   100%     -    0s
         0     2    0.00000    0   63    1.93504    0.00000   100%     -    0s
    H  329   182                       1.9350410    0.00000   100%  18.3    0s
    H  825   397                       1.8164540    0.00000   100%  23.0    2s
    H  948   422                       1.7654538    0.00000   100%  21.4    2s
    H  948   379                       1.6939279    0.00000   100%  21.4    2s
    H  949   362                       1.6914857    0.00000   100%  21.4    2s
    H 1160   383                       1.6865475    0.00064   100%  20.0    2s
    H 1289   352                       1.6865034    0.00488   100%  20.1    3s
    H 1289   337                       1.6864971    0.00488   100%  20.1    3s
    H 1292   320                       1.6864970    0.00488   100%  20.1    3s
    H 1771   336                       1.6294783    0.32530  80.0%  19.2    3s
      4227   385     cutoff   78         1.62948    1.24692  23.5%  13.5    5s
    * 6952   388             120       1.6294670    1.57877  3.11%  10.1    6s
     13883   183    1.62946  111    6    1.62947    1.62937  0.01%   6.6   10s
    
    Cutting planes:
      Learned: 54
      Gomory: 2
      Implied bound: 14
      MIR: 2
      Flow cover: 43
      RLT: 9
      Relax-and-lift: 11
    
    Explored 14849 nodes (95658 simplex iterations) in 10.46 seconds (7.47 work units)
    Thread count was 1 (of 96 available processors)
    
    Solution count 10: 1.62947 1.62947 1.62948 ... 1.76545
    
    Optimal solution found (tolerance 1.00e-06)
    Warning: max constraint violation (1.3049e-06) exceeds tolerance
    Warning: max general constraint violation (1.3049e-06) exceeds tolerance
    Best objective 1.629467045997e+00, best bound 1.629465417462e+00, gap 0.0001%
    
    User-callback calls 14864, time in user-callback 0.00 sec

... Solving fixed model...

    Gurobi Optimizer version 13.0.0 build v13.0.0rc1 (linux64 - "Oracle Linux Server 9.7")
    
    CPU model: AMD EPYC 7643 48-Core Processor, instruction set [SSE2|AVX|AVX2]
    Thread count: 48 physical cores, 96 logical processors, using up to 1 threads
    
    Non-default parameters:
    TimeLimit  300
    MIPGap  1e-06
    LogToConsole  0
    NonConvex  2
    Threads  1
    
    Optimize a model with 572 rows, 336 columns and 1234 nonzeros (Min)
    Model fingerprint: 0x4bbafe56
    Model has 15 linear objective coefficients
    Coefficient statistics:
      Matrix range     [1e+00, 6e+01]
      Objective range  [1e+00, 1e+00]
      Bounds range     [2e-03, 6e+01]
      RHS range        [1e+00, 1e+00]
    Presolve removed 572 rows and 336 columns
    Presolve time: 0.00s
    Presolve: All rows and columns removed
    Iteration    Objective       Primal Inf.    Dual Inf.      Time
           0    1.6294670e+00   0.000000e+00   0.000000e+00      0s
    
    Solved in 0 iterations and 0.00 seconds (0.00 work units)
    Optimal objective  1.629467046e+00
    
    User-callback calls 0, time in user-callback 0.00 sec

--- Reading solution for model GAMS_MODEL
***
*** Solver did not provide marginals for model GAMS_MODEL
***
--- Executing after solve: elapsed 0:00:10.503
--- model.gms(1914) 3 Mb
--- model.gms(2829) 5 Mb
--- Putfile results /local/scratch/a/sgusev/repos/k_means/data/gams_gurobi_gdp.hull/no_mode/2026-02-14_18-57-31/original/results.dat
--- Putfile statresults /local/scratch/a/sgusev/repos/k_means/data/gams_gurobi_gdp.hull/no_mode/2026-02-14_18-57-31/original/resultsstat.dat
*** Status: Normal completion
--- Job model.gms Stop 02/14/26 18:57:42 elapsed 0:00:10.504
Original problem solved. Time taken: 11.067278146743774 seconds
Original objective value: 1.629467045998556
