Solving original (integer) problem with strategy gdp.hull...
--- Job model.gms Start 02/14/26 18:57:55 52.2.0 d8e408be LEX-LEG x86 64bit/Linux
--- Applying:
    /package/gams/52.2/gmsprmun.txt
--- GAMS Parameters defined
    Input /local/scratch/a/sgusev/repos/k_means/data/gams_gurobi_gdp.hull/no_mode/2026-02-14_18-57-55/original/model.gms
    Output /local/scratch/a/sgusev/repos/k_means/data/gams_gurobi_gdp.hull/no_mode/2026-02-14_18-57-55/original/output.lst
    ScrDir /local/scratch/a/sgusev/repos/k_means/data/gams_gurobi_gdp.hull/no_mode/2026-02-14_18-57-55/original/225a/
    SysDir /package/gams/52.2/
    CurDir /local/scratch/a/sgusev/repos/k_means/data/gams_gurobi_gdp.hull/no_mode/2026-02-14_18-57-55/original/
    LogOption 3
    AppendLog 1
Licensee: David Bernal / SECQUOIA Research Group         G251008+0003Ac-GEN
          Purdue University, Davidson School of Chemical EngineeringDCE4838
          225a/gamslice.dat
          5a82958a-fbca-4a23
          node:66820903 mem:995 cores:48 ipport:42571 v:2                  
          Evaluation license: Not for commercial or production use
          The time-limited license stops working on : Jun 30, 2027
System information: 48 physical cores and 995 Gb physical memory detected
GAMS 52.2.0   Copyright (C) 1987-2025 GAMS Development. All rights reserved
--- Starting compilation
--- model.gms(2329) 2 Mb
--- $echo File /local/scratch/a/sgusev/repos/k_means/data/gams_gurobi_gdp.hull/no_mode/2026-02-14_18-57-55/original/gurobi.opt
--- model.gms(3458) 2 Mb
--- Starting execution: elapsed 0:00:00.014
--- model.gms(2338) 3 Mb
--- Generating MINLP model GAMS_MODEL
--- model.gms(2342) 5 Mb
---   704 rows  359 columns  1,715 non-zeroes
---   1,736 nl-code  224 nl-non-zeroes
---   56 discrete-columns
--- Range statistics (absolute non-zero finite values)
--- RHS       [min, max] : [ 2.433E-05, 1.000E+00] - Zero values observed as well
--- Bound     [min, max] : [ 1.000E+00, 5.600E+01] - Zero values observed as well
--- Matrix    [min, max] : [ 1.218E-01, 5.600E+01]
--- model.gms(2342) 3 Mb
--- Executing GUROBI (Solvelink=5): elapsed 0:00:00.019
Reading parameter(s) from "/local/scratch/a/sgusev/repos/k_means/data/gams_gurobi_gdp.hull/no_mode/2026-02-14_18-57-55/original/gurobi.opt"
>>  NonConvex 2
>>  Threads 1
>>  MIPGap 1e-06
>>  MIPGapAbs 1e-10
>>  FeasibilityTol 1e-06
>>  OptimalityTol 1e-06
>>  IntFeasTol 1e-05
Finished reading from "/local/scratch/a/sgusev/repos/k_means/data/gams_gurobi_gdp.hull/no_mode/2026-02-14_18-57-55/original/gurobi.opt"

... GRB_LICENSE_FILE = /local/scratch/a/sgusev/gurobi.lic

    Gurobi           52.2.0 d8e408be Dec 8, 2025           LEG x86 64bit/Linux    

... GAMS/Gurobi Link license.
... GMO Q Extraction (ThreePass): 0.00s

    Gurobi Optimizer version 13.0.0 build v13.0.0rc1 (linux64 - "Oracle Linux Server 9.7")
    
    CPU model: AMD EPYC 7643 48-Core Processor, instruction set [SSE2|AVX|AVX2]
    Thread count: 48 physical cores, 96 logical processors, using up to 1 threads
    
    Non-default parameters:
    TimeLimit  300
    MIPGap  1e-06
    LogToConsole  0
    NonConvex  2
    Threads  1
    
    Optimize a model with 703 rows, 414 columns and 1532 nonzeros (Min)
    Model fingerprint: 0x05b17bf0
    Model has 14 linear objective coefficients
    Model has 56 general nonlinear constraints (336 nonlinear terms)
    Variable types: 358 continuous, 56 integer (0 binary)
    Coefficient statistics:
      Matrix range     [1e+00, 6e+01]
      Objective range  [1e+00, 1e+00]
      Bounds range     [1e+00, 6e+01]
      RHS range        [1e+00, 1e+00]
      NLCon coe range  [2e-05, 1e+00]
    Presolve model has 56 nlconstr
    Added 728 variables to disaggregate expressions
    Presolve removed 168 rows and 126 columns
    Presolve time: 0.01s
    Presolved: 2215 rows, 1017 columns, 5662 nonzeros
    Presolved model has 336 bilinear constraint(s)
    
    Solving non-convex MIQCP to global optimality
    
    Variable types: 961 continuous, 56 integer (56 binary)
    Found heuristic solution: objective 8.0798278
    
    Root relaxation: objective 0.000000e+00, 332 iterations, 0.00 seconds (0.00 work units)
    
        Nodes    |    Current Node    |     Objective Bounds      |     Work
     Expl Unexpl |  Obj  Depth IntInf | Incumbent    BestBd   Gap | It/Node Time
    
         0     0    0.00000    0  168    8.07983    0.00000   100%     -    0s
         0     0    0.00000    0  184    8.07983    0.00000   100%     -    0s
         0     0    0.00000    0  165    8.07983    0.00000   100%     -    0s
         0     0    0.00000    0  145    8.07983    0.00000   100%     -    0s
         0     0    0.00000    0  127    8.07983    0.00000   100%     -    0s
         0     0    0.00000    0  127    8.07983    0.00000   100%     -    0s
         0     0    0.00000    0   51    8.07983    0.00000   100%     -    0s
         0     0    0.00000    0  104    8.07983    0.00000   100%     -    0s
         0     0    0.00000    0  103    8.07983    0.00000   100%     -    0s
         0     0    0.00000    0  101    8.07983    0.00000   100%     -    0s
         0     0    0.00000    0  101    8.07983    0.00000   100%     -    0s
         0     0    0.00000    0   43    8.07983    0.00000   100%     -    0s
         0     0    0.00000    0   79    8.07983    0.00000   100%     -    0s
         0     0    0.00000    0   91    8.07983    0.00000   100%     -    0s
         0     0    0.00000    0   91    8.07983    0.00000   100%     -    0s
         0     0    0.00000    0   87    8.07983    0.00000   100%     -    0s
         0     0    0.00000    0   87    8.07983    0.00000   100%     -    0s
         0     0    0.00000    0   64    8.07983    0.00000   100%     -    0s
    H    0     0                       6.1954673    0.00000   100%     -    0s
    H    0     0                       5.8200006    0.00000   100%     -    0s
         0     2    0.00000    0   64    5.82000    0.00000   100%     -    0s
    H   41    41                       3.8892067    0.00000   100%  14.6    0s
    H   43    42                       3.8298392    0.00000   100%  14.3    0s
    H   43    42                       3.3204198    0.00000   100%  14.3    0s
    H   81    80                       3.2196071    0.00000   100%  11.3    0s
    H   88    82                       2.8467603    0.00000   100%  11.3    0s
    H  121   101                       2.8462664    0.00000   100%   9.9    0s
    H  121   101                       2.8374139    0.00000   100%   9.9    0s
    H  121   101                       2.8364453    0.00000   100%   9.9    0s
    H  121   101                       2.8355636    0.00000   100%   9.9    0s
    H  130   110                       2.8352502    0.00000   100%   9.4    0s
    H  130   110                       2.8352432    0.00000   100%   9.4    0s
    H  138   116                       2.8323848    0.00000   100%   9.1    0s
    H  143   119                       2.8302897    0.00000   100%   8.9    0s
    H  167   143                       2.8302705    0.00000   100%   7.8    0s
    *  170   146              86       2.8302603    0.00000   100%   7.7    0s
    H  625   430                       2.6278712    0.00000   100%  13.1    1s
    H  625   408                       2.5840857    0.00000   100%  13.1    1s
    H  625   387                       2.5659320    0.00000   100%  13.1    1s
    H  625   368                       2.5657432    0.00000   100%  13.1    1s
    H  625   349                       2.5655256    0.00000   100%  13.1    1s
    H  625   332                       2.5655241    0.00000   100%  13.1    1s
    H  635   322                       1.6938149    0.00000   100%  17.0    1s
    H  635   306                       1.6776900    0.00000   100%  17.0    1s
    H  635   291                       1.6737972    0.00000   100%  17.0    1s
    H  635   276                       1.6737931    0.00000   100%  17.0    1s
    H  677   285                       1.4864828    0.00000   100%  20.4    2s
    H  707   286                       1.2696628    0.00000   100%  19.7    2s
    H  801   296                       1.2696628    0.00000   100%  18.6    2s
    H  874   302                       1.2279248    0.00000   100%  17.9    2s
      2399   806    0.53721   43   69    1.22792    0.00000   100%  15.2    5s
    H 3535  1099                       1.2279219    0.00000   100%  16.5    6s
    H 5542  1286                       1.1100134    0.19660  82.3%  15.7    8s
      7606  1412     cutoff   57         1.11001    0.37955  65.8%  15.0   10s
     12539  1770 infeasible   68         1.11001    0.71578  35.5%  12.8   15s
     20420  2722    1.00507   73   18    1.11001    0.90004  18.9%   9.8   20s
     28818  3233    1.10344   81   15    1.11001    0.95346  14.1%   8.0   25s
    *36281  3416             129       1.1100042    0.98310  11.4%   6.9   29s
     37682  3579    1.09647   75    5    1.11000    0.98924  10.9%   6.7   30s
     46594  3344     cutoff   83         1.11000    1.04978  5.43%   5.9   35s
     55554  3500     cutoff   89         1.11000    1.08286  2.45%   5.3   40s
     64771  3815     cutoff   92         1.11000    1.09637  1.23%   4.8   45s
     74261  4099    1.10903   90   16    1.11000    1.10256  0.67%   4.5   50s
     83207  4075    1.10962  100   14    1.11000    1.10618  0.34%   4.2   55s
     92109  4347    1.10938   97    4    1.11000    1.10757  0.22%   4.0   60s
     101058  4354     cutoff  109         1.11000    1.10827  0.16%   3.8   65s
     109772  3648    1.10989  109   19    1.11000    1.10904  0.09%   3.7   70s
     118586  3420    1.10986  109    7    1.11000    1.10947  0.05%   3.6   75s
     127414  3120     cutoff  112         1.11000    1.10966  0.03%   3.5   80s
     136229  2423    1.10998  108    9    1.11000    1.10981  0.02%   3.4   85s
     145109  1723    1.11000  113    6    1.11000    1.10990  0.01%   3.3   90s
    
    Cutting planes:
      Learned: 69
      Gomory: 5
      Implied bound: 14
      Projected implied bound: 5
      MIR: 2
      Flow cover: 67
      RLT: 18
      Relax-and-lift: 24
    
    Explored 152764 nodes (496761 simplex iterations) in 94.37 seconds (72.78 work units)
    Thread count was 1 (of 96 available processors)
    
    Solution count 10: 1.11 1.11 1.11001 ... 1.67769
    
    Optimal solution found (tolerance 1.00e-06)
    Warning: max constraint violation (1.0059e-06) exceeds tolerance
    Warning: max general constraint violation (1.0059e-06) exceeds tolerance
    Best objective 1.110004181833e+00, best bound 1.110003089653e+00, gap 0.0001%
    
    User-callback calls 152803, time in user-callback 0.01 sec

... Solving fixed model...

    Gurobi Optimizer version 13.0.0 build v13.0.0rc1 (linux64 - "Oracle Linux Server 9.7")
    
    CPU model: AMD EPYC 7643 48-Core Processor, instruction set [SSE2|AVX|AVX2]
    Thread count: 48 physical cores, 96 logical processors, using up to 1 threads
    
    Non-default parameters:
    TimeLimit  300
    MIPGap  1e-06
    LogToConsole  0
    NonConvex  2
    Threads  1
    
    Optimize a model with 703 rows, 414 columns and 1532 nonzeros (Min)
    Model fingerprint: 0x6a5ffdc0
    Model has 14 linear objective coefficients
    Coefficient statistics:
      Matrix range     [1e+00, 6e+01]
      Objective range  [1e+00, 1e+00]
      Bounds range     [4e-03, 6e+01]
      RHS range        [1e+00, 1e+00]
    Presolve removed 703 rows and 414 columns
    Presolve time: 0.00s
    Presolve: All rows and columns removed
    Iteration    Objective       Primal Inf.    Dual Inf.      Time
           0    1.1100042e+00   0.000000e+00   0.000000e+00      0s
    
    Solved in 0 iterations and 0.00 seconds (0.00 work units)
    Optimal objective  1.110004182e+00
    
    User-callback calls 0, time in user-callback 0.00 sec

--- Reading solution for model GAMS_MODEL
***
*** Solver did not provide marginals for model GAMS_MODEL
***
--- Executing after solve: elapsed 0:01:34.417
--- model.gms(2345) 3 Mb
--- model.gms(3458) 5 Mb
--- Putfile results /local/scratch/a/sgusev/repos/k_means/data/gams_gurobi_gdp.hull/no_mode/2026-02-14_18-57-55/original/results.dat
--- Putfile statresults /local/scratch/a/sgusev/repos/k_means/data/gams_gurobi_gdp.hull/no_mode/2026-02-14_18-57-55/original/resultsstat.dat
*** Status: Normal completion
--- Job model.gms Stop 02/14/26 18:59:30 elapsed 0:01:34.419
Original problem solved. Time taken: 94.98805713653564 seconds
Original objective value: 1.110004181834974
