Solving original (integer) problem with strategy gdp.hull...
--- Job model.gms Start 02/14/26 17:16:03 52.2.0 d8e408be LEX-LEG x86 64bit/Linux
--- Applying:
    /package/gams/52.2/gmsprmun.txt
--- GAMS Parameters defined
    Input /local/scratch/a/sgusev/repos/k_means/data/gams_gurobi_gdp.hull/no_mode/2026-02-14_17-16-02/original/model.gms
    Output /local/scratch/a/sgusev/repos/k_means/data/gams_gurobi_gdp.hull/no_mode/2026-02-14_17-16-02/original/output.lst
    ScrDir /local/scratch/a/sgusev/repos/k_means/data/gams_gurobi_gdp.hull/no_mode/2026-02-14_17-16-02/original/225a/
    SysDir /package/gams/52.2/
    CurDir /local/scratch/a/sgusev/repos/k_means/data/gams_gurobi_gdp.hull/no_mode/2026-02-14_17-16-02/original/
    LogOption 3
    AppendLog 1
Licensee: David Bernal / SECQUOIA Research Group         G251008+0003Ac-GEN
          Purdue University, Davidson School of Chemical EngineeringDCE4838
          225a/gamslice.dat
          5a82958a-fbca-4a23
          node:66820903 mem:995 cores:48 ipport:35411 v:2                  
          Evaluation license: Not for commercial or production use
          The time-limited license stops working on : Jun 30, 2027
System information: 48 physical cores and 995 Gb physical memory detected
GAMS 52.2.0   Copyright (C) 1987-2025 GAMS Development. All rights reserved
--- Starting compilation
--- model.gms(1843) 2 Mb
--- $echo File /local/scratch/a/sgusev/repos/k_means/data/gams_gurobi_gdp.hull/no_mode/2026-02-14_17-16-02/original/gurobi.opt
--- model.gms(2747) 2 Mb
--- Starting execution: elapsed 0:00:00.012
--- model.gms(1852) 3 Mb
--- Generating MINLP model GAMS_MODEL
--- model.gms(1856) 5 Mb
---   554 rows  284 columns  1,349 non-zeroes
---   1,364 nl-code  176 nl-non-zeroes
---   44 discrete-columns
--- Range statistics (absolute non-zero finite values)
--- RHS       [min, max] : [ 1.756E-05, 1.000E+00] - Zero values observed as well
--- Bound     [min, max] : [ 1.000E+00, 4.400E+01] - Zero values observed as well
--- Matrix    [min, max] : [ 3.530E-02, 4.400E+01]
--- model.gms(1856) 3 Mb
--- Executing GUROBI (Solvelink=5): elapsed 0:00:00.016
Reading parameter(s) from "/local/scratch/a/sgusev/repos/k_means/data/gams_gurobi_gdp.hull/no_mode/2026-02-14_17-16-02/original/gurobi.opt"
>>  NonConvex 2
>>  Threads 1
>>  MIPGap 1e-06
>>  MIPGapAbs 1e-10
>>  FeasibilityTol 1e-06
>>  OptimalityTol 1e-06
>>  IntFeasTol 1e-05
Finished reading from "/local/scratch/a/sgusev/repos/k_means/data/gams_gurobi_gdp.hull/no_mode/2026-02-14_17-16-02/original/gurobi.opt"

... GRB_LICENSE_FILE = /local/scratch/a/sgusev/gurobi.lic

    Gurobi           52.2.0 d8e408be Dec 8, 2025           LEG x86 64bit/Linux    

... GAMS/Gurobi Link license.
... GMO Q Extraction (ThreePass): 0.00s

    Gurobi Optimizer version 13.0.0 build v13.0.0rc1 (linux64 - "Oracle Linux Server 9.7")
    
    CPU model: AMD EPYC 7643 48-Core Processor, instruction set [SSE2|AVX|AVX2]
    Thread count: 48 physical cores, 96 logical processors, using up to 1 threads
    
    Non-default parameters:
    TimeLimit  300
    MIPGap  1e-06
    LogToConsole  0
    NonConvex  2
    Threads  1
    
    Optimize a model with 553 rows, 327 columns and 1205 nonzeros (Min)
    Model fingerprint: 0xcbd4487b
    Model has 11 linear objective coefficients
    Model has 44 general nonlinear constraints (264 nonlinear terms)
    Variable types: 283 continuous, 44 integer (0 binary)
    Coefficient statistics:
      Matrix range     [1e+00, 4e+01]
      Objective range  [1e+00, 1e+00]
      Bounds range     [1e+00, 4e+01]
      RHS range        [1e+00, 1e+00]
      NLCon coe range  [2e-05, 1e+00]
    Presolve model has 44 nlconstr
    Added 572 variables to disaggregate expressions
    Presolve removed 132 rows and 99 columns
    Presolve time: 0.00s
    Presolved: 1741 rows, 801 columns, 4450 nonzeros
    Presolved model has 264 bilinear constraint(s)
    
    Solving non-convex MIQCP to global optimality
    
    Variable types: 757 continuous, 44 integer (44 binary)
    Found heuristic solution: objective 8.8416881
    
    Root relaxation: objective 0.000000e+00, 252 iterations, 0.00 seconds (0.00 work units)
    
        Nodes    |    Current Node    |     Objective Bounds      |     Work
     Expl Unexpl |  Obj  Depth IntInf | Incumbent    BestBd   Gap | It/Node Time
    
         0     0    0.00000    0  132    8.84169    0.00000   100%     -    0s
         0     0    0.00000    0  132    8.84169    0.00000   100%     -    0s
         0     0    0.00000    0  107    8.84169    0.00000   100%     -    0s
         0     0    0.00000    0   78    8.84169    0.00000   100%     -    0s
         0     0    0.00000    0   78    8.84169    0.00000   100%     -    0s
         0     0    0.00000    0   45    8.84169    0.00000   100%     -    0s
         0     0    0.00000    0  106    8.84169    0.00000   100%     -    0s
         0     0    0.00000    0  104    8.84169    0.00000   100%     -    0s
         0     0    0.00000    0  103    8.84169    0.00000   100%     -    0s
         0     0    0.00000    0   51    8.84169    0.00000   100%     -    0s
         0     0    0.00000    0   51    8.84169    0.00000   100%     -    0s
    H    0     0                       7.7954666    0.00000   100%     -    0s
    H    0     0                       7.7450104    0.00000   100%     -    0s
    H    0     0                       6.8092502    0.00000   100%     -    0s
         0     2    0.00000    0   51    6.80925    0.00000   100%     -    0s
    H   13    13                       5.3855128    0.00000   100%  17.8    0s
    H   30    30                       4.0020210    0.00000   100%  17.2    0s
    H   32    32                       3.4617861    0.00000   100%  17.4    0s
    H   81    75                       3.3014961    0.00000   100%   9.7    0s
    H   88    78                       3.2792091    0.00000   100%   9.8    0s
    H   90    78                       3.2301262    0.00000   100%   9.8    0s
    H  118    35                       1.1857046    0.00000   100%  12.4    0s
    H  323    90                       1.0667160    0.00000   100%  15.4    0s
    H  540   160                       0.9865487    0.00000   100%  14.7    1s
    H  661   154                       0.7704951    0.00000   100%  12.8    1s
    H  708   165                       0.7704951    0.00000   100%  12.7    1s
    H  734   171                       0.7704951    0.00000   100%  12.8    1s
    H  753   176                       0.7704951    0.00000   100%  12.9    1s
    H  818   178                       0.7681731    0.00000   100%  13.2    1s
    H  818   178                       0.7667014    0.00000   100%  13.2    1s
    H  818   178                       0.7666033    0.00000   100%  13.2    1s
    H  890   189                       0.7666033    0.00000   100%  13.3    1s
    H  897   190                       0.7666033    0.00000   100%  13.2    1s
    H  949   197                       0.7297341    0.00000   100%  13.5    1s
    H  949   187                       0.7297194    0.00000   100%  13.5    1s
    H  949   178                       0.7297063    0.00000   100%  13.5    1s
    H  949   169                       0.7296951    0.00000   100%  13.5    1s
    H  961   168                       0.7290550    0.00000   100%  13.3    1s
    H  961   159                       0.7287070    0.00000   100%  13.3    1s
    H  969   156                       0.7269215    0.00000   100%  13.2    1s
    H  969   147                       0.7208577    0.00000   100%  13.2    1s
    H 1001   155                       0.7208577    0.00030   100%  17.6    2s
    H 4380   527                       0.7208574    0.48315  33.0%  12.1    4s
    H 4990   624                       0.7208567    0.53663  25.6%  11.2    5s
    H 5990   814                       0.7208532    0.56347  21.8%  10.0    5s
    H10114  1293                       0.7208520    0.61117  15.2%   7.3    7s
     13277  1543     cutoff   59         0.72085    0.63009  12.6%   6.3   10s
    H14359  1565                       0.7208517    0.63727  11.6%   6.1   10s
     24114  2244    0.71701   58   16    0.72085    0.70182  2.64%   4.7   15s
     36013  3457    0.72074   76   10    0.72085    0.71254  1.15%   3.9   20s
     48490  3900     cutoff   73         0.72085    0.71601  0.67%   3.4   25s
     60503  3103    0.71949   64   14    0.72085    0.71858  0.32%   3.0   30s
     72380  2224    0.72077   74   11    0.72085    0.72023  0.09%   2.8   35s
     84582  1159    0.72081   89   16    0.72085    0.72075  0.01%   2.6   40s
    
    Cutting planes:
      Learned: 36
      Gomory: 6
      Implied bound: 19
      MIR: 5
      Flow cover: 26
      RLT: 11
      Relax-and-lift: 4
    
    Explored 90513 nodes (232878 simplex iterations) in 42.40 seconds (30.44 work units)
    Thread count was 1 (of 96 available processors)
    
    Solution count 10: 0.720852 0.720852 0.720853 ... 0.729695
    
    Optimal solution found (tolerance 1.00e-06)
    Best objective 7.208516677346e-01, best bound 7.208509478562e-01, gap 0.0001%
    
    User-callback calls 90550, time in user-callback 0.00 sec

... Solving fixed model...

    Gurobi Optimizer version 13.0.0 build v13.0.0rc1 (linux64 - "Oracle Linux Server 9.7")
    
    CPU model: AMD EPYC 7643 48-Core Processor, instruction set [SSE2|AVX|AVX2]
    Thread count: 48 physical cores, 96 logical processors, using up to 1 threads
    
    Non-default parameters:
    TimeLimit  300
    MIPGap  1e-06
    LogToConsole  0
    NonConvex  2
    Threads  1
    
    Optimize a model with 553 rows, 327 columns and 1205 nonzeros (Min)
    Model fingerprint: 0xcc07d244
    Model has 11 linear objective coefficients
    Coefficient statistics:
      Matrix range     [1e+00, 4e+01]
      Objective range  [1e+00, 1e+00]
      Bounds range     [2e-03, 4e+01]
      RHS range        [1e+00, 1e+00]
    Presolve removed 553 rows and 327 columns
    Presolve time: 0.00s
    Presolve: All rows and columns removed
    Iteration    Objective       Primal Inf.    Dual Inf.      Time
           0    7.2085167e-01   0.000000e+00   0.000000e+00      0s
    
    Solved in 0 iterations and 0.00 seconds (0.00 work units)
    Optimal objective  7.208516677e-01
    
    User-callback calls 0, time in user-callback 0.00 sec

--- Reading solution for model GAMS_MODEL
***
*** Solver did not provide marginals for model GAMS_MODEL
***
--- Executing after solve: elapsed 0:00:42.448
--- model.gms(1859) 3 Mb
--- model.gms(2747) 5 Mb
--- Putfile results /local/scratch/a/sgusev/repos/k_means/data/gams_gurobi_gdp.hull/no_mode/2026-02-14_17-16-02/original/results.dat
--- Putfile statresults /local/scratch/a/sgusev/repos/k_means/data/gams_gurobi_gdp.hull/no_mode/2026-02-14_17-16-02/original/resultsstat.dat
*** Status: Normal completion
--- Job model.gms Stop 02/14/26 17:16:45 elapsed 0:00:42.449
Original problem solved. Time taken: 43.066396713256836 seconds
Original objective value: 0.7208516677362761
