Solving original (integer) problem with strategy gdp.hull...
--- Job model.gms Start 02/14/26 22:09:11 52.2.0 d8e408be LEX-LEG x86 64bit/Linux
--- Applying:
    /package/gams/52.2/gmsprmun.txt
--- GAMS Parameters defined
    Input /local/scratch/a/sgusev/repos/k_means/data/gams_gurobi_gdp.hull/no_mode/2026-02-14_22-09-11/original/model.gms
    Output /local/scratch/a/sgusev/repos/k_means/data/gams_gurobi_gdp.hull/no_mode/2026-02-14_22-09-11/original/output.lst
    ScrDir /local/scratch/a/sgusev/repos/k_means/data/gams_gurobi_gdp.hull/no_mode/2026-02-14_22-09-11/original/225a/
    SysDir /package/gams/52.2/
    CurDir /local/scratch/a/sgusev/repos/k_means/data/gams_gurobi_gdp.hull/no_mode/2026-02-14_22-09-11/original/
    LogOption 3
    AppendLog 1
Licensee: David Bernal / SECQUOIA Research Group         G251008+0003Ac-GEN
          Purdue University, Davidson School of Chemical EngineeringDCE4838
          225a/gamslice.dat
          5a82958a-fbca-4a23
          node:66820903 mem:995 cores:48 ipport:51495 v:2                  
          Evaluation license: Not for commercial or production use
          The time-limited license stops working on : Jun 30, 2027
System information: 48 physical cores and 995 Gb physical memory detected
GAMS 52.2.0   Copyright (C) 1987-2025 GAMS Development. All rights reserved
--- Starting compilation
--- model.gms(2653) 2 Mb
--- $echo File /local/scratch/a/sgusev/repos/k_means/data/gams_gurobi_gdp.hull/no_mode/2026-02-14_22-09-11/original/gurobi.opt
--- model.gms(3932) 2 Mb
--- Starting execution: elapsed 0:00:00.021
--- model.gms(2662) 3 Mb
--- Generating MINLP model GAMS_MODEL
--- model.gms(2666) 5 Mb
---   804 rows  409 columns  1,959 non-zeroes
---   1,984 nl-code  256 nl-non-zeroes
---   64 discrete-columns
--- Range statistics (absolute non-zero finite values)
--- RHS       [min, max] : [ 1.410E-05, 1.000E+00] - Zero values observed as well
--- Bound     [min, max] : [ 1.000E+00, 6.400E+01] - Zero values observed as well
--- Matrix    [min, max] : [ 4.211E-02, 6.400E+01]
--- model.gms(2666) 3 Mb
--- Executing GUROBI (Solvelink=5): elapsed 0:00:00.027
Reading parameter(s) from "/local/scratch/a/sgusev/repos/k_means/data/gams_gurobi_gdp.hull/no_mode/2026-02-14_22-09-11/original/gurobi.opt"
>>  NonConvex 2
>>  Threads 1
>>  MIPGap 1e-06
>>  MIPGapAbs 1e-10
>>  FeasibilityTol 1e-06
>>  OptimalityTol 1e-06
>>  IntFeasTol 1e-05
Finished reading from "/local/scratch/a/sgusev/repos/k_means/data/gams_gurobi_gdp.hull/no_mode/2026-02-14_22-09-11/original/gurobi.opt"

... GRB_LICENSE_FILE = /local/scratch/a/sgusev/gurobi.lic

    Gurobi           52.2.0 d8e408be Dec 8, 2025           LEG x86 64bit/Linux    

... GAMS/Gurobi Link license.
... GMO Q Extraction (ThreePass): 0.00s

    Gurobi Optimizer version 13.0.0 build v13.0.0rc1 (linux64 - "Oracle Linux Server 9.7")
    
    CPU model: AMD EPYC 7643 48-Core Processor, instruction set [SSE2|AVX|AVX2]
    Thread count: 48 physical cores, 96 logical processors, using up to 1 threads
    
    Non-default parameters:
    TimeLimit  300
    MIPGap  1e-06
    LogToConsole  0
    NonConvex  2
    Threads  1
    
    Optimize a model with 803 rows, 472 columns and 1750 nonzeros (Min)
    Model fingerprint: 0x53c5f6f4
    Model has 16 linear objective coefficients
    Model has 64 general nonlinear constraints (384 nonlinear terms)
    Variable types: 408 continuous, 64 integer (0 binary)
    Coefficient statistics:
      Matrix range     [1e+00, 6e+01]
      Objective range  [1e+00, 1e+00]
      Bounds range     [1e+00, 6e+01]
      RHS range        [1e+00, 1e+00]
      NLCon coe range  [1e-05, 1e+00]
    Presolve model has 64 nlconstr
    Added 832 variables to disaggregate expressions
    Presolve removed 192 rows and 144 columns
    Presolve time: 0.01s
    Presolved: 2531 rows, 1161 columns, 6470 nonzeros
    Presolved model has 384 bilinear constraint(s)
    
    Solving non-convex MIQCP to global optimality
    
    Variable types: 1097 continuous, 64 integer (64 binary)
    Found heuristic solution: objective 9.7260101
    
    Root relaxation: objective 0.000000e+00, 358 iterations, 0.00 seconds (0.00 work units)
    
        Nodes    |    Current Node    |     Objective Bounds      |     Work
     Expl Unexpl |  Obj  Depth IntInf | Incumbent    BestBd   Gap | It/Node Time
    
         0     0    0.00000    0  200    9.72601    0.00000   100%     -    0s
         0     0    0.00000    0  200    9.72601    0.00000   100%     -    0s
         0     0    0.00000    0  184    9.72601    0.00000   100%     -    0s
         0     0    0.00000    0  197    9.72601    0.00000   100%     -    0s
         0     0    0.00000    0  197    9.72601    0.00000   100%     -    0s
         0     0    0.00000    0   71    9.72601    0.00000   100%     -    0s
         0     0    0.00000    0   69    9.72601    0.00000   100%     -    0s
         0     0    0.00000    0   93    9.72601    0.00000   100%     -    0s
         0     0    0.00000    0   93    9.72601    0.00000   100%     -    0s
         0     0    0.00000    0   70    9.72601    0.00000   100%     -    0s
         0     0    0.00000    0   70    9.72601    0.00000   100%     -    0s
         0     0    0.00000    0   70    9.72601    0.00000   100%     -    0s
    H    0     0                       7.5860709    0.00000   100%     -    0s
    H    0     0                       5.9686217    0.00000   100%     -    0s
    H    0     0                       5.5546039    0.00000   100%     -    0s
         0     2    0.00000    0   58    5.55460    0.00000   100%     -    0s
    H   32    32                       3.5143486    0.00000   100%  18.6    0s
    H   36    34                       3.3112504    0.00000   100%  17.9    0s
    H  115   101                       3.2876094    0.00000   100%   9.3    0s
    H  485   215                       2.1409953    0.00000   100%  12.8    1s
    H  619   285                       2.0785536    0.00000   100%  12.7    1s
    H  619   271                       2.0772229    0.00000   100%  12.7    1s
    H  619   257                       2.0769084    0.00000   100%  12.7    1s
    H  619   244                       2.0767664    0.00000   100%  12.7    1s
    H  619   232                       2.0767618    0.00000   100%  12.7    1s
    H  632   228                       2.0558153    0.00000   100%  16.9    2s
    H  632   216                       2.0549272    0.00000   100%  16.9    2s
    H  632   205                       2.0549176    0.00000   100%  16.9    2s
    H  632   195                       2.0548282    0.00000   100%  16.9    2s
    H  634   187                       2.0531021    0.00000   100%  17.0    2s
    H  634   177                       2.0422888    0.00000   100%  17.0    2s
    H  640   172                       2.0422744    0.00000   100%  17.0    2s
    H  640   164                       2.0422696    0.00000   100%  17.0    2s
    H  644   158                       2.0421799    0.00000   100%  17.0    2s
    H  654   157                       2.0402640    0.00000   100%  17.0    2s
    H  654   150                       2.0399810    0.00000   100%  17.0    2s
    H  654   143                       2.0380174    0.00000   100%  17.0    2s
    H  654   136                       2.0346230    0.00000   100%  17.0    2s
    H  654   130                       2.0346186    0.00000   100%  17.0    2s
    H  660   128                       2.0228426    0.00000   100%  16.9    2s
    H  674   121                       2.0228426    0.00000   100%  16.8    2s
    H  886   133                       1.6363135    0.00000   100%  14.9    2s
    H 1610   436                       1.6130346    0.00000   100%  13.7    3s
    H 1685   466                       1.5957614    0.00000   100%  13.6    3s
    H 1685   466                       1.5953124    0.00000   100%  13.6    3s
    H 1685   466                       1.5953075    0.00000   100%  13.6    3s
    H 1801   508                       1.5654461    0.00000   100%  13.6    4s
    H 1801   507                       1.5639016    0.00000   100%  13.6    4s
    H 1826   510                       1.5639015    0.00000   100%  13.8    4s
    H 1901   531                       1.5638950    0.00000   100%  13.7    4s
    H 1901   531                       1.5638930    0.00000   100%  13.7    4s
      2412   704    0.77417   28   87    1.56389    0.00000   100%  14.2    5s
    H 2903   869                       1.5638905    0.00000   100%  14.1    5s
    H 4016  1306                       1.5493650    0.00000   100%  14.6    7s
    H 4406  1490                       1.5416047    0.00000   100%  14.3    8s
    H 4406  1490                       1.5369996    0.00000   100%  14.3    8s
    H 4506  1548                       1.5369991    0.00000   100%  14.2    8s
    H 4747  1609                       1.5106738    0.00201   100%  14.3    8s
      5316  1745    0.03648   33   92    1.51067    0.03648  97.6%  14.9   10s
    H 6258  1840                       1.5000889    0.24203  83.9%  14.9   11s
    H 6605  1779                       1.4983035    0.35668  76.2%  14.9   11s
    H 7083  1688                       1.4983025    0.41432  72.3%  14.8   12s
      9721  1642    1.25539   49   36    1.49830    0.60087  59.9%  14.0   15s
     15117  2753    1.35250   66   19    1.49830    0.81422  45.7%  12.4   20s
    H17240  3057                       1.4969396    0.87332  41.7%  12.1   23s
     19194  3421    0.92029   56   62    1.49694    0.91132  39.1%  11.8   25s
     25193  4254    1.26252   64   36    1.49694    1.00086  33.1%  11.1   30s
     31382  4624     cutoff   46         1.49694    1.07441  28.2%  10.6   35s
     38179  4958    1.49621   75   13    1.49694    1.12243  25.0%  10.0   40s
     45437  5301 infeasible   74         1.49694    1.17282  21.7%   9.2   45s
     52484  5371    1.39965   56   29    1.49694    1.20863  19.3%   8.7   50s
     59654  5220    1.35221   60   27    1.49694    1.24825  16.6%   8.2   55s
     66670  4924    1.35133   67   20    1.49694    1.28882  13.9%   7.8   60s
     73789  4668    1.47436   55   22    1.49694    1.32386  11.6%   7.5   65s
     80783  3680     cutoff   72         1.49694    1.36132  9.06%   7.2   70s
     87043  1765    1.45063   77   28    1.49694    1.41734  5.32%   7.1   75s
    *90222   952             115       1.4969292    1.46747  1.97%   7.0   77s
     93088   672    1.49634   90   19    1.49693    1.48835  0.57%   6.9   80s
     100458   682    1.49691  110    2    1.49693    1.49676  0.01%   6.6   85s
     109156   788    1.49688  115    2    1.49693    1.49688  0.00%   6.2   90s
     118387   427    1.49691  115    8    1.49693    1.49691  0.00%   5.8   95s
    
    Cutting planes:
      Learned: 80
      Gomory: 2
      Implied bound: 28
      Projected implied bound: 2
      MIR: 5
      Flow cover: 107
      RLT: 32
      Relax-and-lift: 25
    
    Explored 120708 nodes (689012 simplex iterations) in 96.37 seconds (71.94 work units)
    Thread count was 1 (of 96 available processors)
    
    Solution count 10: 1.49693 1.49693 1.49694 ... 1.5416
    
    Optimal solution found (tolerance 1.00e-06)
    Warning: max constraint violation (1.3539e-06) exceeds tolerance
    Warning: max general constraint violation (1.3539e-06) exceeds tolerance
    Best objective 1.496929172016e+00, best bound 1.496927889740e+00, gap 0.0001%
    
    User-callback calls 120759, time in user-callback 0.01 sec

... Solving fixed model...

    Gurobi Optimizer version 13.0.0 build v13.0.0rc1 (linux64 - "Oracle Linux Server 9.7")
    
    CPU model: AMD EPYC 7643 48-Core Processor, instruction set [SSE2|AVX|AVX2]
    Thread count: 48 physical cores, 96 logical processors, using up to 1 threads
    
    Non-default parameters:
    TimeLimit  300
    MIPGap  1e-06
    LogToConsole  0
    NonConvex  2
    Threads  1
    
    Optimize a model with 803 rows, 472 columns and 1750 nonzeros (Min)
    Model fingerprint: 0x47d62871
    Model has 16 linear objective coefficients
    Coefficient statistics:
      Matrix range     [1e+00, 6e+01]
      Objective range  [1e+00, 1e+00]
      Bounds range     [4e-03, 6e+01]
      RHS range        [1e+00, 1e+00]
    Presolve removed 803 rows and 472 columns
    Presolve time: 0.00s
    Presolve: All rows and columns removed
    Iteration    Objective       Primal Inf.    Dual Inf.      Time
           0    1.4969292e+00   0.000000e+00   0.000000e+00      0s
    
    Solved in 0 iterations and 0.00 seconds (0.00 work units)
    Optimal objective  1.496929172e+00
    
    User-callback calls 0, time in user-callback 0.00 sec

--- Reading solution for model GAMS_MODEL
***
*** Solver did not provide marginals for model GAMS_MODEL
***
--- Executing after solve: elapsed 0:01:36.430
--- model.gms(2669) 3 Mb
--- model.gms(3932) 5 Mb
--- Putfile results /local/scratch/a/sgusev/repos/k_means/data/gams_gurobi_gdp.hull/no_mode/2026-02-14_22-09-11/original/results.dat
--- Putfile statresults /local/scratch/a/sgusev/repos/k_means/data/gams_gurobi_gdp.hull/no_mode/2026-02-14_22-09-11/original/resultsstat.dat
*** Status: Normal completion
--- Job model.gms Stop 02/14/26 22:10:48 elapsed 0:01:36.435
Original problem solved. Time taken: 97.02350282669067 seconds
Original objective value: 1.496929172019275
