Solving original (integer) problem with strategy gdp.binary_multiplication...
--- Job model.gms Start 02/18/26 23:11:36 52.2.0 d8e408be LEX-LEG x86 64bit/Linux
--- Applying:
    /package/gams/52.2/gmsprmun.txt
--- GAMS Parameters defined
    Input /local/scratch/a/sgusev/repos/k_means/data/gams_gurobi_gdp.binary_multiplication/no_mode/2026-02-18_23-11-36/original/model.gms
    Output /local/scratch/a/sgusev/repos/k_means/data/gams_gurobi_gdp.binary_multiplication/no_mode/2026-02-18_23-11-36/original/output.lst
    ScrDir /local/scratch/a/sgusev/repos/k_means/data/gams_gurobi_gdp.binary_multiplication/no_mode/2026-02-18_23-11-36/original/225a/
    SysDir /package/gams/52.2/
    CurDir /local/scratch/a/sgusev/repos/k_means/data/gams_gurobi_gdp.binary_multiplication/no_mode/2026-02-18_23-11-36/original/
    LogOption 3
    AppendLog 1
Licensee: David Bernal / SECQUOIA Research Group         G251008+0003Ac-GEN
          Purdue University, Davidson School of Chemical EngineeringDCE4838
          225a/gamslice.dat
          5a82958a-fbca-4a23
          node:66820903 mem:995 cores:48 ipport:51909 v:2                  
          Evaluation license: Not for commercial or production use
          The time-limited license stops working on : Jun 30, 2027
System information: 48 physical cores and 995 Gb physical memory detected
GAMS 52.2.0   Copyright (C) 1987-2025 GAMS Development. All rights reserved
--- Starting compilation
--- model.gms(209) 2 Mb
--- $echo File /local/scratch/a/sgusev/repos/k_means/data/gams_gurobi_gdp.binary_multiplication/no_mode/2026-02-18_23-11-36/original/gurobi.opt
--- model.gms(381) 2 Mb
--- Starting execution: elapsed 0:00:00.006
--- model.gms(218) 3 Mb
--- Generating MINLP model GAMS_MODEL
--- model.gms(222) 5 Mb
---   51 rows  55 columns  197 non-zeroes
---   396 nl-code  144 nl-non-zeroes
---   36 discrete-columns
--- Range statistics (absolute non-zero finite values)
--- RHS       [min, max] : [ 1.000E+00, 1.000E+00] - Zero values observed as well
--- Bound     [min, max] : [ 1.000E+00, 4.800E+01] - Zero values observed as well
--- Matrix    [min, max] : [ 9.248E-02, 1.546E+00] - Zero values observed as well
--- model.gms(222) 3 Mb
--- Executing GUROBI (Solvelink=5): elapsed 0:00:00.009
Reading parameter(s) from "/local/scratch/a/sgusev/repos/k_means/data/gams_gurobi_gdp.binary_multiplication/no_mode/2026-02-18_23-11-36/original/gurobi.opt"
>>  NonConvex 2
>>  Threads 1
>>  MIPGap 1e-06
>>  MIPGapAbs 1e-10
>>  FeasibilityTol 1e-06
>>  OptimalityTol 1e-06
>>  IntFeasTol 1e-05
Finished reading from "/local/scratch/a/sgusev/repos/k_means/data/gams_gurobi_gdp.binary_multiplication/no_mode/2026-02-18_23-11-36/original/gurobi.opt"

... GRB_LICENSE_FILE = /local/scratch/a/sgusev/gurobi.lic

    Gurobi           52.2.0 d8e408be Dec 8, 2025           LEG x86 64bit/Linux    

... GAMS/Gurobi Link license.
... GMO Q Extraction (ThreePass): 0.00s

    Gurobi Optimizer version 13.0.0 build v13.0.0rc1 (linux64 - "Oracle Linux Server 9.7")
    
    CPU model: AMD EPYC 7643 48-Core Processor, instruction set [SSE2|AVX|AVX2]
    Thread count: 48 physical cores, 96 logical processors, using up to 1 threads
    
    Non-default parameters:
    TimeLimit  300
    MIPGap  1e-06
    LogToConsole  0
    NonConvex  2
    Threads  1
    
    Optimize a model with 50 rows, 90 columns and 76 nonzeros (Min)
    Model fingerprint: 0xa156035c
    Model has 12 linear objective coefficients
    Model has 36 general nonlinear constraints (108 nonlinear terms)
    Variable types: 54 continuous, 36 integer (0 binary)
    Coefficient statistics:
      Matrix range     [1e+00, 1e+00]
      Objective range  [1e+00, 1e+00]
      Bounds range     [1e+00, 5e+01]
      RHS range        [1e+00, 1e+00]
      NLCon coe range  [8e-02, 1e+00]
    Presolve model has 36 nlconstr
    Added 180 variables to disaggregate expressions
    Presolve removed 36 rows and 0 columns
    Presolve time: 0.00s
    Presolved: 482 rows, 307 columns, 1120 nonzeros
    Presolved model has 72 bilinear constraint(s)
    
    Solving non-convex MIQCP to global optimality
    
    Variable types: 271 continuous, 36 integer (36 binary)
    Found heuristic solution: objective 8.9348330
    
    Root relaxation: objective 0.000000e+00, 33 iterations, 0.00 seconds (0.00 work units)
    
        Nodes    |    Current Node    |     Objective Bounds      |     Work
     Expl Unexpl |  Obj  Depth IntInf | Incumbent    BestBd   Gap | It/Node Time
    
         0     0    0.00000    0   72    8.93483    0.00000   100%     -    0s
    H    0     0                       7.8906095    0.00000   100%     -    0s
         0     0    0.00000    0   86    7.89061    0.00000   100%     -    0s
         0     0    0.00000    0   98    7.89061    0.00000   100%     -    0s
         0     0    0.00000    0   79    7.89061    0.00000   100%     -    0s
    H    0     0                       6.8919543    0.00000   100%     -    0s
         0     0    0.00000    0   79    6.89195    0.00000   100%     -    0s
         0     0    0.00000    0   91    6.89195    0.00000   100%     -    0s
         0     0    0.00000    0   84    6.89195    0.00000   100%     -    0s
         0     0    0.00000    0   84    6.89195    0.00000   100%     -    0s
         0     0    0.00000    0   88    6.89195    0.00000   100%     -    0s
         0     0    0.00000    0   78    6.89195    0.00000   100%     -    0s
         0     0    0.00000    0   78    6.89195    0.00000   100%     -    0s
    H    0     0                       5.6951415    0.00000   100%     -    0s
    H    0     0                       5.4378113    0.00000   100%     -    0s
    H    0     0                       5.0401792    0.00000   100%     -    0s
    H    0     0                       4.9196581    0.00000   100%     -    0s
    H    0     0                       4.6403719    0.00000   100%     -    0s
         0     2    0.00000    0   78    4.64037    0.00000   100%     -    0s
    H   46    23                       3.0092485    0.00000   100%  10.4    0s
    H   82    41                       2.6837456    0.00000   100%  14.6    0s
    H  328   176                       2.6031754    0.00000   100%  11.8    0s
    H  350   180                       2.6031754    0.00000   100%  12.2    0s
    H 1228   356                       2.3419288    0.54441  76.8%  16.6    1s
    H 1230   332                       2.1991550    0.54441  75.2%  16.6    1s
    * 2916   212              81       2.1991477    2.00158  8.98%  13.7    1s
     10161   365     cutoff   78         2.19915    2.19876  0.02%   8.7    5s
    
    Explored 14288 nodes (121685 simplex iterations) in 6.53 seconds (4.23 work units)
    Thread count was 1 (of 96 available processors)
    
    Solution count 10: 2.19915 2.19915 2.34193 ... 5.43781
    
    Optimal solution found (tolerance 1.00e-06)
    Warning: max constraint violation (1.2432e-06) exceeds tolerance
    Warning: max general constraint violation (1.2432e-06) exceeds tolerance
    Best objective 2.199147685649e+00, best bound 2.199146091523e+00, gap 0.0001%
    
    User-callback calls 14309, time in user-callback 0.00 sec

... Solving fixed model...

    Gurobi Optimizer version 13.0.0 build v13.0.0rc1 (linux64 - "Oracle Linux Server 9.7")
    
    CPU model: AMD EPYC 7643 48-Core Processor, instruction set [SSE2|AVX|AVX2]
    Thread count: 48 physical cores, 96 logical processors, using up to 1 threads
    
    Non-default parameters:
    TimeLimit  300
    MIPGap  1e-06
    LogToConsole  0
    NonConvex  2
    Threads  1
    
    Optimize a model with 50 rows, 90 columns and 76 nonzeros (Min)
    Model fingerprint: 0xcf561685
    Model has 12 linear objective coefficients
    Coefficient statistics:
      Matrix range     [1e+00, 1e+00]
      Objective range  [1e+00, 1e+00]
      Bounds range     [5e-02, 1e+00]
      RHS range        [1e+00, 1e+00]
    Presolve removed 50 rows and 90 columns
    Presolve time: 0.00s
    Presolve: All rows and columns removed
    Iteration    Objective       Primal Inf.    Dual Inf.      Time
           0    2.1991477e+00   0.000000e+00   0.000000e+00      0s
    
    Solved in 0 iterations and 0.00 seconds (0.00 work units)
    Optimal objective  2.199147686e+00
    
    User-callback calls 0, time in user-callback 0.00 sec

--- Reading solution for model GAMS_MODEL
***
*** Solver did not provide marginals for model GAMS_MODEL
***
--- Executing after solve: elapsed 0:00:06.563
--- model.gms(225) 3 Mb
--- model.gms(381) 5 Mb
--- Putfile results /local/scratch/a/sgusev/repos/k_means/data/gams_gurobi_gdp.binary_multiplication/no_mode/2026-02-18_23-11-36/original/results.dat
--- Putfile statresults /local/scratch/a/sgusev/repos/k_means/data/gams_gurobi_gdp.binary_multiplication/no_mode/2026-02-18_23-11-36/original/resultsstat.dat
*** Status: Normal completion
--- Job model.gms Stop 02/18/26 23:11:43 elapsed 0:00:06.564
Original problem solved. Time taken: 7.051209211349487 seconds
Original objective value: 2.199147685649291
