Solving original (integer) problem with strategy gdp.binary_multiplication...
--- Job model.gms Start 02/19/26 02:27:14 52.2.0 d8e408be LEX-LEG x86 64bit/Linux
--- Applying:
    /package/gams/52.2/gmsprmun.txt
--- GAMS Parameters defined
    Input /local/scratch/a/sgusev/repos/k_means/data/gams_gurobi_gdp.binary_multiplication/no_mode/2026-02-19_02-27-14/original/model.gms
    Output /local/scratch/a/sgusev/repos/k_means/data/gams_gurobi_gdp.binary_multiplication/no_mode/2026-02-19_02-27-14/original/output.lst
    ScrDir /local/scratch/a/sgusev/repos/k_means/data/gams_gurobi_gdp.binary_multiplication/no_mode/2026-02-19_02-27-14/original/225a/
    SysDir /package/gams/52.2/
    CurDir /local/scratch/a/sgusev/repos/k_means/data/gams_gurobi_gdp.binary_multiplication/no_mode/2026-02-19_02-27-14/original/
    LogOption 3
    AppendLog 1
Licensee: David Bernal / SECQUOIA Research Group         G251008+0003Ac-GEN
          Purdue University, Davidson School of Chemical EngineeringDCE4838
          225a/gamslice.dat
          5a82958a-fbca-4a23
          node:66820903 mem:995 cores:48 ipport:43391 v:2                  
          Evaluation license: Not for commercial or production use
          The time-limited license stops working on : Jun 30, 2027
System information: 48 physical cores and 995 Gb physical memory detected
GAMS 52.2.0   Copyright (C) 1987-2025 GAMS Development. All rights reserved
--- Starting compilation
--- model.gms(270) 2 Mb
--- $echo File /local/scratch/a/sgusev/repos/k_means/data/gams_gurobi_gdp.binary_multiplication/no_mode/2026-02-19_02-27-14/original/gurobi.opt
--- model.gms(477) 2 Mb
--- Starting execution: elapsed 0:00:00.006
--- model.gms(279) 3 Mb
--- Generating MINLP model GAMS_MODEL
--- model.gms(283) 5 Mb
---   67 rows  74 columns  309 non-zeroes
---   720 nl-code  240 nl-non-zeroes
---   48 discrete-columns
--- Range statistics (absolute non-zero finite values)
--- RHS       [min, max] : [ 1.000E+00, 1.000E+00] - Zero values observed as well
--- Bound     [min, max] : [ 1.000E+00, 9.600E+01] - Zero values observed as well
--- Matrix    [min, max] : [ 1.508E-01, 1.696E+00] - Zero values observed as well
--- model.gms(283) 3 Mb
--- Executing GUROBI (Solvelink=5): elapsed 0:00:00.009
Reading parameter(s) from "/local/scratch/a/sgusev/repos/k_means/data/gams_gurobi_gdp.binary_multiplication/no_mode/2026-02-19_02-27-14/original/gurobi.opt"
>>  NonConvex 2
>>  Threads 1
>>  MIPGap 1e-06
>>  MIPGapAbs 1e-10
>>  FeasibilityTol 1e-06
>>  OptimalityTol 1e-06
>>  IntFeasTol 1e-05
Finished reading from "/local/scratch/a/sgusev/repos/k_means/data/gams_gurobi_gdp.binary_multiplication/no_mode/2026-02-19_02-27-14/original/gurobi.opt"

... GRB_LICENSE_FILE = /local/scratch/a/sgusev/gurobi.lic

    Gurobi           52.2.0 d8e408be Dec 8, 2025           LEG x86 64bit/Linux    

... GAMS/Gurobi Link license.
... GMO Q Extraction (ThreePass): 0.00s

    Gurobi Optimizer version 13.0.0 build v13.0.0rc1 (linux64 - "Oracle Linux Server 9.7")
    
    CPU model: AMD EPYC 7643 48-Core Processor, instruction set [SSE2|AVX|AVX2]
    Thread count: 48 physical cores, 96 logical processors, using up to 1 threads
    
    Non-default parameters:
    TimeLimit  300
    MIPGap  1e-06
    LogToConsole  0
    NonConvex  2
    Threads  1
    
    Optimize a model with 66 rows, 121 columns and 100 nonzeros (Min)
    Model fingerprint: 0x2780e54d
    Model has 16 linear objective coefficients
    Model has 48 general nonlinear constraints (192 nonlinear terms)
    Variable types: 73 continuous, 48 integer (0 binary)
    Coefficient statistics:
      Matrix range     [1e+00, 1e+00]
      Objective range  [1e+00, 1e+00]
      Bounds range     [1e+00, 1e+02]
      RHS range        [1e+00, 1e+00]
      NLCon coe range  [1e-02, 1e+00]
    Presolve model has 48 nlconstr
    Added 336 variables to disaggregate expressions
    Presolve removed 48 rows and 0 columns
    Presolve time: 0.00s
    Presolved: 834 rows, 506 columns, 1924 nonzeros
    Presolved model has 144 bilinear constraint(s)
    
    Solving non-convex MIQCP to global optimality
    
    Variable types: 458 continuous, 48 integer (48 binary)
    Found heuristic solution: objective 15.2757687
    
    Root relaxation: objective 0.000000e+00, 254 iterations, 0.00 seconds (0.00 work units)
    
        Nodes    |    Current Node    |     Objective Bounds      |     Work
     Expl Unexpl |  Obj  Depth IntInf | Incumbent    BestBd   Gap | It/Node Time
    
         0     0    0.00000    0   69   15.27577    0.00000   100%     -    0s
         0     0    0.00000    0   88   15.27577    0.00000   100%     -    0s
         0     0    0.00000    0  172   15.27577    0.00000   100%     -    0s
         0     0    0.00000    0  144   15.27577    0.00000   100%     -    0s
    H    0     0                      14.4081945    0.00000   100%     -    0s
         0     0    0.00000    0  144   14.40819    0.00000   100%     -    0s
         0     0    0.00000    0  169   14.40819    0.00000   100%     -    0s
         0     0    0.00000    0  166   14.40819    0.00000   100%     -    0s
         0     0    0.00000    0  166   14.40819    0.00000   100%     -    0s
         0     0    0.00000    0  174   14.40819    0.00000   100%     -    0s
         0     0    0.00000    0  158   14.40819    0.00000   100%     -    0s
    H    0     0                      13.6027895    0.00000   100%     -    0s
    H    0     0                      13.3652092    0.00000   100%     -    0s
         0     0    0.00000    0  172   13.36521    0.00000   100%     -    0s
         0     0    0.00000    0  174   13.36521    0.00000   100%     -    0s
         0     0    0.00000    0  168   13.36521    0.00000   100%     -    0s
         0     0    0.00000    0  168   13.36521    0.00000   100%     -    0s
         0     0    0.00000    0  161   13.36521    0.00000   100%     -    0s
    H    0     0                      12.0229451    0.00000   100%     -    0s
         0     2    0.00000    0  161   12.02295    0.00000   100%     -    0s
    H    4     4                      11.4067327    0.00000   100%  23.0    0s
    H    4     4                      10.7762857    0.00000   100%  23.0    0s
    H    5     5                      10.6820976    0.00000   100%  28.2    0s
    H    5     5                      10.1853174    0.00000   100%  28.2    0s
    H    6     6                       8.7028421    0.00000   100%  24.5    0s
    H    7     7                       8.7028421    0.00000   100%  27.1    0s
    H 1069   611                       8.1080707    0.00000   100%  21.0    2s
    H 1070   591                       7.8196488    0.00000   100%  21.0    2s
    H 1070   570                       7.8196488    0.00000   100%  21.0    2s
    H 1152   575                       7.7538310    0.00000   100%  20.2    2s
    H 1188   546                       7.6264170    0.00000   100%  20.4    2s
    H 1188   528                       7.6256757    0.00000   100%  20.4    2s
    H 1188   512                       7.6256540    0.00000   100%  20.4    2s
    H 1188   496                       7.6256519    0.00000   100%  20.4    2s
    H 1287   485                       7.6256519    0.00000   100%  20.6    2s
    H 2287  1018                       7.6256503    0.93860  87.7%  20.5    3s
    H 4876  2168                       7.6229002    1.58105  79.3%  20.5    4s
    H 4876  2168                       7.6217935    1.58105  79.3%  20.5    4s
    H 4876  2168                       7.6210824    1.58105  79.3%  20.5    4s
      5007  2230 infeasible   29         7.62108    1.62437  78.7%  20.5    5s
    H 5876  2564                       7.6209977    1.76670  76.8%  20.5    5s
    H 6097  2648                       7.6209977    1.80590  76.3%  20.6    5s
    H 6489  2797                       7.6064689    1.88051  75.3%  20.6    6s
    H 7489  2862                       6.9082568    2.05762  70.2%  20.8    7s
    H 9133  3325                       6.9004416    2.34747  66.0%  21.3    8s
    H 9133  3325                       6.9000264    2.34747  66.0%  21.3    8s
     10646  3759     cutoff   29         6.90003    2.51194  63.6%  21.2   10s
     16327  4984    5.06839   28  159    6.90003    3.03146  56.1%  21.5   15s
    H17115  5136                       6.8985645    3.09433  55.1%  21.5   15s
    H17115  5134                       6.8980016    3.09433  55.1%  21.5   15s
    H17115  5134                       6.8979470    3.09433  55.1%  21.5   15s
    H17115  5134                       6.8977687    3.09433  55.1%  21.5   15s
    H18118  5306                       6.8977651    3.18173  53.9%  21.5   16s
    H19067  5516                       6.8898825    3.24513  52.9%  21.5   17s
     21653  5975    3.39964   20  166    6.88988    3.39964  50.7%  21.5   20s
     27340  6815     cutoff   34         6.88988    3.69412  46.4%  21.6   25s
     32892  7421     cutoff   34         6.88988    3.95706  42.6%  21.5   30s
     38143  7809 infeasible   23         6.88988    4.16712  39.5%  21.6   35s
     43544  8068     cutoff   33         6.88988    4.36725  36.6%  21.5   40s
     48563  8152     cutoff   31         6.88988    4.54516  34.0%  21.5   45s
     53915  8125     cutoff   35         6.88988    4.71293  31.6%  21.5   50s
     59018  7833     cutoff   35         6.88988    4.88243  29.1%  21.5   55s
     63762  7474    5.45936   28  157    6.88988    5.03292  27.0%  21.4   60s
     68282  6928     cutoff   30         6.88988    5.18506  24.7%  21.4   65s
    H70913  6481                       6.8897205    5.28487  23.3%  21.4   67s
    H70922  6478                       6.8897205    5.28512  23.3%  21.4   67s
    H71458  6360                       6.8897205    5.30615  23.0%  21.4   68s
    H72447  6027                       6.7681442    5.34061  21.1%  21.4   69s
    H72474  6022                       6.7681442    5.34152  21.1%  21.4   69s
    H72529  6005                       6.7681442    5.34430  21.0%  21.4   69s
     72947  5912     cutoff   35         6.76814    5.36352  20.8%  21.4   70s
     77207  4640    5.67794   30  152    6.76814    5.58860  17.4%  21.4   75s
     81936  3035     cutoff   30         6.76814    5.90629  12.7%  21.3   80s
     87107  1572     cutoff   52         6.76814    6.28573  7.13%  20.9   85s
    *90142  1356             120       6.7681262    6.44302  4.80%  20.6   87s
     92747  1502    6.72567   56   80    6.76813    6.52439  3.60%  20.3   90s
     98730  2063    6.61006   54   80    6.76813    6.60319  2.44%  19.6   95s
     104913  2290     cutoff   62         6.76813    6.65841  1.62%  19.0  100s
     111512  2663    6.76599   64   80    6.76813    6.69128  1.14%  18.4  105s
     118347  2908    6.74821   66   96    6.76813    6.71445  0.79%  17.8  110s
     125303  3368    6.76038   68   48    6.76813    6.72555  0.63%  17.3  115s
     132023  2940     cutoff   68         6.76813    6.73573  0.48%  16.8  120s
     138873  2896     cutoff   69         6.76813    6.74864  0.29%  16.4  125s
     145363  3028     cutoff   79         6.76813    6.75763  0.16%  16.0  130s
     153372  3177    6.76431   81  112    6.76813    6.76278  0.08%  15.4  135s
     161335  3068    6.76770   83   48    6.76813    6.76488  0.05%  14.9  140s
     169611  3036    6.76806   88   80    6.76813    6.76596  0.03%  14.4  145s
     177546  2885    6.76812   92   95    6.76813    6.76673  0.02%  14.0  150s
     185702  3053     cutoff   99         6.76813    6.76730  0.01%  13.6  155s
     193665  2696    6.76794  103  112    6.76813    6.76763  0.01%  13.2  160s
     201734  3187    6.76808  105  112    6.76813    6.76783  0.00%  12.8  165s
     209665  2912     cutoff   92         6.76813    6.76797  0.00%  12.5  170s
     217817  2528    6.76812  115   32    6.76813    6.76803  0.00%  12.2  175s
     225832  1191    6.76812  114   64    6.76813    6.76810  0.00%  12.0  180s
    
    Cutting planes:
      Gomory: 3
      Implied bound: 1
      MIR: 6
      Flow cover: 30
      Inf proof: 2
      RLT: 2
    
    Explored 227406 nodes (2706035 simplex iterations) in 180.98 seconds (126.65 work units)
    Thread count was 1 (of 96 available processors)
    
    Solution count 10: 6.76813 6.76814 6.88972 ... 6.90003
    
    Optimal solution found (tolerance 1.00e-06)
    Warning: max constraint violation (1.8061e-06) exceeds tolerance
    Warning: max general constraint violation (1.8061e-06) exceeds tolerance
    Best objective 6.768126167785e+00, best bound 6.768119451805e+00, gap 0.0001%
    
    User-callback calls 227457, time in user-callback 0.01 sec

... Solving fixed model...

    Gurobi Optimizer version 13.0.0 build v13.0.0rc1 (linux64 - "Oracle Linux Server 9.7")
    
    CPU model: AMD EPYC 7643 48-Core Processor, instruction set [SSE2|AVX|AVX2]
    Thread count: 48 physical cores, 96 logical processors, using up to 1 threads
    
    Non-default parameters:
    TimeLimit  300
    MIPGap  1e-06
    LogToConsole  0
    NonConvex  2
    Threads  1
    
    Optimize a model with 66 rows, 121 columns and 100 nonzeros (Min)
    Model fingerprint: 0x68cb5287
    Model has 16 linear objective coefficients
    Coefficient statistics:
      Matrix range     [1e+00, 1e+00]
      Objective range  [1e+00, 1e+00]
      Bounds range     [5e-02, 1e+00]
      RHS range        [1e+00, 1e+00]
    Presolve removed 66 rows and 121 columns
    Presolve time: 0.00s
    Presolve: All rows and columns removed
    Iteration    Objective       Primal Inf.    Dual Inf.      Time
           0    6.7681262e+00   0.000000e+00   0.000000e+00      0s
    
    Solved in 0 iterations and 0.00 seconds (0.00 work units)
    Optimal objective  6.768126168e+00
    
    User-callback calls 0, time in user-callback 0.00 sec

--- Reading solution for model GAMS_MODEL
***
*** Solver did not provide marginals for model GAMS_MODEL
***
--- Executing after solve: elapsed 0:03:01.015
--- model.gms(286) 3 Mb
--- model.gms(477) 5 Mb
--- Putfile results /local/scratch/a/sgusev/repos/k_means/data/gams_gurobi_gdp.binary_multiplication/no_mode/2026-02-19_02-27-14/original/results.dat
--- Putfile statresults /local/scratch/a/sgusev/repos/k_means/data/gams_gurobi_gdp.binary_multiplication/no_mode/2026-02-19_02-27-14/original/resultsstat.dat
*** Status: Normal completion
--- Job model.gms Stop 02/19/26 02:30:15 elapsed 0:03:01.015
Original problem solved. Time taken: 181.4761142730713 seconds
Original objective value: 6.768126167785501
