Solving original (integer) problem with strategy gdp.binary_multiplication...
--- Job model.gms Start 02/18/26 23:12:52 52.2.0 d8e408be LEX-LEG x86 64bit/Linux
--- Applying:
    /package/gams/52.2/gmsprmun.txt
--- GAMS Parameters defined
    Input /local/scratch/a/sgusev/repos/k_means/data/gams_gurobi_gdp.binary_multiplication/no_mode/2026-02-18_23-12-52/original/model.gms
    Output /local/scratch/a/sgusev/repos/k_means/data/gams_gurobi_gdp.binary_multiplication/no_mode/2026-02-18_23-12-52/original/output.lst
    ScrDir /local/scratch/a/sgusev/repos/k_means/data/gams_gurobi_gdp.binary_multiplication/no_mode/2026-02-18_23-12-52/original/225a/
    SysDir /package/gams/52.2/
    CurDir /local/scratch/a/sgusev/repos/k_means/data/gams_gurobi_gdp.binary_multiplication/no_mode/2026-02-18_23-12-52/original/
    LogOption 3
    AppendLog 1
Licensee: David Bernal / SECQUOIA Research Group         G251008+0003Ac-GEN
          Purdue University, Davidson School of Chemical EngineeringDCE4838
          225a/gamslice.dat
          5a82958a-fbca-4a23
          node:66820903 mem:995 cores:48 ipport:37917 v:2                  
          Evaluation license: Not for commercial or production use
          The time-limited license stops working on : Jun 30, 2027
System information: 48 physical cores and 995 Gb physical memory detected
GAMS 52.2.0   Copyright (C) 1987-2025 GAMS Development. All rights reserved
--- Starting compilation
--- model.gms(205) 2 Mb
--- $echo File /local/scratch/a/sgusev/repos/k_means/data/gams_gurobi_gdp.binary_multiplication/no_mode/2026-02-18_23-12-52/original/gurobi.opt
--- model.gms(372) 2 Mb
--- Starting execution: elapsed 0:00:00.006
--- model.gms(214) 3 Mb
--- Generating MINLP model GAMS_MODEL
--- model.gms(218) 5 Mb
---   47 rows  54 columns  214 non-zeroes
---   495 nl-code  165 nl-non-zeroes
---   33 discrete-columns
--- Range statistics (absolute non-zero finite values)
--- RHS       [min, max] : [ 1.000E+00, 1.000E+00] - Zero values observed as well
--- Bound     [min, max] : [ 1.000E+00, 6.600E+01] - Zero values observed as well
--- Matrix    [min, max] : [ 2.844E-01, 2.038E+00] - Zero values observed as well
--- model.gms(218) 3 Mb
--- Executing GUROBI (Solvelink=5): elapsed 0:00:00.009
Reading parameter(s) from "/local/scratch/a/sgusev/repos/k_means/data/gams_gurobi_gdp.binary_multiplication/no_mode/2026-02-18_23-12-52/original/gurobi.opt"
>>  NonConvex 2
>>  Threads 1
>>  MIPGap 1e-06
>>  MIPGapAbs 1e-10
>>  FeasibilityTol 1e-06
>>  OptimalityTol 1e-06
>>  IntFeasTol 1e-05
Finished reading from "/local/scratch/a/sgusev/repos/k_means/data/gams_gurobi_gdp.binary_multiplication/no_mode/2026-02-18_23-12-52/original/gurobi.opt"

... GRB_LICENSE_FILE = /local/scratch/a/sgusev/gurobi.lic

    Gurobi           52.2.0 d8e408be Dec 8, 2025           LEG x86 64bit/Linux    

... GAMS/Gurobi Link license.
... GMO Q Extraction (ThreePass): 0.00s

    Gurobi Optimizer version 13.0.0 build v13.0.0rc1 (linux64 - "Oracle Linux Server 9.7")
    
    CPU model: AMD EPYC 7643 48-Core Processor, instruction set [SSE2|AVX|AVX2]
    Thread count: 48 physical cores, 96 logical processors, using up to 1 threads
    
    Non-default parameters:
    TimeLimit  300
    MIPGap  1e-06
    LogToConsole  0
    NonConvex  2
    Threads  1
    
    Optimize a model with 46 rows, 86 columns and 70 nonzeros (Min)
    Model fingerprint: 0x132c62fc
    Model has 11 linear objective coefficients
    Model has 33 general nonlinear constraints (132 nonlinear terms)
    Variable types: 53 continuous, 33 integer (0 binary)
    Coefficient statistics:
      Matrix range     [1e+00, 1e+00]
      Objective range  [1e+00, 1e+00]
      Bounds range     [1e+00, 7e+01]
      RHS range        [1e+00, 1e+00]
      NLCon coe range  [1e-02, 9e-01]
    Presolve model has 33 nlconstr
    Added 231 variables to disaggregate expressions
    Presolve removed 33 rows and 0 columns
    Presolve time: 0.00s
    Presolved: 574 rows, 351 columns, 1324 nonzeros
    Presolved model has 99 bilinear constraint(s)
    
    Solving non-convex MIQCP to global optimality
    
    Variable types: 318 continuous, 33 integer (33 binary)
    Found heuristic solution: objective 8.7789380
    
    Root relaxation: objective 0.000000e+00, 34 iterations, 0.00 seconds (0.00 work units)
    
        Nodes    |    Current Node    |     Objective Bounds      |     Work
     Expl Unexpl |  Obj  Depth IntInf | Incumbent    BestBd   Gap | It/Node Time
    
         0     0    0.00000    0   99    8.77894    0.00000   100%     -    0s
         0     0    0.00000    0  115    8.77894    0.00000   100%     -    0s
         0     0    0.00000    0  118    8.77894    0.00000   100%     -    0s
         0     0    0.00000    0  111    8.77894    0.00000   100%     -    0s
         0     0    0.00000    0  111    8.77894    0.00000   100%     -    0s
         0     0    0.00000    0  109    8.77894    0.00000   100%     -    0s
         0     0    0.00000    0  109    8.77894    0.00000   100%     -    0s
         0     0    0.00000    0  109    8.77894    0.00000   100%     -    0s
         0     0    0.00000    0  109    8.77894    0.00000   100%     -    0s
    H    0     0                       5.5805826    0.00000   100%     -    0s
    H    0     0                       4.8866981    0.00000   100%     -    0s
         0     2    0.00000    0  109    4.88670    0.00000   100%     -    0s
    H    2     2                       4.8631543    0.00000   100%  15.5    0s
    H    3     3                       4.8258257    0.00000   100%  12.7    0s
    H    3     3                       4.5768824    0.00000   100%  12.7    0s
    H    4     4                       4.5768824    0.00000   100%  15.0    0s
    H    5     5                       4.5672258    0.00000   100%  15.2    0s
    H   26    26                       4.3392764    0.00000   100%   9.9    0s
    H   26    26                       4.3392764    0.00000   100%   9.9    0s
    H   33    32                       4.3209665    0.00000   100%   9.0    0s
    H   33    32                       4.3209665    0.00000   100%   9.0    0s
    H   33    32                       4.2064840    0.00000   100%   9.0    0s
    H   37    36                       4.2064840    0.00000   100%   9.1    0s
    H  726   458                       4.1385222    0.00000   100%  14.6    1s
    H  755   432                       3.7491828    0.00000   100%  14.9    1s
    H 1721   487                       3.6328729    0.56435  84.5%  16.7    1s
    H 1965   484                       3.3817002    0.56977  83.2%  15.9    1s
    H 2952   561                       3.3817002    1.22214  63.9%  16.6    2s
      5816   371     cutoff   20         3.38170    2.78367  17.7%  16.6    5s
     14761  1077    3.34752   51   77    3.38170    3.33150  1.48%  10.6   10s
     24715  1559     cutoff   82         3.38170    3.36862  0.39%   8.4   15s
    *25864  1684             105       3.3816920    3.37036  0.34%   8.3   15s
     33904  2684    3.37908   65   55    3.38169    3.37544  0.18%   7.4   20s
     45134  3476     cutoff   73         3.38169    3.37934  0.07%   6.5   25s
     56544  3826    3.38110   70   55    3.38169    3.38015  0.05%   5.9   30s
     67806  3682    3.38078   72   55    3.38169    3.38071  0.03%   5.5   35s
     78620  3684    3.38161   84   44    3.38169    3.38105  0.02%   5.4   40s
     88515  3657    3.38149   81   44    3.38169    3.38126  0.01%   5.4   45s
     99552  3412    3.38152   83   66    3.38169    3.38148  0.01%   5.3   50s
     111394  3020    3.38162   92   66    3.38169    3.38157  0.00%   5.1   55s
     122792  2122     cutoff   83         3.38169    3.38163  0.00%   4.9   60s
    
    Cutting planes:
      Gomory: 3
      Implied bound: 3
      MIR: 6
      Flow cover: 17
      RLT: 2
    
    Explored 132853 nodes (642870 simplex iterations) in 64.20 seconds (43.08 work units)
    Thread count was 1 (of 96 available processors)
    
    Solution count 10: 3.38169 3.3817 3.63287 ... 4.57688
    
    Optimal solution found (tolerance 1.00e-06)
    Warning: max constraint violation (1.7711e-06) exceeds tolerance
    Warning: max general constraint violation (1.7711e-06) exceeds tolerance
    Best objective 3.381692017074e+00, best bound 3.381688675806e+00, gap 0.0001%
    
    User-callback calls 132877, time in user-callback 0.01 sec

... Solving fixed model...

    Gurobi Optimizer version 13.0.0 build v13.0.0rc1 (linux64 - "Oracle Linux Server 9.7")
    
    CPU model: AMD EPYC 7643 48-Core Processor, instruction set [SSE2|AVX|AVX2]
    Thread count: 48 physical cores, 96 logical processors, using up to 1 threads
    
    Non-default parameters:
    TimeLimit  300
    MIPGap  1e-06
    LogToConsole  0
    NonConvex  2
    Threads  1
    
    Optimize a model with 46 rows, 86 columns and 70 nonzeros (Min)
    Model fingerprint: 0x265ec4d3
    Model has 11 linear objective coefficients
    Coefficient statistics:
      Matrix range     [1e+00, 1e+00]
      Objective range  [1e+00, 1e+00]
      Bounds range     [8e-02, 1e+00]
      RHS range        [1e+00, 1e+00]
    Presolve removed 46 rows and 86 columns
    Presolve time: 0.00s
    Presolve: All rows and columns removed
    Iteration    Objective       Primal Inf.    Dual Inf.      Time
           0    3.3816920e+00   0.000000e+00   0.000000e+00      0s
    
    Solved in 0 iterations and 0.00 seconds (0.00 work units)
    Optimal objective  3.381692017e+00
    
    User-callback calls 0, time in user-callback 0.00 sec

--- Reading solution for model GAMS_MODEL
***
*** Solver did not provide marginals for model GAMS_MODEL
***
--- Executing after solve: elapsed 0:01:04.239
--- model.gms(221) 3 Mb
--- model.gms(372) 5 Mb
--- Putfile results /local/scratch/a/sgusev/repos/k_means/data/gams_gurobi_gdp.binary_multiplication/no_mode/2026-02-18_23-12-52/original/results.dat
--- Putfile statresults /local/scratch/a/sgusev/repos/k_means/data/gams_gurobi_gdp.binary_multiplication/no_mode/2026-02-18_23-12-52/original/resultsstat.dat
*** Status: Normal completion
--- Job model.gms Stop 02/18/26 23:13:57 elapsed 0:01:04.239
Original problem solved. Time taken: 64.74372220039368 seconds
Original objective value: 3.381692017073867
