Solving original (integer) problem with strategy gdp.binary_multiplication...
--- Job model.gms Start 02/18/26 23:24:39 52.2.0 d8e408be LEX-LEG x86 64bit/Linux
--- Applying:
    /package/gams/52.2/gmsprmun.txt
--- GAMS Parameters defined
    Input /local/scratch/a/sgusev/repos/k_means/data/gams_gurobi_gdp.binary_multiplication/no_mode/2026-02-18_23-24-39/original/model.gms
    Output /local/scratch/a/sgusev/repos/k_means/data/gams_gurobi_gdp.binary_multiplication/no_mode/2026-02-18_23-24-39/original/output.lst
    ScrDir /local/scratch/a/sgusev/repos/k_means/data/gams_gurobi_gdp.binary_multiplication/no_mode/2026-02-18_23-24-39/original/225a/
    SysDir /package/gams/52.2/
    CurDir /local/scratch/a/sgusev/repos/k_means/data/gams_gurobi_gdp.binary_multiplication/no_mode/2026-02-18_23-24-39/original/
    LogOption 3
    AppendLog 1
Licensee: David Bernal / SECQUOIA Research Group         G251008+0003Ac-GEN
          Purdue University, Davidson School of Chemical EngineeringDCE4838
          225a/gamslice.dat
          5a82958a-fbca-4a23
          node:66820903 mem:995 cores:48 ipport:47317 v:2                  
          Evaluation license: Not for commercial or production use
          The time-limited license stops working on : Jun 30, 2027
System information: 48 physical cores and 995 Gb physical memory detected
GAMS 52.2.0   Copyright (C) 1987-2025 GAMS Development. All rights reserved
--- Starting compilation
--- model.gms(278) 2 Mb
--- $echo File /local/scratch/a/sgusev/repos/k_means/data/gams_gurobi_gdp.binary_multiplication/no_mode/2026-02-18_23-24-39/original/gurobi.opt
--- model.gms(492) 2 Mb
--- Starting execution: elapsed 0:00:00.006
--- model.gms(287) 3 Mb
--- Generating MINLP model GAMS_MODEL
--- model.gms(291) 5 Mb
---   71 rows  77 columns  295 non-zeroes
---   605 nl-code  220 nl-non-zeroes
---   55 discrete-columns
--- Range statistics (absolute non-zero finite values)
--- RHS       [min, max] : [ 1.000E+00, 1.000E+00] - Zero values observed as well
--- Bound     [min, max] : [ 1.000E+00, 4.400E+01] - Zero values observed as well
--- Matrix    [min, max] : [ 5.506E-02, 1.155E+00] - Zero values observed as well
--- model.gms(291) 3 Mb
--- Executing GUROBI (Solvelink=5): elapsed 0:00:00.009
Reading parameter(s) from "/local/scratch/a/sgusev/repos/k_means/data/gams_gurobi_gdp.binary_multiplication/no_mode/2026-02-18_23-24-39/original/gurobi.opt"
>>  NonConvex 2
>>  Threads 1
>>  MIPGap 1e-06
>>  MIPGapAbs 1e-10
>>  FeasibilityTol 1e-06
>>  OptimalityTol 1e-06
>>  IntFeasTol 1e-05
Finished reading from "/local/scratch/a/sgusev/repos/k_means/data/gams_gurobi_gdp.binary_multiplication/no_mode/2026-02-18_23-24-39/original/gurobi.opt"

... GRB_LICENSE_FILE = /local/scratch/a/sgusev/gurobi.lic

    Gurobi           52.2.0 d8e408be Dec 8, 2025           LEG x86 64bit/Linux    

... GAMS/Gurobi Link license.
... GMO Q Extraction (ThreePass): 0.00s

    Gurobi Optimizer version 13.0.0 build v13.0.0rc1 (linux64 - "Oracle Linux Server 9.7")
    
    CPU model: AMD EPYC 7643 48-Core Processor, instruction set [SSE2|AVX|AVX2]
    Thread count: 48 physical cores, 96 logical processors, using up to 1 threads
    
    Non-default parameters:
    TimeLimit  300
    MIPGap  1e-06
    LogToConsole  0
    NonConvex  2
    Threads  1
    
    Optimize a model with 70 rows, 131 columns and 118 nonzeros (Min)
    Model fingerprint: 0xc3a10292
    Model has 11 linear objective coefficients
    Model has 55 general nonlinear constraints (165 nonlinear terms)
    Variable types: 76 continuous, 55 integer (0 binary)
    Coefficient statistics:
      Matrix range     [1e+00, 1e+00]
      Objective range  [1e+00, 1e+00]
      Bounds range     [1e+00, 4e+01]
      RHS range        [1e+00, 1e+00]
      NLCon coe range  [1e-02, 9e-01]
    Presolve model has 55 nlconstr
    Added 275 variables to disaggregate expressions
    Presolve removed 55 rows and 0 columns
    Presolve time: 0.00s
    Presolved: 730 rows, 462 columns, 1713 nonzeros
    Presolved model has 110 bilinear constraint(s)
    
    Solving non-convex MIQCP to global optimality
    
    Variable types: 407 continuous, 55 integer (55 binary)
    Found heuristic solution: objective 3.6239092
    
    Root relaxation: objective 0.000000e+00, 109 iterations, 0.00 seconds (0.00 work units)
    
        Nodes    |    Current Node    |     Objective Bounds      |     Work
     Expl Unexpl |  Obj  Depth IntInf | Incumbent    BestBd   Gap | It/Node Time
    
         0     0    0.00000    0   68    3.62391    0.00000   100%     -    0s
    H    0     0                       3.4935224    0.00000   100%     -    0s
         0     0    0.00000    0   72    3.49352    0.00000   100%     -    0s
         0     0    0.00000    0   83    3.49352    0.00000   100%     -    0s
         0     0    0.00000    0   91    3.49352    0.00000   100%     -    0s
         0     0    0.00000    0  110    3.49352    0.00000   100%     -    0s
    H    0     0                       1.8497773    0.00000   100%     -    0s
         0     0    0.00000    0  112    1.84978    0.00000   100%     -    0s
         0     0    0.00000    0  113    1.84978    0.00000   100%     -    0s
         0     0    0.00000    0  106    1.84978    0.00000   100%     -    0s
         0     0    0.00000    0  114    1.84978    0.00000   100%     -    0s
         0     0    0.00000    0  109    1.84978    0.00000   100%     -    0s
         0     0    0.00000    0  109    1.84978    0.00000   100%     -    0s
    H    0     0                       1.5467916    0.00000   100%     -    0s
         0     0    0.00000    0  110    1.54679    0.00000   100%     -    0s
         0     0    0.00000    0  109    1.54679    0.00000   100%     -    0s
         0     0    0.00000    0  109    1.54679    0.00000   100%     -    0s
    H    0     0                       1.3998345    0.00000   100%     -    0s
         0     2    0.00000    0  109    1.39983    0.00000   100%     -    0s
    H    4     4                       1.3986087    0.00000   100%  25.0    0s
    H    4     4                       1.3980654    0.00000   100%  25.0    0s
    H    4     4                       1.3979123    0.00000   100%  25.0    0s
    H    4     4                       1.3978470    0.00000   100%  25.0    0s
    H    4     4                       1.3978442    0.00000   100%  25.0    0s
    H    4     4                       1.3978367    0.00000   100%  25.0    0s
    H    4     4                       1.3978365    0.00000   100%  25.0    0s
    H    4     4                       1.3948588    0.00000   100%  25.0    0s
    H    4     4                       1.3939658    0.00000   100%  25.0    0s
    H    4     4                       1.3938604    0.00000   100%  25.0    0s
    H    5     5                       1.3828210    0.00000   100%  25.4    0s
    H    8     8                       1.3599416    0.00000   100%  24.6    0s
    H    8     8                       1.3523152    0.00000   100%  24.6    0s
    H    9     9                       0.8543215    0.00000   100%  23.0    0s
    H    9     9                       0.8503244    0.00000   100%  23.0    0s
    H    9     9                       0.8490551    0.00000   100%  23.0    0s
    H    9     9                       0.8490077    0.00000   100%  23.0    0s
    H   16    16                       0.8400797    0.00000   100%  16.9    0s
    H   16    16                       0.8400041    0.00000   100%  16.9    0s
    H   16    16                       0.8399871    0.00000   100%  16.9    0s
    H  173    98                       0.7405090    0.00000   100%  17.0    0s
    H  189   101                       0.5343277    0.00000   100%  16.1    0s
    H  220   100                       0.5343277    0.00000   100%  16.8    0s
    H  401   173                       0.5334425    0.00000   100%  15.3    0s
    H  401   171                       0.5261391    0.00000   100%  15.3    0s
    H  401   171                       0.5214781    0.00000   100%  15.3    0s
    H  401   171                       0.5213716    0.00000   100%  15.3    0s
    H  401   171                       0.5213386    0.00000   100%  15.3    0s
    H  457   166                       0.4898529    0.00000   100%  15.5    0s
    H  506   170                       0.4755839    0.00000   100%  16.3    0s
    H  545   181                       0.4755817    0.00000   100%  16.0    0s
    H  784   224                       0.4719532    0.00000   100%  16.6    0s
    H  784   224                       0.4719511    0.00000   100%  16.6    0s
    H  850   252                       0.4719509    0.00000   100%  16.1    0s
    H  871   257                       0.4582956    0.00000   100%  15.8    0s
    H  919   256                       0.4194109    0.00000   100%  15.5    0s
    H 2805   651                       0.4192614    0.00000   100%  17.1    3s
      4228   943    0.05660   30  107    0.41926    0.00349  99.2%  17.6    5s
     10202  1635    0.19555   40   94    0.41926    0.12490  70.2%  16.9   10s
     16782  1759    0.20526   31  100    0.41926    0.20413  51.3%  16.4   15s
     23506  1279     cutoff   44         0.41926    0.28969  30.9%  15.9   20s
     31598  1425     cutoff   52         0.41926    0.35856  14.5%  13.9   25s
    *37611  1453              93       0.4192610    0.38917  7.18%  12.6   28s
    *37615  1455              95       0.4192590    0.38917  7.18%  12.6   28s
     39872  1472    0.40942   63   77    0.41926    0.39541  5.69%  12.2   30s
     48300   888    0.41830   59   77    0.41926    0.41249  1.62%  10.8   35s
    *48769  1039             105       0.4192581    0.41295  1.50%  10.8   35s
    *48770  1038             105       0.4192576    0.41295  1.50%  10.8   35s
    *48778  1026             107       0.4192556    0.41295  1.50%  10.8   35s
     57176  1004    0.41923   72   77    0.41926    0.41816  0.26%   9.7   40s
     66850   778    0.41925   92   55    0.41926    0.41918  0.02%   8.7   45s
    
    Cutting planes:
      Gomory: 6
      Implied bound: 38
      MIR: 6
      Flow cover: 64
      RLT: 19
      Relax-and-lift: 4
    
    Explored 71439 nodes (597116 simplex iterations) in 47.26 seconds (31.70 work units)
    Thread count was 1 (of 96 available processors)
    
    Solution count 10: 0.419256 0.419258 0.419258 ... 0.471951
    
    Optimal solution found (tolerance 1.00e-06)
    Warning: max constraint violation (1.6956e-06) exceeds tolerance
    Warning: max general constraint violation (1.6956e-06) exceeds tolerance
    Best objective 4.192556492698e-01, best bound 4.192552307616e-01, gap 0.0001%
    
    User-callback calls 71495, time in user-callback 0.00 sec

... Solving fixed model...

    Gurobi Optimizer version 13.0.0 build v13.0.0rc1 (linux64 - "Oracle Linux Server 9.7")
    
    CPU model: AMD EPYC 7643 48-Core Processor, instruction set [SSE2|AVX|AVX2]
    Thread count: 48 physical cores, 96 logical processors, using up to 1 threads
    
    Non-default parameters:
    TimeLimit  300
    MIPGap  1e-06
    LogToConsole  0
    NonConvex  2
    Threads  1
    
    Optimize a model with 70 rows, 131 columns and 118 nonzeros (Min)
    Model fingerprint: 0xd0c0d38f
    Model has 11 linear objective coefficients
    Coefficient statistics:
      Matrix range     [1e+00, 1e+00]
      Objective range  [1e+00, 1e+00]
      Bounds range     [2e-02, 1e+00]
      RHS range        [1e+00, 1e+00]
    Presolve removed 70 rows and 131 columns
    Presolve time: 0.00s
    Presolve: All rows and columns removed
    Iteration    Objective       Primal Inf.    Dual Inf.      Time
           0    4.1925565e-01   0.000000e+00   0.000000e+00      0s
    
    Solved in 0 iterations and 0.00 seconds (0.00 work units)
    Optimal objective  4.192556493e-01
    
    User-callback calls 0, time in user-callback 0.00 sec

--- Reading solution for model GAMS_MODEL
***
*** Solver did not provide marginals for model GAMS_MODEL
***
--- Executing after solve: elapsed 0:00:47.315
--- model.gms(294) 3 Mb
--- model.gms(492) 5 Mb
--- Putfile results /local/scratch/a/sgusev/repos/k_means/data/gams_gurobi_gdp.binary_multiplication/no_mode/2026-02-18_23-24-39/original/results.dat
--- Putfile statresults /local/scratch/a/sgusev/repos/k_means/data/gams_gurobi_gdp.binary_multiplication/no_mode/2026-02-18_23-24-39/original/resultsstat.dat
*** Status: Normal completion
--- Job model.gms Stop 02/18/26 23:25:26 elapsed 0:00:47.315
Original problem solved. Time taken: 47.808942556381226 seconds
Original objective value: 0.419255649269773
