Solving original (integer) problem with strategy gdp.hull...
--- Job model.gms Start 02/14/26 17:31:06 52.2.0 d8e408be LEX-LEG x86 64bit/Linux
--- Applying:
    /package/gams/52.2/gmsprmun.txt
--- GAMS Parameters defined
    Input /local/scratch/a/sgusev/repos/k_means/data/gams_gurobi_gdp.hull/no_mode/2026-02-14_17-31-05/original/model.gms
    Output /local/scratch/a/sgusev/repos/k_means/data/gams_gurobi_gdp.hull/no_mode/2026-02-14_17-31-05/original/output.lst
    ScrDir /local/scratch/a/sgusev/repos/k_means/data/gams_gurobi_gdp.hull/no_mode/2026-02-14_17-31-05/original/225a/
    SysDir /package/gams/52.2/
    CurDir /local/scratch/a/sgusev/repos/k_means/data/gams_gurobi_gdp.hull/no_mode/2026-02-14_17-31-05/original/
    LogOption 3
    AppendLog 1
Licensee: David Bernal / SECQUOIA Research Group         G251008+0003Ac-GEN
          Purdue University, Davidson School of Chemical EngineeringDCE4838
          225a/gamslice.dat
          5a82958a-fbca-4a23
          node:66820903 mem:995 cores:48 ipport:43973 v:2                  
          Evaluation license: Not for commercial or production use
          The time-limited license stops working on : Jun 30, 2027
System information: 48 physical cores and 995 Gb physical memory detected
GAMS 52.2.0   Copyright (C) 1987-2025 GAMS Development. All rights reserved
--- Starting compilation
--- model.gms(2280) 2 Mb
--- $echo File /local/scratch/a/sgusev/repos/k_means/data/gams_gurobi_gdp.hull/no_mode/2026-02-14_17-31-05/original/gurobi.opt
--- model.gms(3385) 2 Mb
--- Starting execution: elapsed 0:00:00.014
--- model.gms(2289) 3 Mb
--- Generating MINLP model GAMS_MODEL
--- model.gms(2293) 5 Mb
---   687 rows  352 columns  1,681 non-zeroes
---   1,705 nl-code  220 nl-non-zeroes
---   55 discrete-columns
--- Range statistics (absolute non-zero finite values)
--- RHS       [min, max] : [ 5.506E-06, 1.000E+00] - Zero values observed as well
--- Bound     [min, max] : [ 1.000E+00, 4.400E+01] - Zero values observed as well
--- Matrix    [min, max] : [ 1.958E-02, 4.400E+01]
--- model.gms(2293) 3 Mb
--- Executing GUROBI (Solvelink=5): elapsed 0:00:00.019
Reading parameter(s) from "/local/scratch/a/sgusev/repos/k_means/data/gams_gurobi_gdp.hull/no_mode/2026-02-14_17-31-05/original/gurobi.opt"
>>  NonConvex 2
>>  Threads 1
>>  MIPGap 1e-06
>>  MIPGapAbs 1e-10
>>  FeasibilityTol 1e-06
>>  OptimalityTol 1e-06
>>  IntFeasTol 1e-05
Finished reading from "/local/scratch/a/sgusev/repos/k_means/data/gams_gurobi_gdp.hull/no_mode/2026-02-14_17-31-05/original/gurobi.opt"

... GRB_LICENSE_FILE = /local/scratch/a/sgusev/gurobi.lic

    Gurobi           52.2.0 d8e408be Dec 8, 2025           LEG x86 64bit/Linux    

... GAMS/Gurobi Link license.
... GMO Q Extraction (ThreePass): 0.00s

    Gurobi Optimizer version 13.0.0 build v13.0.0rc1 (linux64 - "Oracle Linux Server 9.7")
    
    CPU model: AMD EPYC 7643 48-Core Processor, instruction set [SSE2|AVX|AVX2]
    Thread count: 48 physical cores, 96 logical processors, using up to 1 threads
    
    Non-default parameters:
    TimeLimit  300
    MIPGap  1e-06
    LogToConsole  0
    NonConvex  2
    Threads  1
    
    Optimize a model with 686 rows, 406 columns and 1504 nonzeros (Min)
    Model fingerprint: 0x18011a41
    Model has 11 linear objective coefficients
    Model has 55 general nonlinear constraints (330 nonlinear terms)
    Variable types: 351 continuous, 55 integer (0 binary)
    Coefficient statistics:
      Matrix range     [1e+00, 4e+01]
      Objective range  [1e+00, 1e+00]
      Bounds range     [1e+00, 4e+01]
      RHS range        [1e+00, 1e+00]
      NLCon coe range  [6e-06, 1e+00]
    Presolve model has 55 nlconstr
    Added 715 variables to disaggregate expressions
    Presolve removed 165 rows and 121 columns
    Presolve time: 0.01s
    Presolved: 2171 rows, 1001 columns, 5563 nonzeros
    Presolved model has 330 bilinear constraint(s)
    
    Solving non-convex MIQCP to global optimality
    
    Variable types: 946 continuous, 55 integer (55 binary)
    Found heuristic solution: objective 3.6239092
    
    Root relaxation: objective 0.000000e+00, 336 iterations, 0.00 seconds (0.00 work units)
    
        Nodes    |    Current Node    |     Objective Bounds      |     Work
     Expl Unexpl |  Obj  Depth IntInf | Incumbent    BestBd   Gap | It/Node Time
    
         0     0    0.00000    0  173    3.62391    0.00000   100%     -    0s
         0     0    0.00000    0  197    3.62391    0.00000   100%     -    0s
         0     0    0.00000    0   93    3.62391    0.00000   100%     -    0s
         0     0    0.00000    0   80    3.62391    0.00000   100%     -    0s
         0     0    0.00000    0   85    3.62391    0.00000   100%     -    0s
         0     0    0.00000    0   85    3.62391    0.00000   100%     -    0s
         0     0    0.00000    0   54    3.62391    0.00000   100%     -    0s
         0     0    0.00000    0   77    3.62391    0.00000   100%     -    0s
         0     0    0.00000    0   58    3.62391    0.00000   100%     -    0s
         0     0    0.00000    0   58    3.62391    0.00000   100%     -    0s
         0     0    0.00000    0   46    3.62391    0.00000   100%     -    0s
         0     0    0.00000    0   55    3.62391    0.00000   100%     -    0s
         0     0    0.00000    0   69    3.62391    0.00000   100%     -    0s
         0     0    0.00000    0   69    3.62391    0.00000   100%     -    0s
         0     0    0.00000    0   47    3.62391    0.00000   100%     -    0s
         0     0    0.00000    0   47    3.62391    0.00000   100%     -    0s
    H    0     0                       3.6239072    0.00000   100%     -    0s
    H    0     0                       2.0571753    0.00000   100%     -    0s
    H    0     0                       2.0571753    0.00000   100%     -    0s
         0     2    0.00000    0   47    2.05718    0.00000   100%     -    0s
    H    1     1                       1.9652585    0.00000   100%   0.0    0s
    H    4     4                       1.9080590    0.00000   100%   9.2    0s
    H    6     6                       1.6944846    0.00000   100%  10.5    0s
    H   11    11                       1.6944846    0.00000   100%  12.4    0s
    H   15    15                       1.6944846    0.00000   100%  12.1    0s
    H   20    20                       1.6944846    0.00000   100%  11.5    0s
    H   27    25                       1.6944846    0.00000   100%  12.9    0s
    H  102    81                       1.4114443    0.00000   100%  12.1    0s
    H  164   139                       1.4114443    0.00000   100%   9.0    0s
    H  327   193                       1.1616791    0.00000   100%   9.7    0s
    H  389   235                       1.1231176    0.00000   100%   8.8    0s
    H  499   272                       0.9383328    0.00000   100%   8.9    1s
    H  523   296                       0.9383328    0.00000   100%   8.6    1s
    H  620   343                       0.9278946    0.00000   100%   8.2    1s
    H  628   331                       0.9104270    0.00000   100%   8.1    1s
    H  628   314                       0.8878374    0.00000   100%   8.1    1s
    H  628   298                       0.8813011    0.00000   100%   8.1    1s
    H  628   283                       0.7370863    0.00000   100%   8.1    1s
    H  628   268                       0.7300752    0.00000   100%   8.1    1s
    H  628   255                       0.6834539    0.00000   100%   8.1    1s
    H  628   242                       0.6806600    0.00000   100%   8.1    1s
    H  628   229                       0.6805411    0.00000   100%   8.1    1s
    H  628   217                       0.6775878    0.00000   100%   8.1    1s
    H  628   206                       0.6257475    0.00000   100%   8.1    1s
    H  628   196                       0.6194035    0.00000   100%   8.1    1s
    H  628   186                       0.6193125    0.00000   100%   8.1    1s
    H  628   176                       0.6193078    0.00000   100%   8.1    1s
    H  629   168                       0.6193014    0.00000   100%  10.5    1s
    H  629   159                       0.6193005    0.00000   100%  10.5    1s
    H  631   152                       0.6192814    0.00000   100%  10.5    1s
    H  631   144                       0.6192813    0.00000   100%  10.5    1s
    H  634   139                       0.6192743    0.00000   100%  10.5    1s
    H  634   132                       0.6192650    0.00000   100%  10.5    1s
    H  640   125                       0.6190915    0.00000   100%  10.5    1s
    H  640   119                       0.6190889    0.00000   100%  10.5    1s
    H  640   113                       0.6190815    0.00000   100%  10.5    1s
    H  640   107                       0.6190787    0.00000   100%  10.5    1s
    H 1723   677                       0.4194109    0.00000   100%  10.6    3s
    H 1840   697                       0.4194109    0.00000   100%  10.7    3s
    H 1840   697                       0.4194109    0.00000   100%  10.7    3s
      3282  1219    0.00501   32   34    0.41941    0.00000   100%   9.4    5s
    H 4387  1498                       0.4192614    0.00000   100%  10.4    6s
    H 5694  1655                       0.4192614    0.00000   100%  10.9    8s
    H 5850  1554                       0.4192614    0.00000   100%  11.1    8s
    H 5850  1481                       0.4192614    0.00000   100%  11.1    8s
      8022  1116     cutoff   61         0.41926    0.06444  84.6%  11.5   10s
     15831   982    0.30399   33   33    0.41926    0.30286  27.8%   9.6   15s
     23751  1509    0.39734   74    9    0.41926    0.34594  17.5%   7.7   20s
     34749  3004    0.37391   60   11    0.41926    0.37269  11.1%   6.3   25s
     45114  2496     cutoff   73         0.41926    0.37905  9.59%   5.5   30s
    *52312   472              88       0.4192583    0.41771  0.37%   5.1   33s
    *52313   467              88       0.4192570    0.41771  0.37%   5.1   33s
     54123   359    0.41899   72   12    0.41926    0.41882  0.10%   5.0   35s
    *54892   276              84       0.4192564    0.41905  0.05%   5.0   35s
    *54895   275              84       0.4192551    0.41905  0.05%   5.0   35s
    *55814   220              91       0.4192538    0.41916  0.02%   4.9   35s
    
    Cutting planes:
      Learned: 40
      Gomory: 5
      Implied bound: 18
      Projected implied bound: 1
      MIR: 1
      Flow cover: 35
      RLT: 27
      Relax-and-lift: 6
    
    Explored 56541 nodes (278209 simplex iterations) in 36.22 seconds (26.28 work units)
    Thread count was 1 (of 96 available processors)
    
    Solution count 10: 0.419254 0.419254 0.419255 ... 0.419411
    
    Optimal solution found (tolerance 1.00e-06)
    Warning: max constraint violation (1.6727e-06) exceeds tolerance
    Warning: max general constraint violation (1.6727e-06) exceeds tolerance
    Best objective 4.192537706777e-01, best bound 4.192535220642e-01, gap 0.0001%
    
    User-callback calls 56598, time in user-callback 0.00 sec

... Solving fixed model...

    Gurobi Optimizer version 13.0.0 build v13.0.0rc1 (linux64 - "Oracle Linux Server 9.7")
    
    CPU model: AMD EPYC 7643 48-Core Processor, instruction set [SSE2|AVX|AVX2]
    Thread count: 48 physical cores, 96 logical processors, using up to 1 threads
    
    Non-default parameters:
    TimeLimit  300
    MIPGap  1e-06
    LogToConsole  0
    NonConvex  2
    Threads  1
    
    Optimize a model with 686 rows, 406 columns and 1504 nonzeros (Min)
    Model fingerprint: 0x0d5bd9c0
    Model has 11 linear objective coefficients
    Coefficient statistics:
      Matrix range     [1e+00, 4e+01]
      Objective range  [1e+00, 1e+00]
      Bounds range     [2e-02, 4e+01]
      RHS range        [1e+00, 1e+00]
    Presolve removed 686 rows and 406 columns
    Presolve time: 0.00s
    Presolve: All rows and columns removed
    Iteration    Objective       Primal Inf.    Dual Inf.      Time
           0    4.1925377e-01   0.000000e+00   0.000000e+00      0s
    
    Solved in 0 iterations and 0.00 seconds (0.00 work units)
    Optimal objective  4.192537707e-01
    
    User-callback calls 0, time in user-callback 0.00 sec

--- Reading solution for model GAMS_MODEL
***
*** Solver did not provide marginals for model GAMS_MODEL
***
--- Executing after solve: elapsed 0:00:36.307
--- model.gms(2296) 3 Mb
--- model.gms(3385) 5 Mb
--- Putfile results /local/scratch/a/sgusev/repos/k_means/data/gams_gurobi_gdp.hull/no_mode/2026-02-14_17-31-05/original/results.dat
--- Putfile statresults /local/scratch/a/sgusev/repos/k_means/data/gams_gurobi_gdp.hull/no_mode/2026-02-14_17-31-05/original/resultsstat.dat
*** Status: Normal completion
--- Job model.gms Stop 02/14/26 17:31:42 elapsed 0:00:36.309
Original problem solved. Time taken: 36.90752673149109 seconds
Original objective value: 0.419253770679484
