Solving original (integer) problem with strategy gdp.hull...
--- Job model.gms Start 02/14/26 17:17:24 52.2.0 d8e408be LEX-LEG x86 64bit/Linux
--- Applying:
    /package/gams/52.2/gmsprmun.txt
--- GAMS Parameters defined
    Input /local/scratch/a/sgusev/repos/k_means/data/gams_gurobi_gdp.hull/no_mode/2026-02-14_17-17-23/original/model.gms
    Output /local/scratch/a/sgusev/repos/k_means/data/gams_gurobi_gdp.hull/no_mode/2026-02-14_17-17-23/original/output.lst
    ScrDir /local/scratch/a/sgusev/repos/k_means/data/gams_gurobi_gdp.hull/no_mode/2026-02-14_17-17-23/original/225a/
    SysDir /package/gams/52.2/
    CurDir /local/scratch/a/sgusev/repos/k_means/data/gams_gurobi_gdp.hull/no_mode/2026-02-14_17-17-23/original/
    LogOption 3
    AppendLog 1
Licensee: David Bernal / SECQUOIA Research Group         G251008+0003Ac-GEN
          Purdue University, Davidson School of Chemical EngineeringDCE4838
          225a/gamslice.dat
          5a82958a-fbca-4a23
          node:66820903 mem:995 cores:48 ipport:60821 v:2                  
          Evaluation license: Not for commercial or production use
          The time-limited license stops working on : Jun 30, 2027
System information: 48 physical cores and 995 Gb physical memory detected
GAMS 52.2.0   Copyright (C) 1987-2025 GAMS Development. All rights reserved
--- Starting compilation
--- model.gms(1943) 2 Mb
--- $echo File /local/scratch/a/sgusev/repos/k_means/data/gams_gurobi_gdp.hull/no_mode/2026-02-14_17-17-23/original/gurobi.opt
--- model.gms(2880) 2 Mb
--- Starting execution: elapsed 0:00:00.013
--- model.gms(1952) 3 Mb
--- Generating MINLP model GAMS_MODEL
--- model.gms(1956) 5 Mb
---   586 rows  285 columns  1,413 non-zeroes
---   1,320 nl-code  165 nl-non-zeroes
---   33 discrete-columns
--- Range statistics (absolute non-zero finite values)
--- RHS       [min, max] : [ 2.844E-05, 1.000E+00] - Zero values observed as well
--- Bound     [min, max] : [ 1.000E+00, 6.600E+01] - Zero values observed as well
--- Matrix    [min, max] : [ 2.560E-02, 6.600E+01]
--- model.gms(1956) 3 Mb
--- Executing GUROBI (Solvelink=5): elapsed 0:00:00.017
Reading parameter(s) from "/local/scratch/a/sgusev/repos/k_means/data/gams_gurobi_gdp.hull/no_mode/2026-02-14_17-17-23/original/gurobi.opt"
>>  NonConvex 2
>>  Threads 1
>>  MIPGap 1e-06
>>  MIPGapAbs 1e-10
>>  FeasibilityTol 1e-06
>>  OptimalityTol 1e-06
>>  IntFeasTol 1e-05
Finished reading from "/local/scratch/a/sgusev/repos/k_means/data/gams_gurobi_gdp.hull/no_mode/2026-02-14_17-17-23/original/gurobi.opt"

... GRB_LICENSE_FILE = /local/scratch/a/sgusev/gurobi.lic

    Gurobi           52.2.0 d8e408be Dec 8, 2025           LEG x86 64bit/Linux    

... GAMS/Gurobi Link license.
... GMO Q Extraction (ThreePass): 0.00s

    Gurobi Optimizer version 13.0.0 build v13.0.0rc1 (linux64 - "Oracle Linux Server 9.7")
    
    CPU model: AMD EPYC 7643 48-Core Processor, instruction set [SSE2|AVX|AVX2]
    Thread count: 48 physical cores, 96 logical processors, using up to 1 threads
    
    Non-default parameters:
    TimeLimit  300
    MIPGap  1e-06
    LogToConsole  0
    NonConvex  2
    Threads  1
    
    Optimize a model with 585 rows, 317 columns and 1269 nonzeros (Min)
    Model fingerprint: 0xf731c40a
    Model has 11 linear objective coefficients
    Model has 33 general nonlinear constraints (264 nonlinear terms)
    Variable types: 284 continuous, 33 integer (0 binary)
    Coefficient statistics:
      Matrix range     [1e+00, 7e+01]
      Objective range  [1e+00, 1e+00]
      Bounds range     [1e+00, 7e+01]
      RHS range        [1e+00, 1e+00]
      NLCon coe range  [3e-05, 1e+00]
    Presolve model has 33 nlconstr
    Added 561 variables to disaggregate expressions
    Presolve removed 132 rows and 110 columns
    Presolve time: 0.00s
    Presolved: 1740 rows, 769 columns, 4426 nonzeros
    Presolved model has 264 bilinear constraint(s)
    
    Solving non-convex MIQCP to global optimality
    
    Variable types: 736 continuous, 33 integer (33 binary)
    Found heuristic solution: objective 8.7789380
    
    Root relaxation: objective 0.000000e+00, 232 iterations, 0.00 seconds (0.00 work units)
    
        Nodes    |    Current Node    |     Objective Bounds      |     Work
     Expl Unexpl |  Obj  Depth IntInf | Incumbent    BestBd   Gap | It/Node Time
    
         0     0    0.00000    0  132    8.77894    0.00000   100%     -    0s
         0     0    0.00000    0  132    8.77894    0.00000   100%     -    0s
         0     0    0.00000    0  146    8.77894    0.00000   100%     -    0s
         0     0    0.00000    0  121    8.77894    0.00000   100%     -    0s
         0     0    0.00000    0  121    8.77894    0.00000   100%     -    0s
         0     0    0.00000    0   78    8.77894    0.00000   100%     -    0s
         0     0    0.00000    0   78    8.77894    0.00000   100%     -    0s
         0     0    0.00000    0  132    8.77894    0.00000   100%     -    0s
         0     0    0.00000    0  132    8.77894    0.00000   100%     -    0s
         0     0    0.00000    0   69    8.77894    0.00000   100%     -    0s
         0     0    0.00000    0   68    8.77894    0.00000   100%     -    0s
    H    0     0                       6.5052842    0.00000   100%     -    0s
    H    0     0                       6.0152123    0.00000   100%     -    0s
         0     2    0.00000    0   68    6.01521    0.00000   100%     -    0s
    H   20    20                       5.8943493    0.00000   100%  19.4    0s
    H   26    25                       5.7826090    0.00000   100%  17.2    0s
    H   63    50                       5.6284000    0.00000   100%  11.1    0s
    H   68    48                       5.4645954    0.00000   100%  11.2    0s
    H   82    61                       5.2054731    0.00000   100%  11.6    0s
    H   83    62                       4.8395608    0.00000   100%  11.6    0s
    H  167   126                       4.6660986    0.00000   100%  10.7    0s
    H  168   125                       4.4455252    0.00000   100%  10.7    0s
    *  350   279             107       4.4455172    0.00000   100%   6.5    0s
    H  563   388                       4.3350900    0.00000   100%   8.9    1s
    H  613   333                       4.0853476    0.00000   100%   8.5    1s
    H  613   315                       3.9535285    0.00000   100%   8.5    1s
    H  613   309                       3.8365849    0.00000   100%   8.5    1s
    H  615   293                       3.8002898    0.00000   100%   8.5    1s
    H  615   278                       3.8001276    0.00000   100%   8.5    1s
    H  615   264                       3.8000888    0.00000   100%   8.5    1s
    H  618   253                       3.7715835    0.00000   100%   8.4    1s
    H  618   240                       3.7684150    0.00000   100%   8.4    1s
    H  618   228                       3.7683135    0.00000   100%   8.4    1s
    H  618   217                       3.7683119    0.00000   100%   8.4    1s
    H  628   211                       3.6186059    0.00000   100%  12.5    1s
    H  628   201                       3.5948810    0.00000   100%  12.5    1s
    H  628   190                       3.5879165    0.00000   100%  12.5    1s
    H  628   181                       3.5867104    0.00000   100%  12.5    1s
    H  628   171                       3.5863240    0.00000   100%  12.5    1s
    H  628   163                       3.5859160    0.00000   100%  12.5    1s
    H  631   156                       3.5849792    0.00000   100%  12.5    1s
    H  632   149                       3.5831862    0.00000   100%  12.6    1s
    H  632   142                       3.5831707    0.00000   100%  12.6    1s
    H  632   135                       3.5831698    0.00000   100%  12.6    1s
    H  634   129                       3.5822263    0.00000   100%  12.6    1s
    H  636   124                       3.5821353    0.00000   100%  12.8    1s
    H  638   119                       3.5818994    0.00000   100%  12.8    1s
    H  639   114                       3.5818522    0.00000   100%  12.9    1s
    H  640   109                       3.5818495    0.00000   100%  12.8    1s
    H  663   120                       3.5818483    0.00000   100%  13.2    1s
    H  709   129                       3.5818466    0.00000   100%  13.3    1s
    H  710   125                       3.5818299    0.00000   100%  13.2    1s
    H  750   135                       3.5779809    0.00000   100%  13.2    1s
    H  750   131                       3.5779809    0.00000   100%  13.2    1s
    H  953   241                       3.5108908    0.00000   100%  13.2    2s
    H  953   239                       3.5039082    0.00000   100%  13.2    2s
    H 1006   274                       3.4972122    0.00000   100%  13.3    2s
    H 1006   274                       3.4910218    0.00000   100%  13.3    2s
    H 1006   274                       3.4863802    0.00000   100%  13.3    2s
    H 1006   274                       3.4863766    0.00000   100%  13.3    2s
    H 1061   318                       3.4763011    0.00000   100%  13.3    2s
    H 1061   318                       3.4717143    0.00000   100%  13.3    2s
    H 1061   318                       3.4715849    0.00000   100%  13.3    2s
    H 1061   318                       3.4715486    0.00000   100%  13.3    2s
    H 1202   401                       3.4714960    0.00000   100%  13.8    2s
    H 1241   432                       3.3817068    0.00000   100%  14.0    2s
    H 1325   482                       3.3817051    0.00000   100%  14.0    2s
    H 1440   559                       3.3817006    0.00000   100%  13.9    2s
    H 2247   889                       3.3817002    0.03126  99.1%  15.4    4s
      3450  1145    2.34019   30   57    3.38170    0.55322  83.6%  15.8    5s
     10315   867     cutoff   33         3.38170    2.46593  27.1%  15.2   10s
     18537   889    3.36769   54   22    3.38170    3.30089  2.39%  10.4   15s
     27926  2082    3.38088   73   14    3.38170    3.36811  0.40%   7.6   20s
     38505  2901     cutoff   66         3.38170    3.37578  0.17%   5.9   25s
     48709  3619     cutoff   85         3.38170    3.37853  0.09%   4.9   30s
     58742  3582    3.38093   86   18    3.38170    3.37981  0.06%   4.3   35s
    *60161  3525             117       3.3816942    3.38000  0.05%   4.2   35s
     67874  3860    3.38154   83   19    3.38169    3.38068  0.03%   3.9   40s
     77912  4306     cutoff   79         3.38169    3.38097  0.02%   3.7   45s
     87890  3978    3.38143   81   17    3.38169    3.38116  0.02%   3.5   50s
     97616  3726    3.38167   94   10    3.38169    3.38135  0.01%   3.3   55s
     107696  3892     cutoff  110         3.38169    3.38147  0.01%   3.1   60s
     117795  4119    3.38160   95   13    3.38169    3.38152  0.01%   3.0   65s
     127904  3808    3.38169  111    3    3.38169    3.38156  0.00%   2.9   70s
     137945  3205    3.38169  109   11    3.38169    3.38162  0.00%   2.8   75s
    *140564  2946             121       3.3816905    3.38163  0.00%   2.8   76s
     146891  2775    3.38167  108   10    3.38169    3.38164  0.00%   2.7   80s
     157532  2136    3.38168  109    9    3.38169    3.38166  0.00%   2.7   85s
    
    Cutting planes:
      Learned: 33
      Gomory: 2
      Implied bound: 23
      Projected implied bound: 1
      MIR: 1
      Flow cover: 20
      RLT: 6
      Relax-and-lift: 2
    
    Explored 163325 nodes (427460 simplex iterations) in 87.77 seconds (67.09 work units)
    Thread count was 1 (of 96 available processors)
    
    Solution count 10: 3.38169 3.38169 3.38169 ... 3.47158
    
    Optimal solution found (tolerance 1.00e-06)
    Warning: max constraint violation (1.5582e-06) exceeds tolerance
    Warning: max general constraint violation (1.5582e-06) exceeds tolerance
    Best objective 3.381690540630e+00, best bound 3.381687181112e+00, gap 0.0001%
    
    User-callback calls 163389, time in user-callback 0.01 sec

... Solving fixed model...

    Gurobi Optimizer version 13.0.0 build v13.0.0rc1 (linux64 - "Oracle Linux Server 9.7")
    
    CPU model: AMD EPYC 7643 48-Core Processor, instruction set [SSE2|AVX|AVX2]
    Thread count: 48 physical cores, 96 logical processors, using up to 1 threads
    
    Non-default parameters:
    TimeLimit  300
    MIPGap  1e-06
    LogToConsole  0
    NonConvex  2
    Threads  1
    
    Optimize a model with 585 rows, 317 columns and 1269 nonzeros (Min)
    Model fingerprint: 0xbeec6fe3
    Model has 11 linear objective coefficients
    Coefficient statistics:
      Matrix range     [1e+00, 7e+01]
      Objective range  [1e+00, 1e+00]
      Bounds range     [8e-02, 7e+01]
      RHS range        [1e+00, 1e+00]
    Presolve removed 585 rows and 317 columns
    Presolve time: 0.00s
    Presolve: All rows and columns removed
    Iteration    Objective       Primal Inf.    Dual Inf.      Time
           0    3.3816905e+00   0.000000e+00   0.000000e+00      0s
    
    Solved in 0 iterations and 0.00 seconds (0.00 work units)
    Optimal objective  3.381690541e+00
    
    User-callback calls 0, time in user-callback 0.00 sec

--- Reading solution for model GAMS_MODEL
***
*** Solver did not provide marginals for model GAMS_MODEL
***
--- Executing after solve: elapsed 0:01:27.821
--- model.gms(1959) 3 Mb
--- model.gms(2880) 5 Mb
--- Putfile results /local/scratch/a/sgusev/repos/k_means/data/gams_gurobi_gdp.hull/no_mode/2026-02-14_17-17-23/original/results.dat
--- Putfile statresults /local/scratch/a/sgusev/repos/k_means/data/gams_gurobi_gdp.hull/no_mode/2026-02-14_17-17-23/original/resultsstat.dat
*** Status: Normal completion
--- Job model.gms Stop 02/14/26 17:18:52 elapsed 0:01:27.823
Original problem solved. Time taken: 88.39095902442932 seconds
Original objective value: 3.3816905412061598
