Solving original (integer) problem with strategy gdp.binary_multiplication...
--- Job model.gms Start 02/19/26 02:17:42 52.2.0 d8e408be LEX-LEG x86 64bit/Linux
--- Applying:
    /package/gams/52.2/gmsprmun.txt
--- GAMS Parameters defined
    Input /local/scratch/a/sgusev/repos/k_means/data/gams_gurobi_gdp.binary_multiplication/no_mode/2026-02-19_02-17-42/original/model.gms
    Output /local/scratch/a/sgusev/repos/k_means/data/gams_gurobi_gdp.binary_multiplication/no_mode/2026-02-19_02-17-42/original/output.lst
    ScrDir /local/scratch/a/sgusev/repos/k_means/data/gams_gurobi_gdp.binary_multiplication/no_mode/2026-02-19_02-17-42/original/225a/
    SysDir /package/gams/52.2/
    CurDir /local/scratch/a/sgusev/repos/k_means/data/gams_gurobi_gdp.binary_multiplication/no_mode/2026-02-19_02-17-42/original/
    LogOption 3
    AppendLog 1
Licensee: David Bernal / SECQUOIA Research Group         G251008+0003Ac-GEN
          Purdue University, Davidson School of Chemical EngineeringDCE4838
          225a/gamslice.dat
          5a82958a-fbca-4a23
          node:66820903 mem:995 cores:48 ipport:46649 v:2                  
          Evaluation license: Not for commercial or production use
          The time-limited license stops working on : Jun 30, 2027
System information: 48 physical cores and 995 Gb physical memory detected
GAMS 52.2.0   Copyright (C) 1987-2025 GAMS Development. All rights reserved
--- Starting compilation
--- model.gms(274) 2 Mb
--- $echo File /local/scratch/a/sgusev/repos/k_means/data/gams_gurobi_gdp.binary_multiplication/no_mode/2026-02-19_02-17-42/original/gurobi.opt
--- model.gms(486) 2 Mb
--- Starting execution: elapsed 0:00:00.006
--- model.gms(283) 3 Mb
--- Generating MINLP model GAMS_MODEL
--- model.gms(287) 5 Mb
---   71 rows  75 columns  277 non-zeroes
---   561 nl-code  204 nl-non-zeroes
---   51 discrete-columns
--- Range statistics (absolute non-zero finite values)
--- RHS       [min, max] : [ 1.000E+00, 1.000E+00] - Zero values observed as well
--- Bound     [min, max] : [ 1.000E+00, 6.800E+01] - Zero values observed as well
--- Matrix    [min, max] : [ 9.160E-02, 1.663E+00] - Zero values observed as well
--- model.gms(287) 3 Mb
--- Executing GUROBI (Solvelink=5): elapsed 0:00:00.009
Reading parameter(s) from "/local/scratch/a/sgusev/repos/k_means/data/gams_gurobi_gdp.binary_multiplication/no_mode/2026-02-19_02-17-42/original/gurobi.opt"
>>  NonConvex 2
>>  Threads 1
>>  MIPGap 1e-06
>>  MIPGapAbs 1e-10
>>  FeasibilityTol 1e-06
>>  OptimalityTol 1e-06
>>  IntFeasTol 1e-05
Finished reading from "/local/scratch/a/sgusev/repos/k_means/data/gams_gurobi_gdp.binary_multiplication/no_mode/2026-02-19_02-17-42/original/gurobi.opt"

... GRB_LICENSE_FILE = /local/scratch/a/sgusev/gurobi.lic

    Gurobi           52.2.0 d8e408be Dec 8, 2025           LEG x86 64bit/Linux    

... GAMS/Gurobi Link license.
... GMO Q Extraction (ThreePass): 0.00s

    Gurobi Optimizer version 13.0.0 build v13.0.0rc1 (linux64 - "Oracle Linux Server 9.7")
    
    CPU model: AMD EPYC 7643 48-Core Processor, instruction set [SSE2|AVX|AVX2]
    Thread count: 48 physical cores, 96 logical processors, using up to 1 threads
    
    Non-default parameters:
    TimeLimit  300
    MIPGap  1e-06
    LogToConsole  0
    NonConvex  2
    Threads  1
    
    Optimize a model with 70 rows, 125 columns and 106 nonzeros (Min)
    Model fingerprint: 0x05562e12
    Model has 17 linear objective coefficients
    Model has 51 general nonlinear constraints (153 nonlinear terms)
    Variable types: 74 continuous, 51 integer (0 binary)
    Coefficient statistics:
      Matrix range     [1e+00, 1e+00]
      Objective range  [1e+00, 1e+00]
      Bounds range     [1e+00, 7e+01]
      RHS range        [1e+00, 1e+00]
      NLCon coe range  [4e-02, 1e+00]
    Presolve model has 51 nlconstr
    Added 255 variables to disaggregate expressions
    Presolve removed 51 rows and 0 columns
    Presolve time: 0.00s
    Presolved: 682 rows, 432 columns, 1585 nonzeros
    Presolved model has 102 bilinear constraint(s)
    
    Solving non-convex MIQCP to global optimality
    
    Variable types: 381 continuous, 51 integer (51 binary)
    Found heuristic solution: objective 10.2222146
    
    Root relaxation: objective 0.000000e+00, 139 iterations, 0.00 seconds (0.00 work units)
    
        Nodes    |    Current Node    |     Objective Bounds      |     Work
     Expl Unexpl |  Obj  Depth IntInf | Incumbent    BestBd   Gap | It/Node Time
    
         0     0    0.00000    0   74   10.22221    0.00000   100%     -    0s
         0     0    0.00000    0  124   10.22221    0.00000   100%     -    0s
         0     0    0.00000    0  124   10.22221    0.00000   100%     -    0s
         0     0    0.00000    0  128   10.22221    0.00000   100%     -    0s
         0     0    0.00000    0  116   10.22221    0.00000   100%     -    0s
         0     0    0.00000    0  114   10.22221    0.00000   100%     -    0s
         0     0    0.00000    0  113   10.22221    0.00000   100%     -    0s
         0     0    0.00000    0  122   10.22221    0.00000   100%     -    0s
         0     0    0.00000    0  122   10.22221    0.00000   100%     -    0s
         0     0    0.00000    0  114   10.22221    0.00000   100%     -    0s
    H    0     0                       7.9657790    0.00000   100%     -    0s
    H    0     0                       7.6761980    0.00000   100%     -    0s
    H    0     0                       5.6471261    0.00000   100%     -    0s
         0     2    0.00000    0  114    5.64713    0.00000   100%     -    0s
    H    7     7                       5.2163030    0.00000   100%  16.7    0s
    H    7     7                       5.0560448    0.00000   100%  16.7    0s
    H    8     8                       4.3981528    0.00000   100%  15.8    0s
    H    8     8                       4.0455193    0.00000   100%  15.8    0s
    H    8     8                       3.9507418    0.00000   100%  15.8    0s
    H   10    10                       3.7388485    0.00000   100%  17.7    0s
    H   10    10                       3.6385060    0.00000   100%  17.7    0s
    H   12    12                       3.2737142    0.00000   100%  15.8    0s
    H 1046   376                       3.2735699    0.41766  87.2%  21.4    1s
    H 1162   392                       2.8298451    0.41766  85.2%  22.1    1s
      5749   557     cutoff   31         2.82985    2.10935  25.5%  21.7    5s
    * 6679   534              93       2.8298400    2.27916  19.5%  20.6    5s
    * 6680   533              93       2.8298362    2.27916  19.5%  20.6    5s
     14682   542    2.81300   57   68    2.82984    2.79821  1.12%  14.3   10s
     26156  1412    2.82983   81   21    2.82984    2.82146  0.30%  11.1   15s
     36272  1092    2.82886   74   51    2.82984    2.82527  0.16%   9.7   20s
    
    Explored 45675 nodes (396343 simplex iterations) in 23.84 seconds (17.03 work units)
    Thread count was 1 (of 96 available processors)
    
    Solution count 10: 2.82984 2.82984 2.82985 ... 4.39815
    
    Optimal solution found (tolerance 1.00e-06)
    Best objective 2.829836192155e+00, best bound 2.829834091923e+00, gap 0.0001%
    
    User-callback calls 45696, time in user-callback 0.00 sec

... Solving fixed model...

    Gurobi Optimizer version 13.0.0 build v13.0.0rc1 (linux64 - "Oracle Linux Server 9.7")
    
    CPU model: AMD EPYC 7643 48-Core Processor, instruction set [SSE2|AVX|AVX2]
    Thread count: 48 physical cores, 96 logical processors, using up to 1 threads
    
    Non-default parameters:
    TimeLimit  300
    MIPGap  1e-06
    LogToConsole  0
    NonConvex  2
    Threads  1
    
    Optimize a model with 70 rows, 125 columns and 106 nonzeros (Min)
    Model fingerprint: 0xbe67c249
    Model has 17 linear objective coefficients
    Coefficient statistics:
      Matrix range     [1e+00, 1e+00]
      Objective range  [1e+00, 1e+00]
      Bounds range     [8e-03, 1e+00]
      RHS range        [1e+00, 1e+00]
    Presolve removed 70 rows and 125 columns
    Presolve time: 0.00s
    Presolve: All rows and columns removed
    Iteration    Objective       Primal Inf.    Dual Inf.      Time
           0    2.8298362e+00   0.000000e+00   0.000000e+00      0s
    
    Solved in 0 iterations and 0.00 seconds (0.00 work units)
    Optimal objective  2.829836192e+00
    
    User-callback calls 0, time in user-callback 0.00 sec

--- Reading solution for model GAMS_MODEL
***
*** Solver did not provide marginals for model GAMS_MODEL
***
--- Executing after solve: elapsed 0:00:23.880
--- model.gms(290) 3 Mb
--- model.gms(486) 5 Mb
--- Putfile results /local/scratch/a/sgusev/repos/k_means/data/gams_gurobi_gdp.binary_multiplication/no_mode/2026-02-19_02-17-42/original/results.dat
--- Putfile statresults /local/scratch/a/sgusev/repos/k_means/data/gams_gurobi_gdp.binary_multiplication/no_mode/2026-02-19_02-17-42/original/resultsstat.dat
*** Status: Normal completion
--- Job model.gms Stop 02/19/26 02:18:06 elapsed 0:00:23.881
Original problem solved. Time taken: 24.36940360069275 seconds
Original objective value: 2.829836192155443
