Solving original (integer) problem with strategy gdp.binary_multiplication...
--- Job model.gms Start 02/18/26 23:51:39 52.2.0 d8e408be LEX-LEG x86 64bit/Linux
--- Applying:
    /package/gams/52.2/gmsprmun.txt
--- GAMS Parameters defined
    Input /local/scratch/a/sgusev/repos/k_means/data/gams_gurobi_gdp.binary_multiplication/no_mode/2026-02-18_23-51-38/original/model.gms
    Output /local/scratch/a/sgusev/repos/k_means/data/gams_gurobi_gdp.binary_multiplication/no_mode/2026-02-18_23-51-38/original/output.lst
    ScrDir /local/scratch/a/sgusev/repos/k_means/data/gams_gurobi_gdp.binary_multiplication/no_mode/2026-02-18_23-51-38/original/225a/
    SysDir /package/gams/52.2/
    CurDir /local/scratch/a/sgusev/repos/k_means/data/gams_gurobi_gdp.binary_multiplication/no_mode/2026-02-18_23-51-38/original/
    LogOption 3
    AppendLog 1
Licensee: David Bernal / SECQUOIA Research Group         G251008+0003Ac-GEN
          Purdue University, Davidson School of Chemical EngineeringDCE4838
          225a/gamslice.dat
          5a82958a-fbca-4a23
          node:66820903 mem:995 cores:48 ipport:42633 v:2                  
          Evaluation license: Not for commercial or production use
          The time-limited license stops working on : Jun 30, 2027
System information: 48 physical cores and 995 Gb physical memory detected
GAMS 52.2.0   Copyright (C) 1987-2025 GAMS Development. All rights reserved
--- Starting compilation
--- model.gms(235) 2 Mb
--- $echo File /local/scratch/a/sgusev/repos/k_means/data/gams_gurobi_gdp.binary_multiplication/no_mode/2026-02-18_23-51-38/original/gurobi.opt
--- model.gms(423) 2 Mb
--- Starting execution: elapsed 0:00:00.006
--- model.gms(244) 3 Mb
--- Generating MINLP model GAMS_MODEL
--- model.gms(248) 5 Mb
---   59 rows  63 columns  229 non-zeroes
---   462 nl-code  168 nl-non-zeroes
---   42 discrete-columns
--- Range statistics (absolute non-zero finite values)
--- RHS       [min, max] : [ 1.000E+00, 1.000E+00] - Zero values observed as well
--- Bound     [min, max] : [ 1.000E+00, 5.600E+01] - Zero values observed as well
--- Matrix    [min, max] : [ 5.503E-03, 1.504E+00] - Zero values observed as well
--- model.gms(248) 3 Mb
--- Executing GUROBI (Solvelink=5): elapsed 0:00:00.008
Reading parameter(s) from "/local/scratch/a/sgusev/repos/k_means/data/gams_gurobi_gdp.binary_multiplication/no_mode/2026-02-18_23-51-38/original/gurobi.opt"
>>  NonConvex 2
>>  Threads 1
>>  MIPGap 1e-06
>>  MIPGapAbs 1e-10
>>  FeasibilityTol 1e-06
>>  OptimalityTol 1e-06
>>  IntFeasTol 1e-05
Finished reading from "/local/scratch/a/sgusev/repos/k_means/data/gams_gurobi_gdp.binary_multiplication/no_mode/2026-02-18_23-51-38/original/gurobi.opt"

... GRB_LICENSE_FILE = /local/scratch/a/sgusev/gurobi.lic

    Gurobi           52.2.0 d8e408be Dec 8, 2025           LEG x86 64bit/Linux    

... GAMS/Gurobi Link license.
... GMO Q Extraction (ThreePass): 0.00s

    Gurobi Optimizer version 13.0.0 build v13.0.0rc1 (linux64 - "Oracle Linux Server 9.7")
    
    CPU model: AMD EPYC 7643 48-Core Processor, instruction set [SSE2|AVX|AVX2]
    Thread count: 48 physical cores, 96 logical processors, using up to 1 threads
    
    Non-default parameters:
    TimeLimit  300
    MIPGap  1e-06
    LogToConsole  0
    NonConvex  2
    Threads  1
    
    Optimize a model with 58 rows, 104 columns and 88 nonzeros (Min)
    Model fingerprint: 0x1b6e179f
    Model has 14 linear objective coefficients
    Model has 42 general nonlinear constraints (126 nonlinear terms)
    Variable types: 62 continuous, 42 integer (0 binary)
    Coefficient statistics:
      Matrix range     [1e+00, 1e+00]
      Objective range  [1e+00, 1e+00]
      Bounds range     [1e+00, 6e+01]
      RHS range        [1e+00, 1e+00]
      NLCon coe range  [1e-02, 1e+00]
    Presolve model has 42 nlconstr
    Added 210 variables to disaggregate expressions
    Presolve removed 42 rows and 0 columns
    Presolve time: 0.00s
    Presolved: 562 rows, 357 columns, 1306 nonzeros
    Presolved model has 84 bilinear constraint(s)
    
    Solving non-convex MIQCP to global optimality
    
    Variable types: 315 continuous, 42 integer (42 binary)
    Found heuristic solution: objective 6.3526495
    
    Root relaxation: objective 0.000000e+00, 34 iterations, 0.00 seconds (0.00 work units)
    
        Nodes    |    Current Node    |     Objective Bounds      |     Work
     Expl Unexpl |  Obj  Depth IntInf | Incumbent    BestBd   Gap | It/Node Time
    
         0     0    0.00000    0   84    6.35265    0.00000   100%     -    0s
    H    0     0                       6.3354225    0.00000   100%     -    0s
         0     0    0.00000    0   94    6.33542    0.00000   100%     -    0s
         0     0    0.00000    0  102    6.33542    0.00000   100%     -    0s
         0     0    0.00000    0   88    6.33542    0.00000   100%     -    0s
         0     0    0.00000    0   96    6.33542    0.00000   100%     -    0s
         0     0    0.00000    0  102    6.33542    0.00000   100%     -    0s
         0     0    0.00000    0   90    6.33542    0.00000   100%     -    0s
    H    0     0                       4.2386893    0.00000   100%     -    0s
         0     0    0.00000    0   94    4.23869    0.00000   100%     -    0s
         0     0    0.00000    0  101    4.23869    0.00000   100%     -    0s
         0     0    0.00000    0   83    4.23869    0.00000   100%     -    0s
         0     0    0.00000    0   83    4.23869    0.00000   100%     -    0s
    H    0     0                       2.3456008    0.00000   100%     -    0s
         0     2    0.00000    0   83    2.34560    0.00000   100%     -    0s
    H    4     4                       1.9119350    0.00000   100%  20.8    0s
      8419   622    1.89874   59   42    1.91194    1.82094  4.76%  11.8    5s
    *11338   873              85       1.9119307    1.85399  3.03%  10.3    6s
    *15928  1927              86       1.9119253    1.87400  1.98%   8.9    7s
     21821  3042     cutoff   63         1.91193    1.87821  1.76%   8.2   10s
     34699  3230    1.91057   66   14    1.91193    1.89592  0.84%   8.1   15s
     48356  2125     cutoff   69         1.91193    1.90279  0.48%   7.8   20s
    
    Explored 55770 nodes (414433 simplex iterations) in 22.94 seconds (15.60 work units)
    Thread count was 1 (of 96 available processors)
    
    Solution count 7: 1.91193 1.91193 1.91194 ... 6.35265
    
    Optimal solution found (tolerance 1.00e-06)
    Warning: max constraint violation (1.7855e-06) exceeds tolerance
    Warning: max general constraint violation (1.7855e-06) exceeds tolerance
    Best objective 1.911925299189e+00, best bound 1.911924454680e+00, gap 0.0000%
    
    User-callback calls 55783, time in user-callback 0.00 sec

... Solving fixed model...

    Gurobi Optimizer version 13.0.0 build v13.0.0rc1 (linux64 - "Oracle Linux Server 9.7")
    
    CPU model: AMD EPYC 7643 48-Core Processor, instruction set [SSE2|AVX|AVX2]
    Thread count: 48 physical cores, 96 logical processors, using up to 1 threads
    
    Non-default parameters:
    TimeLimit  300
    MIPGap  1e-06
    LogToConsole  0
    NonConvex  2
    Threads  1
    
    Optimize a model with 58 rows, 104 columns and 88 nonzeros (Min)
    Model fingerprint: 0xc8d5e267
    Model has 14 linear objective coefficients
    Coefficient statistics:
      Matrix range     [1e+00, 1e+00]
      Objective range  [1e+00, 1e+00]
      Bounds range     [3e-04, 1e+00]
      RHS range        [1e+00, 1e+00]
    Presolve removed 58 rows and 104 columns
    Presolve time: 0.00s
    Presolve: All rows and columns removed
    Iteration    Objective       Primal Inf.    Dual Inf.      Time
           0    1.9119253e+00   0.000000e+00   0.000000e+00      0s
    
    Solved in 0 iterations and 0.00 seconds (0.00 work units)
    Optimal objective  1.911925299e+00
    
    User-callback calls 0, time in user-callback 0.00 sec

--- Reading solution for model GAMS_MODEL
***
*** Solver did not provide marginals for model GAMS_MODEL
***
--- Executing after solve: elapsed 0:00:22.983
--- model.gms(251) 3 Mb
--- model.gms(423) 5 Mb
--- Putfile results /local/scratch/a/sgusev/repos/k_means/data/gams_gurobi_gdp.binary_multiplication/no_mode/2026-02-18_23-51-38/original/results.dat
--- Putfile statresults /local/scratch/a/sgusev/repos/k_means/data/gams_gurobi_gdp.binary_multiplication/no_mode/2026-02-18_23-51-38/original/resultsstat.dat
*** Status: Normal completion
--- Job model.gms Stop 02/18/26 23:52:02 elapsed 0:00:22.983
Original problem solved. Time taken: 23.45100212097168 seconds
Original objective value: 1.911925299188804
