Solving original (integer) problem with strategy gdp.hull...
--- Job model.gms Start 02/14/26 22:08:35 52.2.0 d8e408be LEX-LEG x86 64bit/Linux
--- Applying:
    /package/gams/52.2/gmsprmun.txt
--- GAMS Parameters defined
    Input /local/scratch/a/sgusev/repos/k_means/data/gams_gurobi_gdp.hull/no_mode/2026-02-14_22-08-34/original/model.gms
    Output /local/scratch/a/sgusev/repos/k_means/data/gams_gurobi_gdp.hull/no_mode/2026-02-14_22-08-34/original/output.lst
    ScrDir /local/scratch/a/sgusev/repos/k_means/data/gams_gurobi_gdp.hull/no_mode/2026-02-14_22-08-34/original/225a/
    SysDir /package/gams/52.2/
    CurDir /local/scratch/a/sgusev/repos/k_means/data/gams_gurobi_gdp.hull/no_mode/2026-02-14_22-08-34/original/
    LogOption 3
    AppendLog 1
Licensee: David Bernal / SECQUOIA Research Group         G251008+0003Ac-GEN
          Purdue University, Davidson School of Chemical EngineeringDCE4838
          225a/gamslice.dat
          5a82958a-fbca-4a23
          node:66820903 mem:995 cores:48 ipport:56665 v:2                  
          Evaluation license: Not for commercial or production use
          The time-limited license stops working on : Jun 30, 2027
System information: 48 physical cores and 995 Gb physical memory detected
GAMS 52.2.0   Copyright (C) 1987-2025 GAMS Development. All rights reserved
--- Starting compilation
--- model.gms(2144) 2 Mb
--- $echo File /local/scratch/a/sgusev/repos/k_means/data/gams_gurobi_gdp.hull/no_mode/2026-02-14_22-08-34/original/gurobi.opt
--- model.gms(3189) 2 Mb
--- Starting execution: elapsed 0:00:00.016
--- model.gms(2153) 3 Mb
--- Generating MINLP model GAMS_MODEL
--- model.gms(2157) 5 Mb
---   649 rows  330 columns  1,569 non-zeroes
---   1,581 nl-code  204 nl-non-zeroes
---   51 discrete-columns
--- Range statistics (absolute non-zero finite values)
--- RHS       [min, max] : [ 9.160E-06, 1.000E+00] - Zero values observed as well
--- Bound     [min, max] : [ 1.000E+00, 6.800E+01] - Zero values observed as well
--- Matrix    [min, max] : [ 8.148E-02, 6.800E+01]
--- model.gms(2157) 3 Mb
--- Executing GUROBI (Solvelink=5): elapsed 0:00:00.021
Reading parameter(s) from "/local/scratch/a/sgusev/repos/k_means/data/gams_gurobi_gdp.hull/no_mode/2026-02-14_22-08-34/original/gurobi.opt"
>>  NonConvex 2
>>  Threads 1
>>  MIPGap 1e-06
>>  MIPGapAbs 1e-10
>>  FeasibilityTol 1e-06
>>  OptimalityTol 1e-06
>>  IntFeasTol 1e-05
Finished reading from "/local/scratch/a/sgusev/repos/k_means/data/gams_gurobi_gdp.hull/no_mode/2026-02-14_22-08-34/original/gurobi.opt"

... GRB_LICENSE_FILE = /local/scratch/a/sgusev/gurobi.lic

    Gurobi           52.2.0 d8e408be Dec 8, 2025           LEG x86 64bit/Linux    

... GAMS/Gurobi Link license.
... GMO Q Extraction (ThreePass): 0.00s

    Gurobi Optimizer version 13.0.0 build v13.0.0rc1 (linux64 - "Oracle Linux Server 9.7")
    
    CPU model: AMD EPYC 7643 48-Core Processor, instruction set [SSE2|AVX|AVX2]
    Thread count: 48 physical cores, 96 logical processors, using up to 1 threads
    
    Non-default parameters:
    TimeLimit  300
    MIPGap  1e-06
    LogToConsole  0
    NonConvex  2
    Threads  1
    
    Optimize a model with 648 rows, 380 columns and 1398 nonzeros (Min)
    Model fingerprint: 0x5a6eac39
    Model has 17 linear objective coefficients
    Model has 51 general nonlinear constraints (306 nonlinear terms)
    Variable types: 329 continuous, 51 integer (0 binary)
    Coefficient statistics:
      Matrix range     [1e+00, 7e+01]
      Objective range  [1e+00, 1e+00]
      Bounds range     [1e+00, 7e+01]
      RHS range        [1e+00, 1e+00]
      NLCon coe range  [9e-06, 1e+00]
    Presolve model has 51 nlconstr
    Added 663 variables to disaggregate expressions
    Presolve removed 153 rows and 119 columns
    Presolve time: 0.00s
    Presolved: 2025 rows, 925 columns, 5155 nonzeros
    Presolved model has 306 bilinear constraint(s)
    
    Solving non-convex MIQCP to global optimality
    
    Variable types: 874 continuous, 51 integer (51 binary)
    Found heuristic solution: objective 10.2222146
    
    Root relaxation: objective 0.000000e+00, 307 iterations, 0.00 seconds (0.00 work units)
    
        Nodes    |    Current Node    |     Objective Bounds      |     Work
     Expl Unexpl |  Obj  Depth IntInf | Incumbent    BestBd   Gap | It/Node Time
    
         0     0    0.00000    0  153   10.22221    0.00000   100%     -    0s
         0     0    0.00000    0  152   10.22221    0.00000   100%     -    0s
         0     0    0.00000    0  147   10.22221    0.00000   100%     -    0s
         0     0    0.00000    0  163   10.22221    0.00000   100%     -    0s
         0     0    0.00000    0  163   10.22221    0.00000   100%     -    0s
         0     0    0.00000    0   77   10.22221    0.00000   100%     -    0s
         0     0    0.00000    0   78   10.22221    0.00000   100%     -    0s
         0     0    0.00000    0  136   10.22221    0.00000   100%     -    0s
         0     0    0.00000    0  136   10.22221    0.00000   100%     -    0s
         0     0    0.00000    0   80   10.22221    0.00000   100%     -    0s
         0     0    0.00000    0   80   10.22221    0.00000   100%     -    0s
         0     0    0.00000    0   77   10.22221    0.00000   100%     -    0s
    H    0     0                       6.1058835    0.00000   100%     -    0s
    H    0     0                       5.8430598    0.00000   100%     -    0s
         0     2    0.00000    0   77    5.84306    0.00000   100%     -    0s
    H    1     1                       5.6943964    0.00000   100%   1.0    0s
    H    4     4                       4.8758568    0.00000   100%  20.8    0s
    H   29    28                       4.8758568    0.00000   100%  12.1    0s
    H  648   423                       4.6799879    0.00000   100%  16.1    1s
    H  654   407                       4.6799879    0.00000   100%  20.3    1s
    H  654   387                       4.6761345    0.00000   100%  20.3    1s
    H  654   367                       4.6721623    0.00000   100%  20.3    1s
    H  654   349                       4.6713526    0.00000   100%  20.3    1s
    H  654   331                       4.6703910    0.00000   100%  20.3    1s
    H  654   315                       4.6627301    0.00000   100%  20.3    1s
    H  664   304                       4.3862282    0.00000   100%  24.4    1s
    H  664   289                       4.0489498    0.00000   100%  24.4    1s
    H  664   274                       4.0489498    0.00000   100%  24.4    1s
    H  666   262                       3.9978471    0.00000   100%  24.5    2s
    H  675   255                       3.9978470    0.00000   100%  24.5    2s
    H  688   250                       3.9644130    0.00000   100%  24.3    2s
    H  688   239                       3.9644060    0.00000   100%  24.3    2s
    H  688   227                       3.9643325    0.00000   100%  24.3    2s
    H  688   216                       3.9643290    0.00000   100%  24.3    2s
    H  688   206                       3.9459712    0.00000   100%  24.3    2s
    H  688   196                       3.9454488    0.00000   100%  24.3    2s
    H  688   187                       3.9451157    0.00000   100%  24.3    2s
    H  691   179                       3.9447401    0.00000   100%  24.2    2s
    H  691   171                       3.9420534    0.00000   100%  24.2    2s
    H  691   163                       3.9420444    0.00000   100%  24.2    2s
    H  695   159                       3.9420023    0.00000   100%  24.2    2s
    H  738   171                       3.8521624    0.00000   100%  23.1    2s
    H  743   167                       3.8521624    0.00000   100%  23.0    2s
    H  828   203                       3.8521624    0.00000   100%  21.6    2s
    H  849   190                       3.7127837    0.00000   100%  21.6    2s
    H  864   184                       3.6414147    0.00000   100%  21.8    2s
    H  905   190                       3.6145611    0.00000   100%  21.5    2s
    H  905   184                       3.6142305    0.00000   100%  21.5    2s
    H 1091   297                       3.4865309    0.09919  97.2%  20.6    2s
    H 1093   289                       3.3148248    0.09919  97.0%  20.5    2s
    H 1847   647                       3.2333527    0.46127  85.7%  17.9    3s
    H 2811   822                       2.9207858    0.82656  71.7%  16.8    4s
      3711   966    2.16888   39   76    2.92079    1.10130  62.3%  16.7    5s
    H 3988   944                       2.8582112    1.14532  59.9%  16.8    5s
    H 4002   940                       2.8298451    1.14532  59.5%  16.8    5s
    * 4086  1002             107       2.8298359    1.14532  59.5%  16.5    5s
      9405   920    2.56986   61   16    2.82984    2.56725  9.28%  13.7   10s
     19404   996    2.82919   87   13    2.82984    2.81599  0.49%   7.9   15s
    *25083   379             106       2.8298355    2.82947  0.01%   6.5   17s
    
    Cutting planes:
      Learned: 56
      Gomory: 1
      Implied bound: 16
      Flow cover: 25
      RLT: 9
      Relax-and-lift: 10
    
    Explored 26371 nodes (166560 simplex iterations) in 18.52 seconds (13.29 work units)
    Thread count was 1 (of 96 available processors)
    
    Solution count 10: 2.82984 2.82984 2.82984 ... 3.61423
    
    Optimal solution found (tolerance 1.00e-06)
    Best objective 2.829835473015e+00, best bound 2.829834735918e+00, gap 0.0000%
    
    User-callback calls 26416, time in user-callback 0.00 sec

... Solving fixed model...

    Gurobi Optimizer version 13.0.0 build v13.0.0rc1 (linux64 - "Oracle Linux Server 9.7")
    
    CPU model: AMD EPYC 7643 48-Core Processor, instruction set [SSE2|AVX|AVX2]
    Thread count: 48 physical cores, 96 logical processors, using up to 1 threads
    
    Non-default parameters:
    TimeLimit  300
    MIPGap  1e-06
    LogToConsole  0
    NonConvex  2
    Threads  1
    
    Optimize a model with 648 rows, 380 columns and 1398 nonzeros (Min)
    Model fingerprint: 0x7a270ee3
    Model has 17 linear objective coefficients
    Coefficient statistics:
      Matrix range     [1e+00, 7e+01]
      Objective range  [1e+00, 1e+00]
      Bounds range     [8e-03, 7e+01]
      RHS range        [1e+00, 1e+00]
    Presolve removed 648 rows and 380 columns
    Presolve time: 0.00s
    Presolve: All rows and columns removed
    Iteration    Objective       Primal Inf.    Dual Inf.      Time
           0    2.8298355e+00   0.000000e+00   0.000000e+00      0s
    
    Solved in 0 iterations and 0.00 seconds (0.00 work units)
    Optimal objective  2.829835473e+00
    
    User-callback calls 0, time in user-callback 0.00 sec

--- Reading solution for model GAMS_MODEL
***
*** Solver did not provide marginals for model GAMS_MODEL
***
--- Executing after solve: elapsed 0:00:18.567
--- model.gms(2160) 3 Mb
--- model.gms(3189) 5 Mb
--- Putfile results /local/scratch/a/sgusev/repos/k_means/data/gams_gurobi_gdp.hull/no_mode/2026-02-14_22-08-34/original/results.dat
--- Putfile statresults /local/scratch/a/sgusev/repos/k_means/data/gams_gurobi_gdp.hull/no_mode/2026-02-14_22-08-34/original/resultsstat.dat
*** Status: Normal completion
--- Job model.gms Stop 02/14/26 22:08:54 elapsed 0:00:18.574
Original problem solved. Time taken: 19.1355140209198 seconds
Original objective value: 2.829835473016876
