Solving original (integer) problem with strategy gdp.hull...
--- Job model.gms Start 02/14/26 17:12:22 52.2.0 d8e408be LEX-LEG x86 64bit/Linux
--- Applying:
    /package/gams/52.2/gmsprmun.txt
--- GAMS Parameters defined
    Input /local/scratch/a/sgusev/repos/k_means/data/gams_gurobi_gdp.hull/no_mode/2026-02-14_17-12-21/original/model.gms
    Output /local/scratch/a/sgusev/repos/k_means/data/gams_gurobi_gdp.hull/no_mode/2026-02-14_17-12-21/original/output.lst
    ScrDir /local/scratch/a/sgusev/repos/k_means/data/gams_gurobi_gdp.hull/no_mode/2026-02-14_17-12-21/original/225a/
    SysDir /package/gams/52.2/
    CurDir /local/scratch/a/sgusev/repos/k_means/data/gams_gurobi_gdp.hull/no_mode/2026-02-14_17-12-21/original/
    LogOption 3
    AppendLog 1
Licensee: David Bernal / SECQUOIA Research Group         G251008+0003Ac-GEN
          Purdue University, Davidson School of Chemical EngineeringDCE4838
          225a/gamslice.dat
          5a82958a-fbca-4a23
          node:66820903 mem:995 cores:48 ipport:53543 v:2                  
          Evaluation license: Not for commercial or production use
          The time-limited license stops working on : Jun 30, 2027
System information: 48 physical cores and 995 Gb physical memory detected
GAMS 52.2.0   Copyright (C) 1987-2025 GAMS Development. All rights reserved
--- Starting compilation
--- model.gms(1406) 2 Mb
--- $echo File /local/scratch/a/sgusev/repos/k_means/data/gams_gurobi_gdp.hull/no_mode/2026-02-14_17-12-21/original/gurobi.opt
--- model.gms(2109) 2 Mb
--- Starting execution: elapsed 0:00:00.011
--- model.gms(1415) 3 Mb
--- Generating MINLP model GAMS_MODEL
--- model.gms(1419) 5 Mb
---   421 rows  216 columns  1,017 non-zeroes
---   1,023 nl-code  132 nl-non-zeroes
---   33 discrete-columns
--- Range statistics (absolute non-zero finite values)
--- RHS       [min, max] : [ 8.431E-06, 1.000E+00] - Zero values observed as well
--- Bound     [min, max] : [ 1.000E+00, 4.400E+01] - Zero values observed as well
--- Matrix    [min, max] : [ 1.532E-02, 4.400E+01]
--- model.gms(1419) 3 Mb
--- Executing GUROBI (Solvelink=5): elapsed 0:00:00.015
Reading parameter(s) from "/local/scratch/a/sgusev/repos/k_means/data/gams_gurobi_gdp.hull/no_mode/2026-02-14_17-12-21/original/gurobi.opt"
>>  NonConvex 2
>>  Threads 1
>>  MIPGap 1e-06
>>  MIPGapAbs 1e-10
>>  FeasibilityTol 1e-06
>>  OptimalityTol 1e-06
>>  IntFeasTol 1e-05
Finished reading from "/local/scratch/a/sgusev/repos/k_means/data/gams_gurobi_gdp.hull/no_mode/2026-02-14_17-12-21/original/gurobi.opt"

... GRB_LICENSE_FILE = /local/scratch/a/sgusev/gurobi.lic

    Gurobi           52.2.0 d8e408be Dec 8, 2025           LEG x86 64bit/Linux    

... GAMS/Gurobi Link license.
... GMO Q Extraction (ThreePass): 0.00s

    Gurobi Optimizer version 13.0.0 build v13.0.0rc1 (linux64 - "Oracle Linux Server 9.7")
    
    CPU model: AMD EPYC 7643 48-Core Processor, instruction set [SSE2|AVX|AVX2]
    Thread count: 48 physical cores, 96 logical processors, using up to 1 threads
    
    Non-default parameters:
    TimeLimit  300
    MIPGap  1e-06
    LogToConsole  0
    NonConvex  2
    Threads  1
    
    Optimize a model with 420 rows, 248 columns and 906 nonzeros (Min)
    Model fingerprint: 0x1ea48201
    Model has 11 linear objective coefficients
    Model has 33 general nonlinear constraints (198 nonlinear terms)
    Variable types: 215 continuous, 33 integer (0 binary)
    Coefficient statistics:
      Matrix range     [1e+00, 4e+01]
      Objective range  [1e+00, 1e+00]
      Bounds range     [1e+00, 4e+01]
      RHS range        [1e+00, 1e+00]
      NLCon coe range  [8e-06, 1e+00]
    Presolve model has 33 nlconstr
    Added 429 variables to disaggregate expressions
    Presolve removed 99 rows and 77 columns
    Presolve time: 0.00s
    Presolved: 1311 rows, 601 columns, 3337 nonzeros
    Presolved model has 198 bilinear constraint(s)
    
    Solving non-convex MIQCP to global optimality
    
    Variable types: 568 continuous, 33 integer (33 binary)
    Found heuristic solution: objective 5.5559487
    
    Root relaxation: objective 0.000000e+00, 187 iterations, 0.00 seconds (0.00 work units)
    
        Nodes    |    Current Node    |     Objective Bounds      |     Work
     Expl Unexpl |  Obj  Depth IntInf | Incumbent    BestBd   Gap | It/Node Time
    
         0     0    0.00000    0   99    5.55595    0.00000   100%     -    0s
         0     0    0.00000    0   99    5.55595    0.00000   100%     -    0s
         0     0    0.00000    0   99    5.55595    0.00000   100%     -    0s
         0     0    0.00000    0   79    5.55595    0.00000   100%     -    0s
         0     0    0.00000    0   79    5.55595    0.00000   100%     -    0s
         0     0    0.00000    0   87    5.55595    0.00000   100%     -    0s
         0     0    0.00000    0  121    5.55595    0.00000   100%     -    0s
         0     0    0.00000    0  121    5.55595    0.00000   100%     -    0s
         0     0    0.00000    0   64    5.55595    0.00000   100%     -    0s
         0     0    0.00000    0   64    5.55595    0.00000   100%     -    0s
         0     0    0.00000    0   51    5.55595    0.00000   100%     -    0s
    H    0     0                       5.2799893    0.00000   100%     -    0s
    H    0     0                       4.4048042    0.00000   100%     -    0s
         0     2    0.00000    0   51    4.40480    0.00000   100%     -    0s
    H    1     1                       4.1222819    0.00000   100%   0.0    0s
    H   11    11                       3.7398929    0.00000   100%  17.0    0s
    H   32    29                       3.7398929    0.00000   100%  11.8    0s
    H  136    60                       2.1948929    0.00000   100%  12.4    0s
    H  312   164                       2.1315905    0.00000   100%  11.7    0s
    *  417   255              68       2.1315864    0.00000   100%   9.4    0s
    *  419   253              69       2.1315826    0.00000   100%   9.4    0s
    H  587   357                       2.0878784    0.00000   100%   9.1    0s
    H  588   306                       2.0477099    0.00000   100%   9.1    0s
    H  605   311                       2.0477099    0.00000   100%   8.9    0s
    H  646   317                       2.0207654    0.00000   100%  11.6    1s
    H  646   301                       2.0096850    0.00000   100%  11.6    1s
    H  646   286                       2.0096194    0.00000   100%  11.6    1s
    H  646   271                       2.0084938    0.00000   100%  11.6    1s
    H  656   264                       1.9539366    0.00000   100%  11.4    1s
    H  658   252                       1.9027784    0.00000   100%  13.7    1s
    H  658   239                       1.8971078    0.00000   100%  13.7    1s
    H  658   227                       1.8838167    0.00000   100%  13.7    1s
    H  658   215                       1.8803342    0.00000   100%  13.7    1s
    H  658   204                       1.8803342    0.00000   100%  13.7    1s
    H  660   196                       1.8573930    0.00000   100%  13.8    1s
    H  660   186                       1.8559493    0.00000   100%  13.8    1s
    H  660   176                       1.8511274    0.00000   100%  13.8    1s
    H  660   167                       1.8511247    0.00000   100%  13.8    1s
    H  660   159                       1.7889491    0.00000   100%  13.8    1s
    H  660   151                       1.7862503    0.00000   100%  13.8    1s
    H  660   143                       1.7855756    0.00000   100%  13.8    1s
    H  660   136                       1.7854069    0.00000   100%  13.8    1s
    H  661   129                       1.6545060    0.00000   100%  13.8    1s
    H  662   123                       1.5526824    0.00000   100%  13.8    1s
    H  666   120                       1.0019145    0.00000   100%  13.9    1s
    H  670   114                       0.9729334    0.00148   100%  14.0    1s
    H  670   109                       0.9605099    0.00148   100%  14.0    1s
    H  670   103                       0.9605086    0.00148   100%  14.0    1s
    H  677   101                       0.9365735    0.00454   100%  14.0    1s
    H  677    96                       0.9313990    0.00454   100%  14.0    1s
    H  677    92                       0.9313789    0.00454   100%  14.0    1s
    H  678    87                       0.9281842    0.00454   100%  14.1    1s
    H  678    83                       0.9013593    0.00454  99.5%  14.1    1s
    H  680    78                       0.8988138    0.00454  99.5%  14.1    1s
    H  680    75                       0.8980304    0.00454  99.5%  14.1    1s
    H  680    71                       0.8978592    0.00454  99.5%  14.1    1s
    H  680    68                       0.8969370    0.00454  99.5%  14.1    1s
    H  680    64                       0.8969183    0.00454  99.5%  14.1    1s
    H  680    61                       0.8969125    0.00454  99.5%  14.1    1s
    H  681    58                       0.8968961    0.00454  99.5%  14.1    1s
    H  685    55                       0.8837703    0.00454  99.5%  14.1    1s
    * 1405    53              74       0.8837685    0.85906  2.80%  10.1    1s
    * 1727    31              76       0.8837676    0.88319  0.07%   8.8    1s
    * 1750    32              76       0.8837655    0.88319  0.07%   8.7    1s
    * 1823    33              74       0.8837624    0.88355  0.02%   8.4    1s
    * 1824    30              74       0.8837614    0.88355  0.02%   8.4    1s
    
    Cutting planes:
      Learned: 21
      Gomory: 1
      Implied bound: 12
      Flow cover: 33
      Relax-and-lift: 3
    
    Explored 1927 nodes (16574 simplex iterations) in 2.01 seconds (1.28 work units)
    Thread count was 1 (of 96 available processors)
    
    Solution count 10: 0.883761 0.883762 0.883766 ... 0.896937
    
    Optimal solution found (tolerance 1.00e-06)
    Warning: max constraint violation (1.7767e-06) exceeds tolerance
    Warning: max general constraint violation (1.7767e-06) exceeds tolerance
    Best objective 8.837614138035e-01, best bound 8.837614138033e-01, gap 0.0000%
    
    User-callback calls 1983, time in user-callback 0.00 sec

... Solving fixed model...

    Gurobi Optimizer version 13.0.0 build v13.0.0rc1 (linux64 - "Oracle Linux Server 9.7")
    
    CPU model: AMD EPYC 7643 48-Core Processor, instruction set [SSE2|AVX|AVX2]
    Thread count: 48 physical cores, 96 logical processors, using up to 1 threads
    
    Non-default parameters:
    TimeLimit  300
    MIPGap  1e-06
    LogToConsole  0
    NonConvex  2
    Threads  1
    
    Optimize a model with 420 rows, 248 columns and 906 nonzeros (Min)
    Model fingerprint: 0x72121d75
    Model has 11 linear objective coefficients
    Coefficient statistics:
      Matrix range     [1e+00, 4e+01]
      Objective range  [1e+00, 1e+00]
      Bounds range     [1e-03, 4e+01]
      RHS range        [1e+00, 1e+00]
    Presolve removed 420 rows and 248 columns
    Presolve time: 0.00s
    Presolve: All rows and columns removed
    Iteration    Objective       Primal Inf.    Dual Inf.      Time
           0    8.8376141e-01   0.000000e+00   0.000000e+00      0s
    
    Solved in 0 iterations and 0.00 seconds (0.00 work units)
    Optimal objective  8.837614138e-01
    
    User-callback calls 0, time in user-callback 0.00 sec

--- Reading solution for model GAMS_MODEL
***
*** Solver did not provide marginals for model GAMS_MODEL
***
--- Executing after solve: elapsed 0:00:02.057
--- model.gms(1422) 3 Mb
--- model.gms(2109) 5 Mb
--- Putfile results /local/scratch/a/sgusev/repos/k_means/data/gams_gurobi_gdp.hull/no_mode/2026-02-14_17-12-21/original/results.dat
--- Putfile statresults /local/scratch/a/sgusev/repos/k_means/data/gams_gurobi_gdp.hull/no_mode/2026-02-14_17-12-21/original/resultsstat.dat
*** Status: Normal completion
--- Job model.gms Stop 02/14/26 17:12:24 elapsed 0:00:02.058
Original problem solved. Time taken: 2.6056969165802 seconds
Original objective value: 0.883761413804668
