Solving original (integer) problem with strategy gdp.hull...
--- Job model.gms Start 02/14/26 17:13:14 52.2.0 d8e408be LEX-LEG x86 64bit/Linux
--- Applying:
    /package/gams/52.2/gmsprmun.txt
--- GAMS Parameters defined
    Input /local/scratch/a/sgusev/repos/k_means/data/gams_gurobi_gdp.hull/no_mode/2026-02-14_17-13-13/original/model.gms
    Output /local/scratch/a/sgusev/repos/k_means/data/gams_gurobi_gdp.hull/no_mode/2026-02-14_17-13-13/original/output.lst
    ScrDir /local/scratch/a/sgusev/repos/k_means/data/gams_gurobi_gdp.hull/no_mode/2026-02-14_17-13-13/original/225a/
    SysDir /package/gams/52.2/
    CurDir /local/scratch/a/sgusev/repos/k_means/data/gams_gurobi_gdp.hull/no_mode/2026-02-14_17-13-13/original/
    LogOption 3
    AppendLog 1
Licensee: David Bernal / SECQUOIA Research Group         G251008+0003Ac-GEN
          Purdue University, Davidson School of Chemical EngineeringDCE4838
          225a/gamslice.dat
          5a82958a-fbca-4a23
          node:66820903 mem:995 cores:48 ipport:41259 v:2                  
          Evaluation license: Not for commercial or production use
          The time-limited license stops working on : Jun 30, 2027
System information: 48 physical cores and 995 Gb physical memory detected
GAMS 52.2.0   Copyright (C) 1987-2025 GAMS Development. All rights reserved
--- Starting compilation
--- model.gms(1772) 2 Mb
--- $echo File /local/scratch/a/sgusev/repos/k_means/data/gams_gurobi_gdp.hull/no_mode/2026-02-14_17-13-13/original/gurobi.opt
--- model.gms(2631) 2 Mb
--- Starting execution: elapsed 0:00:00.012
--- model.gms(1781) 3 Mb
--- Generating MINLP model GAMS_MODEL
--- model.gms(1785) 5 Mb
---   533 rows  260 columns  1,285 non-zeroes
---   1,200 nl-code  150 nl-non-zeroes
---   30 discrete-columns
--- Range statistics (absolute non-zero finite values)
--- RHS       [min, max] : [ 5.186E-05, 1.000E+00] - Zero values observed as well
--- Bound     [min, max] : [ 1.000E+00, 6.000E+01] - Zero values observed as well
--- Matrix    [min, max] : [ 1.970E-01, 6.000E+01]
--- model.gms(1785) 3 Mb
--- Executing GUROBI (Solvelink=5): elapsed 0:00:00.016
Reading parameter(s) from "/local/scratch/a/sgusev/repos/k_means/data/gams_gurobi_gdp.hull/no_mode/2026-02-14_17-13-13/original/gurobi.opt"
>>  NonConvex 2
>>  Threads 1
>>  MIPGap 1e-06
>>  MIPGapAbs 1e-10
>>  FeasibilityTol 1e-06
>>  OptimalityTol 1e-06
>>  IntFeasTol 1e-05
Finished reading from "/local/scratch/a/sgusev/repos/k_means/data/gams_gurobi_gdp.hull/no_mode/2026-02-14_17-13-13/original/gurobi.opt"

... GRB_LICENSE_FILE = /local/scratch/a/sgusev/gurobi.lic

    Gurobi           52.2.0 d8e408be Dec 8, 2025           LEG x86 64bit/Linux    

... GAMS/Gurobi Link license.
... GMO Q Extraction (ThreePass): 0.00s

    Gurobi Optimizer version 13.0.0 build v13.0.0rc1 (linux64 - "Oracle Linux Server 9.7")
    
    CPU model: AMD EPYC 7643 48-Core Processor, instruction set [SSE2|AVX|AVX2]
    Thread count: 48 physical cores, 96 logical processors, using up to 1 threads
    
    Non-default parameters:
    TimeLimit  300
    MIPGap  1e-06
    LogToConsole  0
    NonConvex  2
    Threads  1
    
    Optimize a model with 532 rows, 289 columns and 1154 nonzeros (Min)
    Model fingerprint: 0x349fd3de
    Model has 10 linear objective coefficients
    Model has 30 general nonlinear constraints (240 nonlinear terms)
    Variable types: 259 continuous, 30 integer (0 binary)
    Coefficient statistics:
      Matrix range     [1e+00, 6e+01]
      Objective range  [1e+00, 1e+00]
      Bounds range     [1e+00, 6e+01]
      RHS range        [1e+00, 1e+00]
      NLCon coe range  [5e-05, 1e+00]
    Presolve model has 30 nlconstr
    Added 510 variables to disaggregate expressions
    Presolve removed 120 rows and 100 columns
    Presolve time: 0.00s
    Presolved: 1582 rows, 700 columns, 4024 nonzeros
    Presolved model has 240 bilinear constraint(s)
    
    Solving non-convex MIQCP to global optimality
    
    Variable types: 670 continuous, 30 integer (30 binary)
    Found heuristic solution: objective 9.8065339
    
    Root relaxation: objective 0.000000e+00, 215 iterations, 0.00 seconds (0.00 work units)
    
        Nodes    |    Current Node    |     Objective Bounds      |     Work
     Expl Unexpl |  Obj  Depth IntInf | Incumbent    BestBd   Gap | It/Node Time
    
         0     0    0.00000    0  120    9.80653    0.00000   100%     -    0s
         0     0    0.00000    0  120    9.80653    0.00000   100%     -    0s
         0     0    0.00000    0  156    9.80653    0.00000   100%     -    0s
         0     0    0.00000    0  123    9.80653    0.00000   100%     -    0s
         0     0    0.00000    0  123    9.80653    0.00000   100%     -    0s
         0     0    0.00000    0   80    9.80653    0.00000   100%     -    0s
         0     0    0.00000    0   76    9.80653    0.00000   100%     -    0s
         0     0    0.00000    0   90    9.80653    0.00000   100%     -    0s
         0     0    0.00000    0   90    9.80653    0.00000   100%     -    0s
         0     0    0.00000    0   90    9.80653    0.00000   100%     -    0s
         0     0    0.00000    0   90    9.80653    0.00000   100%     -    0s
         0     0    0.00000    0   59    9.80653    0.00000   100%     -    0s
    H    0     0                       8.4227593    0.00000   100%     -    0s
    H    0     0                       8.0965334    0.00000   100%     -    0s
    H    0     0                       7.7363681    0.00000   100%     -    0s
         0     2    0.00000    0   59    7.73637    0.00000   100%     -    0s
    H    1     1                       6.5036193    0.00000   100%   0.0    0s
    H    4     4                       6.4247729    0.00000   100%  28.2    0s
    H    5     5                       4.8385129    0.00000   100%  26.2    0s
    H  269   168                       4.3913086    0.00000   100%  14.3    0s
    H  655   401                       3.9640709    0.23041  94.2%  12.9    1s
    H  656   381                       3.9266225    0.23041  94.1%  15.0    1s
    H  656   362                       3.8760307    0.23041  94.1%  15.0    1s
    H  656   343                       3.8700129    0.23041  94.0%  15.0    1s
    H  656   326                       3.8693503    0.23041  94.0%  15.0    1s
    H  656   309                       3.8693321    0.23041  94.0%  15.0    1s
    H  656   294                       3.8691181    0.23041  94.0%  15.0    1s
    H  657   280                       3.8633332    0.23041  94.0%  15.0    1s
    H  657   266                       3.7753571    0.23041  93.9%  15.0    1s
    H  657   252                       3.7673830    0.23041  93.9%  15.0    1s
    H  657   239                       3.7673668    0.23041  93.9%  15.0    1s
    H  658   228                       3.7673633    0.23041  93.9%  15.0    1s
    H  658   217                       3.7673583    0.23041  93.9%  15.0    1s
    H  659   206                       3.7546178    0.23041  93.9%  15.1    1s
    H  659   195                       3.7544350    0.23041  93.9%  15.1    1s
    H  659   185                       3.7542499    0.23041  93.9%  15.1    1s
    H  660   176                       3.6740287    0.23041  93.7%  15.2    1s
    H  660   167                       3.6677158    0.23041  93.7%  15.2    1s
    H  660   159                       3.6675405    0.23041  93.7%  15.2    1s
    H  661   152                       3.6594882    0.23041  93.7%  15.2    1s
    H  661   144                       3.6590163    0.23041  93.7%  15.2    1s
    H  662   137                       3.2489285    0.23041  92.9%  15.2    1s
    H  662   130                       3.2468304    0.23041  92.9%  15.2    1s
    H  662   123                       3.2464176    0.23041  92.9%  15.2    1s
    H  662   117                       3.2463621    0.23041  92.9%  15.2    1s
    H  664   113                       3.2463277    0.23041  92.9%  15.4    1s
    H  669   110                       3.2462486    0.23041  92.9%  15.4    1s
    H  676   108                       3.2462223    0.23041  92.9%  15.4    1s
    H  676   103                       3.2462216    0.23041  92.9%  15.4    1s
    H 1194   299                       3.2321341    0.23041  92.9%  14.9    2s
    H 1194   299                       3.2265676    0.23041  92.9%  14.9    2s
    H 1194   299                       3.2265532    0.23041  92.9%  14.9    2s
    H 2639   488                       3.2265355    1.42728  55.8%  15.4    3s
    H 2699   480                       3.2265350    1.43727  55.5%  15.5    3s
    H 2730   483                       3.2265272    1.47339  54.3%  15.6    3s
    H 2969   459                       3.2265222    1.67646  48.0%  15.7    3s
    H 3242   425                       3.2265199    1.94873  39.6%  15.7    3s
    H 3242   425                       3.2265181    1.94873  39.6%  15.7    3s
    H 3242   425                       3.2265181    1.94873  39.6%  15.7    3s
    H 3990   372                       3.2264966    2.44124  24.3%  15.2    4s
    * 4991   756             118       3.2264889    2.76455  14.3%  13.2    5s
    *10826  1996             111       3.2264840    2.96837  8.00%   7.8    8s
     14909  2461    3.22384   64   18    3.22648    3.05828  5.21%   6.6   10s
     25013  4241    3.22288   64   14    3.22648    3.10760  3.68%   5.1   15s
     36332  5950     cutoff   62         3.22648    3.12503  3.14%   4.2   20s
     47922  6622     cutoff   58         3.22648    3.13845  2.73%   3.7   25s
     58178  7680    3.21168   62   14    3.22648    3.19175  1.08%   3.5   30s
     68370  8684    3.22564   72   17    3.22648    3.19804  0.88%   3.4   35s
     78684  9052     cutoff   71         3.22648    3.20149  0.77%   3.3   40s
     89588  9477    3.22330   75   12    3.22648    3.20471  0.67%   3.1   45s
     100648  9461     cutoff   79         3.22648    3.20800  0.57%   3.0   50s
     111565  9457    3.22609   84   14    3.22648    3.21282  0.42%   2.8   55s
     122603  9783    3.22201   61   16    3.22648    3.21672  0.30%   2.7   60s
     133568 10205     cutoff   93         3.22648    3.21952  0.22%   2.6   65s
     144641 10460    3.22590   92   14    3.22648    3.22150  0.15%   2.6   70s
     155790 10708    3.22406   74   17    3.22648    3.22262  0.12%   2.5   75s
     166864 10603    3.22570   82   12    3.22648    3.22341  0.10%   2.4   80s
     178233 10324    3.22645   92   14    3.22648    3.22413  0.07%   2.4   85s
     189241  9966    3.22589   85   20    3.22648    3.22479  0.05%   2.3   90s
     199548  9475    3.22642   93   14    3.22648    3.22521  0.04%   2.3   95s
     209777  9164    3.22647   97    6    3.22648    3.22558  0.03%   2.3  100s
     220136  8762     cutoff   93         3.22648    3.22581  0.02%   2.3  105s
     230447  8040    3.22646   98   14    3.22648    3.22597  0.02%   2.3  110s
     240735  7311     cutoff  101         3.22648    3.22613  0.01%   2.3  115s
     250963  6842    3.22644   95   18    3.22648    3.22624  0.01%   2.3  120s
     261164  6083     cutoff  108         3.22648    3.22631  0.01%   2.3  125s
     271504  5177    3.22648  103   14    3.22648    3.22636  0.00%   2.3  130s
     281783  3517    3.22647   95   16    3.22648    3.22642  0.00%   2.3  135s
    
    Cutting planes:
      Learned: 53
      Implied bound: 17
      MIR: 1
      Relax-and-lift: 4
    
    Explored 290720 nodes (664914 simplex iterations) in 139.53 seconds (102.99 work units)
    Thread count was 1 (of 96 available processors)
    
    Solution count 10: 3.22648 3.22648 3.22649 ... 3.22654
    
    Optimal solution found (tolerance 1.00e-06)
    Warning: max constraint violation (1.1910e-06) exceeds tolerance
    Warning: max general constraint violation (1.1910e-06) exceeds tolerance
    Best objective 3.226484046135e+00, best bound 3.226480820646e+00, gap 0.0001%
    
    User-callback calls 290774, time in user-callback 0.02 sec

... Solving fixed model...

    Gurobi Optimizer version 13.0.0 build v13.0.0rc1 (linux64 - "Oracle Linux Server 9.7")
    
    CPU model: AMD EPYC 7643 48-Core Processor, instruction set [SSE2|AVX|AVX2]
    Thread count: 48 physical cores, 96 logical processors, using up to 1 threads
    
    Non-default parameters:
    TimeLimit  300
    MIPGap  1e-06
    LogToConsole  0
    NonConvex  2
    Threads  1
    
    Optimize a model with 532 rows, 289 columns and 1154 nonzeros (Min)
    Model fingerprint: 0x7396ac37
    Model has 10 linear objective coefficients
    Coefficient statistics:
      Matrix range     [1e+00, 6e+01]
      Objective range  [1e+00, 1e+00]
      Bounds range     [8e-02, 6e+01]
      RHS range        [1e+00, 1e+00]
    Presolve removed 532 rows and 289 columns
    Presolve time: 0.00s
    Presolve: All rows and columns removed
    Iteration    Objective       Primal Inf.    Dual Inf.      Time
           0    3.2264840e+00   0.000000e+00   0.000000e+00      0s
    
    Solved in 0 iterations and 0.00 seconds (0.00 work units)
    Optimal objective  3.226484046e+00
    
    User-callback calls 0, time in user-callback 0.00 sec

--- Reading solution for model GAMS_MODEL
***
*** Solver did not provide marginals for model GAMS_MODEL
***
--- Executing after solve: elapsed 0:02:19.585
--- model.gms(1788) 3 Mb
--- model.gms(2631) 5 Mb
--- Putfile results /local/scratch/a/sgusev/repos/k_means/data/gams_gurobi_gdp.hull/no_mode/2026-02-14_17-13-13/original/results.dat
--- Putfile statresults /local/scratch/a/sgusev/repos/k_means/data/gams_gurobi_gdp.hull/no_mode/2026-02-14_17-13-13/original/resultsstat.dat
*** Status: Normal completion
--- Job model.gms Stop 02/14/26 17:15:33 elapsed 0:02:19.587
Original problem solved. Time taken: 140.14535093307495 seconds
Original objective value: 3.22648404613626
