Solving original (integer) problem with strategy gdp.hull...
--- Job model.gms Start 02/14/26 18:08:29 52.2.0 d8e408be LEX-LEG x86 64bit/Linux
--- Applying:
    /package/gams/52.2/gmsprmun.txt
--- GAMS Parameters defined
    Input /local/scratch/a/sgusev/repos/k_means/data/gams_gurobi_gdp.hull/no_mode/2026-02-14_18-08-28/original/model.gms
    Output /local/scratch/a/sgusev/repos/k_means/data/gams_gurobi_gdp.hull/no_mode/2026-02-14_18-08-28/original/output.lst
    ScrDir /local/scratch/a/sgusev/repos/k_means/data/gams_gurobi_gdp.hull/no_mode/2026-02-14_18-08-28/original/225a/
    SysDir /package/gams/52.2/
    CurDir /local/scratch/a/sgusev/repos/k_means/data/gams_gurobi_gdp.hull/no_mode/2026-02-14_18-08-28/original/
    LogOption 3
    AppendLog 1
Licensee: David Bernal / SECQUOIA Research Group         G251008+0003Ac-GEN
          Purdue University, Davidson School of Chemical EngineeringDCE4838
          225a/gamslice.dat
          5a82958a-fbca-4a23
          node:66820903 mem:995 cores:48 ipport:35563 v:2                  
          Evaluation license: Not for commercial or production use
          The time-limited license stops working on : Jun 30, 2027
System information: 48 physical cores and 995 Gb physical memory detected
GAMS 52.2.0   Copyright (C) 1987-2025 GAMS Development. All rights reserved
--- Starting compilation
--- model.gms(2285) 2 Mb
--- $echo File /local/scratch/a/sgusev/repos/k_means/data/gams_gurobi_gdp.hull/no_mode/2026-02-14_18-08-28/original/gurobi.opt
--- model.gms(3378) 2 Mb
--- Starting execution: elapsed 0:00:00.013
--- model.gms(2294) 3 Mb
--- Generating MINLP model GAMS_MODEL
--- model.gms(2298) 5 Mb
---   692 rows  335 columns  1,669 non-zeroes
---   1,560 nl-code  195 nl-non-zeroes
---   39 discrete-columns
--- Range statistics (absolute non-zero finite values)
--- RHS       [min, max] : [ 2.742E-05, 1.000E+00] - Zero values observed as well
--- Bound     [min, max] : [ 1.000E+00, 7.800E+01] - Zero values observed as well
--- Matrix    [min, max] : [ 1.849E-01, 7.800E+01]
--- model.gms(2298) 3 Mb
--- Executing GUROBI (Solvelink=5): elapsed 0:00:00.018
Reading parameter(s) from "/local/scratch/a/sgusev/repos/k_means/data/gams_gurobi_gdp.hull/no_mode/2026-02-14_18-08-28/original/gurobi.opt"
>>  NonConvex 2
>>  Threads 1
>>  MIPGap 1e-06
>>  MIPGapAbs 1e-10
>>  FeasibilityTol 1e-06
>>  OptimalityTol 1e-06
>>  IntFeasTol 1e-05
Finished reading from "/local/scratch/a/sgusev/repos/k_means/data/gams_gurobi_gdp.hull/no_mode/2026-02-14_18-08-28/original/gurobi.opt"

... GRB_LICENSE_FILE = /local/scratch/a/sgusev/gurobi.lic

    Gurobi           52.2.0 d8e408be Dec 8, 2025           LEG x86 64bit/Linux    

... GAMS/Gurobi Link license.
... GMO Q Extraction (ThreePass): 0.00s

    Gurobi Optimizer version 13.0.0 build v13.0.0rc1 (linux64 - "Oracle Linux Server 9.7")
    
    CPU model: AMD EPYC 7643 48-Core Processor, instruction set [SSE2|AVX|AVX2]
    Thread count: 48 physical cores, 96 logical processors, using up to 1 threads
    
    Non-default parameters:
    TimeLimit  300
    MIPGap  1e-06
    LogToConsole  0
    NonConvex  2
    Threads  1
    
    Optimize a model with 691 rows, 373 columns and 1499 nonzeros (Min)
    Model fingerprint: 0x1ff1b007
    Model has 13 linear objective coefficients
    Model has 39 general nonlinear constraints (312 nonlinear terms)
    Variable types: 334 continuous, 39 integer (0 binary)
    Coefficient statistics:
      Matrix range     [1e+00, 8e+01]
      Objective range  [1e+00, 1e+00]
      Bounds range     [1e+00, 8e+01]
      RHS range        [1e+00, 1e+00]
      NLCon coe range  [3e-05, 1e+00]
    Presolve model has 39 nlconstr
    Added 663 variables to disaggregate expressions
    Presolve removed 156 rows and 130 columns
    Presolve time: 0.01s
    Presolved: 2056 rows, 907 columns, 5230 nonzeros
    Presolved model has 312 bilinear constraint(s)
    
    Solving non-convex MIQCP to global optimality
    
    Variable types: 868 continuous, 39 integer (39 binary)
    Found heuristic solution: objective 13.8862527
    
    Root relaxation: objective 0.000000e+00, 290 iterations, 0.00 seconds (0.00 work units)
    
        Nodes    |    Current Node    |     Objective Bounds      |     Work
     Expl Unexpl |  Obj  Depth IntInf | Incumbent    BestBd   Gap | It/Node Time
    
         0     0    0.00000    0  156   13.88625    0.00000   100%     -    0s
         0     0    0.00000    0  164   13.88625    0.00000   100%     -    0s
         0     0    0.00000    0  176   13.88625    0.00000   100%     -    0s
         0     0    0.00000    0  176   13.88625    0.00000   100%     -    0s
         0     0    0.00000    0  150   13.88625    0.00000   100%     -    0s
         0     0    0.00000    0  150   13.88625    0.00000   100%     -    0s
         0     0    0.00000    0   76   13.88625    0.00000   100%     -    0s
         0     0    0.00000    0  121   13.88625    0.00000   100%     -    0s
         0     0    0.00000    0  143   13.88625    0.00000   100%     -    0s
         0     0    0.00000    0  143   13.88625    0.00000   100%     -    0s
         0     0    0.00000    0  125   13.88625    0.00000   100%     -    0s
         0     0    0.00000    0  152   13.88625    0.00000   100%     -    0s
         0     0    0.00000    0  162   13.88625    0.00000   100%     -    0s
         0     0    0.00000    0  162   13.88625    0.00000   100%     -    0s
         0     0    0.00000    0  102   13.88625    0.00000   100%     -    0s
         0     0    0.00000    0  102   13.88625    0.00000   100%     -    0s
         0     0    0.00000    0   82   13.88625    0.00000   100%     -    0s
    H    0     0                       9.7625279    0.00000   100%     -    0s
    H    0     0                       9.3268169    0.00000   100%     -    0s
         0     2    0.00000    0   82    9.32682    0.00000   100%     -    0s
    H    4     4                       8.8310644    0.00000   100%  23.5    0s
    H   83    66                       6.6093155    0.00000   100%  15.1    0s
    H  112    94                       6.6093155    0.00000   100%  17.2    0s
    H  115    95                       6.6093155    0.00000   100%  17.0    0s
    H  135   103                       6.6054553    0.00000   100%  16.5    0s
    H  135   103                       6.6038134    0.00000   100%  16.5    0s
    H  135   103                       6.6025300    0.00000   100%  16.5    0s
    H  135   103                       6.6016062    0.00000   100%  16.5    0s
    H  135   103                       6.6010385    0.00000   100%  16.5    0s
    H  135   103                       6.6008163    0.00000   100%  16.5    0s
    H  169   137                       6.5991767    0.00000   100%  18.0    0s
    H  169   137                       6.5941559    0.00000   100%  18.0    0s
    H  186   151                       6.5941559    0.00000   100%  16.8    0s
    H  238   189                       6.4727825    0.00000   100%  17.5    0s
    H  661   450                       6.3505345    0.04556  99.3%  19.1    2s
    H  661   428                       6.2868482    0.04556  99.3%  19.1    2s
    H  661   407                       6.2669321    0.04556  99.3%  19.1    2s
    H  661   387                       6.2667833    0.04556  99.3%  19.1    2s
    H  661   369                       6.2667675    0.04556  99.3%  19.1    2s
    H  661   351                       6.2667643    0.04556  99.3%  19.1    2s
    H  665   336                       6.1948584    0.04556  99.3%  19.2    2s
    H  665   320                       6.1921049    0.04556  99.3%  19.2    2s
    H  665   305                       6.1920943    0.04556  99.3%  19.2    2s
    H  671   294                       5.7269674    0.04556  99.2%  19.4    2s
      3587  1183 infeasible   27         5.72697    2.78406  51.4%  16.2    5s
    H 3632  1187                       5.7269618    2.81191  50.9%  16.3    5s
      8862  1499    5.10651   23   57    5.72696    4.37600  23.6%  14.6   10s
     16740  2136     cutoff   35         5.72696    5.22541  8.76%  10.1   15s
     24424  2513     cutoff   47         5.72696    5.42721  5.23%   8.5   20s
     32401  2692    5.53708   39   38    5.72696    5.53201  3.40%   7.3   25s
     40317  2887     cutoff   60         5.72696    5.58715  2.44%   6.5   30s
     48006  3151    5.68360   55   25    5.72696    5.61635  1.93%   5.9   35s
     55488  2606     cutoff   61         5.72696    5.64443  1.44%   5.4   40s
     62604  2481     cutoff   52         5.72696    5.68185  0.79%   5.1   45s
     70004  3265     cutoff   61         5.72696    5.70265  0.42%   4.9   50s
     77383  3772    5.72552   72   27    5.72696    5.71099  0.28%   4.7   55s
     84891  4090    5.72195   66   23    5.72696    5.71438  0.22%   4.5   60s
     92559  4148    5.72506   70   26    5.72696    5.71700  0.17%   4.3   65s
     100392  4049    5.72676   79   13    5.72696    5.71989  0.12%   4.1   70s
     108469  4358     cutoff   75         5.72696    5.72154  0.09%   4.0   75s
     116472  4765     cutoff   78         5.72696    5.72233  0.08%   3.8   80s
     124622  5109    5.72677   84   15    5.72696    5.72288  0.07%   3.7   85s
     132820  5163    5.72563   68   19    5.72696    5.72339  0.06%   3.6   90s
     141017  5030    5.72681   79   30    5.72696    5.72419  0.05%   3.5   95s
     149255  5430    5.72486   83   36    5.72696    5.72485  0.04%   3.4  100s
     157652  6053    5.72669   79   10    5.72696    5.72529  0.03%   3.3  105s
     166002  6493    5.72663   84   19    5.72696    5.72553  0.02%   3.2  110s
     174382  6779     cutoff   86         5.72696    5.72569  0.02%   3.1  115s
     182940  6905     cutoff   88         5.72696    5.72580  0.02%   3.0  120s
     191533  6872    5.72687   83   21    5.72696    5.72590  0.02%   3.0  125s
    H195185  6816                       5.7269615    5.72594  0.02%   2.9  127s
     198969  6800    5.72688   82   14    5.72696    5.72598  0.02%   2.9  130s
    H200504  6791                       5.7269615    5.72599  0.02%   2.9  131s
     207044  6733     cutoff   89         5.72696    5.72606  0.02%   2.9  135s
     215823  6540    5.72691   85   15    5.72696    5.72614  0.01%   2.8  140s
     224792  6187    5.72668   80   13    5.72696    5.72624  0.01%   2.8  145s
     233700  5473    5.72660   81   16    5.72696    5.72637  0.01%   2.7  150s
     241800  4793    5.72670   91   34    5.72696    5.72656  0.01%   2.7  155s
     249902  5225    5.72695   92   24    5.72696    5.72666  0.01%   2.7  160s
     258187  5500    5.72674   92   26    5.72696    5.72670  0.00%   2.7  165s
     266390  5863     cutoff   98         5.72696    5.72673  0.00%   2.7  170s
     274642  6245    5.72692   94   14    5.72696    5.72674  0.00%   2.7  175s
     282802  6451    5.72689   98   10    5.72696    5.72676  0.00%   2.7  180s
     291051  6494    5.72693  102   17    5.72696    5.72677  0.00%   2.7  185s
     299275  6362    5.72693  100   13    5.72696    5.72678  0.00%   2.7  190s
     307760  6209    5.72680   85   13    5.72696    5.72679  0.00%   2.7  195s
     316099  6006    5.72690   98   16    5.72696    5.72680  0.00%   2.7  200s
     324268  5601    5.72683   94   32    5.72696    5.72682  0.00%   2.7  205s
     332235  5142    5.72695   97   11    5.72696    5.72684  0.00%   2.7  210s
     340230  4579    5.72695   95   17    5.72696    5.72686  0.00%   2.7  215s
     348258  4114    5.72695  100   12    5.72696    5.72689  0.00%   2.7  220s
     356585  4129    5.72693  100    8    5.72696    5.72690  0.00%   2.7  225s
     364833  4105    5.72693  102   13    5.72696    5.72691  0.00%   2.7  230s
    *367326  3994             110       5.7269611    5.72691  0.00%   2.7  231s
    H369681  3828                       5.7269601    5.72691  0.00%   2.7  233s
     371618  3733     cutoff  105         5.72696    5.72692  0.00%   2.7  235s
     379657  3306    5.72694  102   14    5.72696    5.72692  0.00%   2.7  240s
     387923  2398     cutoff  108         5.72696    5.72693  0.00%   2.7  245s
    
    Cutting planes:
      Learned: 59
    
    Explored 395574 nodes (1055610 simplex iterations) in 249.39 seconds (185.15 work units)
    Thread count was 1 (of 96 available processors)
    
    Solution count 10: 5.72696 5.72696 5.72696 ... 6.19486
    
    Optimal solution found (tolerance 1.00e-06)
    Best objective 5.726960126335e+00, best bound 5.726954411487e+00, gap 0.0001%
    
    User-callback calls 395613, time in user-callback 0.02 sec

... Solving fixed model...

    Gurobi Optimizer version 13.0.0 build v13.0.0rc1 (linux64 - "Oracle Linux Server 9.7")
    
    CPU model: AMD EPYC 7643 48-Core Processor, instruction set [SSE2|AVX|AVX2]
    Thread count: 48 physical cores, 96 logical processors, using up to 1 threads
    
    Non-default parameters:
    TimeLimit  300
    MIPGap  1e-06
    LogToConsole  0
    NonConvex  2
    Threads  1
    
    Optimize a model with 691 rows, 373 columns and 1499 nonzeros (Min)
    Model fingerprint: 0x816b00fe
    Model has 13 linear objective coefficients
    Coefficient statistics:
      Matrix range     [1e+00, 8e+01]
      Objective range  [1e+00, 1e+00]
      Bounds range     [4e-02, 8e+01]
      RHS range        [1e+00, 1e+00]
    Presolve removed 691 rows and 373 columns
    Presolve time: 0.00s
    Presolve: All rows and columns removed
    Iteration    Objective       Primal Inf.    Dual Inf.      Time
           0    5.7269601e+00   0.000000e+00   0.000000e+00      0s
    
    Solved in 0 iterations and 0.00 seconds (0.00 work units)
    Optimal objective  5.726960126e+00
    
    User-callback calls 0, time in user-callback 0.00 sec

--- Reading solution for model GAMS_MODEL
***
*** Solver did not provide marginals for model GAMS_MODEL
***
--- Executing after solve: elapsed 0:04:09.440
--- model.gms(2301) 3 Mb
--- model.gms(3378) 5 Mb
--- Putfile results /local/scratch/a/sgusev/repos/k_means/data/gams_gurobi_gdp.hull/no_mode/2026-02-14_18-08-28/original/results.dat
--- Putfile statresults /local/scratch/a/sgusev/repos/k_means/data/gams_gurobi_gdp.hull/no_mode/2026-02-14_18-08-28/original/resultsstat.dat
*** Status: Normal completion
--- Job model.gms Stop 02/14/26 18:12:38 elapsed 0:04:09.442
Original problem solved. Time taken: 249.99826884269714 seconds
Original objective value: 5.7269601263366
